[
  {
    "question": "How does provisional rule 6.3 change parental leave entitlement for staff members?",
    "answer": "Provisional rule 6.3 changes parental leave entitlement for staff members by replacing the current maternity, paternity, and adoption leave provisions with a parental leave provision of 16 weeks for all parents. Additionally, it provides an additional period of 10 weeks for the parent who gives birth.",
    "context": "1.4 Provisional rule 3.3 (Salary policy) was modified to ensure that salary steps in\ngrade are determined in a consistent manner regardless of whether the staff\nmember changes category, is appointed or is selected for a new position at a\nhigher level within the same category.\n1.5 New provisional rule 3.7 (Rental subsidy) was added for the purposes of\nadditional consistency and clarity in the Staff Rules.\n1.6 New provisional rule 3.16 (Deductions and contributions), paragraph (c), was\nadded to pr...",
    "source": "n2317972.pdf",
    "page": 6,
    "source_documents": [
      {
        "source": "n2317972.pdf",
        "page": 6,
        "content": "1.8 Provisional rule 6.3 (Parental leave) reflects a change in the parental leave\nentitlement pursuant to General Assembly resolution 77/256 to replace the\ncurrent maternity, paternity and adoption leave provisions with a parental leave"
      },
      {
        "source": "n2317972.pdf",
        "page": 6,
        "content": "flexibility in the use of National Professional Officers in accordance with the\nguidelines approved by the General Assembly in its resolution 72/255.\n1.8 Provisional rule 6.3 (Parental leave) reflects a change in the parental leave"
      },
      {
        "source": "n2317972.pdf",
        "page": 6,
        "content": "guidelines approved by the General Assembly in its resolution 72/255.\n1.8 Provisional rule 6.3 (Parental leave) reflects a change in the parental leave\nentitlement pursuant to General Assembly resolution 77/256 to replace the"
      },
      {
        "source": "n2317972.pdf",
        "page": 6,
        "content": "current maternity, paternity and adoption leave provisions with a parental leave\nprovision of 16 weeks for all parents; and to provide an additional period of 10\nweeks for the parent who gives birth.\n1.9 Provisional rule 7.2 (Official travel of staff members and their eligible family"
      },
      {
        "source": "n2317972.pdf",
        "page": 51,
        "content": "the prior approval of the Secretary-General.\nRule 6.3\nParenta l leave\n(a) Under conditions established by the Secretary-General, staff members\nshall be granted:\n(i) Sixteen weeks of parental leave with full pay in the case of the birth or\nadoption of a child;"
      }
    ]
  },
  {
    "question": "What is the purpose of the new provisional rule 3.16 regarding deductions and contributions?",
    "answer": "The purpose of the new provisional rule 3.16 regarding deductions and contributions is to provide a clearer basis for the Organization to make voluntary deductions in accordance with the amounts reflected in family support court orders in cases where staff members have failed to meet those obligations.",
    "context": "1.4 Provisional rule 3.3 (Salary policy) was modified to ensure that salary steps in\ngrade are determined in a consistent manner regardless of whether the staff\nmember changes category, is appointed or is selected for a new position at a\nhigher level within the same category.\n1.5 New provisional rule 3.7 (Rental subsidy) was added for the purposes of\nadditional consistency and clarity in the Staff Rules.\n1.6 New provisional rule 3.16 (Deductions and contributions), paragraph (c), was\nadded to pr...",
    "source": "n2317972.pdf",
    "page": 6,
    "source_documents": [
      {
        "source": "n2317972.pdf",
        "page": 6,
        "content": "additional consistency and clarity in the Staff Rules.\n1.6 New provisional rule 3.16 (Deductions and contributions), paragraph (c), was\nadded to provide a clearer basis for the Organization to make voluntary\ndeductions in accordance with the amounts reflected in family support court"
      },
      {
        "source": "n2317972.pdf",
        "page": 6,
        "content": "higher level within the same category.\n1.5 New provisional rule 3.7 (Rental subsidy) was added for the purposes of\nadditional consistency and clarity in the Staff Rules.\n1.6 New provisional rule 3.16 (Deductions and contributions), paragraph (c), was"
      },
      {
        "source": "n2317972.pdf",
        "page": 6,
        "content": "added to provide a clearer basis for the Organization to make voluntary\ndeductions in accordance with the amounts reflected in family support court\norders in cases in which staff members have failed to meet those obligations."
      },
      {
        "source": "n2317972.pdf",
        "page": 6,
        "content": "deductions in accordance with the amounts reflected in family support court\norders in cases in which staff members have failed to meet those obligations.\n1.7 Provisional rule 4.4 (Staff in posts subject to local recruitment), paragraph (b),"
      },
      {
        "source": "n2317972.pdf",
        "page": 35,
        "content": "for which provision is made under the present Rules;\n(ii) Indebtedness to the United Nations;\n(iii) Indebtedness to other third parties not involving family support court\norders when any deduction for this purpose is authorized by the Secretary-\nGeneral;"
      }
    ]
  },
  {
    "question": "How does the modification to provisional rule 3.3 impact salary determination for staff members?",
    "answer": "The modification to provisional rule 3.3 ensures that salary steps in a grade are determined consistently regardless of whether a staff member changes category, is appointed, or is selected for a new position at a higher level within the same category. Additionally, if a staff member's service has not been satisfactory and they are demoted to a lower level, their eligibility for a salary step increment in the lower level will be based on satisfactory service at that lower level.",
    "context": "1.4 Provisional rule 3.3 (Salary policy) was modified to ensure that salary steps in\ngrade are determined in a consistent manner regardless of whether the staff\nmember changes category, is appointed or is selected for a new position at a\nhigher level within the same category.\n1.5 New provisional rule 3.7 (Rental subsidy) was added for the purposes of\nadditional consistency and clarity in the Staff Rules.\n1.6 New provisional rule 3.16 (Deductions and contributions), paragraph (c), was\nadded to pr...",
    "source": "n2317972.pdf",
    "page": 6,
    "source_documents": [
      {
        "source": "n2317972.pdf",
        "page": 6,
        "content": "1.4 Provisional rule 3.3 (Salary policy) was modified to ensure that salary steps in\ngrade are determined in a consistent manner regardless of whether the staff\nmember changes category, is appointed or is selected for a new position at a\nhigher level within the same category."
      },
      {
        "source": "n2317972.pdf",
        "page": 27,
        "content": "(d) If a staff member whose service has not been satisfactory is demoted to a\nlower level, the staff member’s eligibility for salary step increment in the lower level\nwill be based on satisfactory service at the lower level.\nRule 3.3\nSalary policy"
      },
      {
        "source": "n2317972.pdf",
        "page": 27,
        "content": "lower level, the staff member’s eligibility for salary step increment in the lower level\nwill be based on satisfactory service at the lower level.\nRule 3.3\nSalary policy\n(a) On appointment, or on selection to a different category, staff members"
      },
      {
        "source": "n2317972.pdf",
        "page": 6,
        "content": "grade are determined in a consistent manner regardless of whether the staff\nmember changes category, is appointed or is selected for a new position at a\nhigher level within the same category.\n1.5 New provisional rule 3.7 (Rental subsidy) was added for the purposes of"
      },
      {
        "source": "n2317972.pdf",
        "page": 6,
        "content": "higher level within the same category.\n1.5 New provisional rule 3.7 (Rental subsidy) was added for the purposes of\nadditional consistency and clarity in the Staff Rules.\n1.6 New provisional rule 3.16 (Deductions and contributions), paragraph (c), was"
      }
    ]
  },
  {
    "question": "What are the implications of provisional rule 7.2 for the official travel of staff members and their eligible family members?",
    "answer": "The implications of provisional rule 7.2 for the official travel of staff members and their eligible family members are that before any travel is undertaken, it must be authorized in writing. The United Nations will pay for the travel expenses of certain individuals under conditions established by the Secretary-General. Additionally, relocation shipments to or from places not specified may be authorized under certain conditions. It is the responsibility of staff members to ensure they have proper authorization before commencing travel.",
    "context": "1.4 Provisional rule 3.3 (Salary policy) was modified to ensure that salary steps in\ngrade are determined in a consistent manner regardless of whether the staff\nmember changes category, is appointed or is selected for a new position at a\nhigher level within the same category.\n1.5 New provisional rule 3.7 (Rental subsidy) was added for the purposes of\nadditional consistency and clarity in the Staff Rules.\n1.6 New provisional rule 3.16 (Deductions and contributions), paragraph (c), was\nadded to pr...",
    "source": "n2317972.pdf",
    "page": 6,
    "source_documents": [
      {
        "source": "n2317972.pdf",
        "page": 63,
        "content": "provisions of staff rule 7.2 (Official travel of staff members and their eligible\nfamily members);\n(iii) Relocation shipment from or to a place other than those specified may be\nauthorized under conditions established by the Secretary-General."
      },
      {
        "source": "n2317972.pdf",
        "page": 54,
        "content": "Before travel is undertaken, it shall be authorized in writing. Staff members shall\nbe responsible for ascertaining that they have the proper authorization before\ncommencing travel.\nRule 7.2\nOfficial travel of staff memb ers and their eligible family members"
      },
      {
        "source": "n2317972.pdf",
        "page": 54,
        "content": "commencing travel.\nRule 7.2\nOfficial travel of staff memb ers and their eligible family members\n(a) The United Nations shall pay the travel expenses in respect of official\ntravel for the following individuals, under conditions established by the Secretary-\nGeneral:\n(i) On initial appointment:"
      },
      {
        "source": "n2317972.pdf",
        "page": 64,
        "content": "travel status, from the place of death to a place to which the deceased was entitled to\nreturn transportation under staff rule 7.2 (Official travel of staff members and their\neligible family members) under conditions established by the Secretary-General.\nRule 7.16\nInsur ance"
      },
      {
        "source": "n2317972.pdf",
        "page": 64,
        "content": "return transportation under staff rule 7.2 (Official travel of staff members and their\neligible family members) under conditions established by the Secretary-General.\nRule 7.16\nInsur ance\n(a) Staff members shall not be reimbursed for the cost of personal accident"
      }
    ]
  },
  {
    "question": "What updates were approved by the General Assembly regarding salary scales and pay protection measures for staff in the Professional and higher categories?",
    "answer": "The General Assembly approved an update of the salary scale and pay protection measures for staff in the Professional and higher categories. The updates included adjustments to the salary scale, pay protection measures, and pensionable remuneration scales. Additionally, there were pay protection measures for staff in the Professional and higher categories whose salaries are higher than the maximum salaries on the unified salary scales.",
    "context": "1.4 Provisional rule 3.3 (Salary policy) was modified to ensure that salary steps in\ngrade are determined in a consistent manner regardless of whether the staff\nmember changes category, is appointed or is selected for a new position at a\nhigher level within the same category.\n1.5 New provisional rule 3.7 (Rental subsidy) was added for the purposes of\nadditional consistency and clarity in the Staff Rules.\n1.6 New provisional rule 3.16 (Deductions and contributions), paragraph (c), was\nadded to pr...",
    "source": "n2317972.pdf",
    "page": 6,
    "source_documents": [
      {
        "source": "n2317972.pdf",
        "page": 6,
        "content": "pay protection measures\n2.1 By its resolution 77/256 A–B, the General Assembly approved an update of the\nsalary scale and pay protection measures for staff in the Professional and higher\ncategories, as set out in annex I to the Staff Regulations.\n4/115 23-12028"
      },
      {
        "source": "n2317972.pdf",
        "page": 6,
        "content": "Section 2\nUpdates to the scales on salary and pensionable remuneration, and\npay protection measures\n2.1 By its resolution 77/256 A–B, the General Assembly approved an update of the\nsalary scale and pay protection measures for staff in the Professional and higher"
      },
      {
        "source": "n2317972.pdf",
        "page": 7,
        "content": "2.2 The salary scale and pay protection measures for staff in the Field Service\ncategory, as set out in appendix A to the Staff Rules, were updated pursuant to\nGeneral Assembly resolution 77/256 A–B.\n2.3 The pensionable remuneration scales in appendix A to the Staff Rules were also"
      },
      {
        "source": "n2317972.pdf",
        "page": 6,
        "content": "age of separation of 65 years effective 1 January 2018 as decided by the General\nAssembly in its resolution 70/244.\nSection 2\nUpdates to the scales on salary and pensionable remuneration, and\npay protection measures\n2.1 By its resolution 77/256 A–B, the General Assembly approved an update of the"
      },
      {
        "source": "n2317972.pdf",
        "page": 92,
        "content": "ST/SGB/2023/1/Rev.1\nPay protection measures for staff in the Professional and\nhigher categories whose salaries are higher than the\nmaximum salaries on the unified salary scales, with effect\nfrom 1 January 2023, showing annual gross salaries and\nne etquivalents oanf toefr satpapf lfi caastsiessment"
      }
    ]
  },
  {
    "question": "How were the pensionable remuneration scales updated in accordance with the regulations of the United Nations Joint Staff Pension Fund?",
    "answer": "The pensionable remuneration scales were updated in accordance with the regulations of the United Nations Joint Staff Pension Fund by establishing the pensionable remuneration of staff members in the Field Service category in the same manner as for staff in the Professional and higher categories.",
    "context": "2.2 The salary scale and pay protection measures for staff in the Field Service\ncategory, as set out in appendix A to the Staff Rules, were updated pursuant to\nGeneral Assembly resolution 77/256 A–B.\n2.3 The pensionable remuneration scales in appendix A to the Staff Rules were also\nupdated in accordance with the regulations of the United Nations Joint Staff\nPension Fund.\nSect ion 3\nFinal pr ovisions\n3.1 The provisional Rules shall remain provisional until the requirements of staff\nregulations 12...",
    "source": "n2317972.pdf",
    "page": 7,
    "source_documents": [
      {
        "source": "n2317972.pdf",
        "page": 7,
        "content": "General Assembly resolution 77/256 A–B.\n2.3 The pensionable remuneration scales in appendix A to the Staff Rules were also\nupdated in accordance with the regulations of the United Nations Joint Staff\nPension Fund.\nSect ion 3\nFinal pr ovisions"
      },
      {
        "source": "n2317972.pdf",
        "page": 27,
        "content": "Regulations of the United Nations Joint Staff Pension Fund.\n(b) The pensionable remuneration of staff members in the Field Service\ncategory shall be established in the same manner as for staff in the Professional and\nhigher categories.\n23-12028 25/115"
      },
      {
        "source": "n2317972.pdf",
        "page": 28,
        "content": "accordance with article 25 of the Regulations of the United Nations Joint Staff\nPension Fund shall be based on either:\n(i) The pensionable remuneration of the staff member used to determine such\ncontributions at the time of change in category; or"
      },
      {
        "source": "n2317972.pdf",
        "page": 19,
        "content": "application of the Staff Regulations and Rules and of the Regulations of the United\nNations Joint Staff Pension Fund. Such payment shall afford the United Nations a\ncomplete release from all further liability in respect of any sum so paid."
      },
      {
        "source": "n2317972.pdf",
        "page": 113,
        "content": "Arti3c. l7e\nRelation to benefits under the U nited Nations Joint Staff Pension Fund\nCompensation awarded pursuant to the provisions set out below is intended to\nsupplement the benefits under the Regulations of the United Nations Joint Staff\nPension Fund in accordance with the following provisions:"
      }
    ]
  },
  {
    "question": "What were the updates made to the salary scale and pay protection measures for staff in the Field Service category?",
    "answer": "The salary scale and pay protection measures for staff in the Field Service category were updated pursuant to General Assembly resolution 77/256 A–B. Additionally, pensionable remuneration scales were also updated. Pay protection measures were put in place for staff in the Field Service category whose salaries were higher than those at the maximum step of their grade upon conversion to the unified salary scale on 1 January 2017. These measures were maintained as a pay protection measure until further notice.",
    "context": "2.2 The salary scale and pay protection measures for staff in the Field Service\ncategory, as set out in appendix A to the Staff Rules, were updated pursuant to\nGeneral Assembly resolution 77/256 A–B.\n2.3 The pensionable remuneration scales in appendix A to the Staff Rules were also\nupdated in accordance with the regulations of the United Nations Joint Staff\nPension Fund.\nSect ion 3\nFinal pr ovisions\n3.1 The provisional Rules shall remain provisional until the requirements of staff\nregulations 12...",
    "source": "n2317972.pdf",
    "page": 7,
    "source_documents": [
      {
        "source": "n2317972.pdf",
        "page": 7,
        "content": "2.2 The salary scale and pay protection measures for staff in the Field Service\ncategory, as set out in appendix A to the Staff Rules, were updated pursuant to\nGeneral Assembly resolution 77/256 A–B.\n2.3 The pensionable remuneration scales in appendix A to the Staff Rules were also"
      },
      {
        "source": "n2317972.pdf",
        "page": 87,
        "content": "categories and in the Field Service category that were higher than those at the\nmaximum step of their grade upon conversion to the unified salary scale on 1 January\n2017 shall be maintained as a pay protection measure, until such time as the staff"
      },
      {
        "source": "n2317972.pdf",
        "page": 100,
        "content": "9 Pensionable remuneration for staff in the Field ServiceS category\n8 T\n/1\n1\n5\n/S\nG\nEffective 1 February 2023 B /2\n0\n(United States dollars) 2\n3\n/1\n/R\nStep e v\n.1\nLevel I II III IV V VI VII VIII IX X XI XII XIII"
      },
      {
        "source": "n2317972.pdf",
        "page": 98,
        "content": "9 Salary scale for staff in the Field Service category, sShowing annual gross salaries and net equivalents after application of\n6 T\n/1\n1 staff a ssessment\n/S\nG\n5\nB\n/2\n0\nEffective 1 January 2023 2\n3\n(United States dollars)\n/1\n/R\ne\nv\n.1\nStep\nLevel I II III IV V VI VII VIII IX X XI XII XIII\n* * * * * *"
      },
      {
        "source": "n2317972.pdf",
        "page": 92,
        "content": "ST/SGB/2023/1/Rev.1\nPay protection measures for staff in the Professional and\nhigher categories whose salaries are higher than the\nmaximum salaries on the unified salary scales, with effect\nfrom 1 January 2023, showing annual gross salaries and\nne etquivalents oanf toefr satpapf lfi caastsiessment"
      }
    ]
  },
  {
    "question": "What conditions need to be met for the provisional Rules to no longer be considered provisional?",
    "answer": "The conditions that need to be met for the provisional rules to no longer be considered provisional are outlined in regulations 12.3 and 12.4. These conditions include reporting the full text of provisional staff rules and amendments annually to the General Assembly and ensuring that the Assembly does not find them inconsistent with the intent and purpose of the Regulations. Once these conditions are met, the provisional rules can be finalized.",
    "context": "2.2 The salary scale and pay protection measures for staff in the Field Service\ncategory, as set out in appendix A to the Staff Rules, were updated pursuant to\nGeneral Assembly resolution 77/256 A–B.\n2.3 The pensionable remuneration scales in appendix A to the Staff Rules were also\nupdated in accordance with the regulations of the United Nations Joint Staff\nPension Fund.\nSect ion 3\nFinal pr ovisions\n3.1 The provisional Rules shall remain provisional until the requirements of staff\nregulations 12...",
    "source": "n2317972.pdf",
    "page": 7,
    "source_documents": [
      {
        "source": "n2317972.pdf",
        "page": 85,
        "content": "annually to the General Assembly. Should the Assembly find that a provisional rule\nand/or amendment is inconsistent with the intent and purpose of the Regulations, it\nmay direct that the rule and/or amendment be withdrawn or modified.\nRegulat ion 12.4"
      },
      {
        "source": "n2317972.pdf",
        "page": 85,
        "content": "regulations 12.3 and 12.4 below have been met.\nRegulat ion 12.3\nThe full text of provisional staff rules and amendments shall be reported\nannually to the General Assembly. Should the Assembly find that a provisional rule"
      },
      {
        "source": "n2317972.pdf",
        "page": 85,
        "content": "implement the present Regulations shall be provisional until the requirements of\nregulations 12.3 and 12.4 below have been met.\nRegulat ion 12.3\nThe full text of provisional staff rules and amendments shall be reported"
      },
      {
        "source": "n2317972.pdf",
        "page": 85,
        "content": "and/or amendment is inconsistent with the intent and purpose of the Regulations, it\nmay direct that the rule and/or amendment be withdrawn or modified.\nRegulat ion 12.4\nThe provisional rules and amendments reported by the Secretary-General,"
      },
      {
        "source": "n2317972.pdf",
        "page": 85,
        "content": "Regulat ion 12.3\nThe full text of provisional staff rules and amendments shall be reported\nannually to the General Assembly. Should the Assembly find that a provisional rule\nand/or amendment is inconsistent with the intent and purpose of the Regulations, it"
      }
    ]
  },
  {
    "question": "Who signed the bulletin and holds the position of Secretary-General?",
    "answer": "The bulletin was signed by António Guterres, who holds the position of Secretary-General.",
    "context": "2.2 The salary scale and pay protection measures for staff in the Field Service\ncategory, as set out in appendix A to the Staff Rules, were updated pursuant to\nGeneral Assembly resolution 77/256 A–B.\n2.3 The pensionable remuneration scales in appendix A to the Staff Rules were also\nupdated in accordance with the regulations of the United Nations Joint Staff\nPension Fund.\nSect ion 3\nFinal pr ovisions\n3.1 The provisional Rules shall remain provisional until the requirements of staff\nregulations 12...",
    "source": "n2317972.pdf",
    "page": 7,
    "source_documents": [
      {
        "source": "n2317972.pdf",
        "page": 11,
        "content": "whose employment and contractual relationship are defined by a letter of appointment\nsubject to regulations promulgated by the General Assembly pursuant to Article 101,\nparagraph 1, of the Charter. The Secretary-General, as the chief administrative officer,"
      },
      {
        "source": "n2317972.pdf",
        "page": 11,
        "content": "the Secretariat, within the meaning of Article 97 of the Charter of the United Nations,\nwhose employment and contractual relationship are defined by a letter of appointment\nsubject to regulations promulgated by the General Assembly pursuant to Article 101,"
      },
      {
        "source": "n2317972.pdf",
        "page": 8,
        "content": "and subsidiary organs.\nArtic le 97\nThe Secretariat shall comprise a Secretary-General and such staff as the\nOrganization may require. The Secretary-General shall be appointed by the General\nAssembly upon the recommendation of the Security Council. He shall be the chief"
      },
      {
        "source": "n2317972.pdf",
        "page": 106,
        "content": "ST/SGB/2023/1/Rev.1\n(c) Composition of the Board:\n(i) Voting members:\na. Three representatives of the Administration appointed by the\nSecretary-General;\nb. Three representatives of the staff appointed by the Secretary-General\non the recommendation of the staff representative bodies;"
      },
      {
        "source": "n2317972.pdf",
        "page": 7,
        "content": "regulations 12.3 and 12.4 have been met.\n3.2 The present bulletin supersedes Secretary-General’s bulletin ST/SGB/2023/1.\n(Signed) António Gute rres\nSecretary-General\n23-12028 5/115"
      }
    ]
  },
  {
    "question": "What is the significance of the present bulletin superseding Secretary-General’s bulletin ST/SGB/2023/1?",
    "answer": "The significance of the present bulletin superseding Secretary-General’s bulletin ST/SGB/2023/1 is that it indicates that the information, regulations, or guidelines provided in the previous bulletin have been updated, revised, or replaced by the new bulletin. This means that the content of the previous bulletin is no longer valid or in effect, and the new bulletin should be followed instead.",
    "context": "2.2 The salary scale and pay protection measures for staff in the Field Service\ncategory, as set out in appendix A to the Staff Rules, were updated pursuant to\nGeneral Assembly resolution 77/256 A–B.\n2.3 The pensionable remuneration scales in appendix A to the Staff Rules were also\nupdated in accordance with the regulations of the United Nations Joint Staff\nPension Fund.\nSect ion 3\nFinal pr ovisions\n3.1 The provisional Rules shall remain provisional until the requirements of staff\nregulations 12...",
    "source": "n2317972.pdf",
    "page": 7,
    "source_documents": [
      {
        "source": "n2317972.pdf",
        "page": 7,
        "content": "regulations 12.3 and 12.4 have been met.\n3.2 The present bulletin supersedes Secretary-General’s bulletin ST/SGB/2023/1.\n(Signed) António Gute rres\nSecretary-General\n23-12028 5/115"
      },
      {
        "source": "n2317972.pdf",
        "page": 15,
        "content": "ST/SGB/2023/1/Rev.1\nRegulat ion 1.3\nPerformanc e of staff\n(a) Staff members are accountable to the Secretary-General for the proper\ndischarge of their functions. Staff members are required to uphold the highest\nstandards of efficiency, competence and integrity in the discharge of their functions."
      },
      {
        "source": "n2317972.pdf",
        "page": 85,
        "content": "ST/SGB/2023/1/Rev.1\nArtic le XII\nGeneral p rovisions\nRegulat ion 12.1\nThe present Regulations may be supplemented or amended by the General\nAssembly, without prejudice to the acquired rights of staff members.\nRegulat ion 12.2\nSuch staff rules and amendments as the Secretary-General may make to"
      },
      {
        "source": "n2317972.pdf",
        "page": 106,
        "content": "ST/SGB/2023/1/Rev.1\n(c) Composition of the Board:\n(i) Voting members:\na. Three representatives of the Administration appointed by the\nSecretary-General;\nb. Three representatives of the staff appointed by the Secretary-General\non the recommendation of the staff representative bodies;"
      },
      {
        "source": "n2317972.pdf",
        "page": 19,
        "content": "including at the Assistant Secretary-General level and above, in accordance with\nprocedures promulgated by the Secretary-General.\nRule 1.5\nNotification by staff members and obligation to supply information\n(a) Staff members shall supply the Secretary-General with relevant"
      }
    ]
  },
  {
    "question": "How is the Secretary-General of the United Nations appointed according to the Charter?",
    "answer": "The Secretary-General of the United Nations is appointed by the General Assembly upon the recommendation of the Security Council, as stated in Article 97 of the Charter of the United Nations.",
    "context": "Charter of th e United Nations\nProvisions relatin g to service of the staff\nArti cle 8\nThe United Nations shall place no restrictions on the eligibility of men and\nwomen to participate in any capacity and under conditions of equality in its principal\nand subsidiary organs.\nArtic le 97\nThe Secretariat shall comprise a Secretary-General and such staff as the\nOrganization may require. The Secretary-General shall be appointed by the General\nAssembly upon the recommendation of the Security Council. H...",
    "source": "n2317972.pdf",
    "page": 8,
    "source_documents": [
      {
        "source": "n2317972.pdf",
        "page": 11,
        "content": "the Secretariat, within the meaning of Article 97 of the Charter of the United Nations,\nwhose employment and contractual relationship are defined by a letter of appointment\nsubject to regulations promulgated by the General Assembly pursuant to Article 101,"
      },
      {
        "source": "n2317972.pdf",
        "page": 11,
        "content": "whose employment and contractual relationship are defined by a letter of appointment\nsubject to regulations promulgated by the General Assembly pursuant to Article 101,\nparagraph 1, of the Charter. The Secretary-General, as the chief administrative officer,"
      },
      {
        "source": "n2317972.pdf",
        "page": 8,
        "content": "Organization may require. The Secretary-General shall be appointed by the General\nAssembly upon the recommendation of the Security Council. He shall be the chief\nadministrative officer of the Organization.\nArtic le 100\n1. In the performance of their duties, the Secretary-General and the staff shall"
      },
      {
        "source": "n2317972.pdf",
        "page": 36,
        "content": "Charter as well as the requirements of the post.\nRegulat ion 4.5\n(a) Appointment of Under-Secretaries-General and of Assistant Secretaries-\nGeneral shall normally be for a period of up to five years, subject to prolongation or"
      },
      {
        "source": "n2317972.pdf",
        "page": 8,
        "content": "Artic le 101\n1. The staff shall be appointed by the Secretary-General under regulations\nestablished by the General Assembly.\n2. Appropriate staffs shall be permanently assigned to the Economic and\nSocial Council, the Trusteeship Council, and, as required, to other organs of the"
      }
    ]
  },
  {
    "question": "What are the provisions in the Charter of the United Nations related to the eligibility of men and women to participate in its organs?",
    "answer": "The provisions in the Charter of the United Nations related to the eligibility of men and women to participate in its organs are outlined in Article 8 and Article 97. These articles state that the United Nations shall place no restrictions on the eligibility of men and women to participate in any capacity and under conditions of equality in its principal and subsidiary organs.",
    "context": "Charter of th e United Nations\nProvisions relatin g to service of the staff\nArti cle 8\nThe United Nations shall place no restrictions on the eligibility of men and\nwomen to participate in any capacity and under conditions of equality in its principal\nand subsidiary organs.\nArtic le 97\nThe Secretariat shall comprise a Secretary-General and such staff as the\nOrganization may require. The Secretary-General shall be appointed by the General\nAssembly upon the recommendation of the Security Council. H...",
    "source": "n2317972.pdf",
    "page": 8,
    "source_documents": [
      {
        "source": "n2317972.pdf",
        "page": 8,
        "content": "Charter of th e United Nations\nProvisions relatin g to service of the staff\nArti cle 8\nThe United Nations shall place no restrictions on the eligibility of men and\nwomen to participate in any capacity and under conditions of equality in its principal\nand subsidiary organs.\nArtic le 97"
      },
      {
        "source": "n2317972.pdf",
        "page": 8,
        "content": "The United Nations shall place no restrictions on the eligibility of men and\nwomen to participate in any capacity and under conditions of equality in its principal\nand subsidiary organs.\nArtic le 97\nThe Secretariat shall comprise a Secretary-General and such staff as the"
      },
      {
        "source": "n2317972.pdf",
        "page": 12,
        "content": "separately funded organs, holding appointments under the Staff Rules;\n(f) The privileges and immunities enjoyed by the United Nations by virtue of\nArticle 105 of the Charter are conferred in the interests of the Organization. These"
      },
      {
        "source": "n2317972.pdf",
        "page": 12,
        "content": "(f) The privileges and immunities enjoyed by the United Nations by virtue of\nArticle 105 of the Charter are conferred in the interests of the Organization. These\nprivileges and immunities furnish no excuse to the staff members who are covered by"
      },
      {
        "source": "n2317972.pdf",
        "page": 8,
        "content": "women to participate in any capacity and under conditions of equality in its principal\nand subsidiary organs.\nArtic le 97\nThe Secretariat shall comprise a Secretary-General and such staff as the\nOrganization may require. The Secretary-General shall be appointed by the General"
      }
    ]
  },
  {
    "question": "What are the restrictions in place for the Secretary-General and the staff in terms of seeking instructions from external authorities?",
    "answer": "The Secretary-General and the staff are not allowed to seek or receive instructions from any Government or any other authority external to the Organization. They must follow the directions and instructions properly issued by the Secretary-General and their supervisors.",
    "context": "Charter of th e United Nations\nProvisions relatin g to service of the staff\nArti cle 8\nThe United Nations shall place no restrictions on the eligibility of men and\nwomen to participate in any capacity and under conditions of equality in its principal\nand subsidiary organs.\nArtic le 97\nThe Secretariat shall comprise a Secretary-General and such staff as the\nOrganization may require. The Secretary-General shall be appointed by the General\nAssembly upon the recommendation of the Security Council. H...",
    "source": "n2317972.pdf",
    "page": 8,
    "source_documents": [
      {
        "source": "n2317972.pdf",
        "page": 8,
        "content": "Artic le 100\n1. In the performance of their duties, the Secretary-General and the staff shall\nnot seek or receive instructions from any Government or from any other authority\nexternal to the Organization. They shall refrain from any action which might reflect"
      },
      {
        "source": "n2317972.pdf",
        "page": 13,
        "content": "exercising this authority, the Secretary-General shall seek to ensure, having regard to\nthe circumstances, that all necessary safety and security arrangements are made for\nstaff carrying out the responsibilities entrusted to them;"
      },
      {
        "source": "n2317972.pdf",
        "page": 17,
        "content": "Organization provided that it is reported and entrusted to the Secretary-General\nthrough established procedures.\n(m) The Secretary-General may authorize staff members to accept from a\nnon-governmental source or a university or a related institution, academic awards,"
      },
      {
        "source": "n2317972.pdf",
        "page": 16,
        "content": "Rule 1.2\nBasic rights and obligations of staff\nGene ral\n(a) Staff members shall follow the directions and instructions properly issued\nby the Secretary-General and by their supervisors.\n(b) Staff members must comply with local laws and honour their private legal"
      },
      {
        "source": "n2317972.pdf",
        "page": 19,
        "content": "General.\n(e) Staff members may at any time be required by the Secretary-General to\nsupply information concerning facts anterior to their appointment and relevant to their\nsuitability or concerning facts relevant to their integrity, conduct and service as staff\nmembers.\nRule 1.6"
      }
    ]
  },
  {
    "question": "How are the staff of the United Nations appointed and what factors are considered in determining their conditions of service?",
    "answer": "Staff members specifically recruited for service with the United Nations Secretariat or any program, fund, or subsidiary organ of the United Nations are appointed based on the necessity of securing suitable posts within their parent organization at their duty station. The paramount consideration in the employment of staff and in determining their conditions of service is to ensure that they have received consideration for suitable posts available within their parent organization.",
    "context": "Charter of th e United Nations\nProvisions relatin g to service of the staff\nArti cle 8\nThe United Nations shall place no restrictions on the eligibility of men and\nwomen to participate in any capacity and under conditions of equality in its principal\nand subsidiary organs.\nArtic le 97\nThe Secretariat shall comprise a Secretary-General and such staff as the\nOrganization may require. The Secretary-General shall be appointed by the General\nAssembly upon the recommendation of the Security Council. H...",
    "source": "n2317972.pdf",
    "page": 8,
    "source_documents": [
      {
        "source": "n2317972.pdf",
        "page": 87,
        "content": "satisfied if such staff members have received consideration for suitable posts\navailable within their parent organization at their duty station.\n(f) Staff members specifically recruited for service with the United Nations"
      },
      {
        "source": "n2317972.pdf",
        "page": 70,
        "content": "satisfied if such staff members have received consideration for suitable posts\navailable within their parent organization at their duty stations.\n(e) Staff members specifically recruited for service with the United Nations"
      },
      {
        "source": "n2317972.pdf",
        "page": 8,
        "content": "United Nations. These staffs shall form a part of the Secretariat.\n3. The paramount consideration in the employment of the staff and in the\ndetermination of the conditions of service shall be the necessity of securing the"
      },
      {
        "source": "n2317972.pdf",
        "page": 87,
        "content": "(f) Staff members specifically recruited for service with the United Nations\nSecretariat or with any programme, fund or subsidiary organ of the United Nations\nthat enjoys a special status in matters of appointment under a resolution of the General\n23-12028 85/115"
      },
      {
        "source": "n2317972.pdf",
        "page": 70,
        "content": "(e) Staff members specifically recruited for service with the United Nations\nSecretariat or with any programme, fund or subsidiary organ of the United Nations\nthat enjoys a special status in matters of appointment under a resolution of the General"
      }
    ]
  },
  {
    "question": "What is the purpose of the Staff Regulations of the United Nations?",
    "answer": "The purpose of the Staff Regulations of the United Nations is to embody the fundamental conditions of service, basic rights, duties, and obligations of the United Nations Secretariat. They represent the broad principles of human resources policy for the staffing and administration of the Secretariat.",
    "context": "Staff Regulations of the United Nations\nScope and purpose\nThe Staff Regulations embody the fundamental conditions of service and the\nbasic rights, duties and obligations of the United Nations Secretariat. They represent\nthe broad principles of human resources policy for the staffing and administration of\nthe Secretariat. For the purposes of these Regulations, the expressions “United\nNations Secretariat”, “staff members” or “staff” shall refer to all the staff members of\nthe Secretariat, within t...",
    "source": "n2317972.pdf",
    "page": 11,
    "source_documents": [
      {
        "source": "n2317972.pdf",
        "page": 11,
        "content": "Staff Regulations of the United Nations\nScope and purpose\nThe Staff Regulations embody the fundamental conditions of service and the\nbasic rights, duties and obligations of the United Nations Secretariat. They represent"
      },
      {
        "source": "n2317972.pdf",
        "page": 11,
        "content": "Scope and purpose\nThe Staff Regulations embody the fundamental conditions of service and the\nbasic rights, duties and obligations of the United Nations Secretariat. They represent\nthe broad principles of human resources policy for the staffing and administration of"
      },
      {
        "source": "n2317972.pdf",
        "page": 9,
        "content": "Earl aimeerndments to the Staff Regulations\nThe General Assembly established the Staff Regulations of the United Nations\naccording to Article 101 of the Charter by resolution 590 (VI) of 2 February 1952 and\namended them thereafter by resolutions 781 (VIII) and 782 (VIII) of 9 December"
      },
      {
        "source": "n2317972.pdf",
        "page": 11,
        "content": "shall provide and enforce such staff rules consistent with these principles as the\nSecretary-General considers necessary.\n23-12028 9/115"
      },
      {
        "source": "n2317972.pdf",
        "page": 11,
        "content": "the broad principles of human resources policy for the staffing and administration of\nthe Secretariat. For the purposes of these Regulations, the expressions “United\nNations Secretariat”, “staff members” or “staff” shall refer to all the staff members of"
      }
    ]
  },
  {
    "question": "What privileges and immunities are granted to the Organization and its officials within the territory of its Member States according to the Charter?",
    "answer": "According to Article 105 of the Charter, the privileges and immunities enjoyed by the United Nations are conferred in the interests of the Organization. These privileges and immunities are necessary for the independent exercise of functions by representatives of Member States and officials of the Organization within the territory of Member States. These privileges and immunities do not excuse staff members from observing the laws and police regulations of the State in which they are located.",
    "context": "Charter of th e United Nations\nProvisions relatin g to service of the staff\nArti cle 8\nThe United Nations shall place no restrictions on the eligibility of men and\nwomen to participate in any capacity and under conditions of equality in its principal\nand subsidiary organs.\nArtic le 97\nThe Secretariat shall comprise a Secretary-General and such staff as the\nOrganization may require. The Secretary-General shall be appointed by the General\nAssembly upon the recommendation of the Security Council. H...",
    "source": "n2317972.pdf",
    "page": 8,
    "source_documents": [
      {
        "source": "n2317972.pdf",
        "page": 12,
        "content": "Article 105 of the Charter are conferred in the interests of the Organization. These\nprivileges and immunities furnish no excuse to the staff members who are covered by\nthem to fail to observe laws and police regulations of the State in which they are"
      },
      {
        "source": "n2317972.pdf",
        "page": 12,
        "content": "(f) The privileges and immunities enjoyed by the United Nations by virtue of\nArticle 105 of the Charter are conferred in the interests of the Organization. These\nprivileges and immunities furnish no excuse to the staff members who are covered by"
      },
      {
        "source": "n2317972.pdf",
        "page": 8,
        "content": "privileges and immunities as are necessary for the fulfilment of its purposes.\n2. Representatives of the Members of the United Nations and officials of the\nOrganization shall similarly enjoy such privileges and immunities as are necessary"
      },
      {
        "source": "n2317972.pdf",
        "page": 12,
        "content": "separately funded organs, holding appointments under the Staff Rules;\n(f) The privileges and immunities enjoyed by the United Nations by virtue of\nArticle 105 of the Charter are conferred in the interests of the Organization. These"
      },
      {
        "source": "n2317972.pdf",
        "page": 8,
        "content": "2. Representatives of the Members of the United Nations and officials of the\nOrganization shall similarly enjoy such privileges and immunities as are necessary\nfor the independent exercise of their functions in connection with the Organization."
      }
    ]
  },
  {
    "question": "Who do the expressions 'United Nations Secretariat', 'staff members', or 'staff' refer to in these Regulations?",
    "answer": "The expressions 'United Nations Secretariat', 'staff members', or 'staff' refer to all the staff members of the Secretariat, within the meaning of Article 97 of the Charter of the United Nations.",
    "context": "Staff Regulations of the United Nations\nScope and purpose\nThe Staff Regulations embody the fundamental conditions of service and the\nbasic rights, duties and obligations of the United Nations Secretariat. They represent\nthe broad principles of human resources policy for the staffing and administration of\nthe Secretariat. For the purposes of these Regulations, the expressions “United\nNations Secretariat”, “staff members” or “staff” shall refer to all the staff members of\nthe Secretariat, within t...",
    "source": "n2317972.pdf",
    "page": 11,
    "source_documents": [
      {
        "source": "n2317972.pdf",
        "page": 11,
        "content": "the Secretariat. For the purposes of these Regulations, the expressions “United\nNations Secretariat”, “staff members” or “staff” shall refer to all the staff members of\nthe Secretariat, within the meaning of Article 97 of the Charter of the United Nations,"
      },
      {
        "source": "n2317972.pdf",
        "page": 11,
        "content": "Nations Secretariat”, “staff members” or “staff” shall refer to all the staff members of\nthe Secretariat, within the meaning of Article 97 of the Charter of the United Nations,\nwhose employment and contractual relationship are defined by a letter of appointment"
      },
      {
        "source": "n2317972.pdf",
        "page": 11,
        "content": "the broad principles of human resources policy for the staffing and administration of\nthe Secretariat. For the purposes of these Regulations, the expressions “United\nNations Secretariat”, “staff members” or “staff” shall refer to all the staff members of"
      },
      {
        "source": "n2317972.pdf",
        "page": 87,
        "content": "(f) Staff members specifically recruited for service with the United Nations\nSecretariat or with any programme, fund or subsidiary organ of the United Nations\nthat enjoys a special status in matters of appointment under a resolution of the General\n23-12028 85/115"
      },
      {
        "source": "n2317972.pdf",
        "page": 70,
        "content": "(e) Staff members specifically recruited for service with the United Nations\nSecretariat or with any programme, fund or subsidiary organ of the United Nations\nthat enjoys a special status in matters of appointment under a resolution of the General"
      }
    ]
  },
  {
    "question": "How are the basic rights, duties, and obligations of the United Nations Secretariat staff defined in the Staff Regulations?",
    "answer": "The basic rights, duties, and obligations of the United Nations Secretariat staff are defined in the Staff Regulations as embodying the fundamental conditions of service and the broad principles of human resources policy for the staffing and administration of the Secretariat. Staff members are required to follow directions and instructions properly issued by the Secretary-General and their supervisors, and they are expected to respect the obligations set out in the Staff Regulations and Rules. The Secretary-General is responsible for ensuring that the rights and duties of staff are upheld.",
    "context": "Staff Regulations of the United Nations\nScope and purpose\nThe Staff Regulations embody the fundamental conditions of service and the\nbasic rights, duties and obligations of the United Nations Secretariat. They represent\nthe broad principles of human resources policy for the staffing and administration of\nthe Secretariat. For the purposes of these Regulations, the expressions “United\nNations Secretariat”, “staff members” or “staff” shall refer to all the staff members of\nthe Secretariat, within t...",
    "source": "n2317972.pdf",
    "page": 11,
    "source_documents": [
      {
        "source": "n2317972.pdf",
        "page": 11,
        "content": "Staff Regulations of the United Nations\nScope and purpose\nThe Staff Regulations embody the fundamental conditions of service and the\nbasic rights, duties and obligations of the United Nations Secretariat. They represent"
      },
      {
        "source": "n2317972.pdf",
        "page": 11,
        "content": "Scope and purpose\nThe Staff Regulations embody the fundamental conditions of service and the\nbasic rights, duties and obligations of the United Nations Secretariat. They represent\nthe broad principles of human resources policy for the staffing and administration of"
      },
      {
        "source": "n2317972.pdf",
        "page": 11,
        "content": "basic rights, duties and obligations of the United Nations Secretariat. They represent\nthe broad principles of human resources policy for the staffing and administration of\nthe Secretariat. For the purposes of these Regulations, the expressions “United"
      },
      {
        "source": "n2317972.pdf",
        "page": 16,
        "content": "between the Government and the United Nations.\nRule 1.2\nBasic rights and obligations of staff\nGene ral\n(a) Staff members shall follow the directions and instructions properly issued\nby the Secretary-General and by their supervisors."
      },
      {
        "source": "n2317972.pdf",
        "page": 12,
        "content": "other source external to the Organization.\n“I also solemnly declare and promise to respect the obligations incumbent\nupon me as set out in the Staff Regulations and Rules.”\n(c) The Secretary-General shall ensure that the rights and duties of staff"
      }
    ]
  },
  {
    "question": "What role does the Secretary-General play in relation to the enforcement of staff rules consistent with the principles outlined in the Staff Regulations?",
    "answer": "The Secretary-General is responsible for providing and enforcing staff rules consistent with the principles outlined in the Staff Regulations. The Secretary-General ensures that staff members are held accountable for the proper discharge of their functions and upholding the highest standards of efficiency, competence, and integrity. Additionally, the Secretary-General seeks to ensure that necessary safety and security arrangements are made for staff carrying out their responsibilities.",
    "context": "Staff Regulations of the United Nations\nScope and purpose\nThe Staff Regulations embody the fundamental conditions of service and the\nbasic rights, duties and obligations of the United Nations Secretariat. They represent\nthe broad principles of human resources policy for the staffing and administration of\nthe Secretariat. For the purposes of these Regulations, the expressions “United\nNations Secretariat”, “staff members” or “staff” shall refer to all the staff members of\nthe Secretariat, within t...",
    "source": "n2317972.pdf",
    "page": 11,
    "source_documents": [
      {
        "source": "n2317972.pdf",
        "page": 11,
        "content": "shall provide and enforce such staff rules consistent with these principles as the\nSecretary-General considers necessary.\n23-12028 9/115"
      },
      {
        "source": "n2317972.pdf",
        "page": 11,
        "content": "subject to regulations promulgated by the General Assembly pursuant to Article 101,\nparagraph 1, of the Charter. The Secretary-General, as the chief administrative officer,\nshall provide and enforce such staff rules consistent with these principles as the\nSecretary-General considers necessary."
      },
      {
        "source": "n2317972.pdf",
        "page": 12,
        "content": "upon me as set out in the Staff Regulations and Rules.”\n(c) The Secretary-General shall ensure that the rights and duties of staff\nmembers, as set out in the Charter and the Staff Regulations and Rules and in the\nrelevant resolutions and decisions of the General Assembly, are respected;"
      },
      {
        "source": "n2317972.pdf",
        "page": 15,
        "content": "ST/SGB/2023/1/Rev.1\nRegulat ion 1.3\nPerformanc e of staff\n(a) Staff members are accountable to the Secretary-General for the proper\ndischarge of their functions. Staff members are required to uphold the highest\nstandards of efficiency, competence and integrity in the discharge of their functions."
      },
      {
        "source": "n2317972.pdf",
        "page": 13,
        "content": "exercising this authority, the Secretary-General shall seek to ensure, having regard to\nthe circumstances, that all necessary safety and security arrangements are made for\nstaff carrying out the responsibilities entrusted to them;"
      }
    ]
  },
  {
    "question": "How are the Staff Regulations of the United Nations related to the Charter of the United Nations?",
    "answer": "The Staff Regulations of the United Nations are related to the Charter of the United Nations as they are established according to Article 101 of the Charter. The Staff Regulations embody the fundamental conditions of service and the basic rights, duties, and obligations of the United Nations Secretariat, in line with the principles and standards set out in the Charter. Failure to comply with the Staff Regulations and Rules, as well as the Charter of the United Nations, may lead to disciplinary procedures being instituted against staff members.",
    "context": "Staff Regulations of the United Nations\nScope and purpose\nThe Staff Regulations embody the fundamental conditions of service and the\nbasic rights, duties and obligations of the United Nations Secretariat. They represent\nthe broad principles of human resources policy for the staffing and administration of\nthe Secretariat. For the purposes of these Regulations, the expressions “United\nNations Secretariat”, “staff members” or “staff” shall refer to all the staff members of\nthe Secretariat, within t...",
    "source": "n2317972.pdf",
    "page": 11,
    "source_documents": [
      {
        "source": "n2317972.pdf",
        "page": 9,
        "content": "Earl aimeerndments to the Staff Regulations\nThe General Assembly established the Staff Regulations of the United Nations\naccording to Article 101 of the Charter by resolution 590 (VI) of 2 February 1952 and\namended them thereafter by resolutions 781 (VIII) and 782 (VIII) of 9 December"
      },
      {
        "source": "n2317972.pdf",
        "page": 11,
        "content": "Staff Regulations of the United Nations\nScope and purpose\nThe Staff Regulations embody the fundamental conditions of service and the\nbasic rights, duties and obligations of the United Nations Secretariat. They represent"
      },
      {
        "source": "n2317972.pdf",
        "page": 78,
        "content": "Charter of the United Nations, the Staff Regulations and Rules or other relevant\nadministrative issuances or to observe the standards of conduct expected of an\ninternational civil servant may amount to misconduct and may lead to the institution"
      },
      {
        "source": "n2317972.pdf",
        "page": 16,
        "content": "(d) Disciplinary procedures may be instituted against staff members who fail\nto comply with their obligations and the standards of conduct set out in the Charter\nof the United Nations, the Staff Regulations and Rules, the Financial Regulations and\nRules and administrative issuances."
      },
      {
        "source": "n2317972.pdf",
        "page": 8,
        "content": "Charter of th e United Nations\nProvisions relatin g to service of the staff\nArti cle 8\nThe United Nations shall place no restrictions on the eligibility of men and\nwomen to participate in any capacity and under conditions of equality in its principal\nand subsidiary organs.\nArtic le 97"
      }
    ]
  },
  {
    "question": "What are the duties, obligations, and privileges outlined in the document?",
    "answer": "The document outlines the duties, obligations, and privileges of staff members within an organization. It includes instructions on the performance of duties, respecting obligations as set out in the Staff Regulations and Rules, and the status of staff members. It also mentions that privileges and immunities do not excuse non-performance of private obligations and that any issues regarding these should be reported immediately.",
    "context": "Contents\nArticle or\nchapter Title Regulations Rules Page\nScope and purpose . . . . . . . . . . . . . . . . . . . . . . . . . . . . . . . . . . . . . . . . . . . . . . . . . . . . . . . . . 9\nI. Duties, obligations and privileges . . . . . . . . . . . . . . . . . . . . . . . . . . 1.1–1.3 1.1–1.9 10\nII. Classification of posts and staff . . . . . . . . . . . . . . . . . . . . . . . . . . . 2.1 2.1 19\nIII. Salaries and related allowances . . . . . . . . . . . . . . . . . . . . . . . . . . . 3.1–3....",
    "source": "n2317972.pdf",
    "page": 10,
    "source_documents": [
      {
        "source": "n2317972.pdf",
        "page": 10,
        "content": "I. Duties, obligations and privileges . . . . . . . . . . . . . . . . . . . . . . . . . . 1.1–1.3 1.1–1.9 10\nII. Classification of posts and staff . . . . . . . . . . . . . . . . . . . . . . . . . . . 2.1 2.1 19"
      },
      {
        "source": "n2317972.pdf",
        "page": 10,
        "content": "Contents\nArticle or\nchapter Title Regulations Rules Page\nScope and purpose . . . . . . . . . . . . . . . . . . . . . . . . . . . . . . . . . . . . . . . . . . . . . . . . . . . . . . . . . 9\nI. Duties, obligations and privileges . . . . . . . . . . . . . . . . . . . . . . . . . . 1.1–1.3 1.1–1.9 10"
      },
      {
        "source": "n2317972.pdf",
        "page": 12,
        "content": "instructions in regard to the performance of my duties from any Government or\nother source external to the Organization.\n“I also solemnly declare and promise to respect the obligations incumbent\nupon me as set out in the Staff Regulations and Rules.”"
      },
      {
        "source": "n2317972.pdf",
        "page": 16,
        "content": "ST/SGB/2023/1/Rev.1\nChapt er I\nDuties, obligat ions and privileges\nRule 1.1\nStatus of staff\n(a) The declaration made by a staff member on appointment pursuant to staff\nregulation 1.1 (b) shall be placed in the staff member’s official status file. A new"
      },
      {
        "source": "n2317972.pdf",
        "page": 12,
        "content": "located, nor do they furnish an excuse for non-performance of their private\nobligations. In any case where an issue arises regarding the application of these\nprivileges and immunities, the staff member shall immediately report the matter to"
      }
    ]
  },
  {
    "question": "What are the transitional measures mentioned in the document?",
    "answer": "The transitional measures mentioned in the document relate to the application of revised rules for claims filed for incidents occurring after the entry into force of the revised rules. Additionally, transitional measures are also mentioned regarding salary scales and pensionable remuneration for language staff in the Professional category appointed for specific temporary assignments.",
    "context": "Contents\nArticle or\nchapter Title Regulations Rules Page\nScope and purpose . . . . . . . . . . . . . . . . . . . . . . . . . . . . . . . . . . . . . . . . . . . . . . . . . . . . . . . . . 9\nI. Duties, obligations and privileges . . . . . . . . . . . . . . . . . . . . . . . . . . 1.1–1.3 1.1–1.9 10\nII. Classification of posts and staff . . . . . . . . . . . . . . . . . . . . . . . . . . . 2.1 2.1 19\nIII. Salaries and related allowances . . . . . . . . . . . . . . . . . . . . . . . . . . . 3.1–3....",
    "source": "n2317972.pdf",
    "page": 10,
    "source_documents": [
      {
        "source": "n2317972.pdf",
        "page": 117,
        "content": "Transitiona l measures\nArtic le 6.1\nTransitiona l measures\n(a) For claims filed for incidents occurring after the entry into force of the\npresent revised rules, such revised rules will be applied.\n(b) For claims filed for incidents that occurred prior to the entry into force of"
      },
      {
        "source": "n2317972.pdf",
        "page": 117,
        "content": "substantial part those determinations.\nSecti on VI\nTransitiona l measures\nArtic le 6.1\nTransitiona l measures\n(a) For claims filed for incidents occurring after the entry into force of the\npresent revised rules, such revised rules will be applied."
      },
      {
        "source": "n2317972.pdf",
        "page": 10,
        "content": "XII. General provisions . . . . . . . . . . . . . . . . . . . . . . . . . . . . . . . . . . . . . 12.1–12.5 12.1–12.4 83\nXIII. Transitional measures . . . . . . . . . . . . . . . . . . . . . . . . . . . . . . . . . . . . . . . . . . . . . 13.1–13.6 85\nAnnexes to the Staff Regulations\nPage\nAnnex"
      },
      {
        "source": "n2317972.pdf",
        "page": 117,
        "content": "evidence or material mistake undermines or otherwise calls into question in\nsubstantial part those determinations.\nSecti on VI\nTransitiona l measures\nArtic le 6.1\nTransitiona l measures\n(a) For claims filed for incidents occurring after the entry into force of the"
      },
      {
        "source": "n2317972.pdf",
        "page": 27,
        "content": "applicable to language staff in the Professional category appointed for specific\ntemporary assignments.\n(c) The transitional measures governing the salary scales and pensionable\nremuneration are subject to the provisions of staff rule 13.1 (Salary scales).\nRule 3.2\nSalary ste p increments"
      }
    ]
  },
  {
    "question": "How does the document address disciplinary measures for staff?",
    "answer": "The document outlines specific disciplinary measures that can be imposed on staff members, such as written censure, loss of grade steps, or deferment of salary increment. It also emphasizes that any disciplinary measure should be proportionate to the nature and gravity of the misconduct. Additionally, it mentions that staff members have the right to challenge the imposition of disciplinary measures through a formal application process.",
    "context": "Contents\nArticle or\nchapter Title Regulations Rules Page\nScope and purpose . . . . . . . . . . . . . . . . . . . . . . . . . . . . . . . . . . . . . . . . . . . . . . . . . . . . . . . . . 9\nI. Duties, obligations and privileges . . . . . . . . . . . . . . . . . . . . . . . . . . 1.1–1.3 1.1–1.9 10\nII. Classification of posts and staff . . . . . . . . . . . . . . . . . . . . . . . . . . . 2.1 2.1 19\nIII. Salaries and related allowances . . . . . . . . . . . . . . . . . . . . . . . . . . . 3.1–3....",
    "source": "n2317972.pdf",
    "page": 10,
    "source_documents": [
      {
        "source": "n2317972.pdf",
        "page": 78,
        "content": "Rule 10.2\nDisciplina ry measures\n(a) Disciplinary measures may take one or more of the following forms only:\n(i) Written censure;\n(ii) Loss of one or more steps in grade;\n(iii) Deferment, for a specified period, of eligibility for salary increment;"
      },
      {
        "source": "n2317972.pdf",
        "page": 79,
        "content": "disciplinary measure may be imposed on a staff member following the completion of\nan investigation unless the staff member has been notified, in writing, of the formal\nallegations of misconduct against the staff member and has been given the opportunity"
      },
      {
        "source": "n2317972.pdf",
        "page": 79,
        "content": "expense.\n(b) Any disciplinary measure imposed on a staff member shall be\nproportionate to the nature and gravity of the staff member’s misconduct.\n(c) A staff member against whom disciplinary or non-disciplinary measures,\npursuant to staff rule 10.2, have been imposed following the completion of a"
      },
      {
        "source": "n2317972.pdf",
        "page": 78,
        "content": "considered disciplinary measures. Such measures are administrative measures that\ninclude, but are not limited to, the following:\n(i) Written or oral reprimand;\n(ii) Recovery of monies owed to the Organization;\n(iii) Administrative leave with full or partial pay or without pay pending"
      },
      {
        "source": "n2317972.pdf",
        "page": 79,
        "content": "(c) A staff member against whom disciplinary or non-disciplinary measures,\npursuant to staff rule 10.2, have been imposed following the completion of a\ndisciplinary process may submit an application challenging the imposition of such"
      }
    ]
  },
  {
    "question": "How are staff salaries and related allowances addressed in the regulations?",
    "answer": "Staff salaries and related allowances are addressed in the regulations by specifying that salaries of staff members shall be fixed by the Secretary-General in accordance with the provisions of annex I to the present Regulations. Additionally, the regulations mention that staff members may receive allowances that are available to staff members generally, as well as dependent spouse allowances for certain categories of staff members. The regulations also mention the assessment of salaries and adjustments, as well as the calculation of termination indemnity for staff members.",
    "context": "Contents\nArticle or\nchapter Title Regulations Rules Page\nScope and purpose . . . . . . . . . . . . . . . . . . . . . . . . . . . . . . . . . . . . . . . . . . . . . . . . . . . . . . . . . 9\nI. Duties, obligations and privileges . . . . . . . . . . . . . . . . . . . . . . . . . . 1.1–1.3 1.1–1.9 10\nII. Classification of posts and staff . . . . . . . . . . . . . . . . . . . . . . . . . . . 2.1 2.1 19\nIII. Salaries and related allowances . . . . . . . . . . . . . . . . . . . . . . . . . . . 3.1–3....",
    "source": "n2317972.pdf",
    "page": 10,
    "source_documents": [
      {
        "source": "n2317972.pdf",
        "page": 89,
        "content": "General Assembly, subject to the staff assessment plan provided in staff regulation 3.3\nand to post adjustments wherever applied. If otherwise eligible, they shall receive the\nallowances that are available to staff members generally."
      },
      {
        "source": "n2317972.pdf",
        "page": 23,
        "content": "ST/SGB/2023/1/Rev.1\nArtic le III\nSalaries and r elated allowances\nRegulat ion 3.1\nSalaries of staff members shall be fixed by the Secretary-General in accordance\nwith the provisions of annex I to the present Regulations.\nRegautlio n 3.2"
      },
      {
        "source": "n2317972.pdf",
        "page": 23,
        "content": "the education expenses actually incurred, up to a maximum amount approved by the\nGeneral Assembly.\nRegulat ion 3.3\n(a) An assessment at the rates and under the conditions specified below shall\nbe applied to the salaries and such other emoluments of staff members as are\n23-12028 21/115"
      },
      {
        "source": "n2317972.pdf",
        "page": 25,
        "content": "adjustments, which are not subject to staff assessment but may be subject to\nnational income taxation.\nRegulat ion 3.4\nStaff members whose salary rates are set forth in paragraphs 1 and 3 of annex I\nto the present Regulations shall be entitled to receive a dependent spouse allowance"
      },
      {
        "source": "n2317972.pdf",
        "page": 71,
        "content": "to the Staff Regulations shall be calculated as shown in the table below.\nStaff category Calculation of termination indemnity\nProfessional and higher categories Gross salary less staff assessment\nField Service category Gross salary less staff assessment plus\nlanguage allowance, if any"
      }
    ]
  },
  {
    "question": "What provisions are made for annual and special leave, as well as attendance and leave for staff?",
    "answer": "The provisions for annual and special leave for staff are outlined in Regulation 5 of ST/SGB/2023/1/Rev.1. Staff members are allowed appropriate annual leave, which can be taken in units of days and half-days when authorized. Special leave may be authorized by the Secretary-General in exceptional cases. Staff members accrue 2 1/2 days per month of annual leave while in full pay status and can accumulate up to 60 working days of annual leave. All arrangements related to leave are subject to the exigencies of service, which may require staff members to take leave during a specific period. In exceptional circumstances, a staff member may be granted advance leave.",
    "context": "Contents\nArticle or\nchapter Title Regulations Rules Page\nScope and purpose . . . . . . . . . . . . . . . . . . . . . . . . . . . . . . . . . . . . . . . . . . . . . . . . . . . . . . . . . 9\nI. Duties, obligations and privileges . . . . . . . . . . . . . . . . . . . . . . . . . . 1.1–1.3 1.1–1.9 10\nII. Classification of posts and staff . . . . . . . . . . . . . . . . . . . . . . . . . . . 2.1 2.1 19\nIII. Salaries and related allowances . . . . . . . . . . . . . . . . . . . . . . . . . . . 3.1–3....",
    "source": "n2317972.pdf",
    "page": 10,
    "source_documents": [
      {
        "source": "n2317972.pdf",
        "page": 43,
        "content": "ST/SGB/2023/1/Rev.1\nArti cle V\nAnnual and special leave\nRegulat ion 5.1\nStaff members shall be allowed appropriate annual leave.\nRegulat ion 5.2\nSpecial leave may be authorized by the Secretary-General in exceptional cases.\nRegulat ion 5.3"
      },
      {
        "source": "n2317972.pdf",
        "page": 45,
        "content": "General.\n(c) (i) Annual leave may be taken in units of days and half-days;\n(ii) Leave may be taken only when authorized.\n(d) All arrangements related to leave shall be subject to the exigencies of\nservice, which may require that leave be taken by a staff member during a period"
      },
      {
        "source": "n2317972.pdf",
        "page": 73,
        "content": "appointment, in accordance with staff rules 4.17 (Reinstatement), 4.18\n(Re-employment) and 5.3 (Annual leave). The payment shall be calculated as shown\nin the table below.\nStaff category Calculation of the accrued annual leave"
      },
      {
        "source": "n2317972.pdf",
        "page": 45,
        "content": "absence to accrued annual leave, or a combination of accrued annual leave and\nuncertified sick leave where available or special leave without pay.\n(f) A staff member may, in exceptional circumstances, be granted advance"
      },
      {
        "source": "n2317972.pdf",
        "page": 45,
        "content": "General.\n(b) A staff member who holds a fixed-term or a continuing appointment:\n(i) Shall accrue 2 1/2 days per month of annual leave while in full pay status;\n(ii) May accumulate and carry forward up to 60 working days of annual leave"
      }
    ]
  },
  {
    "question": "What is the purpose of amending the Staff Regulations of the United Nations?",
    "answer": "The purpose of amending the Staff Regulations of the United Nations is to update and adjust the fundamental conditions of service, rights, duties, and obligations of the United Nations Secretariat in line with changing circumstances, needs, and policies. Amendments ensure that the regulations remain relevant and effective in governing the staffing and administration of the United Nations.",
    "context": "Earl aimeerndments to the Staff Regulations\nThe General Assembly established the Staff Regulations of the United Nations\naccording to Article 101 of the Charter by resolution 590 (VI) of 2 February 1952 and\namended them thereafter by resolutions 781 (VIII) and 782 (VIII) of 9 December\n1953, resolution 882 (IX) of 14 December 1954, resolution 887 (IX) of 17 December\n1954, resolution 974 (X) of 15 December 1955, resolution 1095 (XI) of 27 February\n1957, resolutions 1225 (XII) and 1234 (XII) of 14 ...",
    "source": "n2317972.pdf",
    "page": 9,
    "source_documents": [
      {
        "source": "n2317972.pdf",
        "page": 9,
        "content": "Earl aimeerndments to the Staff Regulations\nThe General Assembly established the Staff Regulations of the United Nations\naccording to Article 101 of the Charter by resolution 590 (VI) of 2 February 1952 and\namended them thereafter by resolutions 781 (VIII) and 782 (VIII) of 9 December"
      },
      {
        "source": "n2317972.pdf",
        "page": 11,
        "content": "Scope and purpose\nThe Staff Regulations embody the fundamental conditions of service and the\nbasic rights, duties and obligations of the United Nations Secretariat. They represent\nthe broad principles of human resources policy for the staffing and administration of"
      },
      {
        "source": "n2317972.pdf",
        "page": 11,
        "content": "Staff Regulations of the United Nations\nScope and purpose\nThe Staff Regulations embody the fundamental conditions of service and the\nbasic rights, duties and obligations of the United Nations Secretariat. They represent"
      },
      {
        "source": "n2317972.pdf",
        "page": 85,
        "content": "ST/SGB/2023/1/Rev.1\nArtic le XII\nGeneral p rovisions\nRegulat ion 12.1\nThe present Regulations may be supplemented or amended by the General\nAssembly, without prejudice to the acquired rights of staff members.\nRegulat ion 12.2\nSuch staff rules and amendments as the Secretary-General may make to"
      },
      {
        "source": "n2317972.pdf",
        "page": 85,
        "content": "Assembly, without prejudice to the acquired rights of staff members.\nRegulat ion 12.2\nSuch staff rules and amendments as the Secretary-General may make to\nimplement the present Regulations shall be provisional until the requirements of\nregulations 12.3 and 12.4 below have been met.\nRegulat ion 12.3"
      }
    ]
  },
  {
    "question": "What are the key responsibilities of staff members according to the document?",
    "answer": "The key responsibilities of staff members according to the document include upholding the highest standards of efficiency, competence, and integrity in the discharge of their functions. They are required to be accountable to the Secretary-General for the proper performance of their duties and to ensure that the required standards of performance are met. Staff members are also expected to provide accurate and complete information when required.",
    "context": "ST/SGB/2023/1/Rev.1\nArti cle I\nDuties, oblpirgiavti iloengse sand\nRegulat ion 1.1\nStatus of staff\n(a) Staff members are international civil servants. Their responsibilities as\nstaff members are not national but exclusively international;\n(b) Staff members shall make the following written declaration witnessed by\nthe Secretary-General or his or her authorized representative:\n“I solemnly declare and promise to exercise in all loyalty, discretion and\nconscience the functions entrusted to me as an i...",
    "source": "n2317972.pdf",
    "page": 12,
    "source_documents": [
      {
        "source": "n2317972.pdf",
        "page": 15,
        "content": "discharge of their functions. Staff members are required to uphold the highest\nstandards of efficiency, competence and integrity in the discharge of their functions.\nTheir performance will be appraised periodically to ensure that the required standards\nof performance are met;"
      },
      {
        "source": "n2317972.pdf",
        "page": 12,
        "content": "Regulat ion 1.1\nStatus of staff\n(a) Staff members are international civil servants. Their responsibilities as\nstaff members are not national but exclusively international;\n(b) Staff members shall make the following written declaration witnessed by"
      },
      {
        "source": "n2317972.pdf",
        "page": 19,
        "content": "and Rules as well as for the purpose of completing administrative arrangements in\nconnection with their employment. Staff members shall be held personally\naccountable for the accuracy and completeness of the information they provide."
      },
      {
        "source": "n2317972.pdf",
        "page": 15,
        "content": "ST/SGB/2023/1/Rev.1\nRegulat ion 1.3\nPerformanc e of staff\n(a) Staff members are accountable to the Secretary-General for the proper\ndischarge of their functions. Staff members are required to uphold the highest\nstandards of efficiency, competence and integrity in the discharge of their functions."
      },
      {
        "source": "n2317972.pdf",
        "page": 76,
        "content": "Nations, be given a statement relating to the functions performed and the length of\nservice. On the staff member’s written request, the statement shall also refer to the\nstaff member’s quality of work and official conduct.\n74/115 23-12028"
      }
    ]
  },
  {
    "question": "What is the significance of resolution numbers in the amendments of the Staff Regulations?",
    "answer": "Resolution numbers in the amendments of the Staff Regulations are significant as they indicate the specific resolutions passed by the General Assembly to make changes to the regulations. Each resolution number corresponds to a specific decision or change made to the Staff Regulations, allowing for easy reference and tracking of modifications over time.",
    "context": "Earl aimeerndments to the Staff Regulations\nThe General Assembly established the Staff Regulations of the United Nations\naccording to Article 101 of the Charter by resolution 590 (VI) of 2 February 1952 and\namended them thereafter by resolutions 781 (VIII) and 782 (VIII) of 9 December\n1953, resolution 882 (IX) of 14 December 1954, resolution 887 (IX) of 17 December\n1954, resolution 974 (X) of 15 December 1955, resolution 1095 (XI) of 27 February\n1957, resolutions 1225 (XII) and 1234 (XII) of 14 ...",
    "source": "n2317972.pdf",
    "page": 9,
    "source_documents": [
      {
        "source": "n2317972.pdf",
        "page": 9,
        "content": "Earl aimeerndments to the Staff Regulations\nThe General Assembly established the Staff Regulations of the United Nations\naccording to Article 101 of the Charter by resolution 590 (VI) of 2 February 1952 and\namended them thereafter by resolutions 781 (VIII) and 782 (VIII) of 9 December"
      },
      {
        "source": "n2317972.pdf",
        "page": 85,
        "content": "Regulat ion 12.3\nThe full text of provisional staff rules and amendments shall be reported\nannually to the General Assembly. Should the Assembly find that a provisional rule\nand/or amendment is inconsistent with the intent and purpose of the Regulations, it"
      },
      {
        "source": "n2317972.pdf",
        "page": 85,
        "content": "regulations 12.3 and 12.4 below have been met.\nRegulat ion 12.3\nThe full text of provisional staff rules and amendments shall be reported\nannually to the General Assembly. Should the Assembly find that a provisional rule"
      },
      {
        "source": "n2317972.pdf",
        "page": 93,
        "content": "(i) That the appointment is subject to the provisions of the Staff Regulations\nand of the Staff Rules applicable to the category of appointment in question and\nto changes which may be duly made in such regulations and rules from time to\ntime;\n(ii) The nature of the appointment;"
      },
      {
        "source": "n2317972.pdf",
        "page": 10,
        "content": "XII. General provisions . . . . . . . . . . . . . . . . . . . . . . . . . . . . . . . . . . . . . 12.1–12.5 12.1–12.4 83\nXIII. Transitional measures . . . . . . . . . . . . . . . . . . . . . . . . . . . . . . . . . . . . . . . . . . . . . 13.1–13.6 85\nAnnexes to the Staff Regulations\nPage\nAnnex"
      }
    ]
  },
  {
    "question": "How frequently have the Staff Regulations been amended since their establishment?",
    "answer": "The Staff Regulations of the United Nations have been amended several times since their establishment. The General Assembly established the Staff Regulations according to Article 101 of the Charter by resolution 590 (VI) of 2 February 1952 and amended them thereafter by resolutions 781 (VIII) and 782 (VIII) of 9 December. Additionally, provisional staff rules and amendments are reported annually to the General Assembly for review.",
    "context": "Earl aimeerndments to the Staff Regulations\nThe General Assembly established the Staff Regulations of the United Nations\naccording to Article 101 of the Charter by resolution 590 (VI) of 2 February 1952 and\namended them thereafter by resolutions 781 (VIII) and 782 (VIII) of 9 December\n1953, resolution 882 (IX) of 14 December 1954, resolution 887 (IX) of 17 December\n1954, resolution 974 (X) of 15 December 1955, resolution 1095 (XI) of 27 February\n1957, resolutions 1225 (XII) and 1234 (XII) of 14 ...",
    "source": "n2317972.pdf",
    "page": 9,
    "source_documents": [
      {
        "source": "n2317972.pdf",
        "page": 9,
        "content": "Earl aimeerndments to the Staff Regulations\nThe General Assembly established the Staff Regulations of the United Nations\naccording to Article 101 of the Charter by resolution 590 (VI) of 2 February 1952 and\namended them thereafter by resolutions 781 (VIII) and 782 (VIII) of 9 December"
      },
      {
        "source": "n2317972.pdf",
        "page": 85,
        "content": "implement the present Regulations shall be provisional until the requirements of\nregulations 12.3 and 12.4 below have been met.\nRegulat ion 12.3\nThe full text of provisional staff rules and amendments shall be reported"
      },
      {
        "source": "n2317972.pdf",
        "page": 85,
        "content": "Regulat ion 12.3\nThe full text of provisional staff rules and amendments shall be reported\nannually to the General Assembly. Should the Assembly find that a provisional rule\nand/or amendment is inconsistent with the intent and purpose of the Regulations, it"
      },
      {
        "source": "n2317972.pdf",
        "page": 85,
        "content": "regulations 12.3 and 12.4 below have been met.\nRegulat ion 12.3\nThe full text of provisional staff rules and amendments shall be reported\nannually to the General Assembly. Should the Assembly find that a provisional rule"
      },
      {
        "source": "n2317972.pdf",
        "page": 85,
        "content": "Assembly, without prejudice to the acquired rights of staff members.\nRegulat ion 12.2\nSuch staff rules and amendments as the Secretary-General may make to\nimplement the present Regulations shall be provisional until the requirements of\nregulations 12.3 and 12.4 below have been met.\nRegulat ion 12.3"
      }
    ]
  },
  {
    "question": "How does the document address the issue of seeking or accepting instructions from external sources?",
    "answer": "The document explicitly states that staff members should not seek or accept instructions from any Government or external authority outside of the Organization. It emphasizes that staff members should discharge their functions with the interests of the Organization only and refrain from actions that might reflect on their position as international officials responsible solely to the Organization.",
    "context": "ST/SGB/2023/1/Rev.1\nArti cle I\nDuties, oblpirgiavti iloengse sand\nRegulat ion 1.1\nStatus of staff\n(a) Staff members are international civil servants. Their responsibilities as\nstaff members are not national but exclusively international;\n(b) Staff members shall make the following written declaration witnessed by\nthe Secretary-General or his or her authorized representative:\n“I solemnly declare and promise to exercise in all loyalty, discretion and\nconscience the functions entrusted to me as an i...",
    "source": "n2317972.pdf",
    "page": 12,
    "source_documents": [
      {
        "source": "n2317972.pdf",
        "page": 13,
        "content": "accept instructions from any Government or from any other source external to the\nOrganization;\n(e) By accepting appointment, staff members pledge themselves to discharge\ntheir functions and regulate their conduct with the interests of the Organization only"
      },
      {
        "source": "n2317972.pdf",
        "page": 8,
        "content": "not seek or receive instructions from any Government or from any other authority\nexternal to the Organization. They shall refrain from any action which might reflect\non their position as international officials responsible only to the Organization."
      },
      {
        "source": "n2317972.pdf",
        "page": 12,
        "content": "instructions in regard to the performance of my duties from any Government or\nother source external to the Organization.\n“I also solemnly declare and promise to respect the obligations incumbent\nupon me as set out in the Staff Regulations and Rules.”"
      },
      {
        "source": "n2317972.pdf",
        "page": 18,
        "content": "relate to the purpose, activities or interests of the United Nations. Outside activities\ninclude but are not limited to:\n(i) Issuing statements to the press, radio or other agencies of public\ninformation;\n(ii) Accepting speaking engagements;"
      },
      {
        "source": "n2317972.pdf",
        "page": 12,
        "content": "interests of the United Nations only in view, and not to seek or accept\ninstructions in regard to the performance of my duties from any Government or\nother source external to the Organization.\n“I also solemnly declare and promise to respect the obligations incumbent"
      }
    ]
  },
  {
    "question": "What core values are staff members expected to uphold according to the document?",
    "answer": "Staff members are expected to uphold and respect the principles set out in the Charter, including faith in fundamental human rights, in the dignity and worth of the human person, in the equal rights of men and women, and exhibit respect for all cultures. Additionally, they are expected to uphold the highest standards of efficiency, competence, and integrity.",
    "context": "ST/SGB/2023/1/Rev.1\nArti cle I\nDuties, oblpirgiavti iloengse sand\nRegulat ion 1.1\nStatus of staff\n(a) Staff members are international civil servants. Their responsibilities as\nstaff members are not national but exclusively international;\n(b) Staff members shall make the following written declaration witnessed by\nthe Secretary-General or his or her authorized representative:\n“I solemnly declare and promise to exercise in all loyalty, discretion and\nconscience the functions entrusted to me as an i...",
    "source": "n2317972.pdf",
    "page": 12,
    "source_documents": [
      {
        "source": "n2317972.pdf",
        "page": 12,
        "content": "Core v alues\n(a) Staff members shall uphold and respect the principles set out in the\nCharter, including faith in fundamental human rights, in the dignity and worth of the\nhuman person and in the equal rights of men and women. Consequently, staff"
      },
      {
        "source": "n2317972.pdf",
        "page": 12,
        "content": "Regulat ion 1.2\nBasic rdi gohbtlsi gaanti ons of staff\nCore v alues\n(a) Staff members shall uphold and respect the principles set out in the\nCharter, including faith in fundamental human rights, in the dignity and worth of the"
      },
      {
        "source": "n2317972.pdf",
        "page": 12,
        "content": "exist and whether they shall be waived in accordance with the relevant instruments.\nRegulat ion 1.2\nBasic rdi gohbtlsi gaanti ons of staff\nCore v alues\n(a) Staff members shall uphold and respect the principles set out in the"
      },
      {
        "source": "n2317972.pdf",
        "page": 12,
        "content": "Charter, including faith in fundamental human rights, in the dignity and worth of the\nhuman person and in the equal rights of men and women. Consequently, staff\nmembers shall exhibit respect for all cultures; they shall not discriminate against any"
      },
      {
        "source": "n2317972.pdf",
        "page": 12,
        "content": "individual or group of individuals or otherwise abuse the power and authority vested\nin them;\n(b) Staff members shall uphold the highest standards of efficiency,\ncompetence and integrity. The concept of integrity includes, but is not limited to,\n10/115 23-12028"
      }
    ]
  },
  {
    "question": "How are the rights and duties of staff members ensured by the Secretary-General?",
    "answer": "The rights and duties of staff members are ensured by the Secretary-General through respecting the Charter, Staff Regulations and Rules, relevant resolutions and decisions of the General Assembly, and by providing necessary safety and security arrangements for staff. The Secretary-General also has the authority to assign staff members to various activities or offices within the United Nations. Additionally, the Secretary-General can provide and enforce staff rules consistent with these principles as deemed necessary.",
    "context": "ST/SGB/2023/1/Rev.1\nArti cle I\nDuties, oblpirgiavti iloengse sand\nRegulat ion 1.1\nStatus of staff\n(a) Staff members are international civil servants. Their responsibilities as\nstaff members are not national but exclusively international;\n(b) Staff members shall make the following written declaration witnessed by\nthe Secretary-General or his or her authorized representative:\n“I solemnly declare and promise to exercise in all loyalty, discretion and\nconscience the functions entrusted to me as an i...",
    "source": "n2317972.pdf",
    "page": 12,
    "source_documents": [
      {
        "source": "n2317972.pdf",
        "page": 12,
        "content": "upon me as set out in the Staff Regulations and Rules.”\n(c) The Secretary-General shall ensure that the rights and duties of staff\nmembers, as set out in the Charter and the Staff Regulations and Rules and in the\nrelevant resolutions and decisions of the General Assembly, are respected;"
      },
      {
        "source": "n2317972.pdf",
        "page": 13,
        "content": "General rights and obligations\n(c) Staff members are subject to the authority of the Secretary-General and to\nassignment by him or her to any of the activities or offices of the United Nations. In\nexercising this authority, the Secretary-General shall seek to ensure, having regard to"
      },
      {
        "source": "n2317972.pdf",
        "page": 12,
        "content": "other source external to the Organization.\n“I also solemnly declare and promise to respect the obligations incumbent\nupon me as set out in the Staff Regulations and Rules.”\n(c) The Secretary-General shall ensure that the rights and duties of staff"
      },
      {
        "source": "n2317972.pdf",
        "page": 13,
        "content": "exercising this authority, the Secretary-General shall seek to ensure, having regard to\nthe circumstances, that all necessary safety and security arrangements are made for\nstaff carrying out the responsibilities entrusted to them;"
      },
      {
        "source": "n2317972.pdf",
        "page": 11,
        "content": "shall provide and enforce such staff rules consistent with these principles as the\nSecretary-General considers necessary.\n23-12028 9/115"
      }
    ]
  },
  {
    "question": "In what situations can the privileges and immunities enjoyed by the United Nations staff members be waived?",
    "answer": "The privileges and immunities enjoyed by United Nations staff members can be waived in situations where a staff member volunteers for military service or requests a waiver of immunity with the advance approval of the Secretary-General. The Secretary-General alone has the authority to decide whether such privileges and immunities exist and whether they shall be waived in accordance with the relevant instruments.",
    "context": "ST/SGB/2023/1/Rev.1\nArti cle I\nDuties, oblpirgiavti iloengse sand\nRegulat ion 1.1\nStatus of staff\n(a) Staff members are international civil servants. Their responsibilities as\nstaff members are not national but exclusively international;\n(b) Staff members shall make the following written declaration witnessed by\nthe Secretary-General or his or her authorized representative:\n“I solemnly declare and promise to exercise in all loyalty, discretion and\nconscience the functions entrusted to me as an i...",
    "source": "n2317972.pdf",
    "page": 12,
    "source_documents": [
      {
        "source": "n2317972.pdf",
        "page": 103,
        "content": "appropriate in the case of a staff member who, with the advance approval of the\nSecretary-General, volunteers for military service or requests a waiver of immunity\nunder section 18 (c) of the Convention on Privileges and Immunities of the United\nNations.\n23-12028 101/115"
      },
      {
        "source": "n2317972.pdf",
        "page": 12,
        "content": "privileges and immunities, the staff member shall immediately report the matter to\nthe Secretary-General, who alone may decide whether such privileges and immunities\nexist and whether they shall be waived in accordance with the relevant instruments.\nRegulat ion 1.2"
      },
      {
        "source": "n2317972.pdf",
        "page": 12,
        "content": "the Secretary-General, who alone may decide whether such privileges and immunities\nexist and whether they shall be waived in accordance with the relevant instruments.\nRegulat ion 1.2\nBasic rdi gohbtlsi gaanti ons of staff\nCore v alues"
      },
      {
        "source": "n2317972.pdf",
        "page": 102,
        "content": "Immunities of the United Nations, staff members who are nationals of those Member\nStates which have acceded to that Convention shall be “immune from national service\nobligations” in the armed services of the country of their nationality."
      },
      {
        "source": "n2317972.pdf",
        "page": 12,
        "content": "(f) The privileges and immunities enjoyed by the United Nations by virtue of\nArticle 105 of the Charter are conferred in the interests of the Organization. These\nprivileges and immunities furnish no excuse to the staff members who are covered by"
      }
    ]
  },
  {
    "question": "What are the fundamental obligations of staff members in relation to their conduct and loyalty within the United Nations?",
    "answer": "The fundamental obligations of staff members within the United Nations include loyalty to the aims, principles, and purposes of the organization as set forth in its Charter. Staff members are expected to exercise loyalty, discretion, and impartiality in their duties, ensuring that their personal views and convictions do not adversely affect their official responsibilities or the interests of the United Nations. Staff members are also required to follow directions and instructions issued by the Secretary-General and their supervisors.",
    "context": "ST/SGB/2023/1/Rev.1\nprobity, impartiality, fairness, honesty and truthfulness in all matters affecting their\nwork and status;\nGeneral rights and obligations\n(c) Staff members are subject to the authority of the Secretary-General and to\nassignment by him or her to any of the activities or offices of the United Nations. In\nexercising this authority, the Secretary-General shall seek to ensure, having regard to\nthe circumstances, that all necessary safety and security arrangements are made for\nstaff...",
    "source": "n2317972.pdf",
    "page": 13,
    "source_documents": [
      {
        "source": "n2317972.pdf",
        "page": 13,
        "content": "in view. Loyalty to the aims, principles and purposes of the United Nations, as set\nforth in its Charter, is a fundamental obligation of all staff members by virtue of their\nstatus as international civil servants;\n(f) While staff members’ personal views and convictions, including their"
      },
      {
        "source": "n2317972.pdf",
        "page": 13,
        "content": "their functions and regulate their conduct with the interests of the Organization only\nin view. Loyalty to the aims, principles and purposes of the United Nations, as set\nforth in its Charter, is a fundamental obligation of all staff members by virtue of their"
      },
      {
        "source": "n2317972.pdf",
        "page": 12,
        "content": "staff members are not national but exclusively international;\n(b) Staff members shall make the following written declaration witnessed by\nthe Secretary-General or his or her authorized representative:\n“I solemnly declare and promise to exercise in all loyalty, discretion and"
      },
      {
        "source": "n2317972.pdf",
        "page": 16,
        "content": "between the Government and the United Nations.\nRule 1.2\nBasic rights and obligations of staff\nGene ral\n(a) Staff members shall follow the directions and instructions properly issued\nby the Secretary-General and by their supervisors."
      },
      {
        "source": "n2317972.pdf",
        "page": 13,
        "content": "political and religious convictions, remain inviolable, staff members shall ensure that\nthose views and convictions do not adversely affect their official duties or the interests\nof the United Nations. They shall conduct themselves at all times in a manner befitting"
      }
    ]
  },
  {
    "question": "How are staff members expected to handle their personal views and convictions in relation to their official duties with the United Nations?",
    "answer": "Staff members are expected to ensure that their personal views and convictions, including political and religious beliefs, do not adversely affect their official duties or the interests of the United Nations. They are required to conduct themselves in a manner befitting their status as international civil servants and maintain loyalty to the aims, principles, and purposes of the United Nations as outlined in its Charter. Additionally, staff members are expected to make a written declaration of loyalty, discretion, and commitment to the United Nations.",
    "context": "ST/SGB/2023/1/Rev.1\nprobity, impartiality, fairness, honesty and truthfulness in all matters affecting their\nwork and status;\nGeneral rights and obligations\n(c) Staff members are subject to the authority of the Secretary-General and to\nassignment by him or her to any of the activities or offices of the United Nations. In\nexercising this authority, the Secretary-General shall seek to ensure, having regard to\nthe circumstances, that all necessary safety and security arrangements are made for\nstaff...",
    "source": "n2317972.pdf",
    "page": 13,
    "source_documents": [
      {
        "source": "n2317972.pdf",
        "page": 13,
        "content": "political and religious convictions, remain inviolable, staff members shall ensure that\nthose views and convictions do not adversely affect their official duties or the interests\nof the United Nations. They shall conduct themselves at all times in a manner befitting"
      },
      {
        "source": "n2317972.pdf",
        "page": 13,
        "content": "status as international civil servants;\n(f) While staff members’ personal views and convictions, including their\npolitical and religious convictions, remain inviolable, staff members shall ensure that\nthose views and convictions do not adversely affect their official duties or the interests"
      },
      {
        "source": "n2317972.pdf",
        "page": 13,
        "content": "in view. Loyalty to the aims, principles and purposes of the United Nations, as set\nforth in its Charter, is a fundamental obligation of all staff members by virtue of their\nstatus as international civil servants;\n(f) While staff members’ personal views and convictions, including their"
      },
      {
        "source": "n2317972.pdf",
        "page": 12,
        "content": "staff members are not national but exclusively international;\n(b) Staff members shall make the following written declaration witnessed by\nthe Secretary-General or his or her authorized representative:\n“I solemnly declare and promise to exercise in all loyalty, discretion and"
      },
      {
        "source": "n2317972.pdf",
        "page": 13,
        "content": "of the United Nations. They shall conduct themselves at all times in a manner befitting\ntheir status as international civil servants and shall not engage in any activity that is\nincompatible with the proper discharge of their duties with the United Nations. They"
      }
    ]
  },
  {
    "question": "What are the restrictions imposed on staff members regarding the use of their office or knowledge gained from official functions for private gain?",
    "answer": "Staff members are restricted from using their office or knowledge gained from official functions for private gain, financial or otherwise. This includes not using their office for personal reasons to prejudice the positions of those they do not favor, and not using their office or knowledge for the private gain of any third party, including family, friends, or those they favor. Additionally, staff members are prohibited from accepting any gift, remuneration, or favor from any source having or seeking to have any type of contractual relationship with the organization.",
    "context": "ST/SGB/2023/1/Rev.1\nprobity, impartiality, fairness, honesty and truthfulness in all matters affecting their\nwork and status;\nGeneral rights and obligations\n(c) Staff members are subject to the authority of the Secretary-General and to\nassignment by him or her to any of the activities or offices of the United Nations. In\nexercising this authority, the Secretary-General shall seek to ensure, having regard to\nthe circumstances, that all necessary safety and security arrangements are made for\nstaff...",
    "source": "n2317972.pdf",
    "page": 13,
    "source_documents": [
      {
        "source": "n2317972.pdf",
        "page": 13,
        "content": "that are required by that status;\n(g) Staff members shall not use their office or knowledge gained from their\nofficial functions for private gain, financial or otherwise, or for the private gain of\nany third party, including family, friends and those they favour. Nor shall staff"
      },
      {
        "source": "n2317972.pdf",
        "page": 13,
        "content": "adversely reflect on their status, or on the integrity, independence and impartiality\nthat are required by that status;\n(g) Staff members shall not use their office or knowledge gained from their\nofficial functions for private gain, financial or otherwise, or for the private gain of"
      },
      {
        "source": "n2317972.pdf",
        "page": 13,
        "content": "official functions for private gain, financial or otherwise, or for the private gain of\nany third party, including family, friends and those they favour. Nor shall staff\nmembers use their office for personal reasons to prejudice the positions of those they\ndo not favour;"
      },
      {
        "source": "n2317972.pdf",
        "page": 13,
        "content": "servants;\n(i) Staff members shall exercise the utmost discretion with regard to all\nmatters of official business. They shall not communicate to any Government, entity,\nperson or any other source any information known to them by reason of their official"
      },
      {
        "source": "n2317972.pdf",
        "page": 17,
        "content": "favour, gift or remuneration within the meaning of the Staff Regulations and Rules.\n(o) Staff members shall not accept any gift, remuneration or favour from any\nsource having or seeking to have any type of contractual relationship with the\nOrganization.\nConflict of interest"
      }
    ]
  },
  {
    "question": "How are staff members expected to handle political activities while maintaining independence and impartiality as international civil servants?",
    "answer": "Staff members are expected to ensure that their participation in any political activity is consistent with, and does not reflect adversely upon, the independence and impartiality required by their status as international civil servants. They should exercise the utmost discretion with regard to all matters of official business and ensure that their personal views and convictions do not adversely affect their official duties or the interests of their role. Additionally, they should not communicate sensitive information to any government or entity that could compromise their responsibilities or the integrity required by their status. If a conflict of interest arises, it should be disclosed to their superiors.",
    "context": "ST/SGB/2023/1/Rev.1\nprobity, impartiality, fairness, honesty and truthfulness in all matters affecting their\nwork and status;\nGeneral rights and obligations\n(c) Staff members are subject to the authority of the Secretary-General and to\nassignment by him or her to any of the activities or offices of the United Nations. In\nexercising this authority, the Secretary-General shall seek to ensure, having regard to\nthe circumstances, that all necessary safety and security arrangements are made for\nstaff...",
    "source": "n2317972.pdf",
    "page": 13,
    "source_documents": [
      {
        "source": "n2317972.pdf",
        "page": 13,
        "content": "status as international civil servants;\n(f) While staff members’ personal views and convictions, including their\npolitical and religious convictions, remain inviolable, staff members shall ensure that\nthose views and convictions do not adversely affect their official duties or the interests"
      },
      {
        "source": "n2317972.pdf",
        "page": 13,
        "content": "participation in any political activity is consistent with, and does not reflect adversely\nupon, the independence and impartiality required by their status as international civil\nservants;\n(i) Staff members shall exercise the utmost discretion with regard to all"
      },
      {
        "source": "n2317972.pdf",
        "page": 13,
        "content": "do not favour;\n(h) Staff members may exercise the right to vote but shall ensure that their\nparticipation in any political activity is consistent with, and does not reflect adversely\nupon, the independence and impartiality required by their status as international civil\nservants;"
      },
      {
        "source": "n2317972.pdf",
        "page": 13,
        "content": "upon, the independence and impartiality required by their status as international civil\nservants;\n(i) Staff members shall exercise the utmost discretion with regard to all\nmatters of official business. They shall not communicate to any Government, entity,"
      },
      {
        "source": "n2317972.pdf",
        "page": 14,
        "content": "responsibilities or with the integrity, independence and impartiality required by the\nstaff member’s status as an international civil servant. When an actual or possible\nconflict of interest does arise, the conflict shall be disclosed by staff members to their"
      }
    ]
  },
  {
    "question": "What are the guidelines concerning the acceptance of honours, gifts, or remuneration by staff members from any Government?",
    "answer": "Staff members are not allowed to accept any honour, decoration, favour, gift, or remuneration from any Government. If refusal of an unanticipated honour, decoration, favour, or gift from a Government would cause embarrassment to the Organization, the staff member may not seek or accept any favour, gift, remuneration, or any other personal benefit from another staff member or any third party in exchange for performing, failing to perform, or delaying the performance of any official act. Additionally, acceptance of any honour, decoration, favour, gift, or remuneration from non-governmental sources requires prior approval from the Secretary-General, granted only in exceptional cases and where appropriate within the Staff Regulations and Rules. Staff members are also prohibited from accepting any gift, remuneration, or favour from any source having or seeking to have any type of contractual relationship with the Organization.",
    "context": "ST/SGB/2023/1/Rev.1\nprobity, impartiality, fairness, honesty and truthfulness in all matters affecting their\nwork and status;\nGeneral rights and obligations\n(c) Staff members are subject to the authority of the Secretary-General and to\nassignment by him or her to any of the activities or offices of the United Nations. In\nexercising this authority, the Secretary-General shall seek to ensure, having regard to\nthe circumstances, that all necessary safety and security arrangements are made for\nstaff...",
    "source": "n2317972.pdf",
    "page": 13,
    "source_documents": [
      {
        "source": "n2317972.pdf",
        "page": 13,
        "content": "Honours, gifts or remuneration\n(j) No staff member shall accept any honour, decoration, favour, gift or\nremuneration from any Government;\n(k) If refusal of an unanticipated honour, decoration, favour or gift from a\nGovernment would cause embarrassment to the Organization, the staff member may"
      },
      {
        "source": "n2317972.pdf",
        "page": 17,
        "content": "neither seek nor accept any favour, gift, remuneration or any other personal benefit\nfrom another staff member or from any third party in exchange for performing, failing\nto perform or delaying the performance of any official act.\nHonours, gifts or remuneration"
      },
      {
        "source": "n2317972.pdf",
        "page": 13,
        "content": "appropriate in the normal course of their duties or by authorization of the Secretary-\nGeneral. These obligations do not cease upon separation from service;\nHonours, gifts or remuneration\n(j) No staff member shall accept any honour, decoration, favour, gift or\nremuneration from any Government;"
      },
      {
        "source": "n2317972.pdf",
        "page": 17,
        "content": "Honours, gifts or remuneration\n(l) Acceptance by staff members of any honour, decoration, favour, gift or\nremuneration from non-governmental sources requires the prior approval of the\nSecretary-General. Approval shall be granted only in exceptional cases and where"
      },
      {
        "source": "n2317972.pdf",
        "page": 17,
        "content": "favour, gift or remuneration within the meaning of the Staff Regulations and Rules.\n(o) Staff members shall not accept any gift, remuneration or favour from any\nsource having or seeking to have any type of contractual relationship with the\nOrganization.\nConflict of interest"
      }
    ]
  },
  {
    "question": "What are the standards that staff members are required to uphold in the discharge of their functions?",
    "answer": "Staff members are required to uphold the highest standards of efficiency, competence, and integrity in the discharge of their functions. Their performance will be periodically appraised to ensure that these required standards are met.",
    "context": "ST/SGB/2023/1/Rev.1\nRegulat ion 1.3\nPerformanc e of staff\n(a) Staff members are accountable to the Secretary-General for the proper\ndischarge of their functions. Staff members are required to uphold the highest\nstandards of efficiency, competence and integrity in the discharge of their functions.\nTheir performance will be appraised periodically to ensure that the required standards\nof performance are met;\n(b) The whole time of staff members shall be at the disposal of the Secretary-\nGeneral for ...",
    "source": "n2317972.pdf",
    "page": 15,
    "source_documents": [
      {
        "source": "n2317972.pdf",
        "page": 15,
        "content": "discharge of their functions. Staff members are required to uphold the highest\nstandards of efficiency, competence and integrity in the discharge of their functions.\nTheir performance will be appraised periodically to ensure that the required standards\nof performance are met;"
      },
      {
        "source": "n2317972.pdf",
        "page": 15,
        "content": "standards of efficiency, competence and integrity in the discharge of their functions.\nTheir performance will be appraised periodically to ensure that the required standards\nof performance are met;\n(b) The whole time of staff members shall be at the disposal of the Secretary-"
      },
      {
        "source": "n2317972.pdf",
        "page": 76,
        "content": "Nations, be given a statement relating to the functions performed and the length of\nservice. On the staff member’s written request, the statement shall also refer to the\nstaff member’s quality of work and official conduct.\n74/115 23-12028"
      },
      {
        "source": "n2317972.pdf",
        "page": 16,
        "content": "members shall not be retaliated against for complying with these duties.\n(d) Disciplinary procedures may be instituted against staff members who fail\nto comply with their obligations and the standards of conduct set out in the Charter"
      },
      {
        "source": "n2317972.pdf",
        "page": 16,
        "content": "(d) Disciplinary procedures may be instituted against staff members who fail\nto comply with their obligations and the standards of conduct set out in the Charter\nof the United Nations, the Staff Regulations and Rules, the Financial Regulations and\nRules and administrative issuances."
      }
    ]
  },
  {
    "question": "How often will the performance of staff members be appraised?",
    "answer": "The performance of staff members shall be appraised regularly, according to the rules and procedures set out by the Secretary-General. The exact frequency of these performance appraisals is not specified in the provided context.",
    "context": "ST/SGB/2023/1/Rev.1\nRegulat ion 1.3\nPerformanc e of staff\n(a) Staff members are accountable to the Secretary-General for the proper\ndischarge of their functions. Staff members are required to uphold the highest\nstandards of efficiency, competence and integrity in the discharge of their functions.\nTheir performance will be appraised periodically to ensure that the required standards\nof performance are met;\n(b) The whole time of staff members shall be at the disposal of the Secretary-\nGeneral for ...",
    "source": "n2317972.pdf",
    "page": 15,
    "source_documents": [
      {
        "source": "n2317972.pdf",
        "page": 19,
        "content": "development programmes are available for the benefit of staff.\n(c) Performance appraisals shall be conducted regularly for all staff members,\nincluding at the Assistant Secretary-General level and above, in accordance with\nprocedures promulgated by the Secretary-General.\nRule 1.5"
      },
      {
        "source": "n2317972.pdf",
        "page": 18,
        "content": "Rule 1.4\nPerformanc e of staff\n(a) Staff members shall be evaluated for their efficiency, competence and\nintegrity through performance appraisal mechanisms that shall assess the staff\nmember’s compliance with the standards set out in the Staff Regulations and Rules\nfor purposes of accountability."
      },
      {
        "source": "n2317972.pdf",
        "page": 18,
        "content": "integrity through performance appraisal mechanisms that shall assess the staff\nmember’s compliance with the standards set out in the Staff Regulations and Rules\nfor purposes of accountability.\n16/115 23-12028"
      },
      {
        "source": "n2317972.pdf",
        "page": 15,
        "content": "discharge of their functions. Staff members are required to uphold the highest\nstandards of efficiency, competence and integrity in the discharge of their functions.\nTheir performance will be appraised periodically to ensure that the required standards\nof performance are met;"
      },
      {
        "source": "n2317972.pdf",
        "page": 18,
        "content": "conditions established by the Secretary-General.\nRule 1.4\nPerformanc e of staff\n(a) Staff members shall be evaluated for their efficiency, competence and\nintegrity through performance appraisal mechanisms that shall assess the staff"
      }
    ]
  },
  {
    "question": "Under what circumstances can staff members be required to work beyond the normal tour of duty?",
    "answer": "Staff members can be required to work beyond the normal tour of duty whenever requested to do so by the organization. This could be due to the needs of service or exceptional circumstances that require additional work hours.",
    "context": "ST/SGB/2023/1/Rev.1\nRegulat ion 1.3\nPerformanc e of staff\n(a) Staff members are accountable to the Secretary-General for the proper\ndischarge of their functions. Staff members are required to uphold the highest\nstandards of efficiency, competence and integrity in the discharge of their functions.\nTheir performance will be appraised periodically to ensure that the required standards\nof performance are met;\n(b) The whole time of staff members shall be at the disposal of the Secretary-\nGeneral for ...",
    "source": "n2317972.pdf",
    "page": 15,
    "source_documents": [
      {
        "source": "n2317972.pdf",
        "page": 44,
        "content": "week for each duty station pursuant to staff regulation 1.3 (b). Exceptions may be\nmade by the Secretary-General as the needs of service may require. A staff member\nmay be required to work beyond the normal number of working hours whenever\nrequested to do so.\nOvertimceo mapnedn sato ry time off"
      },
      {
        "source": "n2317972.pdf",
        "page": 44,
        "content": "may be required to work beyond the normal number of working hours whenever\nrequested to do so.\nOvertimceo mapnedn sato ry time off\n(b) A staff member in the General Service, Security Service or Trades and\nCrafts category, or in the Field Service category up to and including level FS-5, who"
      },
      {
        "source": "n2317972.pdf",
        "page": 48,
        "content": "service, or who are over that age and within 2 years of 25 years of contributory service.\n(d) Staff members holding a temporary appointment may exceptionally be\ngranted special leave, with full or partial pay or without pay, for compelling reasons"
      },
      {
        "source": "n2317972.pdf",
        "page": 44,
        "content": "Overtimceo mapnedn sato ry time off\n(b) A staff member in the General Service, Security Service or Trades and\nCrafts category, or in the Field Service category up to and including level FS-5, who\nis required to work in excess of the normal number of working hours per week shall"
      },
      {
        "source": "n2317972.pdf",
        "page": 48,
        "content": "performing any functions that are incompatible with the staff member’s continued\nstatus as an international civil servant. In exceptional circumstances, special leave\nwithout pay may be granted to staff members who are requested by their Government"
      }
    ]
  },
  {
    "question": "Who are staff members accountable to for the proper discharge of their functions?",
    "answer": "Staff members are accountable for the proper discharge of their functions to the officials responsible for taking appropriate action within the organization.",
    "context": "ST/SGB/2023/1/Rev.1\nRegulat ion 1.3\nPerformanc e of staff\n(a) Staff members are accountable to the Secretary-General for the proper\ndischarge of their functions. Staff members are required to uphold the highest\nstandards of efficiency, competence and integrity in the discharge of their functions.\nTheir performance will be appraised periodically to ensure that the required standards\nof performance are met;\n(b) The whole time of staff members shall be at the disposal of the Secretary-\nGeneral for ...",
    "source": "n2317972.pdf",
    "page": 15,
    "source_documents": [
      {
        "source": "n2317972.pdf",
        "page": 15,
        "content": "discharge of their functions. Staff members are required to uphold the highest\nstandards of efficiency, competence and integrity in the discharge of their functions.\nTheir performance will be appraised periodically to ensure that the required standards\nof performance are met;"
      },
      {
        "source": "n2317972.pdf",
        "page": 19,
        "content": "and Rules as well as for the purpose of completing administrative arrangements in\nconnection with their employment. Staff members shall be held personally\naccountable for the accuracy and completeness of the information they provide."
      },
      {
        "source": "n2317972.pdf",
        "page": 16,
        "content": "courts.\n(c) Staff members have a duty to report any breach of the Organization’s\nregulations and rules to the officials who are responsible for taking appropriate action.\nStaff members shall cooperate with duly authorized audits and investigations. Staff"
      },
      {
        "source": "n2317972.pdf",
        "page": 15,
        "content": "standards of efficiency, competence and integrity in the discharge of their functions.\nTheir performance will be appraised periodically to ensure that the required standards\nof performance are met;\n(b) The whole time of staff members shall be at the disposal of the Secretary-"
      },
      {
        "source": "n2317972.pdf",
        "page": 16,
        "content": "ability of other staff members to discharge their official functions. Staff members\nshall not threaten, retaliate or attempt to retaliate against such individuals or against\nstaff members exercising their rights and duties under the present Rules.\n14/115 23-12028"
      }
    ]
  },
  {
    "question": "Under what conditions can the Secretary-General authorize staff members to engage in outside employment?",
    "answer": "The Secretary-General may authorize staff members to engage in outside employment if the outside occupation or employment does not conflict with the staff member's duties and responsibilities within the United Nations.",
    "context": "ST/SGB/2023/1/Rev.1\n(l) No staff member shall accept any honour, decoration, favour, gift or\nremuneration from any non-governmental source without first obtaining the approval\nof the Secretary-General;\nConflict of interest\n(m) A conflict of interest occurs when, by act or omission, a staff member’s\npersonal interests interfere with the performance of his or her official duties and\nresponsibilities or with the integrity, independence and impartiality required by the\nstaff member’s status as an in...",
    "source": "n2317972.pdf",
    "page": 14,
    "source_documents": [
      {
        "source": "n2317972.pdf",
        "page": 14,
        "content": "whether remunerated or not, without the approval of the Secretary-General;\n(p) The Secretary-General may authorize staff members to engage in an\noutside occupation or employment, whether remunerated or not, if:\n(i) The outside occupation or employment does not conflict with the staff"
      },
      {
        "source": "n2317972.pdf",
        "page": 14,
        "content": "Outside employme nt and activities\n(o) Staff members shall not engage in any outside occupation or employment,\nwhether remunerated or not, without the approval of the Secretary-General;\n(p) The Secretary-General may authorize staff members to engage in an"
      },
      {
        "source": "n2317972.pdf",
        "page": 14,
        "content": "or she deems necessary in the interest of the Organization;\nOutside employme nt and activities\n(o) Staff members shall not engage in any outside occupation or employment,\nwhether remunerated or not, without the approval of the Secretary-General;"
      },
      {
        "source": "n2317972.pdf",
        "page": 45,
        "content": "service, which may require that leave be taken by a staff member during a period\ndesignated by the Secretary-General. The personal circumstances and preferences of\nthe individual staff member shall, as far as possible, be considered."
      },
      {
        "source": "n2317972.pdf",
        "page": 18,
        "content": "(r) Staff members shall not, except in the normal course of official duties or\nwith the prior approval of the Secretary-General, engage in any outside activities that\nrelate to the purpose, activities or interests of the United Nations. Outside activities\ninclude but are not limited to:"
      }
    ]
  },
  {
    "question": "What is the purpose of financial disclosure statements for staff members at the D-1 level and above?",
    "answer": "The purpose of financial disclosure statements for staff members at the D-1 level and above is to identify and disclose any potential conflicts of interest that may arise due to their financial interests, outside activities, or relationships. This helps ensure transparency, integrity, and accountability within the organization by allowing for the identification of any conflicts that need to be mitigated or resolved in favor of the organization's interests.",
    "context": "ST/SGB/2023/1/Rev.1\n(l) No staff member shall accept any honour, decoration, favour, gift or\nremuneration from any non-governmental source without first obtaining the approval\nof the Secretary-General;\nConflict of interest\n(m) A conflict of interest occurs when, by act or omission, a staff member’s\npersonal interests interfere with the performance of his or her official duties and\nresponsibilities or with the integrity, independence and impartiality required by the\nstaff member’s status as an in...",
    "source": "n2317972.pdf",
    "page": 14,
    "source_documents": [
      {
        "source": "n2317972.pdf",
        "page": 14,
        "content": "head of office, mitigated by the Organization and resolved in favour of the interests\nof the Organization;\n(n) All staff members at the D-1 level and above shall be required to file\nfinancial disclosure statements on appointment and at intervals thereafter as"
      },
      {
        "source": "n2317972.pdf",
        "page": 14,
        "content": "of the Organization;\n(n) All staff members at the D-1 level and above shall be required to file\nfinancial disclosure statements on appointment and at intervals thereafter as\nprescribed by the Secretary-General, in respect of themselves, their spouses and their"
      },
      {
        "source": "n2317972.pdf",
        "page": 14,
        "content": "Secretary-General, in making determinations pursuant to staff regulation 1.2 (m). The\nSecretary-General may require other staff to file financial disclosure statements as he\nor she deems necessary in the interest of the Organization;\nOutside employme nt and activities"
      },
      {
        "source": "n2317972.pdf",
        "page": 18,
        "content": "procedures for the filing and utilization of financial disclosure statements.\nOutside employme nt and activities\n(r) Staff members shall not, except in the normal course of official duties or\nwith the prior approval of the Secretary-General, engage in any outside activities that"
      },
      {
        "source": "n2317972.pdf",
        "page": 18,
        "content": "implement the mitigation or remediation prescribed by the Organization to resolve\nthat conflict of interest situation.\n(q) Pursuant to staff regulation 1.2 (n), the Secretary-General shall establish\nprocedures for the filing and utilization of financial disclosure statements."
      }
    ]
  },
  {
    "question": "What role does the Secretary-General play in establishing the working week and official holidays for staff members?",
    "answer": "The Secretary-General establishes the normal working week and official holidays for each duty station. Exceptions can be made by the Secretary-General based on the needs of the service.",
    "context": "ST/SGB/2023/1/Rev.1\nRegulat ion 1.3\nPerformanc e of staff\n(a) Staff members are accountable to the Secretary-General for the proper\ndischarge of their functions. Staff members are required to uphold the highest\nstandards of efficiency, competence and integrity in the discharge of their functions.\nTheir performance will be appraised periodically to ensure that the required standards\nof performance are met;\n(b) The whole time of staff members shall be at the disposal of the Secretary-\nGeneral for ...",
    "source": "n2317972.pdf",
    "page": 15,
    "source_documents": [
      {
        "source": "n2317972.pdf",
        "page": 15,
        "content": "General for the performance of official functions. The Secretary-General shall\nestablish a normal working week and shall establish official holidays for each duty\nstation. Exceptions may be made by the Secretary-General as the needs of the service"
      },
      {
        "source": "n2317972.pdf",
        "page": 15,
        "content": "of performance are met;\n(b) The whole time of staff members shall be at the disposal of the Secretary-\nGeneral for the performance of official functions. The Secretary-General shall\nestablish a normal working week and shall establish official holidays for each duty"
      },
      {
        "source": "n2317972.pdf",
        "page": 15,
        "content": "establish a normal working week and shall establish official holidays for each duty\nstation. Exceptions may be made by the Secretary-General as the needs of the service\nmay require, and staff members shall be required to work beyond the normal tour of\nduty when requested to do so.\n23-12028 13/115"
      },
      {
        "source": "n2317972.pdf",
        "page": 44,
        "content": "(b) Pursuant to staff regulation 1.3 (b), the official holidays not mandated by\nthe General Assembly shall be determined by the Secretary-General at Headquarters\nand under conditions established by the Secretary-General at other duty stations, after\nstaff consultation.\nRule 5.3\nAnnual leave"
      },
      {
        "source": "n2317972.pdf",
        "page": 44,
        "content": "Rule 5.1\nHours o f work\n(a) The Secretary-General shall set the normal number of working hours per\nweek for each duty station pursuant to staff regulation 1.3 (b). Exceptions may be\nmade by the Secretary-General as the needs of service may require. A staff member"
      }
    ]
  },
  {
    "question": "Why is it important for staff members to disclose conflicts of interest to their head of office?",
    "answer": "It is important for staff members to disclose conflicts of interest to their head of office because conflicts of interest can compromise the integrity, independence, and impartiality required by the organization. By disclosing conflicts of interest, the organization can mitigate and resolve them in favor of the organization's interests, ensuring that decisions and actions are made in an ethical and unbiased manner.",
    "context": "ST/SGB/2023/1/Rev.1\n(l) No staff member shall accept any honour, decoration, favour, gift or\nremuneration from any non-governmental source without first obtaining the approval\nof the Secretary-General;\nConflict of interest\n(m) A conflict of interest occurs when, by act or omission, a staff member’s\npersonal interests interfere with the performance of his or her official duties and\nresponsibilities or with the integrity, independence and impartiality required by the\nstaff member’s status as an in...",
    "source": "n2317972.pdf",
    "page": 14,
    "source_documents": [
      {
        "source": "n2317972.pdf",
        "page": 14,
        "content": "conflict of interest does arise, the conflict shall be disclosed by staff members to their\nhead of office, mitigated by the Organization and resolved in favour of the interests\nof the Organization;\n(n) All staff members at the D-1 level and above shall be required to file"
      },
      {
        "source": "n2317972.pdf",
        "page": 14,
        "content": "staff member’s status as an international civil servant. When an actual or possible\nconflict of interest does arise, the conflict shall be disclosed by staff members to their\nhead of office, mitigated by the Organization and resolved in favour of the interests\nof the Organization;"
      },
      {
        "source": "n2317972.pdf",
        "page": 17,
        "content": "Organization.\nConflict of interest\n(p) Staff members shall, except as otherwise authorized by the Secretary-\nGeneral, formally recuse themselves from any involvement in a matter which might\ngive rise to an actual or possible conflict of interest as set out in staff regulation 1.2 (m)"
      },
      {
        "source": "n2317972.pdf",
        "page": 14,
        "content": "of the Secretary-General;\nConflict of interest\n(m) A conflict of interest occurs when, by act or omission, a staff member’s\npersonal interests interfere with the performance of his or her official duties and\nresponsibilities or with the integrity, independence and impartiality required by the"
      },
      {
        "source": "n2317972.pdf",
        "page": 14,
        "content": "ST/SGB/2023/1/Rev.1\n(l) No staff member shall accept any honour, decoration, favour, gift or\nremuneration from any non-governmental source without first obtaining the approval\nof the Secretary-General;\nConflict of interest\n(m) A conflict of interest occurs when, by act or omission, a staff member’s"
      }
    ]
  },
  {
    "question": "Why is it necessary for staff members to use the property and assets of the organization only for official purposes?",
    "answer": "It is necessary for staff members to use the property and assets of the organization only for official purposes to ensure that resources are utilized efficiently and effectively for the organization's mission. This helps in preventing misuse of resources, maintaining transparency, and upholding ethical standards within the organization.",
    "context": "ST/SGB/2023/1/Rev.1\n(l) No staff member shall accept any honour, decoration, favour, gift or\nremuneration from any non-governmental source without first obtaining the approval\nof the Secretary-General;\nConflict of interest\n(m) A conflict of interest occurs when, by act or omission, a staff member’s\npersonal interests interfere with the performance of his or her official duties and\nresponsibilities or with the integrity, independence and impartiality required by the\nstaff member’s status as an in...",
    "source": "n2317972.pdf",
    "page": 14,
    "source_documents": [
      {
        "source": "n2317972.pdf",
        "page": 14,
        "content": "(q) Staff members shall use the property and assets of the Organization only\nfor official purposes and shall exercise reasonable care when utilizing such property\nand assets;\n(r) Staff members must respond fully to requests for information from staff"
      },
      {
        "source": "n2317972.pdf",
        "page": 14,
        "content": "duty station or where the occupation or employment occurs;\nUse of prope rty and assets\n(q) Staff members shall use the property and assets of the Organization only\nfor official purposes and shall exercise reasonable care when utilizing such property\nand assets;"
      },
      {
        "source": "n2317972.pdf",
        "page": 14,
        "content": "for official purposes and shall exercise reasonable care when utilizing such property\nand assets;\n(r) Staff members must respond fully to requests for information from staff\nmembers and other officials of the Organization authorized to investigate the possible\nmisuse of funds, waste or abuse."
      },
      {
        "source": "n2317972.pdf",
        "page": 13,
        "content": "that are required by that status;\n(g) Staff members shall not use their office or knowledge gained from their\nofficial functions for private gain, financial or otherwise, or for the private gain of\nany third party, including family, friends and those they favour. Nor shall staff"
      },
      {
        "source": "n2317972.pdf",
        "page": 13,
        "content": "servants;\n(i) Staff members shall exercise the utmost discretion with regard to all\nmatters of official business. They shall not communicate to any Government, entity,\nperson or any other source any information known to them by reason of their official"
      }
    ]
  },
  {
    "question": "What are the basic rights and obligations of staff members according to Rule 1.2?",
    "answer": "According to Rule 1.2, the basic rights and obligations of staff members include following directions and instructions properly issued by the Secretary-General and supervisors, complying with local laws, honoring private legal agreements between the Government and the United Nations, and upholding and respecting the principles set out in the Charter.",
    "context": "ST/SGB/2023/1/Rev.1\nChapt er I\nDuties, obligat ions and privileges\nRule 1.1\nStatus of staff\n(a) The declaration made by a staff member on appointment pursuant to staff\nregulation 1.1 (b) shall be placed in the staff member’s official status file. A new\ndeclaration shall be made after a break in service that exceeds three months.\n(b) The declaration administered under staff regulation 1.1 (b) shall not\nprevent the close collaboration of staff with a Government pursuant to an agreement\nbetween the...",
    "source": "n2317972.pdf",
    "page": 16,
    "source_documents": [
      {
        "source": "n2317972.pdf",
        "page": 16,
        "content": "Rule 1.2\nBasic rights and obligations of staff\nGene ral\n(a) Staff members shall follow the directions and instructions properly issued\nby the Secretary-General and by their supervisors.\n(b) Staff members must comply with local laws and honour their private legal"
      },
      {
        "source": "n2317972.pdf",
        "page": 16,
        "content": "between the Government and the United Nations.\nRule 1.2\nBasic rights and obligations of staff\nGene ral\n(a) Staff members shall follow the directions and instructions properly issued\nby the Secretary-General and by their supervisors."
      },
      {
        "source": "n2317972.pdf",
        "page": 16,
        "content": "prevent the close collaboration of staff with a Government pursuant to an agreement\nbetween the Government and the United Nations.\nRule 1.2\nBasic rights and obligations of staff\nGene ral\n(a) Staff members shall follow the directions and instructions properly issued"
      },
      {
        "source": "n2317972.pdf",
        "page": 12,
        "content": "Regulat ion 1.2\nBasic rdi gohbtlsi gaanti ons of staff\nCore v alues\n(a) Staff members shall uphold and respect the principles set out in the\nCharter, including faith in fundamental human rights, in the dignity and worth of the"
      },
      {
        "source": "n2317972.pdf",
        "page": 12,
        "content": "exist and whether they shall be waived in accordance with the relevant instruments.\nRegulat ion 1.2\nBasic rdi gohbtlsi gaanti ons of staff\nCore v alues\n(a) Staff members shall uphold and respect the principles set out in the"
      }
    ]
  },
  {
    "question": "Why is it important for staff members to report any breach of the Organization's regulations and rules?",
    "answer": "It is important for staff members to report any breach of the Organization's regulations and rules because it helps maintain transparency, accountability, and integrity within the organization. Reporting breaches ensures that issues are addressed promptly, prevents further violations, and upholds the organization's standards and values. Additionally, reporting breaches can help prevent potential harm to the organization, its stakeholders, and the public.",
    "context": "ST/SGB/2023/1/Rev.1\nChapt er I\nDuties, obligat ions and privileges\nRule 1.1\nStatus of staff\n(a) The declaration made by a staff member on appointment pursuant to staff\nregulation 1.1 (b) shall be placed in the staff member’s official status file. A new\ndeclaration shall be made after a break in service that exceeds three months.\n(b) The declaration administered under staff regulation 1.1 (b) shall not\nprevent the close collaboration of staff with a Government pursuant to an agreement\nbetween the...",
    "source": "n2317972.pdf",
    "page": 16,
    "source_documents": [
      {
        "source": "n2317972.pdf",
        "page": 16,
        "content": "courts.\n(c) Staff members have a duty to report any breach of the Organization’s\nregulations and rules to the officials who are responsible for taking appropriate action.\nStaff members shall cooperate with duly authorized audits and investigations. Staff"
      },
      {
        "source": "n2317972.pdf",
        "page": 16,
        "content": "obligations, including, but not limited to, the obligation to honour orders of competent\ncourts.\n(c) Staff members have a duty to report any breach of the Organization’s\nregulations and rules to the officials who are responsible for taking appropriate action."
      },
      {
        "source": "n2317972.pdf",
        "page": 16,
        "content": "regulations and rules to the officials who are responsible for taking appropriate action.\nStaff members shall cooperate with duly authorized audits and investigations. Staff\nmembers shall not be retaliated against for complying with these duties."
      },
      {
        "source": "n2317972.pdf",
        "page": 14,
        "content": "(r) Staff members must respond fully to requests for information from staff\nmembers and other officials of the Organization authorized to investigate the possible\nmisuse of funds, waste or abuse.\n12/115 23-12028"
      },
      {
        "source": "n2317972.pdf",
        "page": 19,
        "content": "and Rules as well as for the purpose of completing administrative arrangements in\nconnection with their employment. Staff members shall be held personally\naccountable for the accuracy and completeness of the information they provide."
      }
    ]
  },
  {
    "question": "What are the consequences for staff members who do not respond fully to requests for information regarding possible misuse of funds, waste, or abuse?",
    "answer": "Staff members who do not respond fully to requests for information regarding possible misuse of funds, waste, or abuse may face disciplinary measures. These measures could be imposed following the completion of an investigation if the staff member has been notified in writing of formal allegations of misconduct against them.",
    "context": "ST/SGB/2023/1/Rev.1\n(l) No staff member shall accept any honour, decoration, favour, gift or\nremuneration from any non-governmental source without first obtaining the approval\nof the Secretary-General;\nConflict of interest\n(m) A conflict of interest occurs when, by act or omission, a staff member’s\npersonal interests interfere with the performance of his or her official duties and\nresponsibilities or with the integrity, independence and impartiality required by the\nstaff member’s status as an in...",
    "source": "n2317972.pdf",
    "page": 14,
    "source_documents": [
      {
        "source": "n2317972.pdf",
        "page": 14,
        "content": "(r) Staff members must respond fully to requests for information from staff\nmembers and other officials of the Organization authorized to investigate the possible\nmisuse of funds, waste or abuse.\n12/115 23-12028"
      },
      {
        "source": "n2317972.pdf",
        "page": 14,
        "content": "for official purposes and shall exercise reasonable care when utilizing such property\nand assets;\n(r) Staff members must respond fully to requests for information from staff\nmembers and other officials of the Organization authorized to investigate the possible\nmisuse of funds, waste or abuse."
      },
      {
        "source": "n2317972.pdf",
        "page": 79,
        "content": "disciplinary measure may be imposed on a staff member following the completion of\nan investigation unless the staff member has been notified, in writing, of the formal\nallegations of misconduct against the staff member and has been given the opportunity"
      },
      {
        "source": "n2317972.pdf",
        "page": 19,
        "content": "and Rules as well as for the purpose of completing administrative arrangements in\nconnection with their employment. Staff members shall be held personally\naccountable for the accuracy and completeness of the information they provide."
      },
      {
        "source": "n2317972.pdf",
        "page": 79,
        "content": "findings of an investigation indicate that misconduct may have occurred. No\ndisciplinary measure may be imposed on a staff member following the completion of\nan investigation unless the staff member has been notified, in writing, of the formal"
      }
    ]
  },
  {
    "question": "How does the document address prohibited conduct such as sexual exploitation and abuse?",
    "answer": "The document explicitly states that both sexual exploitation and sexual abuse are prohibited. It emphasizes that sexual activity with children (persons under the age of 18) is prohibited regardless of the age of the perpetrator. Additionally, any form of discrimination or harassment, including sexual or gender harassment, as well as abuse in any form at the workplace or in connection with work, is also prohibited. United Nations staff members are required to create and maintain an environment that prevents sexual exploitation and abuse.",
    "context": "ST/SGB/2023/1/Rev.1\nChapt er I\nDuties, obligat ions and privileges\nRule 1.1\nStatus of staff\n(a) The declaration made by a staff member on appointment pursuant to staff\nregulation 1.1 (b) shall be placed in the staff member’s official status file. A new\ndeclaration shall be made after a break in service that exceeds three months.\n(b) The declaration administered under staff regulation 1.1 (b) shall not\nprevent the close collaboration of staff with a Government pursuant to an agreement\nbetween the...",
    "source": "n2317972.pdf",
    "page": 16,
    "source_documents": [
      {
        "source": "n2317972.pdf",
        "page": 16,
        "content": "Rules and administrative issuances.\nSpecific instances of prohibited conduct\n(e) Both sexual exploitation and sexual abuse are prohibited. Sexual activity\nwith children (persons under the age of 18) is prohibited regardless of the age of"
      },
      {
        "source": "n2317972.pdf",
        "page": 16,
        "content": "environment that prevents sexual exploitation and sexual abuse.\n(f) Any form of discrimination or harassment, including sexual or gender\nharassment, as well as abuse in any form at the workplace or in connection with work,\nis prohibited."
      },
      {
        "source": "n2317972.pdf",
        "page": 16,
        "content": "of the United Nations, the Staff Regulations and Rules, the Financial Regulations and\nRules and administrative issuances.\nSpecific instances of prohibited conduct\n(e) Both sexual exploitation and sexual abuse are prohibited. Sexual activity"
      },
      {
        "source": "n2317972.pdf",
        "page": 16,
        "content": "sexual favours or other forms of humiliating, degrading or exploitative behaviour, is\nprohibited. United Nations staff members are obliged to create and maintain an\nenvironment that prevents sexual exploitation and sexual abuse."
      },
      {
        "source": "n2317972.pdf",
        "page": 16,
        "content": "prohibited. United Nations staff members are obliged to create and maintain an\nenvironment that prevents sexual exploitation and sexual abuse.\n(f) Any form of discrimination or harassment, including sexual or gender"
      }
    ]
  },
  {
    "question": "How does the document ensure a safe and respectful work environment for staff members?",
    "answer": "The document ensures a safe and respectful work environment for staff members by emphasizing the importance of respecting all cultures, prohibiting discrimination and abuse of power, upholding high standards of efficiency, promoting effective communication with staff to address welfare issues, and prohibiting any form of discrimination, harassment, or abuse in the workplace.",
    "context": "ST/SGB/2023/1/Rev.1\nChapt er I\nDuties, obligat ions and privileges\nRule 1.1\nStatus of staff\n(a) The declaration made by a staff member on appointment pursuant to staff\nregulation 1.1 (b) shall be placed in the staff member’s official status file. A new\ndeclaration shall be made after a break in service that exceeds three months.\n(b) The declaration administered under staff regulation 1.1 (b) shall not\nprevent the close collaboration of staff with a Government pursuant to an agreement\nbetween the...",
    "source": "n2317972.pdf",
    "page": 16,
    "source_documents": [
      {
        "source": "n2317972.pdf",
        "page": 12,
        "content": "human person and in the equal rights of men and women. Consequently, staff\nmembers shall exhibit respect for all cultures; they shall not discriminate against any\nindividual or group of individuals or otherwise abuse the power and authority vested\nin them;"
      },
      {
        "source": "n2317972.pdf",
        "page": 12,
        "content": "Charter, including faith in fundamental human rights, in the dignity and worth of the\nhuman person and in the equal rights of men and women. Consequently, staff\nmembers shall exhibit respect for all cultures; they shall not discriminate against any"
      },
      {
        "source": "n2317972.pdf",
        "page": 12,
        "content": "members shall exhibit respect for all cultures; they shall not discriminate against any\nindividual or group of individuals or otherwise abuse the power and authority vested\nin them;\n(b) Staff members shall uphold the highest standards of efficiency,"
      },
      {
        "source": "n2317972.pdf",
        "page": 65,
        "content": "communication with the staff in order to ensure the effective participation of the staff\nin identifying, examining and resolving issues relating to staff welfare, including\nconditions of work, general conditions of life and other human resources policies;"
      },
      {
        "source": "n2317972.pdf",
        "page": 16,
        "content": "environment that prevents sexual exploitation and sexual abuse.\n(f) Any form of discrimination or harassment, including sexual or gender\nharassment, as well as abuse in any form at the workplace or in connection with work,\nis prohibited."
      }
    ]
  },
  {
    "question": "Why is it important for staff members not to misrepresent their functions or duties?",
    "answer": "It is important for staff members not to misrepresent their functions or duties because doing so can adversely reflect on their status, integrity, independence, and impartiality that are required by their position within the organization. Misrepresenting functions or duties can also lead to confusion, lack of trust, and potential misuse of resources within the organization.",
    "context": "ST/SGB/2023/1/Rev.1\n(h) Staff members shall not intentionally misrepresent their functions, official\ntitle or the nature of their duties to Member States or to any entities or persons external\nto the United Nations.\n(i) Staff members shall not take any of the following actions with malicious\nintent, or without authorization, or for personal benefit or for the private gain of any\nthird party: alter, destroy, falsify, misplace, abuse or render useless any official\ndocument, record, file or data th...",
    "source": "n2317972.pdf",
    "page": 17,
    "source_documents": [
      {
        "source": "n2317972.pdf",
        "page": 17,
        "content": "ST/SGB/2023/1/Rev.1\n(h) Staff members shall not intentionally misrepresent their functions, official\ntitle or the nature of their duties to Member States or to any entities or persons external\nto the United Nations.\n(i) Staff members shall not take any of the following actions with malicious"
      },
      {
        "source": "n2317972.pdf",
        "page": 13,
        "content": "adversely reflect on their status, or on the integrity, independence and impartiality\nthat are required by that status;\n(g) Staff members shall not use their office or knowledge gained from their\nofficial functions for private gain, financial or otherwise, or for the private gain of"
      },
      {
        "source": "n2317972.pdf",
        "page": 19,
        "content": "and Rules as well as for the purpose of completing administrative arrangements in\nconnection with their employment. Staff members shall be held personally\naccountable for the accuracy and completeness of the information they provide."
      },
      {
        "source": "n2317972.pdf",
        "page": 13,
        "content": "that are required by that status;\n(g) Staff members shall not use their office or knowledge gained from their\nofficial functions for private gain, financial or otherwise, or for the private gain of\nany third party, including family, friends and those they favour. Nor shall staff"
      },
      {
        "source": "n2317972.pdf",
        "page": 14,
        "content": "(r) Staff members must respond fully to requests for information from staff\nmembers and other officials of the Organization authorized to investigate the possible\nmisuse of funds, waste or abuse.\n12/115 23-12028"
      }
    ]
  },
  {
    "question": "What are the consequences for staff members who fail to comply with their obligations?",
    "answer": "The consequences for staff members who fail to comply with their obligations can include disciplinary procedures being instituted against them. This may result in disciplinary measures being taken as outlined in the Charter of the United Nations, the Staff Regulations and Rules, the Financial Regulations and Rules, and other administrative issuances.",
    "context": "ST/SGB/2023/1/Rev.1\nChapt er I\nDuties, obligat ions and privileges\nRule 1.1\nStatus of staff\n(a) The declaration made by a staff member on appointment pursuant to staff\nregulation 1.1 (b) shall be placed in the staff member’s official status file. A new\ndeclaration shall be made after a break in service that exceeds three months.\n(b) The declaration administered under staff regulation 1.1 (b) shall not\nprevent the close collaboration of staff with a Government pursuant to an agreement\nbetween the...",
    "source": "n2317972.pdf",
    "page": 16,
    "source_documents": [
      {
        "source": "n2317972.pdf",
        "page": 16,
        "content": "members shall not be retaliated against for complying with these duties.\n(d) Disciplinary procedures may be instituted against staff members who fail\nto comply with their obligations and the standards of conduct set out in the Charter"
      },
      {
        "source": "n2317972.pdf",
        "page": 16,
        "content": "obligations, including, but not limited to, the obligation to honour orders of competent\ncourts.\n(c) Staff members have a duty to report any breach of the Organization’s\nregulations and rules to the officials who are responsible for taking appropriate action."
      },
      {
        "source": "n2317972.pdf",
        "page": 16,
        "content": "(d) Disciplinary procedures may be instituted against staff members who fail\nto comply with their obligations and the standards of conduct set out in the Charter\nof the United Nations, the Staff Regulations and Rules, the Financial Regulations and\nRules and administrative issuances."
      },
      {
        "source": "n2317972.pdf",
        "page": 16,
        "content": "Staff members shall cooperate with duly authorized audits and investigations. Staff\nmembers shall not be retaliated against for complying with these duties.\n(d) Disciplinary procedures may be instituted against staff members who fail"
      },
      {
        "source": "n2317972.pdf",
        "page": 78,
        "content": "Disciplina ry measures\nRule 10.1\nMiscon duct\n(a) Failure by staff members to comply with their obligations under the\nCharter of the United Nations, the Staff Regulations and Rules or other relevant\nadministrative issuances or to observe the standards of conduct expected of an"
      }
    ]
  },
  {
    "question": "What actions are prohibited for staff members regarding official documents and records?",
    "answer": "Staff members are prohibited from altering, destroying, falsifying, misplacing, abusing, or rendering useless any official document, record, file, or data that is intended to be kept as part of the records of the Organization.",
    "context": "ST/SGB/2023/1/Rev.1\n(h) Staff members shall not intentionally misrepresent their functions, official\ntitle or the nature of their duties to Member States or to any entities or persons external\nto the United Nations.\n(i) Staff members shall not take any of the following actions with malicious\nintent, or without authorization, or for personal benefit or for the private gain of any\nthird party: alter, destroy, falsify, misplace, abuse or render useless any official\ndocument, record, file or data th...",
    "source": "n2317972.pdf",
    "page": 17,
    "source_documents": [
      {
        "source": "n2317972.pdf",
        "page": 17,
        "content": "intent, or without authorization, or for personal benefit or for the private gain of any\nthird party: alter, destroy, falsify, misplace, abuse or render useless any official\ndocument, record, file or data that is intended to be kept as part of the records of the\nOrganization."
      },
      {
        "source": "n2317972.pdf",
        "page": 17,
        "content": "third party: alter, destroy, falsify, misplace, abuse or render useless any official\ndocument, record, file or data that is intended to be kept as part of the records of the\nOrganization.\n(j) Staff members shall not seek to influence Member States, principal or"
      },
      {
        "source": "n2317972.pdf",
        "page": 13,
        "content": "that are required by that status;\n(g) Staff members shall not use their office or knowledge gained from their\nofficial functions for private gain, financial or otherwise, or for the private gain of\nany third party, including family, friends and those they favour. Nor shall staff"
      },
      {
        "source": "n2317972.pdf",
        "page": 17,
        "content": "ST/SGB/2023/1/Rev.1\n(h) Staff members shall not intentionally misrepresent their functions, official\ntitle or the nature of their duties to Member States or to any entities or persons external\nto the United Nations.\n(i) Staff members shall not take any of the following actions with malicious"
      },
      {
        "source": "n2317972.pdf",
        "page": 13,
        "content": "matters of official business. They shall not communicate to any Government, entity,\nperson or any other source any information known to them by reason of their official\nposition that they know or ought to have known has not been made public, except as"
      }
    ]
  },
  {
    "question": "How does the acceptance of honours, gifts, or remuneration from non-governmental sources need to be handled according to the guidelines?",
    "answer": "The acceptance of honours, gifts, or remuneration from non-governmental sources by staff members requires the prior approval of the Secretary-General. Approval is only granted in exceptional cases and where refusal would cause embarrassment to the Organization. Staff members should not accept such items without proper authorization.",
    "context": "ST/SGB/2023/1/Rev.1\n(h) Staff members shall not intentionally misrepresent their functions, official\ntitle or the nature of their duties to Member States or to any entities or persons external\nto the United Nations.\n(i) Staff members shall not take any of the following actions with malicious\nintent, or without authorization, or for personal benefit or for the private gain of any\nthird party: alter, destroy, falsify, misplace, abuse or render useless any official\ndocument, record, file or data th...",
    "source": "n2317972.pdf",
    "page": 17,
    "source_documents": [
      {
        "source": "n2317972.pdf",
        "page": 17,
        "content": "Honours, gifts or remuneration\n(l) Acceptance by staff members of any honour, decoration, favour, gift or\nremuneration from non-governmental sources requires the prior approval of the\nSecretary-General. Approval shall be granted only in exceptional cases and where"
      },
      {
        "source": "n2317972.pdf",
        "page": 17,
        "content": "to perform or delaying the performance of any official act.\nHonours, gifts or remuneration\n(l) Acceptance by staff members of any honour, decoration, favour, gift or\nremuneration from non-governmental sources requires the prior approval of the"
      },
      {
        "source": "n2317972.pdf",
        "page": 13,
        "content": "Honours, gifts or remuneration\n(j) No staff member shall accept any honour, decoration, favour, gift or\nremuneration from any Government;\n(k) If refusal of an unanticipated honour, decoration, favour or gift from a\nGovernment would cause embarrassment to the Organization, the staff member may"
      },
      {
        "source": "n2317972.pdf",
        "page": 13,
        "content": "remuneration from any Government;\n(k) If refusal of an unanticipated honour, decoration, favour or gift from a\nGovernment would cause embarrassment to the Organization, the staff member may\nreceive it on behalf of the Organization and then report and entrust it to the Secretary-"
      },
      {
        "source": "n2317972.pdf",
        "page": 13,
        "content": "appropriate in the normal course of their duties or by authorization of the Secretary-\nGeneral. These obligations do not cease upon separation from service;\nHonours, gifts or remuneration\n(j) No staff member shall accept any honour, decoration, favour, gift or\nremuneration from any Government;"
      }
    ]
  },
  {
    "question": "In what situations can staff members attend governmental or other functions without it being considered receipt of a favour or gift?",
    "answer": "Staff members can attend governmental or other functions such as meetings, conferences, meals, and diplomatic receptions as part of their official functions. In these situations, attendance is not considered receipt of a favour or gift within the meaning of the Staff Regulations and Rules.",
    "context": "ST/SGB/2023/1/Rev.1\n(h) Staff members shall not intentionally misrepresent their functions, official\ntitle or the nature of their duties to Member States or to any entities or persons external\nto the United Nations.\n(i) Staff members shall not take any of the following actions with malicious\nintent, or without authorization, or for personal benefit or for the private gain of any\nthird party: alter, destroy, falsify, misplace, abuse or render useless any official\ndocument, record, file or data th...",
    "source": "n2317972.pdf",
    "page": 17,
    "source_documents": [
      {
        "source": "n2317972.pdf",
        "page": 17,
        "content": "time to time to attend governmental or other functions such as meetings, conferences,\nmeals and diplomatic receptions. Such attendance is not considered receipt of a\nfavour, gift or remuneration within the meaning of the Staff Regulations and Rules."
      },
      {
        "source": "n2317972.pdf",
        "page": 17,
        "content": "(n) Staff members, as part of their official functions, will be expected from\ntime to time to attend governmental or other functions such as meetings, conferences,\nmeals and diplomatic receptions. Such attendance is not considered receipt of a"
      },
      {
        "source": "n2317972.pdf",
        "page": 17,
        "content": "meals and diplomatic receptions. Such attendance is not considered receipt of a\nfavour, gift or remuneration within the meaning of the Staff Regulations and Rules.\n(o) Staff members shall not accept any gift, remuneration or favour from any"
      },
      {
        "source": "n2317972.pdf",
        "page": 17,
        "content": "favour, gift or remuneration within the meaning of the Staff Regulations and Rules.\n(o) Staff members shall not accept any gift, remuneration or favour from any\nsource having or seeking to have any type of contractual relationship with the\nOrganization.\nConflict of interest"
      },
      {
        "source": "n2317972.pdf",
        "page": 17,
        "content": "allow for prior approval or if refusal of an unanticipated honour, decoration, favour\nor gift, including a minor gift of essentially nominal value, would cause\nembarrassment to the Organization, staff members may receive it on behalf of the"
      }
    ]
  },
  {
    "question": "Why is it crucial for staff members not to accept any gift, remuneration, or favour from sources with contractual relationships with the Organization?",
    "answer": "It is crucial for staff members not to accept any gift, remuneration, or favour from sources with contractual relationships with the Organization to avoid conflicts of interest. Accepting such gifts or benefits could compromise the staff member's impartiality, integrity, and objectivity in carrying out their duties within the organization. It helps maintain transparency, fairness, and trust in the organization's operations and decision-making processes.",
    "context": "ST/SGB/2023/1/Rev.1\n(h) Staff members shall not intentionally misrepresent their functions, official\ntitle or the nature of their duties to Member States or to any entities or persons external\nto the United Nations.\n(i) Staff members shall not take any of the following actions with malicious\nintent, or without authorization, or for personal benefit or for the private gain of any\nthird party: alter, destroy, falsify, misplace, abuse or render useless any official\ndocument, record, file or data th...",
    "source": "n2317972.pdf",
    "page": 17,
    "source_documents": [
      {
        "source": "n2317972.pdf",
        "page": 17,
        "content": "favour, gift or remuneration within the meaning of the Staff Regulations and Rules.\n(o) Staff members shall not accept any gift, remuneration or favour from any\nsource having or seeking to have any type of contractual relationship with the\nOrganization.\nConflict of interest"
      },
      {
        "source": "n2317972.pdf",
        "page": 17,
        "content": "(o) Staff members shall not accept any gift, remuneration or favour from any\nsource having or seeking to have any type of contractual relationship with the\nOrganization.\nConflict of interest\n(p) Staff members shall, except as otherwise authorized by the Secretary-"
      },
      {
        "source": "n2317972.pdf",
        "page": 17,
        "content": "neither seek nor accept any favour, gift, remuneration or any other personal benefit\nfrom another staff member or from any third party in exchange for performing, failing\nto perform or delaying the performance of any official act.\nHonours, gifts or remuneration"
      },
      {
        "source": "n2317972.pdf",
        "page": 13,
        "content": "Honours, gifts or remuneration\n(j) No staff member shall accept any honour, decoration, favour, gift or\nremuneration from any Government;\n(k) If refusal of an unanticipated honour, decoration, favour or gift from a\nGovernment would cause embarrassment to the Organization, the staff member may"
      },
      {
        "source": "n2317972.pdf",
        "page": 17,
        "content": "allow for prior approval or if refusal of an unanticipated honour, decoration, favour\nor gift, including a minor gift of essentially nominal value, would cause\nembarrassment to the Organization, staff members may receive it on behalf of the"
      }
    ]
  },
  {
    "question": "What financial responsibilities are staff members required to uphold according to Rule 1.7?",
    "answer": "Staff members are required to exercise reasonable care in any matter affecting the financial interests of the Organization, its physical and human resources, property, and assets according to Rule 1.7.",
    "context": "ST/SGB/2023/1/Rev.1\nRule 1.7\nFinancial r esponsibility\nStaff members shall exercise reasonable care in any matter affecting the\nfinancial interests of the Organization, its physical and human resources, property and\nassets.\nRule 1.8\nLiability insurance\nStaff members who own or drive motor cars shall carry public liability and\nproperty damage insurance in an amount adequate to insure them against claims\narising from injury or death to other persons or from damage to the property of others\ncaused ...",
    "source": "n2317972.pdf",
    "page": 20,
    "source_documents": [
      {
        "source": "n2317972.pdf",
        "page": 20,
        "content": "ST/SGB/2023/1/Rev.1\nRule 1.7\nFinancial r esponsibility\nStaff members shall exercise reasonable care in any matter affecting the\nfinancial interests of the Organization, its physical and human resources, property and\nassets.\nRule 1.8\nLiability insurance"
      },
      {
        "source": "n2317972.pdf",
        "page": 19,
        "content": "and Rules as well as for the purpose of completing administrative arrangements in\nconnection with their employment. Staff members shall be held personally\naccountable for the accuracy and completeness of the information they provide."
      },
      {
        "source": "n2317972.pdf",
        "page": 20,
        "content": "Staff members shall exercise reasonable care in any matter affecting the\nfinancial interests of the Organization, its physical and human resources, property and\nassets.\nRule 1.8\nLiability insurance\nStaff members who own or drive motor cars shall carry public liability and"
      },
      {
        "source": "n2317972.pdf",
        "page": 14,
        "content": "(r) Staff members must respond fully to requests for information from staff\nmembers and other officials of the Organization authorized to investigate the possible\nmisuse of funds, waste or abuse.\n12/115 23-12028"
      },
      {
        "source": "n2317972.pdf",
        "page": 20,
        "content": "financial interests of the Organization, its physical and human resources, property and\nassets.\nRule 1.8\nLiability insurance\nStaff members who own or drive motor cars shall carry public liability and\nproperty damage insurance in an amount adequate to insure them against claims"
      }
    ]
  },
  {
    "question": "How are proprietary rights handled for work performed by staff members as part of their official duties according to Rule 1.9?",
    "answer": "According to Rule 1.9, all rights, including title, copyright, and patent rights, in any work performed by staff members as part of their official duties shall be vested in the United Nations.",
    "context": "ST/SGB/2023/1/Rev.1\nRule 1.7\nFinancial r esponsibility\nStaff members shall exercise reasonable care in any matter affecting the\nfinancial interests of the Organization, its physical and human resources, property and\nassets.\nRule 1.8\nLiability insurance\nStaff members who own or drive motor cars shall carry public liability and\nproperty damage insurance in an amount adequate to insure them against claims\narising from injury or death to other persons or from damage to the property of others\ncaused ...",
    "source": "n2317972.pdf",
    "page": 20,
    "source_documents": [
      {
        "source": "n2317972.pdf",
        "page": 20,
        "content": "caused by their cars.\nRule 1.9\nProprieta ry rights\nAll rights, including title, copyright and patent rights, in any work performed\nby staff members as part of their official duties shall be vested in the United Nations.\n18/115 23-12028"
      },
      {
        "source": "n2317972.pdf",
        "page": 16,
        "content": "ST/SGB/2023/1/Rev.1\nChapt er I\nDuties, obligat ions and privileges\nRule 1.1\nStatus of staff\n(a) The declaration made by a staff member on appointment pursuant to staff\nregulation 1.1 (b) shall be placed in the staff member’s official status file. A new"
      },
      {
        "source": "n2317972.pdf",
        "page": 16,
        "content": "Rule 1.1\nStatus of staff\n(a) The declaration made by a staff member on appointment pursuant to staff\nregulation 1.1 (b) shall be placed in the staff member’s official status file. A new\ndeclaration shall be made after a break in service that exceeds three months."
      },
      {
        "source": "n2317972.pdf",
        "page": 14,
        "content": "(q) Staff members shall use the property and assets of the Organization only\nfor official purposes and shall exercise reasonable care when utilizing such property\nand assets;\n(r) Staff members must respond fully to requests for information from staff"
      },
      {
        "source": "n2317972.pdf",
        "page": 16,
        "content": "Rule 1.2\nBasic rights and obligations of staff\nGene ral\n(a) Staff members shall follow the directions and instructions properly issued\nby the Secretary-General and by their supervisors.\n(b) Staff members must comply with local laws and honour their private legal"
      }
    ]
  },
  {
    "question": "What are the restrictions imposed on staff members regarding engaging in outside activities according to the text?",
    "answer": "Staff members are restricted from engaging in any outside activities that relate to the purpose, activities, or interests of the United Nations without prior approval from the Secretary-General. They are not allowed to engage in any outside occupation or employment, whether paid or unpaid, without the Secretary-General's approval. Additionally, staff members are prohibited from using their office or knowledge gained from their official functions for personal gain or the gain of any third party. The Secretary-General may authorize staff members to engage in outside activities if deemed necessary in the interest of the organization. Staff members can seek clarification on potential conflicts with their status as international civil servants through established procedures.",
    "context": "ST/SGB/2023/1/Rev.1\nthe Organization of any mitigation or remediation measures. Staff members shall\nimplement the mitigation or remediation prescribed by the Organization to resolve\nthat conflict of interest situation.\n(q) Pursuant to staff regulation 1.2 (n), the Secretary-General shall establish\nprocedures for the filing and utilization of financial disclosure statements.\nOutside employme nt and activities\n(r) Staff members shall not, except in the normal course of official duties or\nwith the ...",
    "source": "n2317972.pdf",
    "page": 18,
    "source_documents": [
      {
        "source": "n2317972.pdf",
        "page": 18,
        "content": "(r) Staff members shall not, except in the normal course of official duties or\nwith the prior approval of the Secretary-General, engage in any outside activities that\nrelate to the purpose, activities or interests of the United Nations. Outside activities\ninclude but are not limited to:"
      },
      {
        "source": "n2317972.pdf",
        "page": 14,
        "content": "Outside employme nt and activities\n(o) Staff members shall not engage in any outside occupation or employment,\nwhether remunerated or not, without the approval of the Secretary-General;\n(p) The Secretary-General may authorize staff members to engage in an"
      },
      {
        "source": "n2317972.pdf",
        "page": 14,
        "content": "or she deems necessary in the interest of the Organization;\nOutside employme nt and activities\n(o) Staff members shall not engage in any outside occupation or employment,\nwhether remunerated or not, without the approval of the Secretary-General;"
      },
      {
        "source": "n2317972.pdf",
        "page": 13,
        "content": "that are required by that status;\n(g) Staff members shall not use their office or knowledge gained from their\nofficial functions for private gain, financial or otherwise, or for the private gain of\nany third party, including family, friends and those they favour. Nor shall staff"
      },
      {
        "source": "n2317972.pdf",
        "page": 18,
        "content": "set out in staff regulation 1.2 (h).\n(t) The Secretary-General shall establish procedures whereby staff may seek\nin confidence clarification as to whether proposed outside activities would conflict\nwith their status as international civil servants.\nTravel and per diem for outside activities"
      }
    ]
  },
  {
    "question": "Why is it important for staff members who own or drive motor cars to carry liability insurance as stated in Rule 1.8?",
    "answer": "It is important for staff members who own or drive motor cars to carry liability insurance as stated in Rule 1.8 to ensure that they are adequately insured against claims arising from injury or death to other persons or from damage to the property of others caused by their cars. This helps protect both the staff members and the organization from potential financial liabilities and legal consequences in case of accidents or incidents involving their vehicles.",
    "context": "ST/SGB/2023/1/Rev.1\nRule 1.7\nFinancial r esponsibility\nStaff members shall exercise reasonable care in any matter affecting the\nfinancial interests of the Organization, its physical and human resources, property and\nassets.\nRule 1.8\nLiability insurance\nStaff members who own or drive motor cars shall carry public liability and\nproperty damage insurance in an amount adequate to insure them against claims\narising from injury or death to other persons or from damage to the property of others\ncaused ...",
    "source": "n2317972.pdf",
    "page": 20,
    "source_documents": [
      {
        "source": "n2317972.pdf",
        "page": 20,
        "content": "assets.\nRule 1.8\nLiability insurance\nStaff members who own or drive motor cars shall carry public liability and\nproperty damage insurance in an amount adequate to insure them against claims\narising from injury or death to other persons or from damage to the property of others\ncaused by their cars."
      },
      {
        "source": "n2317972.pdf",
        "page": 20,
        "content": "Staff members shall exercise reasonable care in any matter affecting the\nfinancial interests of the Organization, its physical and human resources, property and\nassets.\nRule 1.8\nLiability insurance\nStaff members who own or drive motor cars shall carry public liability and"
      },
      {
        "source": "n2317972.pdf",
        "page": 20,
        "content": "financial interests of the Organization, its physical and human resources, property and\nassets.\nRule 1.8\nLiability insurance\nStaff members who own or drive motor cars shall carry public liability and\nproperty damage insurance in an amount adequate to insure them against claims"
      },
      {
        "source": "n2317972.pdf",
        "page": 20,
        "content": "ST/SGB/2023/1/Rev.1\nRule 1.7\nFinancial r esponsibility\nStaff members shall exercise reasonable care in any matter affecting the\nfinancial interests of the Organization, its physical and human resources, property and\nassets.\nRule 1.8\nLiability insurance"
      },
      {
        "source": "n2317972.pdf",
        "page": 64,
        "content": "Rule 7.16\nInsur ance\n(a) Staff members shall not be reimbursed for the cost of personal accident\ninsurance or insurance of accompanied personal baggage. However, compensation\nmay be paid, under arrangements in force under staff rule 6.5 (Compensation for loss"
      }
    ]
  },
  {
    "question": "What rights and accommodations are provided to staff members with disabilities based on the text?",
    "answer": "Based on the text provided, staff members with disabilities are entitled to an accessible, non-discriminatory, and inclusive workplace. They also have the right to reasonable accommodation, under conditions established by the Secretary-General.",
    "context": "ST/SGB/2023/1/Rev.1\nthe Organization of any mitigation or remediation measures. Staff members shall\nimplement the mitigation or remediation prescribed by the Organization to resolve\nthat conflict of interest situation.\n(q) Pursuant to staff regulation 1.2 (n), the Secretary-General shall establish\nprocedures for the filing and utilization of financial disclosure statements.\nOutside employme nt and activities\n(r) Staff members shall not, except in the normal course of official duties or\nwith the ...",
    "source": "n2317972.pdf",
    "page": 18,
    "source_documents": [
      {
        "source": "n2317972.pdf",
        "page": 18,
        "content": "Rule 1.3\nEmployment and accessibility for staff members with disabilities\nStaff members with disabilities shall enjoy an accessible, non-discriminatory\nand inclusive workplace, as well as the right to reasonable accommodation, under\nconditions established by the Secretary-General.\nRule 1.4"
      },
      {
        "source": "n2317972.pdf",
        "page": 18,
        "content": "United Nations shall be reduced as envisaged by staff rule 7.7 (a).\nRule 1.3\nEmployment and accessibility for staff members with disabilities\nStaff members with disabilities shall enjoy an accessible, non-discriminatory"
      },
      {
        "source": "n2317972.pdf",
        "page": 18,
        "content": "and inclusive workplace, as well as the right to reasonable accommodation, under\nconditions established by the Secretary-General.\nRule 1.4\nPerformanc e of staff\n(a) Staff members shall be evaluated for their efficiency, competence and"
      },
      {
        "source": "n2317972.pdf",
        "page": 12,
        "content": "Charter, including faith in fundamental human rights, in the dignity and worth of the\nhuman person and in the equal rights of men and women. Consequently, staff\nmembers shall exhibit respect for all cultures; they shall not discriminate against any"
      },
      {
        "source": "n2317972.pdf",
        "page": 12,
        "content": "human person and in the equal rights of men and women. Consequently, staff\nmembers shall exhibit respect for all cultures; they shall not discriminate against any\nindividual or group of individuals or otherwise abuse the power and authority vested\nin them;"
      }
    ]
  },
  {
    "question": "What are the requirements for staff members in terms of providing information to the Secretary-General?",
    "answer": "Staff members are required to supply the Secretary-General with relevant information during the application process and throughout their employment. This information is used to determine their status under the Staff Regulations. Additionally, staff members may be required to provide information about their integrity, conduct, and service as staff members. They are also accountable for the accuracy and completeness of the information they provide and must promptly notify the Secretary-General of any changes affecting their status or administrative arrangements under the Staff Regulations or Staff Rules.",
    "context": "ST/SGB/2023/1/Rev.1\n(b) The Secretary-General shall seek to ensure that appropriate learning and\ndevelopment programmes are available for the benefit of staff.\n(c) Performance appraisals shall be conducted regularly for all staff members,\nincluding at the Assistant Secretary-General level and above, in accordance with\nprocedures promulgated by the Secretary-General.\nRule 1.5\nNotification by staff members and obligation to supply information\n(a) Staff members shall supply the Secretary-General wi...",
    "source": "n2317972.pdf",
    "page": 19,
    "source_documents": [
      {
        "source": "n2317972.pdf",
        "page": 19,
        "content": "procedures promulgated by the Secretary-General.\nRule 1.5\nNotification by staff members and obligation to supply information\n(a) Staff members shall supply the Secretary-General with relevant\ninformation, as required, both during the application process and on subsequent"
      },
      {
        "source": "n2317972.pdf",
        "page": 19,
        "content": "including at the Assistant Secretary-General level and above, in accordance with\nprocedures promulgated by the Secretary-General.\nRule 1.5\nNotification by staff members and obligation to supply information\n(a) Staff members shall supply the Secretary-General with relevant"
      },
      {
        "source": "n2317972.pdf",
        "page": 19,
        "content": "General.\n(e) Staff members may at any time be required by the Secretary-General to\nsupply information concerning facts anterior to their appointment and relevant to their\nsuitability or concerning facts relevant to their integrity, conduct and service as staff\nmembers.\nRule 1.6"
      },
      {
        "source": "n2317972.pdf",
        "page": 19,
        "content": "(a) Staff members shall supply the Secretary-General with relevant\ninformation, as required, both during the application process and on subsequent\nemployment, for the purpose of determining their status under the Staff Regulations"
      },
      {
        "source": "n2317972.pdf",
        "page": 19,
        "content": "accountable for the accuracy and completeness of the information they provide.\n(b) Staff members shall promptly notify the Secretary-General, in writing, of\nany subsequent changes affecting their status or administrative arrangements under\nthe Staff Regulations or Staff Rules."
      }
    ]
  },
  {
    "question": "How are staff members evaluated for their efficiency, competence, and integrity according to the text?",
    "answer": "Staff members are evaluated for their efficiency, competence, and integrity through performance appraisal mechanisms. These mechanisms assess the staff member's compliance with the standards set out in the Staff Regulations and Rules for purposes of accountability. The performance of staff members is periodically appraised to ensure that the required standards of performance are met.",
    "context": "ST/SGB/2023/1/Rev.1\nthe Organization of any mitigation or remediation measures. Staff members shall\nimplement the mitigation or remediation prescribed by the Organization to resolve\nthat conflict of interest situation.\n(q) Pursuant to staff regulation 1.2 (n), the Secretary-General shall establish\nprocedures for the filing and utilization of financial disclosure statements.\nOutside employme nt and activities\n(r) Staff members shall not, except in the normal course of official duties or\nwith the ...",
    "source": "n2317972.pdf",
    "page": 18,
    "source_documents": [
      {
        "source": "n2317972.pdf",
        "page": 18,
        "content": "Rule 1.4\nPerformanc e of staff\n(a) Staff members shall be evaluated for their efficiency, competence and\nintegrity through performance appraisal mechanisms that shall assess the staff\nmember’s compliance with the standards set out in the Staff Regulations and Rules\nfor purposes of accountability."
      },
      {
        "source": "n2317972.pdf",
        "page": 15,
        "content": "discharge of their functions. Staff members are required to uphold the highest\nstandards of efficiency, competence and integrity in the discharge of their functions.\nTheir performance will be appraised periodically to ensure that the required standards\nof performance are met;"
      },
      {
        "source": "n2317972.pdf",
        "page": 18,
        "content": "integrity through performance appraisal mechanisms that shall assess the staff\nmember’s compliance with the standards set out in the Staff Regulations and Rules\nfor purposes of accountability.\n16/115 23-12028"
      },
      {
        "source": "n2317972.pdf",
        "page": 18,
        "content": "conditions established by the Secretary-General.\nRule 1.4\nPerformanc e of staff\n(a) Staff members shall be evaluated for their efficiency, competence and\nintegrity through performance appraisal mechanisms that shall assess the staff"
      },
      {
        "source": "n2317972.pdf",
        "page": 15,
        "content": "standards of efficiency, competence and integrity in the discharge of their functions.\nTheir performance will be appraised periodically to ensure that the required standards\nof performance are met;\n(b) The whole time of staff members shall be at the disposal of the Secretary-"
      }
    ]
  },
  {
    "question": "Can staff members receive financial support for outside activities organized by external entities? If so, under what conditions?",
    "answer": "Staff members can receive financial support for outside activities organized by external entities under certain conditions. The Secretary-General must authorize the staff members to participate in these activities related to the work of the Organization. Additionally, staff members can seek clarification in confidence to ensure that the proposed outside activities do not conflict with their status as international civil servants.",
    "context": "ST/SGB/2023/1/Rev.1\nthe Organization of any mitigation or remediation measures. Staff members shall\nimplement the mitigation or remediation prescribed by the Organization to resolve\nthat conflict of interest situation.\n(q) Pursuant to staff regulation 1.2 (n), the Secretary-General shall establish\nprocedures for the filing and utilization of financial disclosure statements.\nOutside employme nt and activities\n(r) Staff members shall not, except in the normal course of official duties or\nwith the ...",
    "source": "n2317972.pdf",
    "page": 18,
    "source_documents": [
      {
        "source": "n2317972.pdf",
        "page": 18,
        "content": "contrary to staff regulation 1.2 (h). The payment of normal financial contributions to\na political party shall not be construed as an activity inconsistent with the principles\nset out in staff regulation 1.2 (h).\n(t) The Secretary-General shall establish procedures whereby staff may seek"
      },
      {
        "source": "n2317972.pdf",
        "page": 17,
        "content": "relating to the financing of the Organization’s activities, or in order to secure support\nfor improving their personal situation or the personal situation of other staff members\nor for blocking or reversing unfavourable decisions regarding their status or their\ncolleagues’ status."
      },
      {
        "source": "n2317972.pdf",
        "page": 18,
        "content": "Travel and per diem for outside activities\n(u) Staff members who are authorized by the Secretary-General to participate\nin activities related to the work of the Organization which are organized by a\nGovernment, intergovernmental organization, non-governmental organization or"
      },
      {
        "source": "n2317972.pdf",
        "page": 18,
        "content": "in confidence clarification as to whether proposed outside activities would conflict\nwith their status as international civil servants.\nTravel and per diem for outside activities\n(u) Staff members who are authorized by the Secretary-General to participate"
      },
      {
        "source": "n2317972.pdf",
        "page": 18,
        "content": "with their status as international civil servants.\nTravel and per diem for outside activities\n(u) Staff members who are authorized by the Secretary-General to participate\nin activities related to the work of the Organization which are organized by a"
      }
    ]
  },
  {
    "question": "How does the Secretary-General handle conflicts of interest situations among staff members?",
    "answer": "The Secretary-General handles conflicts of interest situations among staff members by requiring staff members to formally recuse themselves from any involvement in a matter that could lead to a conflict of interest. If a conflict of interest arises, staff members must disclose it to their head of office, and the conflict will be mitigated and resolved in favor of the Organization's interests. The Secretary-General may establish mitigation or remediation measures to resolve conflict of interest situations. Staff members are also required to obtain approval from the Secretary-General before accepting any honor, gift, or remuneration from non-governmental sources.",
    "context": "ST/SGB/2023/1/Rev.1\nthe Organization of any mitigation or remediation measures. Staff members shall\nimplement the mitigation or remediation prescribed by the Organization to resolve\nthat conflict of interest situation.\n(q) Pursuant to staff regulation 1.2 (n), the Secretary-General shall establish\nprocedures for the filing and utilization of financial disclosure statements.\nOutside employme nt and activities\n(r) Staff members shall not, except in the normal course of official duties or\nwith the ...",
    "source": "n2317972.pdf",
    "page": 18,
    "source_documents": [
      {
        "source": "n2317972.pdf",
        "page": 14,
        "content": "of the Secretary-General;\nConflict of interest\n(m) A conflict of interest occurs when, by act or omission, a staff member’s\npersonal interests interfere with the performance of his or her official duties and\nresponsibilities or with the integrity, independence and impartiality required by the"
      },
      {
        "source": "n2317972.pdf",
        "page": 17,
        "content": "Organization.\nConflict of interest\n(p) Staff members shall, except as otherwise authorized by the Secretary-\nGeneral, formally recuse themselves from any involvement in a matter which might\ngive rise to an actual or possible conflict of interest as set out in staff regulation 1.2 (m)"
      },
      {
        "source": "n2317972.pdf",
        "page": 14,
        "content": "staff member’s status as an international civil servant. When an actual or possible\nconflict of interest does arise, the conflict shall be disclosed by staff members to their\nhead of office, mitigated by the Organization and resolved in favour of the interests\nof the Organization;"
      },
      {
        "source": "n2317972.pdf",
        "page": 18,
        "content": "ST/SGB/2023/1/Rev.1\nthe Organization of any mitigation or remediation measures. Staff members shall\nimplement the mitigation or remediation prescribed by the Organization to resolve\nthat conflict of interest situation.\n(q) Pursuant to staff regulation 1.2 (n), the Secretary-General shall establish"
      },
      {
        "source": "n2317972.pdf",
        "page": 14,
        "content": "ST/SGB/2023/1/Rev.1\n(l) No staff member shall accept any honour, decoration, favour, gift or\nremuneration from any non-governmental source without first obtaining the approval\nof the Secretary-General;\nConflict of interest\n(m) A conflict of interest occurs when, by act or omission, a staff member’s"
      }
    ]
  },
  {
    "question": "Why is it important for staff members to notify the Secretary-General of any changes affecting their status or administrative arrangements?",
    "answer": "It is important for staff members to notify the Secretary-General of any changes affecting their status or administrative arrangements to ensure that the organization has accurate and up-to-date information about its staff. This helps in maintaining transparency, accountability, and compliance with the organization's rules and regulations. It also allows the organization to make informed decisions regarding staffing and administrative matters.",
    "context": "ST/SGB/2023/1/Rev.1\n(b) The Secretary-General shall seek to ensure that appropriate learning and\ndevelopment programmes are available for the benefit of staff.\n(c) Performance appraisals shall be conducted regularly for all staff members,\nincluding at the Assistant Secretary-General level and above, in accordance with\nprocedures promulgated by the Secretary-General.\nRule 1.5\nNotification by staff members and obligation to supply information\n(a) Staff members shall supply the Secretary-General wi...",
    "source": "n2317972.pdf",
    "page": 19,
    "source_documents": [
      {
        "source": "n2317972.pdf",
        "page": 19,
        "content": "accountable for the accuracy and completeness of the information they provide.\n(b) Staff members shall promptly notify the Secretary-General, in writing, of\nany subsequent changes affecting their status or administrative arrangements under\nthe Staff Regulations or Staff Rules."
      },
      {
        "source": "n2317972.pdf",
        "page": 19,
        "content": "including at the Assistant Secretary-General level and above, in accordance with\nprocedures promulgated by the Secretary-General.\nRule 1.5\nNotification by staff members and obligation to supply information\n(a) Staff members shall supply the Secretary-General with relevant"
      },
      {
        "source": "n2317972.pdf",
        "page": 19,
        "content": "connection with their employment. Staff members shall be held personally\naccountable for the accuracy and completeness of the information they provide.\n(b) Staff members shall promptly notify the Secretary-General, in writing, of"
      },
      {
        "source": "n2317972.pdf",
        "page": 19,
        "content": "General.\n(e) Staff members may at any time be required by the Secretary-General to\nsupply information concerning facts anterior to their appointment and relevant to their\nsuitability or concerning facts relevant to their integrity, conduct and service as staff\nmembers.\nRule 1.6"
      },
      {
        "source": "n2317972.pdf",
        "page": 19,
        "content": "(a) Staff members shall supply the Secretary-General with relevant\ninformation, as required, both during the application process and on subsequent\nemployment, for the purpose of determining their status under the Staff Regulations"
      }
    ]
  },
  {
    "question": "What is the process for staff members to nominate beneficiaries, and what happens in the event of their death?",
    "answer": "Staff members are required to nominate beneficiaries in writing at the time of their appointment using a form prescribed by the Secretary-General. It is the responsibility of the staff member to notify the Secretary-General of any changes or revocations of beneficiaries. In the event of the staff member's death, the amounts due to them will be paid to the nominated beneficiary or beneficiaries. If the nominated beneficiary does not survive, or if no beneficiary has been designated or the designation has been revoked, the amount will be paid to the estate of the staff member.",
    "context": "ST/SGB/2023/1/Rev.1\n(b) The Secretary-General shall seek to ensure that appropriate learning and\ndevelopment programmes are available for the benefit of staff.\n(c) Performance appraisals shall be conducted regularly for all staff members,\nincluding at the Assistant Secretary-General level and above, in accordance with\nprocedures promulgated by the Secretary-General.\nRule 1.5\nNotification by staff members and obligation to supply information\n(a) Staff members shall supply the Secretary-General wi...",
    "source": "n2317972.pdf",
    "page": 19,
    "source_documents": [
      {
        "source": "n2317972.pdf",
        "page": 19,
        "content": "(c) If a nominated beneficiary does not survive, or if a designation of\nbeneficiary has not been made or has been revoked, the amount due to the staff\nmember will, upon the staff member’s death, be paid to the estate of the staff member.\n23-12028 17/115"
      },
      {
        "source": "n2317972.pdf",
        "page": 19,
        "content": "members.\nRule 1.6\nStaff m’se mbbeenref iciaries\n(a) At the time of appointment, each staff member shall nominate a\nbeneficiary or beneficiaries in writing in a form prescribed by the Secretary-General.\nIt shall be the responsibility of the staff member to notify the Secretary-General of"
      },
      {
        "source": "n2317972.pdf",
        "page": 19,
        "content": "any revocations or changes of beneficiaries.\n(b) In the event of the death of a staff member, all amounts due to the staff\nmember will be paid to the nominated beneficiary or beneficiaries, subject to\napplication of the Staff Regulations and Rules and of the Regulations of the United"
      },
      {
        "source": "n2317972.pdf",
        "page": 19,
        "content": "complete release from all further liability in respect of any sum so paid.\n(c) If a nominated beneficiary does not survive, or if a designation of\nbeneficiary has not been made or has been revoked, the amount due to the staff"
      },
      {
        "source": "n2317972.pdf",
        "page": 19,
        "content": "beneficiary or beneficiaries in writing in a form prescribed by the Secretary-General.\nIt shall be the responsibility of the staff member to notify the Secretary-General of\nany revocations or changes of beneficiaries.\n(b) In the event of the death of a staff member, all amounts due to the staff"
      }
    ]
  },
  {
    "question": "Can staff members be required to provide information about their past or their integrity at any time?",
    "answer": "Yes, staff members may be required by the Secretary-General to supply information concerning facts anterior to their appointment and relevant to their suitability, integrity, conduct, and service as staff members. Staff members are personally accountable for the accuracy and completeness of the information they provide.",
    "context": "ST/SGB/2023/1/Rev.1\n(b) The Secretary-General shall seek to ensure that appropriate learning and\ndevelopment programmes are available for the benefit of staff.\n(c) Performance appraisals shall be conducted regularly for all staff members,\nincluding at the Assistant Secretary-General level and above, in accordance with\nprocedures promulgated by the Secretary-General.\nRule 1.5\nNotification by staff members and obligation to supply information\n(a) Staff members shall supply the Secretary-General wi...",
    "source": "n2317972.pdf",
    "page": 19,
    "source_documents": [
      {
        "source": "n2317972.pdf",
        "page": 19,
        "content": "General.\n(e) Staff members may at any time be required by the Secretary-General to\nsupply information concerning facts anterior to their appointment and relevant to their\nsuitability or concerning facts relevant to their integrity, conduct and service as staff\nmembers.\nRule 1.6"
      },
      {
        "source": "n2317972.pdf",
        "page": 19,
        "content": "and Rules as well as for the purpose of completing administrative arrangements in\nconnection with their employment. Staff members shall be held personally\naccountable for the accuracy and completeness of the information they provide."
      },
      {
        "source": "n2317972.pdf",
        "page": 14,
        "content": "(r) Staff members must respond fully to requests for information from staff\nmembers and other officials of the Organization authorized to investigate the possible\nmisuse of funds, waste or abuse.\n12/115 23-12028"
      },
      {
        "source": "n2317972.pdf",
        "page": 19,
        "content": "than a minor traffic violation shall immediately report the fact to the Secretary-\nGeneral.\n(e) Staff members may at any time be required by the Secretary-General to\nsupply information concerning facts anterior to their appointment and relevant to their"
      },
      {
        "source": "n2317972.pdf",
        "page": 19,
        "content": "connection with their employment. Staff members shall be held personally\naccountable for the accuracy and completeness of the information they provide.\n(b) Staff members shall promptly notify the Secretary-General, in writing, of"
      }
    ]
  },
  {
    "question": "How are performance appraisals conducted for staff members at the Assistant Secretary-General level and above?",
    "answer": "Performance appraisals for staff members at the Assistant Secretary-General level and above are conducted regularly in accordance with procedures established by the Secretary-General. The evaluations assess the staff members' efficiency, competence, and integrity to ensure they comply with the standards set out in the Staff Regulations and Rules for accountability purposes. The specific details of the appraisal process would be outlined in the procedures promulgated by the Secretary-General.",
    "context": "ST/SGB/2023/1/Rev.1\n(b) The Secretary-General shall seek to ensure that appropriate learning and\ndevelopment programmes are available for the benefit of staff.\n(c) Performance appraisals shall be conducted regularly for all staff members,\nincluding at the Assistant Secretary-General level and above, in accordance with\nprocedures promulgated by the Secretary-General.\nRule 1.5\nNotification by staff members and obligation to supply information\n(a) Staff members shall supply the Secretary-General wi...",
    "source": "n2317972.pdf",
    "page": 19,
    "source_documents": [
      {
        "source": "n2317972.pdf",
        "page": 19,
        "content": "development programmes are available for the benefit of staff.\n(c) Performance appraisals shall be conducted regularly for all staff members,\nincluding at the Assistant Secretary-General level and above, in accordance with\nprocedures promulgated by the Secretary-General.\nRule 1.5"
      },
      {
        "source": "n2317972.pdf",
        "page": 18,
        "content": "conditions established by the Secretary-General.\nRule 1.4\nPerformanc e of staff\n(a) Staff members shall be evaluated for their efficiency, competence and\nintegrity through performance appraisal mechanisms that shall assess the staff"
      },
      {
        "source": "n2317972.pdf",
        "page": 19,
        "content": "ST/SGB/2023/1/Rev.1\n(b) The Secretary-General shall seek to ensure that appropriate learning and\ndevelopment programmes are available for the benefit of staff.\n(c) Performance appraisals shall be conducted regularly for all staff members,"
      },
      {
        "source": "n2317972.pdf",
        "page": 15,
        "content": "Their performance will be appraised periodically to ensure that the required standards\nof performance are met;\n(b) The whole time of staff members shall be at the disposal of the Secretary-\nGeneral for the performance of official functions. The Secretary-General shall"
      },
      {
        "source": "n2317972.pdf",
        "page": 18,
        "content": "Rule 1.4\nPerformanc e of staff\n(a) Staff members shall be evaluated for their efficiency, competence and\nintegrity through performance appraisal mechanisms that shall assess the staff\nmember’s compliance with the standards set out in the Staff Regulations and Rules\nfor purposes of accountability."
      }
    ]
  },
  {
    "question": "What are the different categories in which posts, other than those of Deputy Secretary-General, Under-Secretaries-General, and Assistant Secretaries-General, can be classified?",
    "answer": "Posts other than those of Deputy Secretary-General, Under-Secretaries-General, and Assistant Secretaries-General can be classified into the following categories: Professional and higher categories, Field Service category, General Service and related categories, including but not limited to National Professional.",
    "context": "ST/SGB/2023/1/Rev.1\nChapt er II\nClassification of posts and staff\nRule 2.1\nClassifica tion of posts\n(a) Posts other than those of Deputy Secretary-General, Under-Secretaries-\nGeneral and Assistant Secretaries-General shall be classified in categories and level\naccording to standards established by the International Civil Service Commission or\nby the Secretary-General, as applicable.\n(b) Each post shall be assigned to a suitable level in any of the following\ncategories: Professional and higher ca...",
    "source": "n2317972.pdf",
    "page": 22,
    "source_documents": [
      {
        "source": "n2317972.pdf",
        "page": 22,
        "content": "Rule 2.1\nClassifica tion of posts\n(a) Posts other than those of Deputy Secretary-General, Under-Secretaries-\nGeneral and Assistant Secretaries-General shall be classified in categories and level\naccording to standards established by the International Civil Service Commission or"
      },
      {
        "source": "n2317972.pdf",
        "page": 22,
        "content": "ST/SGB/2023/1/Rev.1\nChapt er II\nClassification of posts and staff\nRule 2.1\nClassifica tion of posts\n(a) Posts other than those of Deputy Secretary-General, Under-Secretaries-\nGeneral and Assistant Secretaries-General shall be classified in categories and level"
      },
      {
        "source": "n2317972.pdf",
        "page": 22,
        "content": "General and Assistant Secretaries-General shall be classified in categories and level\naccording to standards established by the International Civil Service Commission or\nby the Secretary-General, as applicable.\n(b) Each post shall be assigned to a suitable level in any of the following"
      },
      {
        "source": "n2317972.pdf",
        "page": 22,
        "content": "by the Secretary-General, as applicable.\n(b) Each post shall be assigned to a suitable level in any of the following\ncategories: Professional and higher categories, Field Service category, General\nService and related categories, including but not limited to National Professional"
      },
      {
        "source": "n2317972.pdf",
        "page": 32,
        "content": "General Service category is required to serve in a higher-level post in the Professional\ncategory, or when a staff member in any category holding a fixed-term or continuing\nappointment is required to serve in a post which is classified more than one level"
      }
    ]
  },
  {
    "question": "Who is responsible for establishing the standards for the classification of posts according to Rule 2.1?",
    "answer": "The standards for the classification of posts according to Rule 2.1 can be established by either the International Civil Service Commission or by the Secretary-General, as applicable.",
    "context": "ST/SGB/2023/1/Rev.1\nChapt er II\nClassification of posts and staff\nRule 2.1\nClassifica tion of posts\n(a) Posts other than those of Deputy Secretary-General, Under-Secretaries-\nGeneral and Assistant Secretaries-General shall be classified in categories and level\naccording to standards established by the International Civil Service Commission or\nby the Secretary-General, as applicable.\n(b) Each post shall be assigned to a suitable level in any of the following\ncategories: Professional and higher ca...",
    "source": "n2317972.pdf",
    "page": 22,
    "source_documents": [
      {
        "source": "n2317972.pdf",
        "page": 22,
        "content": "Rule 2.1\nClassifica tion of posts\n(a) Posts other than those of Deputy Secretary-General, Under-Secretaries-\nGeneral and Assistant Secretaries-General shall be classified in categories and level\naccording to standards established by the International Civil Service Commission or"
      },
      {
        "source": "n2317972.pdf",
        "page": 22,
        "content": "ST/SGB/2023/1/Rev.1\nChapt er II\nClassification of posts and staff\nRule 2.1\nClassifica tion of posts\n(a) Posts other than those of Deputy Secretary-General, Under-Secretaries-\nGeneral and Assistant Secretaries-General shall be classified in categories and level"
      },
      {
        "source": "n2317972.pdf",
        "page": 10,
        "content": "I. Duties, obligations and privileges . . . . . . . . . . . . . . . . . . . . . . . . . . 1.1–1.3 1.1–1.9 10\nII. Classification of posts and staff . . . . . . . . . . . . . . . . . . . . . . . . . . . 2.1 2.1 19"
      },
      {
        "source": "n2317972.pdf",
        "page": 22,
        "content": "General and Assistant Secretaries-General shall be classified in categories and level\naccording to standards established by the International Civil Service Commission or\nby the Secretary-General, as applicable.\n(b) Each post shall be assigned to a suitable level in any of the following"
      },
      {
        "source": "n2317972.pdf",
        "page": 22,
        "content": "by the Secretary-General, as applicable.\n(b) Each post shall be assigned to a suitable level in any of the following\ncategories: Professional and higher categories, Field Service category, General\nService and related categories, including but not limited to National Professional"
      }
    ]
  },
  {
    "question": "How are posts assigned to suitable levels within the different categories mentioned in Rule 2.1?",
    "answer": "Posts are assigned to suitable levels within the different categories mentioned in Rule 2.1 according to standards established by the International Civil Service Commission or by the Secretary-General, as applicable. The assignment is based on the nature of the duties, responsibilities, and qualifications required for the specific post.",
    "context": "ST/SGB/2023/1/Rev.1\nChapt er II\nClassification of posts and staff\nRule 2.1\nClassifica tion of posts\n(a) Posts other than those of Deputy Secretary-General, Under-Secretaries-\nGeneral and Assistant Secretaries-General shall be classified in categories and level\naccording to standards established by the International Civil Service Commission or\nby the Secretary-General, as applicable.\n(b) Each post shall be assigned to a suitable level in any of the following\ncategories: Professional and higher ca...",
    "source": "n2317972.pdf",
    "page": 22,
    "source_documents": [
      {
        "source": "n2317972.pdf",
        "page": 22,
        "content": "Rule 2.1\nClassifica tion of posts\n(a) Posts other than those of Deputy Secretary-General, Under-Secretaries-\nGeneral and Assistant Secretaries-General shall be classified in categories and level\naccording to standards established by the International Civil Service Commission or"
      },
      {
        "source": "n2317972.pdf",
        "page": 22,
        "content": "by the Secretary-General, as applicable.\n(b) Each post shall be assigned to a suitable level in any of the following\ncategories: Professional and higher categories, Field Service category, General\nService and related categories, including but not limited to National Professional"
      },
      {
        "source": "n2317972.pdf",
        "page": 22,
        "content": "ST/SGB/2023/1/Rev.1\nChapt er II\nClassification of posts and staff\nRule 2.1\nClassifica tion of posts\n(a) Posts other than those of Deputy Secretary-General, Under-Secretaries-\nGeneral and Assistant Secretaries-General shall be classified in categories and level"
      },
      {
        "source": "n2317972.pdf",
        "page": 22,
        "content": "General and Assistant Secretaries-General shall be classified in categories and level\naccording to standards established by the International Civil Service Commission or\nby the Secretary-General, as applicable.\n(b) Each post shall be assigned to a suitable level in any of the following"
      },
      {
        "source": "n2317972.pdf",
        "page": 32,
        "content": "General Service category is required to serve in a higher-level post in the Professional\ncategory, or when a staff member in any category holding a fixed-term or continuing\nappointment is required to serve in a post which is classified more than one level"
      }
    ]
  },
  {
    "question": "Why is it important for posts to be classified according to standards set by the International Civil Service Commission or by the Secretary-General?",
    "answer": "It is important for posts to be classified according to standards set by the International Civil Service Commission or by the Secretary-General to ensure consistency, transparency, and fairness in the classification of positions within the organization. This helps in establishing clear job descriptions, responsibilities, and appropriate levels of remuneration for staff members across different entities and duty stations within the organization. Additionally, adhering to these standards helps in maintaining the integrity and credibility of the organization's human resources management practices.",
    "context": "ST/SGB/2023/1/Rev.1\nChapt er II\nClassification of posts and staff\nRule 2.1\nClassifica tion of posts\n(a) Posts other than those of Deputy Secretary-General, Under-Secretaries-\nGeneral and Assistant Secretaries-General shall be classified in categories and level\naccording to standards established by the International Civil Service Commission or\nby the Secretary-General, as applicable.\n(b) Each post shall be assigned to a suitable level in any of the following\ncategories: Professional and higher ca...",
    "source": "n2317972.pdf",
    "page": 22,
    "source_documents": [
      {
        "source": "n2317972.pdf",
        "page": 22,
        "content": "Rule 2.1\nClassifica tion of posts\n(a) Posts other than those of Deputy Secretary-General, Under-Secretaries-\nGeneral and Assistant Secretaries-General shall be classified in categories and level\naccording to standards established by the International Civil Service Commission or"
      },
      {
        "source": "n2317972.pdf",
        "page": 22,
        "content": "General and Assistant Secretaries-General shall be classified in categories and level\naccording to standards established by the International Civil Service Commission or\nby the Secretary-General, as applicable.\n(b) Each post shall be assigned to a suitable level in any of the following"
      },
      {
        "source": "n2317972.pdf",
        "page": 22,
        "content": "ST/SGB/2023/1/Rev.1\nChapt er II\nClassification of posts and staff\nRule 2.1\nClassifica tion of posts\n(a) Posts other than those of Deputy Secretary-General, Under-Secretaries-\nGeneral and Assistant Secretaries-General shall be classified in categories and level"
      },
      {
        "source": "n2317972.pdf",
        "page": 22,
        "content": "by the Secretary-General, as applicable.\n(b) Each post shall be assigned to a suitable level in any of the following\ncategories: Professional and higher categories, Field Service category, General\nService and related categories, including but not limited to National Professional"
      },
      {
        "source": "n2317972.pdf",
        "page": 33,
        "content": "duty stations established by the International Civil Service Commission.\n(b) Staff members in the Professional and higher categories, in the Field\nService category, and internationally recruited staff in the General Service category"
      }
    ]
  },
  {
    "question": "What is the significance of the Field Service category in the classification of posts as mentioned in Rule 2.1?",
    "answer": "The significance of the Field Service category in the classification of posts as mentioned in Rule 2.1 is to ensure equity in purchasing power across duty stations for staff members in the Professional and higher categories. This category helps in determining the appropriate level and classification of posts within the organization to maintain fairness and consistency in salaries and benefits for staff working in different locations.",
    "context": "ST/SGB/2023/1/Rev.1\nChapt er II\nClassification of posts and staff\nRule 2.1\nClassifica tion of posts\n(a) Posts other than those of Deputy Secretary-General, Under-Secretaries-\nGeneral and Assistant Secretaries-General shall be classified in categories and level\naccording to standards established by the International Civil Service Commission or\nby the Secretary-General, as applicable.\n(b) Each post shall be assigned to a suitable level in any of the following\ncategories: Professional and higher ca...",
    "source": "n2317972.pdf",
    "page": 22,
    "source_documents": [
      {
        "source": "n2317972.pdf",
        "page": 32,
        "content": "General Service category is required to serve in a higher-level post in the Professional\ncategory, or when a staff member in any category holding a fixed-term or continuing\nappointment is required to serve in a post which is classified more than one level"
      },
      {
        "source": "n2317972.pdf",
        "page": 22,
        "content": "categories: Professional and higher categories, Field Service category, General\nService and related categories, including but not limited to National Professional\nOfficers, Trades and Crafts and Security Service categories.\n20/115 23-12028"
      },
      {
        "source": "n2317972.pdf",
        "page": 30,
        "content": "Professional and higher categories and in the Field Service category to ensure equity\nin purchasing power across duty stations.\n(b) While the salaries of staff members in the Professional and higher\ncategories and in the Field Service category are normally subject to the post"
      },
      {
        "source": "n2317972.pdf",
        "page": 22,
        "content": "Rule 2.1\nClassifica tion of posts\n(a) Posts other than those of Deputy Secretary-General, Under-Secretaries-\nGeneral and Assistant Secretaries-General shall be classified in categories and level\naccording to standards established by the International Civil Service Commission or"
      },
      {
        "source": "n2317972.pdf",
        "page": 22,
        "content": "ST/SGB/2023/1/Rev.1\nChapt er II\nClassification of posts and staff\nRule 2.1\nClassifica tion of posts\n(a) Posts other than those of Deputy Secretary-General, Under-Secretaries-\nGeneral and Assistant Secretaries-General shall be classified in categories and level"
      }
    ]
  },
  {
    "question": "What exemptions can the Secretary-General make in the assessment of salaries and emoluments?",
    "answer": "The Secretary-General may exempt from the assessment the salaries and emoluments of staff members engaged at locality rates.",
    "context": "ST/SGB/2023/1/Rev.1\ncomputed on the basis of salary, excluding post adjustments, provided that the\nSecretary-General may, where he or she deems it advisable, exempt from the\nassessment the salaries and emoluments of staff members engaged at locality rates;\n(b) (i) The assessment shall be calculated at the following rates for staff\nmembers whose salary rates are set forth in paragraphs 1 and 3 of annex I to the\npresent Regulations:\nStaff assessment rates used in conjunction with pensionable remun...",
    "source": "n2317972.pdf",
    "page": 24,
    "source_documents": [
      {
        "source": "n2317972.pdf",
        "page": 24,
        "content": "ST/SGB/2023/1/Rev.1\ncomputed on the basis of salary, excluding post adjustments, provided that the\nSecretary-General may, where he or she deems it advisable, exempt from the\nassessment the salaries and emoluments of staff members engaged at locality rates;"
      },
      {
        "source": "n2317972.pdf",
        "page": 24,
        "content": "Secretary-General may, where he or she deems it advisable, exempt from the\nassessment the salaries and emoluments of staff members engaged at locality rates;\n(b) (i) The assessment shall be calculated at the following rates for staff"
      },
      {
        "source": "n2317972.pdf",
        "page": 89,
        "content": "6. The Secretary-General shall determine the salary rates to be paid to personnel\nspecifically engaged for short-term missions, conference and other short-term service,\nto consultants, to Field Service personnel and to technical assistance experts."
      },
      {
        "source": "n2317972.pdf",
        "page": 71,
        "content": "(b) In lieu of the notice period, the Secretary-General may authorize\ncompensation equivalent to salary, applicable post adjustment and allowances\ncorresponding to the relevant notice period at the rate in effect on the last day of service."
      },
      {
        "source": "n2317972.pdf",
        "page": 27,
        "content": "Rule 3.1\nSalary scales\n(a) The Secretary-General shall publish the salary scales, pensionable\nremuneration and conditions of salary increments for all categories of staff members.\n(b) The Secretary-General may establish special conditions of employment"
      }
    ]
  },
  {
    "question": "How are staff assessments calculated based on salary rates?",
    "answer": "Staff assessments are calculated based on salary rates by applying specific percentage rates to different portions of the gross base salaries or pensionable remuneration. For example, for staff members with salary rates set forth in paragraphs 1 and 3 of annex I, a certain percentage is applied to the first $50,000 per year, and a different percentage is applied to the remaining assessable payments. The specific rates and calculations may vary depending on the regulations in place at the time.",
    "context": "ST/SGB/2023/1/Rev.1\ncomputed on the basis of salary, excluding post adjustments, provided that the\nSecretary-General may, where he or she deems it advisable, exempt from the\nassessment the salaries and emoluments of staff members engaged at locality rates;\n(b) (i) The assessment shall be calculated at the following rates for staff\nmembers whose salary rates are set forth in paragraphs 1 and 3 of annex I to the\npresent Regulations:\nStaff assessment rates used in conjunction with pensionable remun...",
    "source": "n2317972.pdf",
    "page": 24,
    "source_documents": [
      {
        "source": "n2317972.pdf",
        "page": 24,
        "content": "Staff assessmecnotn jruantcetsi ouns ewdi tihn gross base salaries (effective\n1 January 2017)\nStaff assessment rates used in conjunction with\nAssessable payments gross base salaries\n(United States dollars) (percentage)\nFirst 50,000 per year . . . . . . . . . . . . . . . . . . . . . . . . . . 17"
      },
      {
        "source": "n2317972.pdf",
        "page": 24,
        "content": "(b) (i) The assessment shall be calculated at the following rates for staff\nmembers whose salary rates are set forth in paragraphs 1 and 3 of annex I to the\npresent Regulations:\nStaff assessment rates used in conjunction with pensionable remuneration and\npensions (effect ive 1 January 2019)"
      },
      {
        "source": "n2317972.pdf",
        "page": 24,
        "content": "(ii) The assessment shall be calculated at the following rates for staff members\nwhose salary rates are established under paragraph 7 of annex I to the present\nRegulations:\nStaafsfs essment rates used in conjunction with pensionable remuneration and\npensions (effect ive 1 January 2019)"
      },
      {
        "source": "n2317972.pdf",
        "page": 24,
        "content": "Remaining assessable payments . . . . . . . . . . . . . . . . . . 34\n(ii) The assessment shall be calculated at the following rates for staff members\nwhose salary rates are established under paragraph 7 of annex I to the present\nRegulations:"
      },
      {
        "source": "n2317972.pdf",
        "page": 24,
        "content": "assessment the salaries and emoluments of staff members engaged at locality rates;\n(b) (i) The assessment shall be calculated at the following rates for staff\nmembers whose salary rates are set forth in paragraphs 1 and 3 of annex I to the\npresent Regulations:"
      }
    ]
  },
  {
    "question": "How do the assessment rates differ for staff members with different salary rates?",
    "answer": "The assessment rates for staff members with different salary rates are calculated differently based on the paragraphs in annex I of the present Regulations. For staff members whose salary rates are set forth in paragraphs 1 and 3 of annex I, the assessment rates are based on gross base salaries. For staff members whose salary rates are established under paragraph 7 of annex I, the assessment rates are based on pensionable remuneration and pensions. The specific percentages used for calculation are not provided in the context given.",
    "context": "ST/SGB/2023/1/Rev.1\ncomputed on the basis of salary, excluding post adjustments, provided that the\nSecretary-General may, where he or she deems it advisable, exempt from the\nassessment the salaries and emoluments of staff members engaged at locality rates;\n(b) (i) The assessment shall be calculated at the following rates for staff\nmembers whose salary rates are set forth in paragraphs 1 and 3 of annex I to the\npresent Regulations:\nStaff assessment rates used in conjunction with pensionable remun...",
    "source": "n2317972.pdf",
    "page": 24,
    "source_documents": [
      {
        "source": "n2317972.pdf",
        "page": 24,
        "content": "Staff assessmecnotn jruantcetsi ouns ewdi tihn gross base salaries (effective\n1 January 2017)\nStaff assessment rates used in conjunction with\nAssessable payments gross base salaries\n(United States dollars) (percentage)\nFirst 50,000 per year . . . . . . . . . . . . . . . . . . . . . . . . . . 17"
      },
      {
        "source": "n2317972.pdf",
        "page": 24,
        "content": "(b) (i) The assessment shall be calculated at the following rates for staff\nmembers whose salary rates are set forth in paragraphs 1 and 3 of annex I to the\npresent Regulations:\nStaff assessment rates used in conjunction with pensionable remuneration and\npensions (effect ive 1 January 2019)"
      },
      {
        "source": "n2317972.pdf",
        "page": 24,
        "content": "(ii) The assessment shall be calculated at the following rates for staff members\nwhose salary rates are established under paragraph 7 of annex I to the present\nRegulations:\nStaafsfs essment rates used in conjunction with pensionable remuneration and\npensions (effect ive 1 January 2019)"
      },
      {
        "source": "n2317972.pdf",
        "page": 24,
        "content": "Remaining assessable payments . . . . . . . . . . . . . . . . . . 34\n(ii) The assessment shall be calculated at the following rates for staff members\nwhose salary rates are established under paragraph 7 of annex I to the present\nRegulations:"
      },
      {
        "source": "n2317972.pdf",
        "page": 24,
        "content": "assessment the salaries and emoluments of staff members engaged at locality rates;\n(b) (i) The assessment shall be calculated at the following rates for staff\nmembers whose salary rates are set forth in paragraphs 1 and 3 of annex I to the\npresent Regulations:"
      }
    ]
  },
  {
    "question": "What is the significance of the effective dates mentioned in the text?",
    "answer": "The effective dates mentioned in the text are significant because they determine when certain actions or events take place within the context of submitting required forms and supporting documentation, such as expiration of appointments, retirement, termination, and dismissal. These effective dates help establish timelines and deadlines for submitting necessary paperwork or for when specific events officially occur.",
    "context": "ST/SGB/2023/1/Rev.1\ncomputed on the basis of salary, excluding post adjustments, provided that the\nSecretary-General may, where he or she deems it advisable, exempt from the\nassessment the salaries and emoluments of staff members engaged at locality rates;\n(b) (i) The assessment shall be calculated at the following rates for staff\nmembers whose salary rates are set forth in paragraphs 1 and 3 of annex I to the\npresent Regulations:\nStaff assessment rates used in conjunction with pensionable remun...",
    "source": "n2317972.pdf",
    "page": 24,
    "source_documents": [
      {
        "source": "n2317972.pdf",
        "page": 108,
        "content": "All required forms and supporting documentation may be submitted through a\nnational mail service provider, other international courier service or electronically by\nemail or by other designated tool and are deemed received only upon actual receipt.\nEffecti ve dates"
      },
      {
        "source": "n2317972.pdf",
        "page": 108,
        "content": "email or by other designated tool and are deemed received only upon actual receipt.\nEffecti ve dates\n(c) The time limitations for submission of the required forms and supporting\ndocumentation above will be determined on the basis of the following:"
      },
      {
        "source": "n2317972.pdf",
        "page": 108,
        "content": "national mail service provider, other international courier service or electronically by\nemail or by other designated tool and are deemed received only upon actual receipt.\nEffecti ve dates\n(c) The time limitations for submission of the required forms and supporting"
      },
      {
        "source": "n2317972.pdf",
        "page": 76,
        "content": "Expiration of fixed-term or The date of expiration of the appointment specified in\ntemporary appointment the letter of appointment\nRetirement The effective date of retirement\nTermination The effective date of termination specified in the\nnotice of termination"
      },
      {
        "source": "n2317972.pdf",
        "page": 76,
        "content": "temporary appointment the letter of appointment\nRetirement The effective date of retirement\nTermination The effective date of termination specified in the\nnotice of termination\nDismissal The date on which the staff member is notified in\nwriting of the dismissal decision"
      }
    ]
  },
  {
    "question": "Who determines which scale of assessment applies to different groups of personnel?",
    "answer": "The Secretary-General determines which scale of assessment applies to different groups of personnel.",
    "context": "ST/SGB/2023/1/Rev.1\ncomputed on the basis of salary, excluding post adjustments, provided that the\nSecretary-General may, where he or she deems it advisable, exempt from the\nassessment the salaries and emoluments of staff members engaged at locality rates;\n(b) (i) The assessment shall be calculated at the following rates for staff\nmembers whose salary rates are set forth in paragraphs 1 and 3 of annex I to the\npresent Regulations:\nStaff assessment rates used in conjunction with pensionable remun...",
    "source": "n2317972.pdf",
    "page": 24,
    "source_documents": [
      {
        "source": "n2317972.pdf",
        "page": 24,
        "content": "(iii) The Secretary-General shall determine which of the scales of assessment\nset out in subparagraphs (i) and (ii) above shall apply to each of the groups of\npersonnel whose salary rates are established under paragraph 6 of annex I to the\npresent Regulations;\n22/115 23-12028"
      },
      {
        "source": "n2317972.pdf",
        "page": 24,
        "content": "Next 20,000 per year . . . . . . . . . . . . . . . . . . . . . . . . . . 28\nRemaining assessable amount . . . . . . . . . . . . . . . . . . . 29\n(iii) The Secretary-General shall determine which of the scales of assessment"
      },
      {
        "source": "n2317972.pdf",
        "page": 24,
        "content": "Remaining assessable amount . . . . . . . . . . . . . . . . . . . 29\n(iii) The Secretary-General shall determine which of the scales of assessment\nset out in subparagraphs (i) and (ii) above shall apply to each of the groups of"
      },
      {
        "source": "n2317972.pdf",
        "page": 6,
        "content": "grade are determined in a consistent manner regardless of whether the staff\nmember changes category, is appointed or is selected for a new position at a\nhigher level within the same category.\n1.5 New provisional rule 3.7 (Rental subsidy) was added for the purposes of"
      },
      {
        "source": "n2317972.pdf",
        "page": 32,
        "content": "(b) Without prejudice to the principle that selection to a higher-level position\nunder staff rule 4.15 (Senior review bodies and central review bodies) shall be the\nnormal means of recognizing increased responsibilities and demonstrated ability, staff"
      }
    ]
  },
  {
    "question": "How are salaries of staff members fixed according to the Regulations?",
    "answer": "Salaries of staff members are fixed by the Secretary-General in accordance with the provisions of annex I to the present Regulations.",
    "context": "ST/SGB/2023/1/Rev.1\nArtic le III\nSalaries and r elated allowances\nRegulat ion 3.1\nSalaries of staff members shall be fixed by the Secretary-General in accordance\nwith the provisions of annex I to the present Regulations.\nRegautlio n 3.2\n(a) The Secretary-General shall establish terms and conditions under which\nan education grant shall be available to a staff member residing and serving outside\nhis or her recognized home country whose dependent child is in full-time attendance\nat a school, univer...",
    "source": "n2317972.pdf",
    "page": 23,
    "source_documents": [
      {
        "source": "n2317972.pdf",
        "page": 23,
        "content": "Regulat ion 3.1\nSalaries of staff members shall be fixed by the Secretary-General in accordance\nwith the provisions of annex I to the present Regulations.\nRegautlio n 3.2\n(a) The Secretary-General shall establish terms and conditions under which"
      },
      {
        "source": "n2317972.pdf",
        "page": 23,
        "content": "ST/SGB/2023/1/Rev.1\nArtic le III\nSalaries and r elated allowances\nRegulat ion 3.1\nSalaries of staff members shall be fixed by the Secretary-General in accordance\nwith the provisions of annex I to the present Regulations.\nRegautlio n 3.2"
      },
      {
        "source": "n2317972.pdf",
        "page": 89,
        "content": "General Assembly, subject to the staff assessment plan provided in staff regulation 3.3\nand to post adjustments wherever applied. If otherwise eligible, they shall receive the\nallowances that are available to staff members generally."
      },
      {
        "source": "n2317972.pdf",
        "page": 23,
        "content": "the education expenses actually incurred, up to a maximum amount approved by the\nGeneral Assembly.\nRegulat ion 3.3\n(a) An assessment at the rates and under the conditions specified below shall\nbe applied to the salaries and such other emoluments of staff members as are\n23-12028 21/115"
      },
      {
        "source": "n2317972.pdf",
        "page": 24,
        "content": "assessment the salaries and emoluments of staff members engaged at locality rates;\n(b) (i) The assessment shall be calculated at the following rates for staff\nmembers whose salary rates are set forth in paragraphs 1 and 3 of annex I to the\npresent Regulations:"
      }
    ]
  },
  {
    "question": "What conditions need to be met for a staff member to be eligible for an education grant for their child attending school outside their recognized home country?",
    "answer": "To be eligible for an education grant for their child attending school outside their recognized home country, a staff member must hold a fixed-term or a continuing appointment, be regarded as an international recruit under staff rule 4.5, and reside and serve at a location beyond national boundaries. The grant is payable until the end of the school year in which the child completes four years of post-secondary studies or attains a first post-secondary degree, whichever comes first.",
    "context": "ST/SGB/2023/1/Rev.1\nArtic le III\nSalaries and r elated allowances\nRegulat ion 3.1\nSalaries of staff members shall be fixed by the Secretary-General in accordance\nwith the provisions of annex I to the present Regulations.\nRegautlio n 3.2\n(a) The Secretary-General shall establish terms and conditions under which\nan education grant shall be available to a staff member residing and serving outside\nhis or her recognized home country whose dependent child is in full-time attendance\nat a school, univer...",
    "source": "n2317972.pdf",
    "page": 23,
    "source_documents": [
      {
        "source": "n2317972.pdf",
        "page": 23,
        "content": "an education grant shall be available to a staff member residing and serving outside\nhis or her recognized home country whose dependent child is in full-time attendance\nat a school, university or similar educational institution of a type that will, in the"
      },
      {
        "source": "n2317972.pdf",
        "page": 23,
        "content": "Regautlio n 3.2\n(a) The Secretary-General shall establish terms and conditions under which\nan education grant shall be available to a staff member residing and serving outside\nhis or her recognized home country whose dependent child is in full-time attendance"
      },
      {
        "source": "n2317972.pdf",
        "page": 31,
        "content": "who holds a fixed-term or a continuing appointment shall be entitled to an education\ngrant in respect of each child, provided that:\n(i) The staff members are regarded as international recruits under staff rule 4.5\n(Staff in posts subject to international recruitment) and reside and serves at a"
      },
      {
        "source": "n2317972.pdf",
        "page": 31,
        "content": "notwithstanding national boundaries, where the staff member is serving.\nEligi bility\n(b) Subject to conditions established by the Secretary-General, a staff member\nwho holds a fixed-term or a continuing appointment shall be entitled to an education\ngrant in respect of each child, provided that:"
      },
      {
        "source": "n2317972.pdf",
        "page": 23,
        "content": "member’s recognized home country. The grant shall be payable in respect of the child\nup to the end of the school year in which the child completes four years of post-\nsecondary studies or attains a first post-secondary degree, whichever comes first,"
      }
    ]
  },
  {
    "question": "How does the Secretary-General provide assistance for boarding-related expenses to staff members with children attending school outside the duty station?",
    "answer": "The Secretary-General provides assistance for boarding-related expenses to staff members with children attending school outside the duty station under conditions established, subject to a maximum grant approved by the General Assembly. The assistance is provided based on a sliding scale, and the Secretary-General may establish conditions under which boarding assistance may exceptionally be granted. The amount of assistance is not to exceed the cost of the journey between the home country and the duty station.",
    "context": "ST/SGB/2023/1/Rev.1\nArtic le III\nSalaries and r elated allowances\nRegulat ion 3.1\nSalaries of staff members shall be fixed by the Secretary-General in accordance\nwith the provisions of annex I to the present Regulations.\nRegautlio n 3.2\n(a) The Secretary-General shall establish terms and conditions under which\nan education grant shall be available to a staff member residing and serving outside\nhis or her recognized home country whose dependent child is in full-time attendance\nat a school, univer...",
    "source": "n2317972.pdf",
    "page": 23,
    "source_documents": [
      {
        "source": "n2317972.pdf",
        "page": 23,
        "content": "be reimbursed based on a sliding scale, subject to a maximum grant as approved by\nthe General Assembly. Under conditions established by the Secretary-General, travel\ncosts for the child of a staff member in receipt of assistance with boarding expenses"
      },
      {
        "source": "n2317972.pdf",
        "page": 23,
        "content": "Secretary-General but not in an amount exceeding the cost of such a journey between\nthe home country and the duty station;\n(b) Under conditions established by the Secretary-General, assistance for\nboarding-related expenses shall be provided to staff members serving in duty stations"
      },
      {
        "source": "n2317972.pdf",
        "page": 23,
        "content": "at an amount approved by the General Assembly. The Secretary-General may\nestablish conditions under which boarding assistance may exceptionally be granted\nto staff members serving at headquarters duty stations whose children are boarding to"
      },
      {
        "source": "n2317972.pdf",
        "page": 23,
        "content": "boarding to attend school outside the duty station at the primary and secondary levels,\nat an amount approved by the General Assembly. The Secretary-General may\nestablish conditions under which boarding assistance may exceptionally be granted"
      },
      {
        "source": "n2317972.pdf",
        "page": 23,
        "content": "the home country and the duty station;\n(b) Under conditions established by the Secretary-General, assistance for\nboarding-related expenses shall be provided to staff members serving in duty stations\nother than those classified as headquarters duty stations and whose children are"
      }
    ]
  },
  {
    "question": "What criteria determine the amount of education grant available to a staff member with a child who has a physical or mental disability?",
    "answer": "The criteria determining the amount of education grant available to a staff member with a child who has a physical or mental disability are not explicitly mentioned in the provided context. The text mainly focuses on the availability of the grant for staff members in various categories and the conditions under which the grant is provided. For specific details on the amount of the education grant, it would be necessary to refer to the terms and conditions established by the Secretary-General of the organization.",
    "context": "ST/SGB/2023/1/Rev.1\nArtic le III\nSalaries and r elated allowances\nRegulat ion 3.1\nSalaries of staff members shall be fixed by the Secretary-General in accordance\nwith the provisions of annex I to the present Regulations.\nRegautlio n 3.2\n(a) The Secretary-General shall establish terms and conditions under which\nan education grant shall be available to a staff member residing and serving outside\nhis or her recognized home country whose dependent child is in full-time attendance\nat a school, univer...",
    "source": "n2317972.pdf",
    "page": 23,
    "source_documents": [
      {
        "source": "n2317972.pdf",
        "page": 32,
        "content": "(h) A special education grant for a child with a disability shall be available to\nstaff members in all categories, whether serving in their home country or not,\nprovided that they hold a fixed-term or a continuing appointment. The amount to"
      },
      {
        "source": "n2317972.pdf",
        "page": 23,
        "content": "which an education grant shall be available to a staff member whose child is unable,\nby reason of physical or mental disability, to attend a normal educational institution\nand therefore requires special teaching or training to prepare him or her for full"
      },
      {
        "source": "n2317972.pdf",
        "page": 23,
        "content": "(d) The Secretary-General shall also establish terms and conditions under\nwhich an education grant shall be available to a staff member whose child is unable,\nby reason of physical or mental disability, to attend a normal educational institution"
      },
      {
        "source": "n2317972.pdf",
        "page": 32,
        "content": "Secretary-General.\nSpecial education grant for a child with a disability\n(h) A special education grant for a child with a disability shall be available to\nstaff members in all categories, whether serving in their home country or not,"
      },
      {
        "source": "n2317972.pdf",
        "page": 32,
        "content": "child is not possible, one outward and return journey by the staff member or spouse\nmay be authorized in lieu of travel by the child, under conditions established by the\nSecretary-General.\nSpecial education grant for a child with a disability"
      }
    ]
  },
  {
    "question": "Under what circumstances can a staff member receive an education grant for their child attending a local school in a country with a different language?",
    "answer": "A staff member serving in a country where the language is different from their own and who is obliged to pay tuition for teaching their child's mother tongue at a local school can receive an education grant for their child.",
    "context": "ST/SGB/2023/1/Rev.1\nArtic le III\nSalaries and r elated allowances\nRegulat ion 3.1\nSalaries of staff members shall be fixed by the Secretary-General in accordance\nwith the provisions of annex I to the present Regulations.\nRegautlio n 3.2\n(a) The Secretary-General shall establish terms and conditions under which\nan education grant shall be available to a staff member residing and serving outside\nhis or her recognized home country whose dependent child is in full-time attendance\nat a school, univer...",
    "source": "n2317972.pdf",
    "page": 23,
    "source_documents": [
      {
        "source": "n2317972.pdf",
        "page": 23,
        "content": "which an education grant shall be available to a staff member serving in a country\nwhose language is different from his or her own and who is obliged to pay tuition for\nthe teaching of the mother tongue to a dependent child attending a local school in"
      },
      {
        "source": "n2317972.pdf",
        "page": 23,
        "content": "an education grant shall be available to a staff member residing and serving outside\nhis or her recognized home country whose dependent child is in full-time attendance\nat a school, university or similar educational institution of a type that will, in the"
      },
      {
        "source": "n2317972.pdf",
        "page": 31,
        "content": "who holds a fixed-term or a continuing appointment shall be entitled to an education\ngrant in respect of each child, provided that:\n(i) The staff members are regarded as international recruits under staff rule 4.5\n(Staff in posts subject to international recruitment) and reside and serves at a"
      },
      {
        "source": "n2317972.pdf",
        "page": 23,
        "content": "Regautlio n 3.2\n(a) The Secretary-General shall establish terms and conditions under which\nan education grant shall be available to a staff member residing and serving outside\nhis or her recognized home country whose dependent child is in full-time attendance"
      },
      {
        "source": "n2317972.pdf",
        "page": 23,
        "content": "which the instruction is given in a language other than his or her own;\n(d) The Secretary-General shall also establish terms and conditions under\nwhich an education grant shall be available to a staff member whose child is unable,"
      }
    ]
  },
  {
    "question": "What happens if a staff member is not employed for the whole calendar year in terms of payment assessments?",
    "answer": "If a staff member is not employed for the whole calendar year or if there is a change in the annual rate of payments made to them, the rate of assessment for payment deductions will be governed by the annual rate of each payment made to them during their employment period. No part of the assessment collected will be refunded due to cessation of employment during the calendar year.",
    "context": "ST/SGB/2023/1/Rev.1\n(iv) In the case of staff members whose salary scales are established in\ncurrencies other than United States dollars, the relevant amounts to which the\nassessment applies shall be fixed at the local currency equivalent of the above-\nmentioned dollar amounts at the time the salary scales of the staff member\nconcerned are approved;\n(c) In the case of a person who is not employed by the United Nations for the\nwhole of a calendar year or in cases where there is a change in the an...",
    "source": "n2317972.pdf",
    "page": 25,
    "source_documents": [
      {
        "source": "n2317972.pdf",
        "page": 25,
        "content": "whole of a calendar year or in cases where there is a change in the annual rate of\npayments made to a staff member, the rate of assessment shall be governed by the\nannual rate of each such payment made to him or her;\n(d) The assessment computed under the foregoing provisions of the present"
      },
      {
        "source": "n2317972.pdf",
        "page": 35,
        "content": "(a) Staff assessment shall be deducted, each pay period, from the total\npayments due to each staff member, at the rates and subject to the conditions\nprescribed in staff regulation 3.3.\n(b) Contributions of staff members who are participating in the United Nations"
      },
      {
        "source": "n2317972.pdf",
        "page": 25,
        "content": "No part of the assessment so collected shall be refunded because of cessation of\nemployment during the calendar year;\n(e) Revenue derived from staff assessment not otherwise disposed of by\nspecific resolution of the General Assembly shall be credited to the Tax Equalization"
      },
      {
        "source": "n2317972.pdf",
        "page": 25,
        "content": "concerned are approved;\n(c) In the case of a person who is not employed by the United Nations for the\nwhole of a calendar year or in cases where there is a change in the annual rate of\npayments made to a staff member, the rate of assessment shall be governed by the"
      },
      {
        "source": "n2317972.pdf",
        "page": 24,
        "content": "Next 50,000 per year . . . . . . . . . . . . . . . . . . . . . . . . . . 30\nRemaining assessable payments . . . . . . . . . . . . . . . . . . 34\n(ii) The assessment shall be calculated at the following rates for staff members"
      }
    ]
  },
  {
    "question": "How are the relevant amounts for staff members with salary scales in currencies other than USD fixed?",
    "answer": "The relevant amounts for staff members with salary scales in currencies other than USD are fixed at the local currency equivalent of the dollar amounts at the time the salary scales of the staff member concerned are approved.",
    "context": "ST/SGB/2023/1/Rev.1\n(iv) In the case of staff members whose salary scales are established in\ncurrencies other than United States dollars, the relevant amounts to which the\nassessment applies shall be fixed at the local currency equivalent of the above-\nmentioned dollar amounts at the time the salary scales of the staff member\nconcerned are approved;\n(c) In the case of a person who is not employed by the United Nations for the\nwhole of a calendar year or in cases where there is a change in the an...",
    "source": "n2317972.pdf",
    "page": 25,
    "source_documents": [
      {
        "source": "n2317972.pdf",
        "page": 25,
        "content": "currencies other than United States dollars, the relevant amounts to which the\nassessment applies shall be fixed at the local currency equivalent of the above-\nmentioned dollar amounts at the time the salary scales of the staff member\nconcerned are approved;"
      },
      {
        "source": "n2317972.pdf",
        "page": 25,
        "content": "ST/SGB/2023/1/Rev.1\n(iv) In the case of staff members whose salary scales are established in\ncurrencies other than United States dollars, the relevant amounts to which the\nassessment applies shall be fixed at the local currency equivalent of the above-"
      },
      {
        "source": "n2317972.pdf",
        "page": 25,
        "content": "assessment applies shall be fixed at the local currency equivalent of the above-\nmentioned dollar amounts at the time the salary scales of the staff member\nconcerned are approved;\n(c) In the case of a person who is not employed by the United Nations for the"
      },
      {
        "source": "n2317972.pdf",
        "page": 25,
        "content": "mentioned dollar amounts at the time the salary scales of the staff member\nconcerned are approved;\n(c) In the case of a person who is not employed by the United Nations for the\nwhole of a calendar year or in cases where there is a change in the annual rate of"
      },
      {
        "source": "n2317972.pdf",
        "page": 60,
        "content": "ST/SGB/2023/1/Rev.1\n(ii) The lump-sum portion, which is calculated on the basis of one month of\nthe staff member’s net base salary and, where appropriate, post adjustment at\nthe duty station of assignment.\n(c) (i) The Secretary-General may establish and publish special rates of"
      }
    ]
  },
  {
    "question": "What allowances are staff members entitled to based on their marital status and dependent children as per the regulations?",
    "answer": "Based on the provided context, staff members with a dependent spouse are entitled to a dependent spouse allowance, and staff members without a spouse are entitled to a single parent allowance for the first dependent child. Additionally, staff members are entitled to an allowance for each dependent child, except for the first dependent child if the staff member receives a single parent allowance. The full amount of the dependency allowance for dependent children is payable unless adjustments are made, and allowances may be provided in specific circumstances such as extended periods of duty away from the official duty station.",
    "context": "ST/SGB/2023/1/Rev.1\n(iv) In the case of staff members whose salary scales are established in\ncurrencies other than United States dollars, the relevant amounts to which the\nassessment applies shall be fixed at the local currency equivalent of the above-\nmentioned dollar amounts at the time the salary scales of the staff member\nconcerned are approved;\n(c) In the case of a person who is not employed by the United Nations for the\nwhole of a calendar year or in cases where there is a change in the an...",
    "source": "n2317972.pdf",
    "page": 25,
    "source_documents": [
      {
        "source": "n2317972.pdf",
        "page": 29,
        "content": "staff regulations 3.5 and 3.6 (a), the full amount of the dependency allowance\nprovided under those regulations and under the Staff Rules in respect of a\ndependent child shall be payable, except where the staff members or their spouse"
      },
      {
        "source": "n2317972.pdf",
        "page": 25,
        "content": "adjustments, which are not subject to staff assessment but may be subject to\nnational income taxation.\nRegulat ion 3.4\nStaff members whose salary rates are set forth in paragraphs 1 and 3 of annex I\nto the present Regulations shall be entitled to receive a dependent spouse allowance"
      },
      {
        "source": "n2317972.pdf",
        "page": 26,
        "content": "approved by the General Assembly as follows:\n(i) The staff member shall receive an allowance for each dependent child,\nexcept that the allowance shall not be paid in respect of the first dependent child\nif the staff member receives a single parent allowance under regulation 3.5;"
      },
      {
        "source": "n2317972.pdf",
        "page": 58,
        "content": "allowance in cases where deemed appropriate, including in the event of staff members\nbeing assigned to conferences or other extended periods of duty away from their\nofficial duty station.\n(e) When the spouse or dependent children of a staff member are authorized"
      },
      {
        "source": "n2317972.pdf",
        "page": 25,
        "content": "established by the Secretary-General.\nRegulat ion 3.5\nStaff members without a spouse whose salary rates are set forth in paragraphs 1\nand 3 of annex I to the present Regulations shall be entitled to a single parent\nallowance in respect of the first dependent child in the amount of 6 per cent of net"
      }
    ]
  },
  {
    "question": "How is revenue derived from staff assessments handled if not specifically resolved by the General Assembly?",
    "answer": "Revenue derived from staff assessments not specifically resolved by the General Assembly is credited to the Tax Equalization Fund established by Assembly resolution 973 A (X).",
    "context": "ST/SGB/2023/1/Rev.1\n(iv) In the case of staff members whose salary scales are established in\ncurrencies other than United States dollars, the relevant amounts to which the\nassessment applies shall be fixed at the local currency equivalent of the above-\nmentioned dollar amounts at the time the salary scales of the staff member\nconcerned are approved;\n(c) In the case of a person who is not employed by the United Nations for the\nwhole of a calendar year or in cases where there is a change in the an...",
    "source": "n2317972.pdf",
    "page": 25,
    "source_documents": [
      {
        "source": "n2317972.pdf",
        "page": 25,
        "content": "employment during the calendar year;\n(e) Revenue derived from staff assessment not otherwise disposed of by\nspecific resolution of the General Assembly shall be credited to the Tax Equalization\nFund established by Assembly resolution 973 A (X);"
      },
      {
        "source": "n2317972.pdf",
        "page": 25,
        "content": "specific resolution of the General Assembly shall be credited to the Tax Equalization\nFund established by Assembly resolution 973 A (X);\n(f) Where a staff member is subject both to staff assessment under this plan\nand to national income taxation in respect of the salaries and emoluments paid to him"
      },
      {
        "source": "n2317972.pdf",
        "page": 25,
        "content": "No part of the assessment so collected shall be refunded because of cessation of\nemployment during the calendar year;\n(e) Revenue derived from staff assessment not otherwise disposed of by\nspecific resolution of the General Assembly shall be credited to the Tax Equalization"
      },
      {
        "source": "n2317972.pdf",
        "page": 89,
        "content": "General Assembly, subject to the staff assessment plan provided in staff regulation 3.3\nand to post adjustments wherever applied. If otherwise eligible, they shall receive the\nallowances that are available to staff members generally."
      },
      {
        "source": "n2317972.pdf",
        "page": 35,
        "content": "(a) Staff assessment shall be deducted, each pay period, from the total\npayments due to each staff member, at the rates and subject to the conditions\nprescribed in staff regulation 3.3.\n(b) Contributions of staff members who are participating in the United Nations"
      }
    ]
  },
  {
    "question": "What are the different types of dependency allowances that staff members are entitled to receive according to Regulation 3.6?",
    "answer": "According to Regulation 3.6, staff members whose salary rates are set forth in paragraphs 1 and 3 of annex I to the regulations are entitled to receive dependency allowances for a dependent child, for a disabled child, and for a secondary dependant.",
    "context": "ST/SGB/2023/1/Rev.1\nRegulat ion 3.6\n(a) Staff members whose salary rates are set forth in paragraphs 1 and 3 of\nannex I to the present Regulations shall be entitled to receive dependency allowances\nfor a dependent child, for a disabled child and for a secondary dependant at rates\napproved by the General Assembly as follows:\n(i) The staff member shall receive an allowance for each dependent child,\nexcept that the allowance shall not be paid in respect of the first dependent child\nif the staff mem...",
    "source": "n2317972.pdf",
    "page": 26,
    "source_documents": [
      {
        "source": "n2317972.pdf",
        "page": 29,
        "content": "staff regulations 3.5 and 3.6 (a), the full amount of the dependency allowance\nprovided under those regulations and under the Staff Rules in respect of a\ndependent child shall be payable, except where the staff members or their spouse"
      },
      {
        "source": "n2317972.pdf",
        "page": 26,
        "content": "ST/SGB/2023/1/Rev.1\nRegulat ion 3.6\n(a) Staff members whose salary rates are set forth in paragraphs 1 and 3 of\nannex I to the present Regulations shall be entitled to receive dependency allowances\nfor a dependent child, for a disabled child and for a secondary dependant at rates"
      },
      {
        "source": "n2317972.pdf",
        "page": 26,
        "content": "the dependency allowance for a child specified in subparagraph (a) (i) above and\nregulation 3.5 shall be payable only to the extent that the dependency benefits enjoyed\nby the staff member or his or her spouse under applicable laws amount to less than\nsuch a dependency allowance;"
      },
      {
        "source": "n2317972.pdf",
        "page": 29,
        "content": "conditions established by the Secretary-General. Subject to the provisions of\nstaff regulations 3.5 and 3.6 (a), the full amount of the dependency allowance\nprovided under those regulations and under the Staff Rules in respect of a"
      },
      {
        "source": "n2317972.pdf",
        "page": 25,
        "content": "adjustments, which are not subject to staff assessment but may be subject to\nnational income taxation.\nRegulat ion 3.4\nStaff members whose salary rates are set forth in paragraphs 1 and 3 of annex I\nto the present Regulations shall be entitled to receive a dependent spouse allowance"
      }
    ]
  },
  {
    "question": "Under what conditions can the Secretary-General refund staff assessment amounts to a staff member?",
    "answer": "The Secretary-General can refund staff assessment amounts to a staff member under the following conditions:\n1. If the staff member is subject to both staff assessment under the plan and national income taxation on salaries and emoluments paid by the United Nations.\n2. The refund amount should not exceed the staff assessment amount.\n3. If the income taxes paid exceed the staff assessment amount, the Secretary-General may also pay the staff member the excess amount.\n4. Payments made for refunds shall be charged to the Tax Equalization Fund.",
    "context": "ST/SGB/2023/1/Rev.1\n(iv) In the case of staff members whose salary scales are established in\ncurrencies other than United States dollars, the relevant amounts to which the\nassessment applies shall be fixed at the local currency equivalent of the above-\nmentioned dollar amounts at the time the salary scales of the staff member\nconcerned are approved;\n(c) In the case of a person who is not employed by the United Nations for the\nwhole of a calendar year or in cases where there is a change in the an...",
    "source": "n2317972.pdf",
    "page": 25,
    "source_documents": [
      {
        "source": "n2317972.pdf",
        "page": 25,
        "content": "and to national income taxation in respect of the salaries and emoluments paid to him\nor her by the United Nations, the Secretary-General is authorized to refund to him or\nher the amount of staff assessment collected from him or her provided that:"
      },
      {
        "source": "n2317972.pdf",
        "page": 25,
        "content": "(f) Where a staff member is subject both to staff assessment under this plan\nand to national income taxation in respect of the salaries and emoluments paid to him\nor her by the United Nations, the Secretary-General is authorized to refund to him or"
      },
      {
        "source": "n2317972.pdf",
        "page": 25,
        "content": "or her by the United Nations, the Secretary-General is authorized to refund to him or\nher the amount of staff assessment collected from him or her provided that:\n(i) The amount of such refund shall in no case exceed the amount of his or"
      },
      {
        "source": "n2317972.pdf",
        "page": 25,
        "content": "(ii) If the amount of such income taxes exceeds the amount of staff assessment,\nthe Secretary-General may also pay to the staff member the amount of such\nexcess;\n(iii) Payments made in accordance with the provisions of the present regulation\nshall be charged to the Tax Equalization Fund;"
      },
      {
        "source": "n2317972.pdf",
        "page": 34,
        "content": "circumstances and conditions:\n(i) In cases where new staff members arrive without sufficient funds, in such\namount as the Secretary-General may deem appropriate;\n(ii) In exceptional and compelling circumstances, and if the request of the staff"
      }
    ]
  },
  {
    "question": "How should staff members submit claims for dependency allowances according to Regulation 3.6?",
    "answer": "Staff members should submit claims for dependency allowances in writing and supported by evidence satisfactory to the Secretary-General. Additionally, a separate claim for dependency allowances should be made each year.",
    "context": "ST/SGB/2023/1/Rev.1\nRegulat ion 3.6\n(a) Staff members whose salary rates are set forth in paragraphs 1 and 3 of\nannex I to the present Regulations shall be entitled to receive dependency allowances\nfor a dependent child, for a disabled child and for a secondary dependant at rates\napproved by the General Assembly as follows:\n(i) The staff member shall receive an allowance for each dependent child,\nexcept that the allowance shall not be paid in respect of the first dependent child\nif the staff mem...",
    "source": "n2317972.pdf",
    "page": 26,
    "source_documents": [
      {
        "source": "n2317972.pdf",
        "page": 29,
        "content": "staff regulations 3.5 and 3.6 (a), the full amount of the dependency allowance\nprovided under those regulations and under the Staff Rules in respect of a\ndependent child shall be payable, except where the staff members or their spouse"
      },
      {
        "source": "n2317972.pdf",
        "page": 26,
        "content": "ST/SGB/2023/1/Rev.1\nRegulat ion 3.6\n(a) Staff members whose salary rates are set forth in paragraphs 1 and 3 of\nannex I to the present Regulations shall be entitled to receive dependency allowances\nfor a dependent child, for a disabled child and for a secondary dependant at rates"
      },
      {
        "source": "n2317972.pdf",
        "page": 26,
        "content": "the dependency allowance for a child specified in subparagraph (a) (i) above and\nregulation 3.5 shall be payable only to the extent that the dependency benefits enjoyed\nby the staff member or his or her spouse under applicable laws amount to less than\nsuch a dependency allowance;"
      },
      {
        "source": "n2317972.pdf",
        "page": 26,
        "content": "annex I to the present Regulations shall be entitled to receive dependency allowances\nfor a dependent child, for a disabled child and for a secondary dependant at rates\napproved by the General Assembly as follows:\n(i) The staff member shall receive an allowance for each dependent child,"
      },
      {
        "source": "n2317972.pdf",
        "page": 26,
        "content": "which the office is located;\n(e) Claims for dependency allowances shall be submitted in writing and\nsupported by evidence satisfactory to the Secretary-General. A separate claim for\ndependency allowances shall be made each year.\n24/115 23-12028"
      }
    ]
  },
  {
    "question": "What factors does the Secretary-General consider when determining the rates and conditions of dependency allowances for staff members with salary rates set under paragraph 6 or paragraph 7 of annex I?",
    "answer": "The Secretary-General considers the circumstances in the locality where the office is located when determining the rates and conditions of dependency allowances for staff members with salary rates set under paragraph 6 or paragraph 7 of annex I.",
    "context": "ST/SGB/2023/1/Rev.1\nRegulat ion 3.6\n(a) Staff members whose salary rates are set forth in paragraphs 1 and 3 of\nannex I to the present Regulations shall be entitled to receive dependency allowances\nfor a dependent child, for a disabled child and for a secondary dependant at rates\napproved by the General Assembly as follows:\n(i) The staff member shall receive an allowance for each dependent child,\nexcept that the allowance shall not be paid in respect of the first dependent child\nif the staff mem...",
    "source": "n2317972.pdf",
    "page": 26,
    "source_documents": [
      {
        "source": "n2317972.pdf",
        "page": 26,
        "content": "such a dependency allowance;\n(d) Staff members whose salary rates are set by the Secretary-General under\nparagraph 6 or paragraph 7 of annex I to the present Regulations shall be entitled to\nreceive dependency allowances at rates and under conditions determined by the"
      },
      {
        "source": "n2317972.pdf",
        "page": 26,
        "content": "paragraph 6 or paragraph 7 of annex I to the present Regulations shall be entitled to\nreceive dependency allowances at rates and under conditions determined by the\nSecretary-General, due regard being given to the circumstances in the locality in\nwhich the office is located;"
      },
      {
        "source": "n2317972.pdf",
        "page": 26,
        "content": "by the staff member or his or her spouse under applicable laws amount to less than\nsuch a dependency allowance;\n(d) Staff members whose salary rates are set by the Secretary-General under\nparagraph 6 or paragraph 7 of annex I to the present Regulations shall be entitled to"
      },
      {
        "source": "n2317972.pdf",
        "page": 29,
        "content": "(b) The dependency allowances, which are applicable to the different\ncategories of staff, shall be payable in accordance with the applicable rates published\nby the Secretary-General:\n(i) Dependent spouse allowance: a dependent spouse allowance in the amount"
      },
      {
        "source": "n2317972.pdf",
        "page": 29,
        "content": "member’s child in subparagraph (iii) above.\nAmount nodfe dnecpye al lowances\n(b) The dependency allowances, which are applicable to the different\ncategories of staff, shall be payable in accordance with the applicable rates published\nby the Secretary-General:"
      }
    ]
  },
  {
    "question": "How does Regulation 3.6 address the situation where both husband and wife are staff members?",
    "answer": "Regulation 3.6 addresses the situation where both spouses are staff members by stating that their contractual status will not be affected, but their entitlements and benefits will be modified as per the relevant Staff Regulations and Rules. This means that both spouses will receive any adjustments or modifications to their benefits as outlined in the regulations. Additionally, it is mentioned that no preference is given to spouses who are staff members by virtue of their relationship.",
    "context": "ST/SGB/2023/1/Rev.1\nRegulat ion 3.6\n(a) Staff members whose salary rates are set forth in paragraphs 1 and 3 of\nannex I to the present Regulations shall be entitled to receive dependency allowances\nfor a dependent child, for a disabled child and for a secondary dependant at rates\napproved by the General Assembly as follows:\n(i) The staff member shall receive an allowance for each dependent child,\nexcept that the allowance shall not be paid in respect of the first dependent child\nif the staff mem...",
    "source": "n2317972.pdf",
    "page": 26,
    "source_documents": [
      {
        "source": "n2317972.pdf",
        "page": 38,
        "content": "contractual status of either spouse, but their entitlements and other benefits shall be\nmodified as provided in the relevant Staff Regulations and Rules. The same\nmodifications shall apply in the case of a staff member whose spouse is a staff member"
      },
      {
        "source": "n2317972.pdf",
        "page": 38,
        "content": "modified as provided in the relevant Staff Regulations and Rules. The same\nmodifications shall apply in the case of a staff member whose spouse is a staff member\nof another organization participating in the United Nations common system of salaries"
      },
      {
        "source": "n2317972.pdf",
        "page": 38,
        "content": "(d) The marriage of one staff member to another shall not affect the\ncontractual status of either spouse, but their entitlements and other benefits shall be\nmodified as provided in the relevant Staff Regulations and Rules. The same"
      },
      {
        "source": "n2317972.pdf",
        "page": 38,
        "content": "modifications shall apply in the case of a staff member whose spouse is a staff member\nof another organization participating in the United Nations common system of salaries\nand allowances. Where both spouses are staff members and maintain separate"
      },
      {
        "source": "n2317972.pdf",
        "page": 38,
        "content": "considered and that the spouses are not given any preference by virtue of the\nrelationship to the staff members.\n(c) Staff members who are the spouse, grandparent, grandchild, aunt, uncle,\nnephew, niece or cousin of another staff member:"
      }
    ]
  },
  {
    "question": "Under what conditions does the Secretary-General prescribe the payment of dependency allowances for children specified in subparagraph (a) (i) and regulation 3.5?",
    "answer": "The Secretary-General prescribes the payment of dependency allowances for children specified in subparagraph (a) (i) and regulation 3.5 based on the conditions where the dependency benefits enjoyed by the staff member or their spouse under applicable laws amount to less than the dependency allowance.",
    "context": "ST/SGB/2023/1/Rev.1\nRegulat ion 3.6\n(a) Staff members whose salary rates are set forth in paragraphs 1 and 3 of\nannex I to the present Regulations shall be entitled to receive dependency allowances\nfor a dependent child, for a disabled child and for a secondary dependant at rates\napproved by the General Assembly as follows:\n(i) The staff member shall receive an allowance for each dependent child,\nexcept that the allowance shall not be paid in respect of the first dependent child\nif the staff mem...",
    "source": "n2317972.pdf",
    "page": 26,
    "source_documents": [
      {
        "source": "n2317972.pdf",
        "page": 26,
        "content": "dependency benefits, the Secretary-General shall prescribe conditions under which\nthe dependency allowance for a child specified in subparagraph (a) (i) above and\nregulation 3.5 shall be payable only to the extent that the dependency benefits enjoyed"
      },
      {
        "source": "n2317972.pdf",
        "page": 26,
        "content": "laws in the form of governmental grants and staff members who do not receive such\ndependency benefits, the Secretary-General shall prescribe conditions under which\nthe dependency allowance for a child specified in subparagraph (a) (i) above and"
      },
      {
        "source": "n2317972.pdf",
        "page": 26,
        "content": "the dependency allowance for a child specified in subparagraph (a) (i) above and\nregulation 3.5 shall be payable only to the extent that the dependency benefits enjoyed\nby the staff member or his or her spouse under applicable laws amount to less than\nsuch a dependency allowance;"
      },
      {
        "source": "n2317972.pdf",
        "page": 29,
        "content": "dependent child allowance for each recognized dependent child, under\nconditions established by the Secretary-General. Subject to the provisions of\nstaff regulations 3.5 and 3.6 (a), the full amount of the dependency allowance"
      },
      {
        "source": "n2317972.pdf",
        "page": 29,
        "content": "member’s child in subparagraph (iii) above.\nAmount nodfe dnecpye al lowances\n(b) The dependency allowances, which are applicable to the different\ncategories of staff, shall be payable in accordance with the applicable rates published\nby the Secretary-General:"
      }
    ]
  },
  {
    "question": "How are salary levels determined for staff members upon appointment or selection to a different category?",
    "answer": "Salary levels for staff members upon appointment or selection to a different category are typically determined by placing them at the first step of the level of their post, unless otherwise decided by the Secretary-General. Additionally, the salary step increment at the lower level will be based on satisfactory service at that lower level.",
    "context": "ST/SGB/2023/1/Rev.1\nChapte r III\nSalaries and r elated allowances\nRule 3.1\nSalary scales\n(a) The Secretary-General shall publish the salary scales, pensionable\nremuneration and conditions of salary increments for all categories of staff members.\n(b) The Secretary-General may establish special conditions of employment\napplicable to language staff in the Professional category appointed for specific\ntemporary assignments.\n(c) The transitional measures governing the salary scales and pensionable\nrem...",
    "source": "n2317972.pdf",
    "page": 27,
    "source_documents": [
      {
        "source": "n2317972.pdf",
        "page": 6,
        "content": "1.4 Provisional rule 3.3 (Salary policy) was modified to ensure that salary steps in\ngrade are determined in a consistent manner regardless of whether the staff\nmember changes category, is appointed or is selected for a new position at a\nhigher level within the same category."
      },
      {
        "source": "n2317972.pdf",
        "page": 27,
        "content": "will be based on satisfactory service at the lower level.\nRule 3.3\nSalary policy\n(a) On appointment, or on selection to a different category, staff members\nshall normally be placed at the first step of the level of their post, unless otherwise\ndecided by the Secretary-General."
      },
      {
        "source": "n2317972.pdf",
        "page": 27,
        "content": "lower level, the staff member’s eligibility for salary step increment in the lower level\nwill be based on satisfactory service at the lower level.\nRule 3.3\nSalary policy\n(a) On appointment, or on selection to a different category, staff members"
      },
      {
        "source": "n2317972.pdf",
        "page": 73,
        "content": "Staff category Calculation of the grant\nProfessional and higher categories Gross salary less staff assessment\nField Service category Gross salary less staff assessment plus\nlanguage allowance, if any\nGeneral Service and related categories Gross salary less staff assessment plus"
      },
      {
        "source": "n2317972.pdf",
        "page": 87,
        "content": "maximum step of their grade upon conversion to the unified salary scale on 1 January\n2017 shall be maintained as a pay protection measure, until such time as the staff\nmember is selected for a position at a higher level within the same category or\nseparated from service."
      }
    ]
  },
  {
    "question": "What are the conditions for establishing special conditions of employment for language staff in the Professional category?",
    "answer": "The conditions for establishing special conditions of employment for language staff in the Professional category are determined by the Secretary-General and may be applicable for specific temporary assignments.",
    "context": "ST/SGB/2023/1/Rev.1\nChapte r III\nSalaries and r elated allowances\nRule 3.1\nSalary scales\n(a) The Secretary-General shall publish the salary scales, pensionable\nremuneration and conditions of salary increments for all categories of staff members.\n(b) The Secretary-General may establish special conditions of employment\napplicable to language staff in the Professional category appointed for specific\ntemporary assignments.\n(c) The transitional measures governing the salary scales and pensionable\nrem...",
    "source": "n2317972.pdf",
    "page": 27,
    "source_documents": [
      {
        "source": "n2317972.pdf",
        "page": 27,
        "content": "(b) The Secretary-General may establish special conditions of employment\napplicable to language staff in the Professional category appointed for specific\ntemporary assignments.\n(c) The transitional measures governing the salary scales and pensionable"
      },
      {
        "source": "n2317972.pdf",
        "page": 27,
        "content": "remuneration and conditions of salary increments for all categories of staff members.\n(b) The Secretary-General may establish special conditions of employment\napplicable to language staff in the Professional category appointed for specific\ntemporary assignments."
      },
      {
        "source": "n2317972.pdf",
        "page": 89,
        "content": "may be paid to staff members in the General Service category who pass an appropriate\ntest and demonstrate continued proficiency in the use of two or more official\nlanguages.\n9. In order to preserve equivalent standards of living at different offices, the"
      },
      {
        "source": "n2317972.pdf",
        "page": 30,
        "content": "holding a fixed-term or a continuing appointment may be entitled to a pensionable\nlanguage allowance, under rates and conditions determined by the Secretary-General,\nprovided that they have demonstrated proficiency in two or more United Nations\nofficial languages as follows:"
      },
      {
        "source": "n2317972.pdf",
        "page": 31,
        "content": "ST/SGB/2023/1/Rev.1\n(b) Staff members already in receipt of a language allowance under paragraph (a)\nabove shall be entitled to receive a second such pensionable allowance, equal to half\nof the amount of the first, provided that they have demonstrated proficiency by"
      }
    ]
  },
  {
    "question": "What is the process for awarding salary step increments to staff members?",
    "answer": "The process for awarding salary step increments to staff members involves evaluating satisfactory performance and conduct. Salary increments at the D-1 level are awarded annually, except for increments above step IV, which require two years at the previous step. At the D-2 level, increments are awarded biennially. Increments are effective at the beginning of the pay period in which the service requirements are completed. No increment is paid if a staff member's service ends during the month the increment would have been due. Staff members must meet the satisfactory service criteria unless the Secretary-General decides otherwise in a specific case.",
    "context": "ST/SGB/2023/1/Rev.1\nChapte r III\nSalaries and r elated allowances\nRule 3.1\nSalary scales\n(a) The Secretary-General shall publish the salary scales, pensionable\nremuneration and conditions of salary increments for all categories of staff members.\n(b) The Secretary-General may establish special conditions of employment\napplicable to language staff in the Professional category appointed for specific\ntemporary assignments.\n(c) The transitional measures governing the salary scales and pensionable\nrem...",
    "source": "n2317972.pdf",
    "page": 27,
    "source_documents": [
      {
        "source": "n2317972.pdf",
        "page": 89,
        "content": "5. Salary increments at the D-1 level shall be awarded annually, except that any\nincrements above step IV shall be preceded by two years at the previous step. Salary\nincrements at the D-2 level shall be awarded biennially."
      },
      {
        "source": "n2317972.pdf",
        "page": 27,
        "content": "(b) Salary step increments shall be effective on the first day of the pay period\nin which the service requirements are completed. No step increment shall be paid in\nthe case of staff members whose services will cease during the month in which the\nstep increment would otherwise have been due."
      },
      {
        "source": "n2317972.pdf",
        "page": 27,
        "content": "Rule 3.2\nSalary ste p increments\n(a) Satisfactory service for the purpose of awarding a salary step increment\nshall be defined, unless otherwise decided by the Secretary-General in any particular\ncase, by satisfactory performance and conduct of staff members."
      },
      {
        "source": "n2317972.pdf",
        "page": 89,
        "content": "shall be awarded annually, except that any increments above step VII shall be\npreceded by two years at the previous step.\n5. Salary increments at the D-1 level shall be awarded annually, except that any\nincrements above step IV shall be preceded by two years at the previous step. Salary"
      },
      {
        "source": "n2317972.pdf",
        "page": 27,
        "content": "remuneration are subject to the provisions of staff rule 13.1 (Salary scales).\nRule 3.2\nSalary ste p increments\n(a) Satisfactory service for the purpose of awarding a salary step increment\nshall be defined, unless otherwise decided by the Secretary-General in any particular"
      }
    ]
  },
  {
    "question": "How does satisfactory service impact the eligibility for salary step increments when a staff member changes levels?",
    "answer": "If a staff member with satisfactory service changes levels downwards, the period of service since the last step increment shall be credited towards the next step increment within the lower level. However, if a staff member's service has not been satisfactory and they are demoted to a lower level, their eligibility for salary step increments in the lower level will be based on satisfactory service at the lower level.",
    "context": "ST/SGB/2023/1/Rev.1\nChapte r III\nSalaries and r elated allowances\nRule 3.1\nSalary scales\n(a) The Secretary-General shall publish the salary scales, pensionable\nremuneration and conditions of salary increments for all categories of staff members.\n(b) The Secretary-General may establish special conditions of employment\napplicable to language staff in the Professional category appointed for specific\ntemporary assignments.\n(c) The transitional measures governing the salary scales and pensionable\nrem...",
    "source": "n2317972.pdf",
    "page": 27,
    "source_documents": [
      {
        "source": "n2317972.pdf",
        "page": 27,
        "content": "(d) If a staff member whose service has not been satisfactory is demoted to a\nlower level, the staff member’s eligibility for salary step increment in the lower level\nwill be based on satisfactory service at the lower level.\nRule 3.3\nSalary policy"
      },
      {
        "source": "n2317972.pdf",
        "page": 27,
        "content": "lower level, the staff member’s eligibility for salary step increment in the lower level\nwill be based on satisfactory service at the lower level.\nRule 3.3\nSalary policy\n(a) On appointment, or on selection to a different category, staff members"
      },
      {
        "source": "n2317972.pdf",
        "page": 27,
        "content": "period of service since the last step increment shall be credited towards the next step\nincrement within the lower level.\n(d) If a staff member whose service has not been satisfactory is demoted to a\nlower level, the staff member’s eligibility for salary step increment in the lower level"
      },
      {
        "source": "n2317972.pdf",
        "page": 27,
        "content": "the case of staff members whose services will cease during the month in which the\nstep increment would otherwise have been due.\n(c) If a staff member with satisfactory service changes level downwards, the\nperiod of service since the last step increment shall be credited towards the next step"
      },
      {
        "source": "n2317972.pdf",
        "page": 27,
        "content": "(c) If a staff member with satisfactory service changes level downwards, the\nperiod of service since the last step increment shall be credited towards the next step\nincrement within the lower level.\n(d) If a staff member whose service has not been satisfactory is demoted to a"
      }
    ]
  },
  {
    "question": "Where can the definition of pensionable remuneration be found for staff members in the United Nations Joint Staff Pension Fund?",
    "answer": "The definition of pensionable remuneration for staff members in the United Nations Joint Staff Pension Fund can be found in article 51 of the Regulations of the United Nations Joint Staff Pension Fund.",
    "context": "ST/SGB/2023/1/Rev.1\nChapte r III\nSalaries and r elated allowances\nRule 3.1\nSalary scales\n(a) The Secretary-General shall publish the salary scales, pensionable\nremuneration and conditions of salary increments for all categories of staff members.\n(b) The Secretary-General may establish special conditions of employment\napplicable to language staff in the Professional category appointed for specific\ntemporary assignments.\n(c) The transitional measures governing the salary scales and pensionable\nrem...",
    "source": "n2317972.pdf",
    "page": 27,
    "source_documents": [
      {
        "source": "n2317972.pdf",
        "page": 105,
        "content": "participant, would have been considered the staff member’s pensionable remuneration\nat that date.\n(l) United Nations Joint Staff Pension Fund benefits: the definition of Fund\nbenefits is set out in article 3.7 below, on the relation to benefits under the United\nNations Joint Staff Pension Fund."
      },
      {
        "source": "n2317972.pdf",
        "page": 105,
        "content": "on behalf of the United Nations under the terms and conditions set out in the present\nrules.\n(j) Pensionable remuneration: the definition of pensionable remuneration is\nset out in article 51 of the Regulations of the United Nations Joint Staff Pension Fund."
      },
      {
        "source": "n2317972.pdf",
        "page": 27,
        "content": "General.\nRule 3.4\nPensionable remuneration\n(a) The definition of pensionable remuneration is set out in article 51 of the\nRegulations of the United Nations Joint Staff Pension Fund.\n(b) The pensionable remuneration of staff members in the Field Service"
      },
      {
        "source": "n2317972.pdf",
        "page": 28,
        "content": "accordance with article 25 of the Regulations of the United Nations Joint Staff\nPension Fund shall be based on either:\n(i) The pensionable remuneration of the staff member used to determine such\ncontributions at the time of change in category; or"
      },
      {
        "source": "n2317972.pdf",
        "page": 105,
        "content": "or illness, the remuneration shall be that which, had the staff member been a\nparticipant, would have been considered the staff member’s pensionable remuneration\nat that date.\n(l) United Nations Joint Staff Pension Fund benefits: the definition of Fund"
      }
    ]
  },
  {
    "question": "How does passing a test in a third official language affect the language allowance received by staff members?",
    "answer": "Passing a test in a third official language can entitle staff members to receive a second pensionable language allowance, equal to half of the amount of the first allowance they were already receiving. This is mentioned in the context provided.",
    "context": "ST/SGB/2023/1/Rev.1\n(b) Staff members already in receipt of a language allowance under paragraph (a)\nabove shall be entitled to receive a second such pensionable allowance, equal to half\nof the amount of the first, provided that they have demonstrated proficiency by\npassing the prescribed test in a third official language.\n(c) The language allowance shall be taken into account in determining United\nNations Joint Staff Pension Fund, medical and group insurance contributions;\novertime and night di...",
    "source": "n2317972.pdf",
    "page": 31,
    "source_documents": [
      {
        "source": "n2317972.pdf",
        "page": 31,
        "content": "of the amount of the first, provided that they have demonstrated proficiency by\npassing the prescribed test in a third official language.\n(c) The language allowance shall be taken into account in determining United\nNations Joint Staff Pension Fund, medical and group insurance contributions;"
      },
      {
        "source": "n2317972.pdf",
        "page": 31,
        "content": "above shall be entitled to receive a second such pensionable allowance, equal to half\nof the amount of the first, provided that they have demonstrated proficiency by\npassing the prescribed test in a third official language."
      },
      {
        "source": "n2317972.pdf",
        "page": 89,
        "content": "may be paid to staff members in the General Service category who pass an appropriate\ntest and demonstrate continued proficiency in the use of two or more official\nlanguages.\n9. In order to preserve equivalent standards of living at different offices, the"
      },
      {
        "source": "n2317972.pdf",
        "page": 31,
        "content": "ST/SGB/2023/1/Rev.1\n(b) Staff members already in receipt of a language allowance under paragraph (a)\nabove shall be entitled to receive a second such pensionable allowance, equal to half\nof the amount of the first, provided that they have demonstrated proficiency by"
      },
      {
        "source": "n2317972.pdf",
        "page": 89,
        "content": "8. The Secretary-General shall establish rules under which a language allowance\nmay be paid to staff members in the General Service category who pass an appropriate\ntest and demonstrate continued proficiency in the use of two or more official\nlanguages."
      }
    ]
  },
  {
    "question": "What are the eligibility criteria for staff members to receive an education grant for their children?",
    "answer": "The eligibility criteria for staff members to receive an education grant for their children include:\n1. The staff member must hold a fixed-term or a continuing appointment.\n2. The staff member must be regarded as an international recruit under staff rule 4.5.\n3. The staff member must reside and serve at a duty station outside their recognized home country.\n4. The dependent child must be in full-time attendance at a school, university, or similar educational institution.\nIf staff members eligible to receive the education grant are reassigned to a duty station, there may be additional conditions or considerations.",
    "context": "ST/SGB/2023/1/Rev.1\n(b) Staff members already in receipt of a language allowance under paragraph (a)\nabove shall be entitled to receive a second such pensionable allowance, equal to half\nof the amount of the first, provided that they have demonstrated proficiency by\npassing the prescribed test in a third official language.\n(c) The language allowance shall be taken into account in determining United\nNations Joint Staff Pension Fund, medical and group insurance contributions;\novertime and night di...",
    "source": "n2317972.pdf",
    "page": 31,
    "source_documents": [
      {
        "source": "n2317972.pdf",
        "page": 23,
        "content": "an education grant shall be available to a staff member residing and serving outside\nhis or her recognized home country whose dependent child is in full-time attendance\nat a school, university or similar educational institution of a type that will, in the"
      },
      {
        "source": "n2317972.pdf",
        "page": 31,
        "content": "notwithstanding national boundaries, where the staff member is serving.\nEligi bility\n(b) Subject to conditions established by the Secretary-General, a staff member\nwho holds a fixed-term or a continuing appointment shall be entitled to an education\ngrant in respect of each child, provided that:"
      },
      {
        "source": "n2317972.pdf",
        "page": 31,
        "content": "who holds a fixed-term or a continuing appointment shall be entitled to an education\ngrant in respect of each child, provided that:\n(i) The staff members are regarded as international recruits under staff rule 4.5\n(Staff in posts subject to international recruitment) and reside and serves at a"
      },
      {
        "source": "n2317972.pdf",
        "page": 31,
        "content": "(ii) The child is in full-time attendance at a school, university or similar\neducational institution.\n(c) Notwithstanding the eligibility criteria set out in paragraph (b) above, if\nstaff members eligible to receive the education grant are reassigned to a duty station"
      },
      {
        "source": "n2317972.pdf",
        "page": 23,
        "content": "Regautlio n 3.2\n(a) The Secretary-General shall establish terms and conditions under which\nan education grant shall be available to a staff member residing and serving outside\nhis or her recognized home country whose dependent child is in full-time attendance"
      }
    ]
  },
  {
    "question": "How is the duration of the education grant regulated in cases of interruptions in the child's education?",
    "answer": "The duration of the education grant can be extended if the child's education is interrupted for at least one school year by mandatory national service, illness, or other compelling reasons. In such cases, the period of eligibility for the education grant shall be extended by the period of interruption. Additionally, if a child receiving the education grant dies while in service during the school year, the full entitlement for that particular school year shall be granted.",
    "context": "ST/SGB/2023/1/Rev.1\n(b) Staff members already in receipt of a language allowance under paragraph (a)\nabove shall be entitled to receive a second such pensionable allowance, equal to half\nof the amount of the first, provided that they have demonstrated proficiency by\npassing the prescribed test in a third official language.\n(c) The language allowance shall be taken into account in determining United\nNations Joint Staff Pension Fund, medical and group insurance contributions;\novertime and night di...",
    "source": "n2317972.pdf",
    "page": 31,
    "source_documents": [
      {
        "source": "n2317972.pdf",
        "page": 31,
        "content": "Dura tion\n(d) The duration as regulated under staff regulation 3.2 on the education grant\nmay be extended if the child’s education is interrupted for at least one school year by\nmandatory national service, illness or other compelling reasons. In such cases, the"
      },
      {
        "source": "n2317972.pdf",
        "page": 31,
        "content": "may be extended if the child’s education is interrupted for at least one school year by\nmandatory national service, illness or other compelling reasons. In such cases, the\nperiod of eligibility shall be extended by the period of interruption.\n23-12028 29/115"
      },
      {
        "source": "n2317972.pdf",
        "page": 31,
        "content": "education grant for the balance of that school year under conditions established by\nthe Secretary-General.\nDura tion\n(d) The duration as regulated under staff regulation 3.2 on the education grant\nmay be extended if the child’s education is interrupted for at least one school year by"
      },
      {
        "source": "n2317972.pdf",
        "page": 31,
        "content": "within their home country in the course of a school year, they may receive the\neducation grant for the balance of that school year under conditions established by\nthe Secretary-General.\nDura tion\n(d) The duration as regulated under staff regulation 3.2 on the education grant"
      },
      {
        "source": "n2317972.pdf",
        "page": 32,
        "content": "receipt of the education grant dies while in service during the school year, the full\nentitlement for that particular school year shall be granted.\nTra vel\n(g) When a staff member is entitled to boarding assistance in respect of a child"
      }
    ]
  },
  {
    "question": "What conditions determine if a parent or sibling of a staff member is considered a secondary dependant?",
    "answer": "A parent or sibling of a staff member is considered a secondary dependant if the staff member provides that person with not less than half of their financial resources, and in any case with not less than twice the amount paid for a secondary dependant in respect of a dependent parent, brother, or sister.",
    "context": "ST/SGB/2023/1/Rev.1\n(v) A parent or a sibling of a staff member shall be considered as a secondary\ndependant if the staff member provides such a person with not less than half of\nthat person’s financial resources, and in any case with not less than twice the\namount of the dependency allowance. The conditions regarding age, school\nattendance and disability are the same for a sibling as those applicable to a staff\nmember’s child in subparagraph (iii) above.\nAmount nodfe dnecpye al lowances\n(b) The...",
    "source": "n2317972.pdf",
    "page": 29,
    "source_documents": [
      {
        "source": "n2317972.pdf",
        "page": 29,
        "content": "ST/SGB/2023/1/Rev.1\n(v) A parent or a sibling of a staff member shall be considered as a secondary\ndependant if the staff member provides such a person with not less than half of\nthat person’s financial resources, and in any case with not less than twice the"
      },
      {
        "source": "n2317972.pdf",
        "page": 26,
        "content": "paid for a secondary dependant in respect of either a dependent parent, a\ndependent brother or a dependent sister;\n(b) If both husband and wife are staff members, one may claim, for dependent\nchildren, under subparagraph (a) (i) and (ii) above, in which case the other may claim"
      },
      {
        "source": "n2317972.pdf",
        "page": 104,
        "content": "claim under these rules.\n(b) Dependant: the spouse, dependent child or secondary dependant as set\nforth in the Staff Rules. Compensation payable on the basis of or benefit payable to a\ndependent child or secondary dependent sibling ceases on the day the dependent child"
      },
      {
        "source": "n2317972.pdf",
        "page": 26,
        "content": "(b) If both husband and wife are staff members, one may claim, for dependent\nchildren, under subparagraph (a) (i) and (ii) above, in which case the other may claim\nonly under subparagraph (a) (iii) above, if otherwise entitled;"
      },
      {
        "source": "n2317972.pdf",
        "page": 104,
        "content": "forth in the Staff Rules. Compensation payable on the basis of or benefit payable to a\ndependent child or secondary dependent sibling ceases on the day the dependent child\nor secondary dependent sibling reaches the age of 18, or 21 if the dependent child or"
      }
    ]
  },
  {
    "question": "How are dependency allowances calculated for staff members in different categories?",
    "answer": "Dependency allowances for staff members in different categories are calculated based on the gross salary less staff assessment for Professional and higher categories, gross salary less staff assessment plus language allowance for Field Service category, and gross salary less staff assessment plus applicable rates for General Service and related categories. The specific calculation method is determined by the staff category and the allowances applicable to each category are published by the Secretary-General.",
    "context": "ST/SGB/2023/1/Rev.1\n(v) A parent or a sibling of a staff member shall be considered as a secondary\ndependant if the staff member provides such a person with not less than half of\nthat person’s financial resources, and in any case with not less than twice the\namount of the dependency allowance. The conditions regarding age, school\nattendance and disability are the same for a sibling as those applicable to a staff\nmember’s child in subparagraph (iii) above.\nAmount nodfe dnecpye al lowances\n(b) The...",
    "source": "n2317972.pdf",
    "page": 29,
    "source_documents": [
      {
        "source": "n2317972.pdf",
        "page": 28,
        "content": "contributions at the time of change in category; or\n(ii) The pensionable remuneration applicable to the staff member’s grade and\nstep in the Professional category;\nwhichever is higher.\nRule 3.5\nDependency allowances\nDefin itions\n(a) For the purposes of the Staff Regulations and Rules:"
      },
      {
        "source": "n2317972.pdf",
        "page": 73,
        "content": "Staff category Calculation of the grant\nProfessional and higher categories Gross salary less staff assessment\nField Service category Gross salary less staff assessment plus\nlanguage allowance, if any\nGeneral Service and related categories Gross salary less staff assessment plus"
      },
      {
        "source": "n2317972.pdf",
        "page": 71,
        "content": "to the Staff Regulations shall be calculated as shown in the table below.\nStaff category Calculation of termination indemnity\nProfessional and higher categories Gross salary less staff assessment\nField Service category Gross salary less staff assessment plus\nlanguage allowance, if any"
      },
      {
        "source": "n2317972.pdf",
        "page": 29,
        "content": "(b) The dependency allowances, which are applicable to the different\ncategories of staff, shall be payable in accordance with the applicable rates published\nby the Secretary-General:\n(i) Dependent spouse allowance: a dependent spouse allowance in the amount"
      },
      {
        "source": "n2317972.pdf",
        "page": 73,
        "content": "in the table below.\nStaff category Calculation of the accrued annual leave\nProfessional and higher categories Gross salary less staff assessment plus post\nadjustment\nField Service category Gross salary less staff assessment plus post\nadjustment and language allowance, if any"
      }
    ]
  },
  {
    "question": "What is the process for staff members to report changes in the status of a dependant that may affect dependency allowances?",
    "answer": "Staff members are responsible for reporting any changes in the status of a dependent that may affect the payment of dependency allowances to the Secretary-General. This reporting should be done promptly to ensure that the allowances are adjusted accordingly. The specific process and any required documentation for reporting these changes would be established by the Secretary-General.",
    "context": "ST/SGB/2023/1/Rev.1\n(v) A parent or a sibling of a staff member shall be considered as a secondary\ndependant if the staff member provides such a person with not less than half of\nthat person’s financial resources, and in any case with not less than twice the\namount of the dependency allowance. The conditions regarding age, school\nattendance and disability are the same for a sibling as those applicable to a staff\nmember’s child in subparagraph (iii) above.\nAmount nodfe dnecpye al lowances\n(b) The...",
    "source": "n2317972.pdf",
    "page": 29,
    "source_documents": [
      {
        "source": "n2317972.pdf",
        "page": 29,
        "content": "establishment of such an allowance, under conditions established by the\nSecretary-General.\n(c) Staff members shall be responsible for reporting to the Secretary-General\nany change in the status of a dependant that may affect the payment of dependency\nallowances.\n23-12028 27/115"
      },
      {
        "source": "n2317972.pdf",
        "page": 29,
        "content": "staff regulations 3.5 and 3.6 (a), the full amount of the dependency allowance\nprovided under those regulations and under the Staff Rules in respect of a\ndependent child shall be payable, except where the staff members or their spouse"
      },
      {
        "source": "n2317972.pdf",
        "page": 28,
        "content": "(iv) Staff members claiming a child as a dependant must certify that they\nprovide main and continuous support. This certification must be supported by\ndocumentary evidence under conditions established by the Secretary-General,\nif a child:\na. Does not reside with the staff member;\nb. Is married; or"
      },
      {
        "source": "n2317972.pdf",
        "page": 104,
        "content": "(a) Claimant: the staff member or dependant, as defined below, bringing a\nclaim under these rules.\n(b) Dependant: the spouse, dependent child or secondary dependant as set\nforth in the Staff Rules. Compensation payable on the basis of or benefit payable to a"
      },
      {
        "source": "n2317972.pdf",
        "page": 29,
        "content": "set out under the Staff Regulations and Rules;\n(iv) Secondary dependent allowance: a secondary dependency allowance shall\nbe paid in respect of not more than one secondary dependent and such payment\nshall not be made when a payment is being made for a dependent spouse. Staff"
      }
    ]
  },
  {
    "question": "Under what circumstances can staff members continue to receive the post adjustment applicable to their previous duty station?",
    "answer": "Staff members can continue to receive the post adjustment applicable to their previous duty station under the following circumstances:\n- When they are assigned to a duty station whose post adjustment classification is lower than that of their previous duty station.\n- They may continue to receive the previous post adjustment for up to six months while at least one member of their immediate family (spouse and children) remains at the previous duty station.",
    "context": "ST/SGB/2023/1/Rev.1\nRule 3.6\nPost adj ustment\n(a) Post adjustment is an amount paid to staff members serving in the\nProfessional and higher categories and in the Field Service category to ensure equity\nin purchasing power across duty stations.\n(b) While the salaries of staff members in the Professional and higher\ncategories and in the Field Service category are normally subject to the post\nadjustment of their duty station during assignments for one year or more, alternative\narrangements may be m...",
    "source": "n2317972.pdf",
    "page": 30,
    "source_documents": [
      {
        "source": "n2317972.pdf",
        "page": 30,
        "content": "circumstances:\n(i) When staff members are assigned to a duty station whose post adjustment\nclassification is lower than that of their previous duty station, they may continue\nto receive for up to six months the post adjustment applicable to the previous"
      },
      {
        "source": "n2317972.pdf",
        "page": 30,
        "content": "classification is lower than that of their previous duty station, they may continue\nto receive for up to six months the post adjustment applicable to the previous\nduty station while at least one member of their immediate family (spouse and\nchildren) remains at that duty station;"
      },
      {
        "source": "n2317972.pdf",
        "page": 30,
        "content": "arrangements may be made by the Secretary-General under the following\ncircumstances:\n(i) When staff members are assigned to a duty station whose post adjustment\nclassification is lower than that of their previous duty station, they may continue"
      },
      {
        "source": "n2317972.pdf",
        "page": 30,
        "content": "Secretary-General.\n(b) When staff members are assigned to a new duty station and they continue\nto receive the post adjustment of the previous duty station under the provisions of\nstaff rule 3.6 (b) (i), they may claim the previous post adjustment and rental subsidy"
      },
      {
        "source": "n2317972.pdf",
        "page": 30,
        "content": "to receive the post adjustment of the previous duty station under the provisions of\nstaff rule 3.6 (b) (i), they may claim the previous post adjustment and rental subsidy\napplicable to the previous duty station for up to six months while at least one member"
      }
    ]
  },
  {
    "question": "What is post adjustment and why is it paid to staff members in certain categories?",
    "answer": "Post adjustment is an amount paid to staff members serving in the Professional and higher categories and in the Field Service category to ensure equity in purchasing power across duty stations. It is meant to compensate for differences in the cost of living between duty stations, ensuring that staff members are not financially disadvantaged when serving in locations with varying levels of expenses.",
    "context": "ST/SGB/2023/1/Rev.1\nRule 3.6\nPost adj ustment\n(a) Post adjustment is an amount paid to staff members serving in the\nProfessional and higher categories and in the Field Service category to ensure equity\nin purchasing power across duty stations.\n(b) While the salaries of staff members in the Professional and higher\ncategories and in the Field Service category are normally subject to the post\nadjustment of their duty station during assignments for one year or more, alternative\narrangements may be m...",
    "source": "n2317972.pdf",
    "page": 30,
    "source_documents": [
      {
        "source": "n2317972.pdf",
        "page": 30,
        "content": "(a) Post adjustment is an amount paid to staff members serving in the\nProfessional and higher categories and in the Field Service category to ensure equity\nin purchasing power across duty stations.\n(b) While the salaries of staff members in the Professional and higher"
      },
      {
        "source": "n2317972.pdf",
        "page": 30,
        "content": "ST/SGB/2023/1/Rev.1\nRule 3.6\nPost adj ustment\n(a) Post adjustment is an amount paid to staff members serving in the\nProfessional and higher categories and in the Field Service category to ensure equity\nin purchasing power across duty stations."
      },
      {
        "source": "n2317972.pdf",
        "page": 32,
        "content": "category, or when a staff member in any category holding a fixed-term or continuing\nappointment is required to serve in a post which is classified more than one level\nabove the staff member’s level, the allowance may be paid immediately when the staff"
      },
      {
        "source": "n2317972.pdf",
        "page": 33,
        "content": "ST/SGB/2023/1/Rev.1\n(d) The amount of the special post allowance shall be equivalent to the salary\nincrease (including post adjustment and dependency allowances, if any) which the\nstaff member would have received had the staff member been promoted to the next\nhigher level.\nRule 3.11"
      },
      {
        "source": "n2317972.pdf",
        "page": 30,
        "content": "in purchasing power across duty stations.\n(b) While the salaries of staff members in the Professional and higher\ncategories and in the Field Service category are normally subject to the post\nadjustment of their duty station during assignments for one year or more, alternative"
      }
    ]
  },
  {
    "question": "How does the rental subsidy work for internationally recruited staff members?",
    "answer": "Internationally recruited staff members who incur higher-than-average rent costs for reasonable standard accommodations may receive a rental subsidy as a supplement to the post adjustment. The conditions for receiving this subsidy are established by the Secretary-General. The subsidy is designed to help offset the higher rent costs incurred by staff members in certain locations.",
    "context": "ST/SGB/2023/1/Rev.1\nRule 3.6\nPost adj ustment\n(a) Post adjustment is an amount paid to staff members serving in the\nProfessional and higher categories and in the Field Service category to ensure equity\nin purchasing power across duty stations.\n(b) While the salaries of staff members in the Professional and higher\ncategories and in the Field Service category are normally subject to the post\nadjustment of their duty station during assignments for one year or more, alternative\narrangements may be m...",
    "source": "n2317972.pdf",
    "page": 30,
    "source_documents": [
      {
        "source": "n2317972.pdf",
        "page": 30,
        "content": "Rule 3.7\nRental subsidy\n(a) Internationally recruited staff members who incur higher-than-average\nrent costs for reasonable standard accommodations will be paid a supplement to the\npost adjustment in the form of a rental subsidy under conditions established by the\nSecretary-General."
      },
      {
        "source": "n2317972.pdf",
        "page": 30,
        "content": "station or, in lieu of the above, to authorize appropriate payments of the daily\nsubsistence allowance.\nRule 3.7\nRental subsidy\n(a) Internationally recruited staff members who incur higher-than-average\nrent costs for reasonable standard accommodations will be paid a supplement to the"
      },
      {
        "source": "n2317972.pdf",
        "page": 37,
        "content": "Depending on their type of appointment, the allowances and benefits available to\ninternationally recruited staff members, may include: payment of travel expenses\nupon initial appointment and on separation for themselves and their spouses and\n23-12028 35/115"
      },
      {
        "source": "n2317972.pdf",
        "page": 37,
        "content": "been locally recruited shall be considered as having been internationally recruited.\nDepending on their type of appointment, the allowances and benefits available to\ninternationally recruited staff members, may include: payment of travel expenses"
      },
      {
        "source": "n2317972.pdf",
        "page": 74,
        "content": "the staff member has acquired permanent resident status.\nEligibility, amount an d computation of the grant\n(c) Staff members who are internationally recruited pursuant to staff rule 4.5\nshall be eligible for payment of the repatriation grant in accordance with the amount"
      }
    ]
  },
  {
    "question": "Who is eligible for a language allowance according to Rule 3.8?",
    "answer": "Staff members in the General Service, Security Service, or Trades and Crafts category, or in the Field Service category up to and including the FS-5 level, holding a fixed-term or a continuing appointment may be entitled to a pensionable language allowance according to Rule 3.8.",
    "context": "ST/SGB/2023/1/Rev.1\nRule 3.6\nPost adj ustment\n(a) Post adjustment is an amount paid to staff members serving in the\nProfessional and higher categories and in the Field Service category to ensure equity\nin purchasing power across duty stations.\n(b) While the salaries of staff members in the Professional and higher\ncategories and in the Field Service category are normally subject to the post\nadjustment of their duty station during assignments for one year or more, alternative\narrangements may be m...",
    "source": "n2317972.pdf",
    "page": 30,
    "source_documents": [
      {
        "source": "n2317972.pdf",
        "page": 31,
        "content": "above shall be entitled to receive a second such pensionable allowance, equal to half\nof the amount of the first, provided that they have demonstrated proficiency by\npassing the prescribed test in a third official language."
      },
      {
        "source": "n2317972.pdf",
        "page": 31,
        "content": "ST/SGB/2023/1/Rev.1\n(b) Staff members already in receipt of a language allowance under paragraph (a)\nabove shall be entitled to receive a second such pensionable allowance, equal to half\nof the amount of the first, provided that they have demonstrated proficiency by"
      },
      {
        "source": "n2317972.pdf",
        "page": 89,
        "content": "8. The Secretary-General shall establish rules under which a language allowance\nmay be paid to staff members in the General Service category who pass an appropriate\ntest and demonstrate continued proficiency in the use of two or more official\nlanguages."
      },
      {
        "source": "n2317972.pdf",
        "page": 31,
        "content": "of the amount of the first, provided that they have demonstrated proficiency by\npassing the prescribed test in a third official language.\n(c) The language allowance shall be taken into account in determining United\nNations Joint Staff Pension Fund, medical and group insurance contributions;"
      },
      {
        "source": "n2317972.pdf",
        "page": 30,
        "content": "Rule 3.8\nLanguage allowance\n(a) Staff members in the General Service, Security Service or Trades and\nCrafts category, or in the Field Service category up to and including the FS-5 level,\nholding a fixed-term or a continuing appointment may be entitled to a pensionable"
      }
    ]
  },
  {
    "question": "What are the language proficiency requirements for staff members to be entitled to a pensionable language allowance?",
    "answer": "Staff members must demonstrate proficiency by passing the prescribed test in a third official language to be entitled to a second pensionable language allowance. Additionally, staff members in the General Service category must pass an appropriate test and demonstrate continued proficiency in the use of two or more official languages to be eligible for a language allowance.",
    "context": "ST/SGB/2023/1/Rev.1\nRule 3.6\nPost adj ustment\n(a) Post adjustment is an amount paid to staff members serving in the\nProfessional and higher categories and in the Field Service category to ensure equity\nin purchasing power across duty stations.\n(b) While the salaries of staff members in the Professional and higher\ncategories and in the Field Service category are normally subject to the post\nadjustment of their duty station during assignments for one year or more, alternative\narrangements may be m...",
    "source": "n2317972.pdf",
    "page": 30,
    "source_documents": [
      {
        "source": "n2317972.pdf",
        "page": 31,
        "content": "ST/SGB/2023/1/Rev.1\n(b) Staff members already in receipt of a language allowance under paragraph (a)\nabove shall be entitled to receive a second such pensionable allowance, equal to half\nof the amount of the first, provided that they have demonstrated proficiency by"
      },
      {
        "source": "n2317972.pdf",
        "page": 31,
        "content": "above shall be entitled to receive a second such pensionable allowance, equal to half\nof the amount of the first, provided that they have demonstrated proficiency by\npassing the prescribed test in a third official language."
      },
      {
        "source": "n2317972.pdf",
        "page": 31,
        "content": "of the amount of the first, provided that they have demonstrated proficiency by\npassing the prescribed test in a third official language.\n(c) The language allowance shall be taken into account in determining United\nNations Joint Staff Pension Fund, medical and group insurance contributions;"
      },
      {
        "source": "n2317972.pdf",
        "page": 89,
        "content": "may be paid to staff members in the General Service category who pass an appropriate\ntest and demonstrate continued proficiency in the use of two or more official\nlanguages.\n9. In order to preserve equivalent standards of living at different offices, the"
      },
      {
        "source": "n2317972.pdf",
        "page": 30,
        "content": "holding a fixed-term or a continuing appointment may be entitled to a pensionable\nlanguage allowance, under rates and conditions determined by the Secretary-General,\nprovided that they have demonstrated proficiency in two or more United Nations\nofficial languages as follows:"
      }
    ]
  },
  {
    "question": "What happens to the pensionable remuneration of a staff member when they move from the General Service category to the Professional category?",
    "answer": "When a staff member from the General Service category is recruited to the Professional category and this results in a reduction of the pensionable remuneration, the level of pensionable remuneration reached prior to the change in category shall be maintained until it is surpassed by that applicable to the staff member’s grade and step in the Professional category. Contributions payable to the Pension Fund will be based on the higher of the pensionable remuneration used to determine such contributions at the time of the category change or the pensionable remuneration applicable to the staff member’s grade and step in the Professional category.",
    "context": "ST/SGB/2023/1/Rev.1\n(c) When a staff member from the General Service and related categories is\nrecruited to the Professional category and this results in a reduction of the pensionable\nremuneration, the level of pensionable remuneration reached prior to the change in\ncategory shall be maintained until it is surpassed by that applicable to the staff\nmember’s grade and step in the Professional category. Contributions payable in\naccordance with article 25 of the Regulations of the United Nations Jo...",
    "source": "n2317972.pdf",
    "page": 28,
    "source_documents": [
      {
        "source": "n2317972.pdf",
        "page": 28,
        "content": "ST/SGB/2023/1/Rev.1\n(c) When a staff member from the General Service and related categories is\nrecruited to the Professional category and this results in a reduction of the pensionable\nremuneration, the level of pensionable remuneration reached prior to the change in"
      },
      {
        "source": "n2317972.pdf",
        "page": 28,
        "content": "recruited to the Professional category and this results in a reduction of the pensionable\nremuneration, the level of pensionable remuneration reached prior to the change in\ncategory shall be maintained until it is surpassed by that applicable to the staff"
      },
      {
        "source": "n2317972.pdf",
        "page": 28,
        "content": "remuneration, the level of pensionable remuneration reached prior to the change in\ncategory shall be maintained until it is surpassed by that applicable to the staff\nmember’s grade and step in the Professional category. Contributions payable in"
      },
      {
        "source": "n2317972.pdf",
        "page": 28,
        "content": "Pension Fund shall be based on either:\n(i) The pensionable remuneration of the staff member used to determine such\ncontributions at the time of change in category; or\n(ii) The pensionable remuneration applicable to the staff member’s grade and\nstep in the Professional category;\nwhichever is higher."
      },
      {
        "source": "n2317972.pdf",
        "page": 28,
        "content": "category shall be maintained until it is surpassed by that applicable to the staff\nmember’s grade and step in the Professional category. Contributions payable in\naccordance with article 25 of the Regulations of the United Nations Joint Staff\nPension Fund shall be based on either:"
      }
    ]
  },
  {
    "question": "What criteria must be met for a child to be considered a 'dependent child' for a staff member?",
    "answer": "For a child to be considered a 'dependent child' for a staff member, the staff member must provide main and continuing support to the child. The child must meet one of the following criteria:\na. The child is under the age of 18 years;\nb. The child is between the ages of 18 and 21 years and attends school full-time;\nc. A child who cannot be legally adopted, for whom the staff member has legal responsibility and who is residing with the staff member.",
    "context": "ST/SGB/2023/1/Rev.1\n(c) When a staff member from the General Service and related categories is\nrecruited to the Professional category and this results in a reduction of the pensionable\nremuneration, the level of pensionable remuneration reached prior to the change in\ncategory shall be maintained until it is surpassed by that applicable to the staff\nmember’s grade and step in the Professional category. Contributions payable in\naccordance with article 25 of the Regulations of the United Nations Jo...",
    "source": "n2317972.pdf",
    "page": 28,
    "source_documents": [
      {
        "source": "n2317972.pdf",
        "page": 28,
        "content": "(iii) A “dependent child” is a child for whom the staff member provides main\nand continuing support and who meets one of the following criteria:\na. The child is under the age of 18 years;\nb. The child is between the ages of 18 and 21 years and attends"
      },
      {
        "source": "n2317972.pdf",
        "page": 28,
        "content": "c. A child who cannot be legally adopted, for whom the staff member\nhas legal responsibility and who is residing with the staff member;\n(iii) A “dependent child” is a child for whom the staff member provides main\nand continuing support and who meets one of the following criteria:"
      },
      {
        "source": "n2317972.pdf",
        "page": 29,
        "content": "dependant if the staff member provides such a person with not less than half of\nthat person’s financial resources, and in any case with not less than twice the\namount of the dependency allowance. The conditions regarding age, school"
      },
      {
        "source": "n2317972.pdf",
        "page": 29,
        "content": "that person’s financial resources, and in any case with not less than twice the\namount of the dependency allowance. The conditions regarding age, school\nattendance and disability are the same for a sibling as those applicable to a staff\nmember’s child in subparagraph (iii) above."
      },
      {
        "source": "n2317972.pdf",
        "page": 28,
        "content": "a. A staff member’s natural or legally adopted child; or\nb. A staff member’s stepchild who is residing with the staff member; or\nc. A child who cannot be legally adopted, for whom the staff member\nhas legal responsibility and who is residing with the staff member;"
      }
    ]
  },
  {
    "question": "How is a 'dependent spouse' defined according to the Staff Regulations and Rules?",
    "answer": "A \"dependent spouse\" is defined as a spouse whose earnings, if any, do not exceed the lowest entry level of the United Nations General Service gross salary scales in force on 1 January of the year concerned for the duty station in the country set out under the Staff Regulations and Rules.",
    "context": "ST/SGB/2023/1/Rev.1\n(c) When a staff member from the General Service and related categories is\nrecruited to the Professional category and this results in a reduction of the pensionable\nremuneration, the level of pensionable remuneration reached prior to the change in\ncategory shall be maintained until it is surpassed by that applicable to the staff\nmember’s grade and step in the Professional category. Contributions payable in\naccordance with article 25 of the Regulations of the United Nations Jo...",
    "source": "n2317972.pdf",
    "page": 28,
    "source_documents": [
      {
        "source": "n2317972.pdf",
        "page": 28,
        "content": "whichever is higher.\nRule 3.5\nDependency allowances\nDefin itions\n(a) For the purposes of the Staff Regulations and Rules:\n(i) A “dependent spouse” is a spouse whose earnings, if any, do not exceed\nthe lowest entry level of the United Nations General Service gross salary scales"
      },
      {
        "source": "n2317972.pdf",
        "page": 28,
        "content": "step in the Professional category;\nwhichever is higher.\nRule 3.5\nDependency allowances\nDefin itions\n(a) For the purposes of the Staff Regulations and Rules:\n(i) A “dependent spouse” is a spouse whose earnings, if any, do not exceed"
      },
      {
        "source": "n2317972.pdf",
        "page": 28,
        "content": "(i) A “dependent spouse” is a spouse whose earnings, if any, do not exceed\nthe lowest entry level of the United Nations General Service gross salary scales\nin force on 1 January of the year concerned for the duty station in the country"
      },
      {
        "source": "n2317972.pdf",
        "page": 29,
        "content": "set out under the Staff Regulations and Rules;\n(iv) Secondary dependent allowance: a secondary dependency allowance shall\nbe paid in respect of not more than one secondary dependent and such payment\nshall not be made when a payment is being made for a dependent spouse. Staff"
      },
      {
        "source": "n2317972.pdf",
        "page": 104,
        "content": "(a) Claimant: the staff member or dependant, as defined below, bringing a\nclaim under these rules.\n(b) Dependant: the spouse, dependent child or secondary dependant as set\nforth in the Staff Rules. Compensation payable on the basis of or benefit payable to a"
      }
    ]
  },
  {
    "question": "In what circumstances is the level of pensionable remuneration maintained for a staff member moving to the Professional category?",
    "answer": "The level of pensionable remuneration is maintained for a staff member moving to the Professional category when this results in a reduction of pensionable remuneration. The level reached prior to the change in category will be maintained until it is surpassed by that applicable to the staff member’s grade and step in the Professional category. Contributions payable to the Pension Fund will be based on the higher of the two pensionable remunerations.",
    "context": "ST/SGB/2023/1/Rev.1\n(c) When a staff member from the General Service and related categories is\nrecruited to the Professional category and this results in a reduction of the pensionable\nremuneration, the level of pensionable remuneration reached prior to the change in\ncategory shall be maintained until it is surpassed by that applicable to the staff\nmember’s grade and step in the Professional category. Contributions payable in\naccordance with article 25 of the Regulations of the United Nations Jo...",
    "source": "n2317972.pdf",
    "page": 28,
    "source_documents": [
      {
        "source": "n2317972.pdf",
        "page": 28,
        "content": "recruited to the Professional category and this results in a reduction of the pensionable\nremuneration, the level of pensionable remuneration reached prior to the change in\ncategory shall be maintained until it is surpassed by that applicable to the staff"
      },
      {
        "source": "n2317972.pdf",
        "page": 28,
        "content": "remuneration, the level of pensionable remuneration reached prior to the change in\ncategory shall be maintained until it is surpassed by that applicable to the staff\nmember’s grade and step in the Professional category. Contributions payable in"
      },
      {
        "source": "n2317972.pdf",
        "page": 28,
        "content": "ST/SGB/2023/1/Rev.1\n(c) When a staff member from the General Service and related categories is\nrecruited to the Professional category and this results in a reduction of the pensionable\nremuneration, the level of pensionable remuneration reached prior to the change in"
      },
      {
        "source": "n2317972.pdf",
        "page": 28,
        "content": "Pension Fund shall be based on either:\n(i) The pensionable remuneration of the staff member used to determine such\ncontributions at the time of change in category; or\n(ii) The pensionable remuneration applicable to the staff member’s grade and\nstep in the Professional category;\nwhichever is higher."
      },
      {
        "source": "n2317972.pdf",
        "page": 28,
        "content": "category shall be maintained until it is surpassed by that applicable to the staff\nmember’s grade and step in the Professional category. Contributions payable in\naccordance with article 25 of the Regulations of the United Nations Joint Staff\nPension Fund shall be based on either:"
      }
    ]
  },
  {
    "question": "How does the certification process work for staff members claiming a child as a dependant?",
    "answer": "Staff members claiming a child as a dependent must certify that they provide main and continuous support. This certification must be supported by documentary evidence under conditions established by the Secretary-General. If the child does not reside with the staff member, is married, or is considered dependent by the Secretary-General due to certain circumstances, additional documentation may be required. Additionally, if both husband and wife are staff members, specific rules apply for claiming dependent children.",
    "context": "ST/SGB/2023/1/Rev.1\n(c) When a staff member from the General Service and related categories is\nrecruited to the Professional category and this results in a reduction of the pensionable\nremuneration, the level of pensionable remuneration reached prior to the change in\ncategory shall be maintained until it is surpassed by that applicable to the staff\nmember’s grade and step in the Professional category. Contributions payable in\naccordance with article 25 of the Regulations of the United Nations Jo...",
    "source": "n2317972.pdf",
    "page": 28,
    "source_documents": [
      {
        "source": "n2317972.pdf",
        "page": 28,
        "content": "(iv) Staff members claiming a child as a dependant must certify that they\nprovide main and continuous support. This certification must be supported by\ndocumentary evidence under conditions established by the Secretary-General,\nif a child:\na. Does not reside with the staff member;\nb. Is married; or"
      },
      {
        "source": "n2317972.pdf",
        "page": 28,
        "content": "by the Secretary-General as being permanent or for a period that is expected to\nbe long-term that prevents substantial gainful employment;\n(iv) Staff members claiming a child as a dependant must certify that they\nprovide main and continuous support. This certification must be supported by"
      },
      {
        "source": "n2317972.pdf",
        "page": 26,
        "content": "(b) If both husband and wife are staff members, one may claim, for dependent\nchildren, under subparagraph (a) (i) and (ii) above, in which case the other may claim\nonly under subparagraph (a) (iii) above, if otherwise entitled;"
      },
      {
        "source": "n2317972.pdf",
        "page": 104,
        "content": "(a) Claimant: the staff member or dependant, as defined below, bringing a\nclaim under these rules.\n(b) Dependant: the spouse, dependent child or secondary dependant as set\nforth in the Staff Rules. Compensation payable on the basis of or benefit payable to a"
      },
      {
        "source": "n2317972.pdf",
        "page": 29,
        "content": "staff regulations 3.5 and 3.6 (a), the full amount of the dependency allowance\nprovided under those regulations and under the Staff Rules in respect of a\ndependent child shall be payable, except where the staff members or their spouse"
      }
    ]
  },
  {
    "question": "Under what conditions are staff members eligible to receive the mobility incentive?",
    "answer": "Staff members in the Professional and higher categories, in the Field Service category, and internationally recruited staff in the General Service category may be eligible to receive a non-pensionable mobility incentive. The conditions for receiving this incentive include encouraging movement to duty stations classified as A to E in accordance with the classification of duty stations established by the International Civil Service Commission. The specific amount and conditions for receiving the mobility incentive are determined based on factors such as the number of duty stations at which staff members have previously served for a period of one year.",
    "context": "ST/SGB/2023/1/Rev.1\n(d) The amount of the special post allowance shall be equivalent to the salary\nincrease (including post adjustment and dependency allowances, if any) which the\nstaff member would have received had the staff member been promoted to the next\nhigher level.\nRule 3.11\nMobility incentive\n(a) The purpose of the mobility incentive is to encourage movement of staff\nmembers to duty stations classified as A to E in accordance with the classification of\nduty stations established by the I...",
    "source": "n2317972.pdf",
    "page": 33,
    "source_documents": [
      {
        "source": "n2317972.pdf",
        "page": 33,
        "content": "increase (including post adjustment and dependency allowances, if any) which the\nstaff member would have received had the staff member been promoted to the next\nhigher level.\nRule 3.11\nMobility incentive\n(a) The purpose of the mobility incentive is to encourage movement of staff"
      },
      {
        "source": "n2317972.pdf",
        "page": 33,
        "content": "(d) The amount of the mobility incentive, if any, and the conditions under\nwhich it will be paid, shall be determined after taking into account the number of duty\nstations at which staff members have previously served for a period of one year or"
      },
      {
        "source": "n2317972.pdf",
        "page": 33,
        "content": "staff member would have received had the staff member been promoted to the next\nhigher level.\nRule 3.11\nMobility incentive\n(a) The purpose of the mobility incentive is to encourage movement of staff\nmembers to duty stations classified as A to E in accordance with the classification of"
      },
      {
        "source": "n2317972.pdf",
        "page": 33,
        "content": "Rule 3.11\nMobility incentive\n(a) The purpose of the mobility incentive is to encourage movement of staff\nmembers to duty stations classified as A to E in accordance with the classification of\nduty stations established by the International Civil Service Commission."
      },
      {
        "source": "n2317972.pdf",
        "page": 33,
        "content": "(b) Staff members in the Professional and higher categories, in the Field\nService category, and internationally recruited staff in the General Service category\npursuant to staff rule 4.5 (c) may be paid a non-pensionable mobility incentive\nprovided that they:"
      }
    ]
  },
  {
    "question": "How is the amount of the mobility incentive determined?",
    "answer": "The amount of the mobility incentive is determined by taking into account the number of duty stations at which staff members have previously served for a period of one year or payable for one additional year, but in no case for more than a total of six years. Additionally, the amount is also determined by considering the increase in salary (including post adjustment and dependency allowances) that the staff member would have received if they had been promoted to the next higher level.",
    "context": "ST/SGB/2023/1/Rev.1\n(d) The amount of the special post allowance shall be equivalent to the salary\nincrease (including post adjustment and dependency allowances, if any) which the\nstaff member would have received had the staff member been promoted to the next\nhigher level.\nRule 3.11\nMobility incentive\n(a) The purpose of the mobility incentive is to encourage movement of staff\nmembers to duty stations classified as A to E in accordance with the classification of\nduty stations established by the I...",
    "source": "n2317972.pdf",
    "page": 33,
    "source_documents": [
      {
        "source": "n2317972.pdf",
        "page": 33,
        "content": "(d) The amount of the mobility incentive, if any, and the conditions under\nwhich it will be paid, shall be determined after taking into account the number of duty\nstations at which staff members have previously served for a period of one year or"
      },
      {
        "source": "n2317972.pdf",
        "page": 33,
        "content": "Rule 3.11\nMobility incentive\n(a) The purpose of the mobility incentive is to encourage movement of staff\nmembers to duty stations classified as A to E in accordance with the classification of\nduty stations established by the International Civil Service Commission."
      },
      {
        "source": "n2317972.pdf",
        "page": 33,
        "content": "payable for one additional year, but in no case for more than a total of six years.\n(d) The amount of the mobility incentive, if any, and the conditions under\nwhich it will be paid, shall be determined after taking into account the number of duty"
      },
      {
        "source": "n2317972.pdf",
        "page": 33,
        "content": "increase (including post adjustment and dependency allowances, if any) which the\nstaff member would have received had the staff member been promoted to the next\nhigher level.\nRule 3.11\nMobility incentive\n(a) The purpose of the mobility incentive is to encourage movement of staff"
      },
      {
        "source": "n2317972.pdf",
        "page": 33,
        "content": "allowances.\n(c) The mobility incentive shall be discontinued upon five continuous years\nat the same duty station. In the exceptional case of staff members who remained at\nthe same duty station for more than five years at the explicit request of the"
      }
    ]
  },
  {
    "question": "What is the purpose of the mobility incentive outlined in the text?",
    "answer": "The purpose of the mobility incentive outlined in the text is to encourage the movement of staff members to duty stations classified as A to E, in accordance with the classification of duty stations established by the International Civil Service Commission.",
    "context": "ST/SGB/2023/1/Rev.1\n(d) The amount of the special post allowance shall be equivalent to the salary\nincrease (including post adjustment and dependency allowances, if any) which the\nstaff member would have received had the staff member been promoted to the next\nhigher level.\nRule 3.11\nMobility incentive\n(a) The purpose of the mobility incentive is to encourage movement of staff\nmembers to duty stations classified as A to E in accordance with the classification of\nduty stations established by the I...",
    "source": "n2317972.pdf",
    "page": 33,
    "source_documents": [
      {
        "source": "n2317972.pdf",
        "page": 33,
        "content": "Rule 3.11\nMobility incentive\n(a) The purpose of the mobility incentive is to encourage movement of staff\nmembers to duty stations classified as A to E in accordance with the classification of\nduty stations established by the International Civil Service Commission."
      },
      {
        "source": "n2317972.pdf",
        "page": 33,
        "content": "increase (including post adjustment and dependency allowances, if any) which the\nstaff member would have received had the staff member been promoted to the next\nhigher level.\nRule 3.11\nMobility incentive\n(a) The purpose of the mobility incentive is to encourage movement of staff"
      },
      {
        "source": "n2317972.pdf",
        "page": 33,
        "content": "staff member would have received had the staff member been promoted to the next\nhigher level.\nRule 3.11\nMobility incentive\n(a) The purpose of the mobility incentive is to encourage movement of staff\nmembers to duty stations classified as A to E in accordance with the classification of"
      },
      {
        "source": "n2317972.pdf",
        "page": 33,
        "content": "(d) The amount of the mobility incentive, if any, and the conditions under\nwhich it will be paid, shall be determined after taking into account the number of duty\nstations at which staff members have previously served for a period of one year or"
      },
      {
        "source": "n2317972.pdf",
        "page": 33,
        "content": "Organization or for compelling humanitarian reasons, the mobility incentive shall be\npayable for one additional year, but in no case for more than a total of six years.\n(d) The amount of the mobility incentive, if any, and the conditions under"
      }
    ]
  },
  {
    "question": "What is the purpose of the hardship allowance mentioned in the text?",
    "answer": "The purpose of the hardship allowance mentioned in the text is to compensate for the hardship experienced by staff members serving in duty stations classified as B to E by the category.",
    "context": "ST/SGB/2023/1/Rev.1\n(d) The amount of the special post allowance shall be equivalent to the salary\nincrease (including post adjustment and dependency allowances, if any) which the\nstaff member would have received had the staff member been promoted to the next\nhigher level.\nRule 3.11\nMobility incentive\n(a) The purpose of the mobility incentive is to encourage movement of staff\nmembers to duty stations classified as A to E in accordance with the classification of\nduty stations established by the I...",
    "source": "n2317972.pdf",
    "page": 33,
    "source_documents": [
      {
        "source": "n2317972.pdf",
        "page": 33,
        "content": "longer and the hardship classification of the new duty station to which staff members\nare assigned.\nRule 3.12\nHardship allowance\n(a) The purpose of the hardship allowance is to compensate for the hardship\nexperienced by staff members serving in duty stations classified as B to E by the"
      },
      {
        "source": "n2317972.pdf",
        "page": 33,
        "content": "category, and staff in the General Service category considered internationally\nrecruited pursuant to staff rule 4.5 (c) who are appointed or reassigned to a new duty\nstation may be paid a non-pensionable hardship allowance.\n(c) The amount of this allowance, if any, and the conditions under which it"
      },
      {
        "source": "n2317972.pdf",
        "page": 101,
        "content": "calculation of the admissible expenses, subject to a maximum reimbursement equal to\nthe upper limit of the top bracket of the sliding scale in paragraph (a) above plus the\namount of 5,300 United States dollars, equivalent to the lump sum for boarding\nassistance.\n23-12028 99/115"
      },
      {
        "source": "n2317972.pdf",
        "page": 58,
        "content": "authorize a reasonable increase in the daily subsistence allowance to be paid to staff\nmembers who are required to accompany a senior official and whose official duties\nwhile in travel status require that their additional living expenses be set at a rate"
      },
      {
        "source": "n2317972.pdf",
        "page": 6,
        "content": "added to provide a clearer basis for the Organization to make voluntary\ndeductions in accordance with the amounts reflected in family support court\norders in cases in which staff members have failed to meet those obligations."
      }
    ]
  },
  {
    "question": "Who is eligible to receive the hardship allowance according to the text?",
    "answer": "Staff in the General Service category considered internationally recruited pursuant to staff rule 4.5 (c) who are appointed or reassigned to a new duty station may be eligible to receive the hardship allowance.",
    "context": "ST/SGB/2023/1/Rev.1\n(d) The amount of the special post allowance shall be equivalent to the salary\nincrease (including post adjustment and dependency allowances, if any) which the\nstaff member would have received had the staff member been promoted to the next\nhigher level.\nRule 3.11\nMobility incentive\n(a) The purpose of the mobility incentive is to encourage movement of staff\nmembers to duty stations classified as A to E in accordance with the classification of\nduty stations established by the I...",
    "source": "n2317972.pdf",
    "page": 33,
    "source_documents": [
      {
        "source": "n2317972.pdf",
        "page": 33,
        "content": "category, and staff in the General Service category considered internationally\nrecruited pursuant to staff rule 4.5 (c) who are appointed or reassigned to a new duty\nstation may be paid a non-pensionable hardship allowance.\n(c) The amount of this allowance, if any, and the conditions under which it"
      },
      {
        "source": "n2317972.pdf",
        "page": 31,
        "content": "may be extended if the child’s education is interrupted for at least one school year by\nmandatory national service, illness or other compelling reasons. In such cases, the\nperiod of eligibility shall be extended by the period of interruption.\n23-12028 29/115"
      },
      {
        "source": "n2317972.pdf",
        "page": 32,
        "content": "entitlement for that particular school year shall be granted.\nTra vel\n(g) When a staff member is entitled to boarding assistance in respect of a child\nunder paragraph (b) or (c) of appendix B to the present Rules, the staff member shall"
      },
      {
        "source": "n2317972.pdf",
        "page": 34,
        "content": "exceptionally approved the presence of eligible family members of the staff member\nat the duty station.\nRule 3.14\nSalary a dvances\n(a) Salary advances may be made to staff members under the following\ncircumstances and conditions:"
      },
      {
        "source": "n2317972.pdf",
        "page": 74,
        "content": "shall be eligible for payment of the repatriation grant in accordance with the amount\nset forth in annex IV to the Staff Regulations, provided that they meet the following\nconditions:\n(i) The Organization had the obligation to repatriate the staff members upon"
      }
    ]
  },
  {
    "question": "Under what circumstances can staff members receive salary advances according to Rule 3.14?",
    "answer": "Staff members can receive salary advances under the following circumstances according to Rule 3.14:\n- In cases where new staff members arrive without sufficient funds, in such amount as the Secretary-General may deem appropriate.",
    "context": "ST/SGB/2023/1/Rev.1\nRule 3.13\nNo-nfamily serv ice allowance\n(a) The non-family service allowance is an incentive for staff members to\nundertake assignments at non-family locations and recognizes the increased level of\nfinancial and psychological hardship incurred by involuntary separation from their\nfamilies, including additional service-related costs.\n(b) Staff in the Professional and higher categories and in the Field Service\ncategory and staff in the General Service category considered intern...",
    "source": "n2317972.pdf",
    "page": 34,
    "source_documents": [
      {
        "source": "n2317972.pdf",
        "page": 34,
        "content": "member is supported by a detailed justification in writing.\n(b) Salary advances shall be recovered at a constant rate as determined at the\ntime the advance is authorized, in consecutive pay periods, commencing not later than\nthe period following that in which the advance is made.\nRule 3.15"
      },
      {
        "source": "n2317972.pdf",
        "page": 34,
        "content": "at the duty station.\nRule 3.14\nSalary a dvances\n(a) Salary advances may be made to staff members under the following\ncircumstances and conditions:\n(i) In cases where new staff members arrive without sufficient funds, in such\namount as the Secretary-General may deem appropriate;"
      },
      {
        "source": "n2317972.pdf",
        "page": 34,
        "content": "time the advance is authorized, in consecutive pay periods, commencing not later than\nthe period following that in which the advance is made.\nRule 3.15\nRetroactivit y of payments\n(a) The Organization shall make retroactive payments:"
      },
      {
        "source": "n2317972.pdf",
        "page": 34,
        "content": "the period following that in which the advance is made.\nRule 3.15\nRetroactivit y of payments\n(a) The Organization shall make retroactive payments:\n(i) In cases where staff members have not received their regular pay, through\nno fault of their own, in the amount due; and"
      },
      {
        "source": "n2317972.pdf",
        "page": 107,
        "content": "in relation to the claim shall be terminated and all payments made in relation to the\nclaim shall be subject to recovery.\n(b) When made by staff members, such claims may constitute misconduct\nunder chapter X of the Staff Rules, and may result in disciplinary measures.\n23-12028 105/115"
      }
    ]
  },
  {
    "question": "What is the purpose of the non-family service allowance mentioned in the text?",
    "answer": "The purpose of the non-family service allowance is to provide an incentive for staff members to undertake assignments at non-family duty stations. It recognizes the increased financial and psychological hardship that staff members may face due to involuntary separation from their families.",
    "context": "ST/SGB/2023/1/Rev.1\nRule 3.13\nNo-nfamily serv ice allowance\n(a) The non-family service allowance is an incentive for staff members to\nundertake assignments at non-family locations and recognizes the increased level of\nfinancial and psychological hardship incurred by involuntary separation from their\nfamilies, including additional service-related costs.\n(b) Staff in the Professional and higher categories and in the Field Service\ncategory and staff in the General Service category considered intern...",
    "source": "n2317972.pdf",
    "page": 34,
    "source_documents": [
      {
        "source": "n2317972.pdf",
        "page": 34,
        "content": "ST/SGB/2023/1/Rev.1\nRule 3.13\nNo-nfamily serv ice allowance\n(a) The non-family service allowance is an incentive for staff members to\nundertake assignments at non-family locations and recognizes the increased level of\nfinancial and psychological hardship incurred by involuntary separation from their"
      },
      {
        "source": "n2317972.pdf",
        "page": 34,
        "content": "pursuant to staff rule 4.5 (c) who are appointed or reassigned to a non-family duty\nstation may be paid a non-pensionable non-family service allowance.\n(c) The amount and conditions under which the allowance will be paid shall"
      },
      {
        "source": "n2317972.pdf",
        "page": 34,
        "content": "category and staff in the General Service category considered internationally recruited\npursuant to staff rule 4.5 (c) who are appointed or reassigned to a non-family duty\nstation may be paid a non-pensionable non-family service allowance."
      },
      {
        "source": "n2317972.pdf",
        "page": 34,
        "content": "station may be paid a non-pensionable non-family service allowance.\n(c) The amount and conditions under which the allowance will be paid shall\nbe determined by the Secretary-General. When a duty station has been designated as"
      },
      {
        "source": "n2317972.pdf",
        "page": 6,
        "content": "added to provide a clearer basis for the Organization to make voluntary\ndeductions in accordance with the amounts reflected in family support court\norders in cases in which staff members have failed to meet those obligations."
      }
    ]
  },
  {
    "question": "How are retroactive payments handled by the Organization as per Rule 3.15?",
    "answer": "Retroactive payments are handled by the Organization according to Rule 3.15 in cases where staff members have not received their regular pay, through no fault of their own, in the amount due. The Organization shall make retroactive payments starting in the period following that in which the advance is made.",
    "context": "ST/SGB/2023/1/Rev.1\nRule 3.13\nNo-nfamily serv ice allowance\n(a) The non-family service allowance is an incentive for staff members to\nundertake assignments at non-family locations and recognizes the increased level of\nfinancial and psychological hardship incurred by involuntary separation from their\nfamilies, including additional service-related costs.\n(b) Staff in the Professional and higher categories and in the Field Service\ncategory and staff in the General Service category considered intern...",
    "source": "n2317972.pdf",
    "page": 34,
    "source_documents": [
      {
        "source": "n2317972.pdf",
        "page": 34,
        "content": "the period following that in which the advance is made.\nRule 3.15\nRetroactivit y of payments\n(a) The Organization shall make retroactive payments:\n(i) In cases where staff members have not received their regular pay, through\nno fault of their own, in the amount due; and"
      },
      {
        "source": "n2317972.pdf",
        "page": 34,
        "content": "time the advance is authorized, in consecutive pay periods, commencing not later than\nthe period following that in which the advance is made.\nRule 3.15\nRetroactivit y of payments\n(a) The Organization shall make retroactive payments:"
      },
      {
        "source": "n2317972.pdf",
        "page": 34,
        "content": "member is supported by a detailed justification in writing.\n(b) Salary advances shall be recovered at a constant rate as determined at the\ntime the advance is authorized, in consecutive pay periods, commencing not later than\nthe period following that in which the advance is made.\nRule 3.15"
      },
      {
        "source": "n2317972.pdf",
        "page": 34,
        "content": "(a) The Organization shall make retroactive payments:\n(i) In cases where staff members have not received their regular pay, through\nno fault of their own, in the amount due; and\n(ii) Upon separation from service, where final settlement of pay accounts"
      },
      {
        "source": "n2317972.pdf",
        "page": 78,
        "content": "(i) Written or oral reprimand;\n(ii) Recovery of monies owed to the Organization;\n(iii) Administrative leave with full or partial pay or without pay pending\ninvestigation and the disciplinary process pursuant to staff rule 10.4.\n76/115 23-12028"
      }
    ]
  },
  {
    "question": "Who determines the amount and conditions under which the non-family service allowance will be paid?",
    "answer": "The amount and conditions under which the non-family service allowance will be paid are determined by the Secretary-General.",
    "context": "ST/SGB/2023/1/Rev.1\nRule 3.13\nNo-nfamily serv ice allowance\n(a) The non-family service allowance is an incentive for staff members to\nundertake assignments at non-family locations and recognizes the increased level of\nfinancial and psychological hardship incurred by involuntary separation from their\nfamilies, including additional service-related costs.\n(b) Staff in the Professional and higher categories and in the Field Service\ncategory and staff in the General Service category considered intern...",
    "source": "n2317972.pdf",
    "page": 34,
    "source_documents": [
      {
        "source": "n2317972.pdf",
        "page": 34,
        "content": "ST/SGB/2023/1/Rev.1\nRule 3.13\nNo-nfamily serv ice allowance\n(a) The non-family service allowance is an incentive for staff members to\nundertake assignments at non-family locations and recognizes the increased level of\nfinancial and psychological hardship incurred by involuntary separation from their"
      },
      {
        "source": "n2317972.pdf",
        "page": 34,
        "content": "pursuant to staff rule 4.5 (c) who are appointed or reassigned to a non-family duty\nstation may be paid a non-pensionable non-family service allowance.\n(c) The amount and conditions under which the allowance will be paid shall"
      },
      {
        "source": "n2317972.pdf",
        "page": 34,
        "content": "(c) The amount and conditions under which the allowance will be paid shall\nbe determined by the Secretary-General. When a duty station has been designated as\nnon-family, the presence of eligible family members of the staff member shall not be"
      },
      {
        "source": "n2317972.pdf",
        "page": 29,
        "content": "categories and in the Field Service category recognized as a single parent shall\nreceive a single parent allowance in the amount of 6 per cent of net base salary\nplus post adjustment in respect of the first dependent child, under conditions"
      },
      {
        "source": "n2317972.pdf",
        "page": 29,
        "content": "members in the General Service and related categories shall receive a\ndependency allowance with respect to a secondary dependant when local\nconditions and/or the practices of comparator employers call for the\nestablishment of such an allowance, under conditions established by the\nSecretary-General."
      }
    ]
  },
  {
    "question": "How does Rule 3.17 address the recruitment of experts in highly specialized fields?",
    "answer": "Rule 3.17 addresses the recruitment of experts in highly specialized fields by allowing for an incentive payment to be made for the recruitment of such personnel when the Organization is unable to attract suitably qualified individuals. The conditions for this incentive payment are to be prescribed by the Secretary-General.",
    "context": "ST/SGB/2023/1/Rev.1\nRule 3.16\nDeductions an d contributions\n(a) Staff assessment shall be deducted, each pay period, from the total\npayments due to each staff member, at the rates and subject to the conditions\nprescribed in staff regulation 3.3.\n(b) Contributions of staff members who are participating in the United Nations\nJoint Staff Pension Fund shall be deducted, each pay period, from the total payments\ndue to them.\n(c) The Organization shall take voluntary action to provide effective relief ...",
    "source": "n2317972.pdf",
    "page": 35,
    "source_documents": [
      {
        "source": "n2317972.pdf",
        "page": 35,
        "content": "services.\nRule 3.17\nRecruitmen t incentive\nAn incentive payment for the recruitment of experts in highly specialized fields\nin instances in which the Organization was unable to attract suitably qualified\npersonnel may be made under conditions to be prescribed by the Secretary-General."
      },
      {
        "source": "n2317972.pdf",
        "page": 35,
        "content": "such deduction, by notice to the Secretary-General;\n(vi) Facilities and service fees applied for use of United Nations premises or\nservices.\nRule 3.17\nRecruitmen t incentive\nAn incentive payment for the recruitment of experts in highly specialized fields"
      },
      {
        "source": "n2317972.pdf",
        "page": 41,
        "content": "General in respect of the following:\n(i) Appointment to P-1 and P-2 posts that are subject to the system of\ndesirable ranges and to posts in the Professional category requiring special\nlanguage competence at the United Nations Secretariat shall be made\nexclusively through competitive examination;"
      },
      {
        "source": "n2317972.pdf",
        "page": 41,
        "content": "desirable ranges and to posts in the Professional category requiring special\nlanguage competence at the United Nations Secretariat shall be made\nexclusively through competitive examination;\n(ii) Recruitment to the Professional category at the United Nations Secretariat"
      },
      {
        "source": "n2317972.pdf",
        "page": 6,
        "content": "on the recruitment of National Professional Officers, reflects the increased\nflexibility in the use of National Professional Officers in accordance with the\nguidelines approved by the General Assembly in its resolution 72/255."
      }
    ]
  },
  {
    "question": "Under what conditions can the Organization make deductions for unpaid family support obligations?",
    "answer": "The Organization can make deductions for unpaid family support obligations in cases where staff members have failed to meet those obligations as reflected in final court orders. The deductions can be made from salaries and other emoluments under conditions established by the Secretary-General.",
    "context": "ST/SGB/2023/1/Rev.1\nRule 3.16\nDeductions an d contributions\n(a) Staff assessment shall be deducted, each pay period, from the total\npayments due to each staff member, at the rates and subject to the conditions\nprescribed in staff regulation 3.3.\n(b) Contributions of staff members who are participating in the United Nations\nJoint Staff Pension Fund shall be deducted, each pay period, from the total payments\ndue to them.\n(c) The Organization shall take voluntary action to provide effective relief ...",
    "source": "n2317972.pdf",
    "page": 35,
    "source_documents": [
      {
        "source": "n2317972.pdf",
        "page": 6,
        "content": "added to provide a clearer basis for the Organization to make voluntary\ndeductions in accordance with the amounts reflected in family support court\norders in cases in which staff members have failed to meet those obligations."
      },
      {
        "source": "n2317972.pdf",
        "page": 35,
        "content": "unpaid family support obligations pursuant to final court orders by making deductions\nfrom salaries and other emoluments in respect of the amounts reflected in such final\ncourt orders, under conditions established by the Secretary-General."
      },
      {
        "source": "n2317972.pdf",
        "page": 6,
        "content": "deductions in accordance with the amounts reflected in family support court\norders in cases in which staff members have failed to meet those obligations.\n1.7 Provisional rule 4.4 (Staff in posts subject to local recruitment), paragraph (b),"
      },
      {
        "source": "n2317972.pdf",
        "page": 35,
        "content": "due to them.\n(c) The Organization shall take voluntary action to provide effective relief for\nunpaid family support obligations pursuant to final court orders by making deductions\nfrom salaries and other emoluments in respect of the amounts reflected in such final"
      },
      {
        "source": "n2317972.pdf",
        "page": 35,
        "content": "Joint Staff Pension Fund shall be deducted, each pay period, from the total payments\ndue to them.\n(c) The Organization shall take voluntary action to provide effective relief for\nunpaid family support obligations pursuant to final court orders by making deductions"
      }
    ]
  },
  {
    "question": "What are the different types of deductions that can be made from staff members' payments according to Rule 3.16?",
    "answer": "According to Rule 3.16, deductions that can be made from staff members' payments include staff assessments and contributions as prescribed in staff regulation 3.3. Additionally, voluntary deductions can be made in accordance with amounts reflected in family support court orders in cases where staff members have failed to meet those obligations.",
    "context": "ST/SGB/2023/1/Rev.1\nRule 3.16\nDeductions an d contributions\n(a) Staff assessment shall be deducted, each pay period, from the total\npayments due to each staff member, at the rates and subject to the conditions\nprescribed in staff regulation 3.3.\n(b) Contributions of staff members who are participating in the United Nations\nJoint Staff Pension Fund shall be deducted, each pay period, from the total payments\ndue to them.\n(c) The Organization shall take voluntary action to provide effective relief ...",
    "source": "n2317972.pdf",
    "page": 35,
    "source_documents": [
      {
        "source": "n2317972.pdf",
        "page": 35,
        "content": "ST/SGB/2023/1/Rev.1\nRule 3.16\nDeductions an d contributions\n(a) Staff assessment shall be deducted, each pay period, from the total\npayments due to each staff member, at the rates and subject to the conditions\nprescribed in staff regulation 3.3."
      },
      {
        "source": "n2317972.pdf",
        "page": 6,
        "content": "additional consistency and clarity in the Staff Rules.\n1.6 New provisional rule 3.16 (Deductions and contributions), paragraph (c), was\nadded to provide a clearer basis for the Organization to make voluntary\ndeductions in accordance with the amounts reflected in family support court"
      },
      {
        "source": "n2317972.pdf",
        "page": 35,
        "content": "(a) Staff assessment shall be deducted, each pay period, from the total\npayments due to each staff member, at the rates and subject to the conditions\nprescribed in staff regulation 3.3.\n(b) Contributions of staff members who are participating in the United Nations"
      },
      {
        "source": "n2317972.pdf",
        "page": 6,
        "content": "deductions in accordance with the amounts reflected in family support court\norders in cases in which staff members have failed to meet those obligations.\n1.7 Provisional rule 4.4 (Staff in posts subject to local recruitment), paragraph (b),"
      },
      {
        "source": "n2317972.pdf",
        "page": 107,
        "content": "in relation to the claim shall be terminated and all payments made in relation to the\nclaim shall be subject to recovery.\n(b) When made by staff members, such claims may constitute misconduct\nunder chapter X of the Staff Rules, and may result in disciplinary measures.\n23-12028 105/115"
      }
    ]
  },
  {
    "question": "What is the significance of the presence of eligible family members at a non-family duty station as stated in the text?",
    "answer": "The presence of eligible family members at a non-family duty station is significant because it determines whether staff members and their families are eligible for official travel benefits. In the context provided, staff members must not be assigned to a non-family duty station to qualify for official travel benefits for their eligible family members. This condition ensures that staff members and their families are supported in their relocation to duty stations where family support systems are available.",
    "context": "ST/SGB/2023/1/Rev.1\nRule 3.13\nNo-nfamily serv ice allowance\n(a) The non-family service allowance is an incentive for staff members to\nundertake assignments at non-family locations and recognizes the increased level of\nfinancial and psychological hardship incurred by involuntary separation from their\nfamilies, including additional service-related costs.\n(b) Staff in the Professional and higher categories and in the Field Service\ncategory and staff in the General Service category considered intern...",
    "source": "n2317972.pdf",
    "page": 34,
    "source_documents": [
      {
        "source": "n2317972.pdf",
        "page": 54,
        "content": "b. Their eligible family members, provided that the staff members hold\na fixed-term or continuing appointment and are not assigned to a non-family\nduty station, and their services at the new duty station are expected to continue"
      },
      {
        "source": "n2317972.pdf",
        "page": 54,
        "content": "b. Their eligible family members, provided that the staff members hold\na fixed-term or continuing appointment and are not assigned to a non-family\nduty station, and their services are expected to continue for more than six\nmonths beyond the date on which the travel of the eligible family members"
      },
      {
        "source": "n2317972.pdf",
        "page": 55,
        "content": "b. Their eligible family members, provided that the staff members hold\na fixed-term or continuing appointment, were not assigned to a non-family duty\nstation and had completed at least one year of continuous service.\n(b) Eligible family members, for the purposes of official travel, shall be"
      },
      {
        "source": "n2317972.pdf",
        "page": 55,
        "content": "station and had completed at least one year of continuous service.\n(b) Eligible family members, for the purposes of official travel, shall be\ndeemed to comprise a spouse and those children recognized as dependants under staff\nrule 3.5 (a) (iii)."
      },
      {
        "source": "n2317972.pdf",
        "page": 54,
        "content": "a fixed-term or continuing appointment and are not assigned to a non-family\nduty station, and their services at the new duty station are expected to continue\nfor more than six months beyond the date on which the travel of the eligible\nfamily members commences;"
      }
    ]
  },
  {
    "question": "What is the process for determining the amount of grant a staff member may be entitled to for education purposes?",
    "answer": "The amount of grant a staff member may be entitled to for education purposes is determined based on the claim amount bracket in effect for the school year. The reimbursement rate varies depending on the claim amount bracket within which the total expenses fall. The specific amounts and percentages can be found in the Education grant entitlements document provided in the context.",
    "context": "ST/SGB/2023/1/Rev.1\nAmount o f grant\n(e) The amount to which a staff member may be entitled under the grant is set\nout in appendix B to the present Rules.\n(f) The amount of the grant to be paid when the staff member’s period of\nservice or the child’s school attendance does not cover the full school year shall be\nprorated under conditions established by the Secretary-General. If a staff member in\nreceipt of the education grant dies while in service during the school year, the full\nentitlement for...",
    "source": "n2317972.pdf",
    "page": 32,
    "source_documents": [
      {
        "source": "n2317972.pdf",
        "page": 32,
        "content": "(e) The amount to which a staff member may be entitled under the grant is set\nout in appendix B to the present Rules.\n(f) The amount of the grant to be paid when the staff member’s period of\nservice or the child’s school attendance does not cover the full school year shall be"
      },
      {
        "source": "n2317972.pdf",
        "page": 101,
        "content": "Education grant entitlements in effect as of the school year in progress on\n1 Janua0r2 y2 2\nClaim amount bracket Reimbursement rate\n(United States dollars) (percentage)\n0–13 224 86\n13 225–19 836 81\n19 837–26 448 76\n26 449–33 060 71\n33 061–39 672 66\n39 673–46 284 61\n46 285 and above –"
      },
      {
        "source": "n2317972.pdf",
        "page": 32,
        "content": "ST/SGB/2023/1/Rev.1\nAmount o f grant\n(e) The amount to which a staff member may be entitled under the grant is set\nout in appendix B to the present Rules.\n(f) The amount of the grant to be paid when the staff member’s period of"
      },
      {
        "source": "n2317972.pdf",
        "page": 32,
        "content": "prorated under conditions established by the Secretary-General. If a staff member in\nreceipt of the education grant dies while in service during the school year, the full\nentitlement for that particular school year shall be granted.\nTra vel"
      },
      {
        "source": "n2317972.pdf",
        "page": 61,
        "content": "family visit or education grant may be reimbursed up to a maximum amount\nestablished by the Secretary-General.\nUnaccoemdp asnhiipments for staff holding a temporary appointment or staff\nassigned for l ess than one year\n(h) (i) A staff member holding a temporary appointment may be reimbursed"
      }
    ]
  },
  {
    "question": "Under what conditions can a staff member be granted a special education grant for a child with a disability?",
    "answer": "A staff member can be granted a special education grant for a child with a disability if the child is unable to attend a normal educational institution due to physical or mental disability and requires special teaching or training. Additionally, the grant is available to staff members in all categories, whether serving in their home country or not, provided they hold a fixed-term or a continuing appointment. The decision is also influenced by the distance from the area where the staff member is serving and if no suitable school is available in that area, as determined by the Secretary-General.",
    "context": "ST/SGB/2023/1/Rev.1\nAmount o f grant\n(e) The amount to which a staff member may be entitled under the grant is set\nout in appendix B to the present Rules.\n(f) The amount of the grant to be paid when the staff member’s period of\nservice or the child’s school attendance does not cover the full school year shall be\nprorated under conditions established by the Secretary-General. If a staff member in\nreceipt of the education grant dies while in service during the school year, the full\nentitlement for...",
    "source": "n2317972.pdf",
    "page": 32,
    "source_documents": [
      {
        "source": "n2317972.pdf",
        "page": 32,
        "content": "(h) A special education grant for a child with a disability shall be available to\nstaff members in all categories, whether serving in their home country or not,\nprovided that they hold a fixed-term or a continuing appointment. The amount to"
      },
      {
        "source": "n2317972.pdf",
        "page": 101,
        "content": "distance from the area where the staff member is serving and, in the opinion of the\nSecretary-General, no school in that area would be suitable for the child.\nSpecial edu cation grant\n(d) Under conditions established by the Secretary-General, admissible"
      },
      {
        "source": "n2317972.pdf",
        "page": 32,
        "content": "child is not possible, one outward and return journey by the staff member or spouse\nmay be authorized in lieu of travel by the child, under conditions established by the\nSecretary-General.\nSpecial education grant for a child with a disability"
      },
      {
        "source": "n2317972.pdf",
        "page": 32,
        "content": "Secretary-General.\nSpecial education grant for a child with a disability\n(h) A special education grant for a child with a disability shall be available to\nstaff members in all categories, whether serving in their home country or not,"
      },
      {
        "source": "n2317972.pdf",
        "page": 23,
        "content": "which an education grant shall be available to a staff member whose child is unable,\nby reason of physical or mental disability, to attend a normal educational institution\nand therefore requires special teaching or training to prepare him or her for full"
      }
    ]
  },
  {
    "question": "What is the maximum percentage that the recruitment incentive payment can be of the annual net base salary?",
    "answer": "The maximum percentage that the recruitment incentive payment can be of the annual net base salary is 25%.",
    "context": "ST/SGB/2023/1/Rev.1\nRule 3.16\nDeductions an d contributions\n(a) Staff assessment shall be deducted, each pay period, from the total\npayments due to each staff member, at the rates and subject to the conditions\nprescribed in staff regulation 3.3.\n(b) Contributions of staff members who are participating in the United Nations\nJoint Staff Pension Fund shall be deducted, each pay period, from the total payments\ndue to them.\n(c) The Organization shall take voluntary action to provide effective relief ...",
    "source": "n2317972.pdf",
    "page": 35,
    "source_documents": [
      {
        "source": "n2317972.pdf",
        "page": 35,
        "content": "personnel may be made under conditions to be prescribed by the Secretary-General.\nThe amount of the recruitment incentive shall not exceed 25 per cent of the annual\nnet base salary for each year of the agreed appointment.\n23-12028 33/115"
      },
      {
        "source": "n2317972.pdf",
        "page": 24,
        "content": "Assessable payments gross base salaries\n(United States dollars) (percentage)\nFirst 50,000 per year . . . . . . . . . . . . . . . . . . . . . . . . . . 17\nNext 50,000 per year . . . . . . . . . . . . . . . . . . . . . . . . . . 24"
      },
      {
        "source": "n2317972.pdf",
        "page": 24,
        "content": "Total assessable payments pensionable remuneration and pensions\n(United States dollars) (percentage)\nFirst 20,000 per year . . . . . . . . . . . . . . . . . . . . . . . . . . 19\nNext 20,000 per year . . . . . . . . . . . . . . . . . . . . . . . . . . 23"
      },
      {
        "source": "n2317972.pdf",
        "page": 24,
        "content": "Total assessable payments pensionable remuneration and pensions\n(United States dollars) (percentage)\nFirst 20,000 per year . . . . . . . . . . . . . . . . . . . . . . . . . . 19\nNext 20,000 per year . . . . . . . . . . . . . . . . . . . . . . . . . . 23"
      },
      {
        "source": "n2317972.pdf",
        "page": 35,
        "content": "in instances in which the Organization was unable to attract suitably qualified\npersonnel may be made under conditions to be prescribed by the Secretary-General.\nThe amount of the recruitment incentive shall not exceed 25 per cent of the annual"
      }
    ]
  },
  {
    "question": "Can staff members withhold their consent to deductions for contributions to staff representative bodies or other entities, as mentioned in Rule 3.16?",
    "answer": "Yes, staff members have the opportunity to withhold their consent to deductions for contributions to staff representative bodies or other entities, as mentioned in Rule 3.16.",
    "context": "ST/SGB/2023/1/Rev.1\nRule 3.16\nDeductions an d contributions\n(a) Staff assessment shall be deducted, each pay period, from the total\npayments due to each staff member, at the rates and subject to the conditions\nprescribed in staff regulation 3.3.\n(b) Contributions of staff members who are participating in the United Nations\nJoint Staff Pension Fund shall be deducted, each pay period, from the total payments\ndue to them.\n(c) The Organization shall take voluntary action to provide effective relief ...",
    "source": "n2317972.pdf",
    "page": 35,
    "source_documents": [
      {
        "source": "n2317972.pdf",
        "page": 35,
        "content": "(v) Contributions to a staff representative body established pursuant to staff\nregulation 8.1 or any other United Nations entity, provided that staff members\nhave the opportunity to withhold their consent to or at any time to discontinue\nsuch deduction, by notice to the Secretary-General;"
      },
      {
        "source": "n2317972.pdf",
        "page": 6,
        "content": "additional consistency and clarity in the Staff Rules.\n1.6 New provisional rule 3.16 (Deductions and contributions), paragraph (c), was\nadded to provide a clearer basis for the Organization to make voluntary\ndeductions in accordance with the amounts reflected in family support court"
      },
      {
        "source": "n2317972.pdf",
        "page": 66,
        "content": "(e) No staff member shall threaten, retaliate against or attempt to retaliate\nagainst any staff representative exercising staff representative functions under the\npresent chapter.\n(f) The staff representative bodies shall be entitled to effective participation,"
      },
      {
        "source": "n2317972.pdf",
        "page": 18,
        "content": "contrary to staff regulation 1.2 (h). The payment of normal financial contributions to\na political party shall not be construed as an activity inconsistent with the principles\nset out in staff regulation 1.2 (h).\n(t) The Secretary-General shall establish procedures whereby staff may seek"
      },
      {
        "source": "n2317972.pdf",
        "page": 18,
        "content": "membership does not entail action, or an obligation to take action, by the staff member\ncontrary to staff regulation 1.2 (h). The payment of normal financial contributions to\na political party shall not be construed as an activity inconsistent with the principles"
      }
    ]
  },
  {
    "question": "Can staff members in all categories, regardless of their location, apply for a special education grant for their child with a disability?",
    "answer": "Yes, staff members in all categories, whether serving in their home country or not, can apply for a special education grant for their child with a disability, provided that they hold a fixed-term or a continuing appointment.",
    "context": "ST/SGB/2023/1/Rev.1\nAmount o f grant\n(e) The amount to which a staff member may be entitled under the grant is set\nout in appendix B to the present Rules.\n(f) The amount of the grant to be paid when the staff member’s period of\nservice or the child’s school attendance does not cover the full school year shall be\nprorated under conditions established by the Secretary-General. If a staff member in\nreceipt of the education grant dies while in service during the school year, the full\nentitlement for...",
    "source": "n2317972.pdf",
    "page": 32,
    "source_documents": [
      {
        "source": "n2317972.pdf",
        "page": 32,
        "content": "(h) A special education grant for a child with a disability shall be available to\nstaff members in all categories, whether serving in their home country or not,\nprovided that they hold a fixed-term or a continuing appointment. The amount to"
      },
      {
        "source": "n2317972.pdf",
        "page": 32,
        "content": "Secretary-General.\nSpecial education grant for a child with a disability\n(h) A special education grant for a child with a disability shall be available to\nstaff members in all categories, whether serving in their home country or not,"
      },
      {
        "source": "n2317972.pdf",
        "page": 32,
        "content": "child is not possible, one outward and return journey by the staff member or spouse\nmay be authorized in lieu of travel by the child, under conditions established by the\nSecretary-General.\nSpecial education grant for a child with a disability"
      },
      {
        "source": "n2317972.pdf",
        "page": 101,
        "content": "distance from the area where the staff member is serving and, in the opinion of the\nSecretary-General, no school in that area would be suitable for the child.\nSpecial edu cation grant\n(d) Under conditions established by the Secretary-General, admissible"
      },
      {
        "source": "n2317972.pdf",
        "page": 23,
        "content": "(d) The Secretary-General shall also establish terms and conditions under\nwhich an education grant shall be available to a staff member whose child is unable,\nby reason of physical or mental disability, to attend a normal educational institution"
      }
    ]
  },
  {
    "question": "What are the conditions under which a staff member may be granted a special post allowance for assuming higher-level duties temporarily?",
    "answer": "A staff member may be granted a special post allowance for assuming higher-level duties temporarily under the following conditions:\n\n1. The staff member is expected to assume the duties and responsibilities of a post at a clearly recognizable higher level than their own for a temporary period exceeding three months.\n2. This allowance may be granted in exceptional cases from the beginning of the fourth month of service at the higher level.\n3. If the appointment requires the staff member to serve in a post classified more than one level above their own, the allowance may be paid immediately when the staff member assumes the higher duties and responsibilities.\n4. The amount of the special post allowance shall be equivalent to the salary increase the staff member would have received if they had been promoted to the next higher level.",
    "context": "ST/SGB/2023/1/Rev.1\nAmount o f grant\n(e) The amount to which a staff member may be entitled under the grant is set\nout in appendix B to the present Rules.\n(f) The amount of the grant to be paid when the staff member’s period of\nservice or the child’s school attendance does not cover the full school year shall be\nprorated under conditions established by the Secretary-General. If a staff member in\nreceipt of the education grant dies while in service during the school year, the full\nentitlement for...",
    "source": "n2317972.pdf",
    "page": 32,
    "source_documents": [
      {
        "source": "n2317972.pdf",
        "page": 32,
        "content": "established by the Secretary-General.\nRule 3.10\nSpecial po st allowance\n(a) Staff members shall be expected to assume temporarily, as a normal part\nof their customary work and without extra compensation, the duties and\nresponsibilities of higher-level posts."
      },
      {
        "source": "n2317972.pdf",
        "page": 32,
        "content": "and responsibilities of a post at a clearly recognizable higher level than their own for\na temporary period exceeding three months may, in exceptional cases, be granted a\nnon-pensionable special post allowance from the beginning of the fourth month of\nservice at the higher level."
      },
      {
        "source": "n2317972.pdf",
        "page": 32,
        "content": "appointment is required to serve in a post which is classified more than one level\nabove the staff member’s level, the allowance may be paid immediately when the staff\nmember assumes the higher duties and responsibilities.\n30/115 23-12028"
      },
      {
        "source": "n2317972.pdf",
        "page": 32,
        "content": "a temporary period exceeding three months may, in exceptional cases, be granted a\nnon-pensionable special post allowance from the beginning of the fourth month of\nservice at the higher level.\n(c) In the case of a staff member holding a fixed-term or continuing"
      },
      {
        "source": "n2317972.pdf",
        "page": 33,
        "content": "ST/SGB/2023/1/Rev.1\n(d) The amount of the special post allowance shall be equivalent to the salary\nincrease (including post adjustment and dependency allowances, if any) which the\nstaff member would have received had the staff member been promoted to the next\nhigher level.\nRule 3.11"
      }
    ]
  },
  {
    "question": "What is the role of the Secretary-General in the appointment and promotion of staff members according to the text?",
    "answer": "The role of the Secretary-General in the appointment and promotion of staff members is to have the power of appointment, ensuring that the highest standards of efficiency, competence, and integrity are maintained in the selection process. The Secretary-General is responsible for appointing staff members and ensuring that the conditions of service prioritize securing staff of the highest standards.",
    "context": "ST/SGB/2023/1/Rev.1\nArtic le IV\nAppointment a nd promotion\nRegulat ion 4.1\nAs stated in Article 101 of the Charter, the power of appointment of staff members\nrests with the Secretary-General. Upon appointment, each staff member, including a staff\nmember on secondment from government service, shall receive a letter of appointment in\naccordance with the provisions of annex II to the present Regulations and signed by the\nSecretary-General or by an official in the name of the Secretary-General.\nRegu...",
    "source": "n2317972.pdf",
    "page": 36,
    "source_documents": [
      {
        "source": "n2317972.pdf",
        "page": 36,
        "content": "ST/SGB/2023/1/Rev.1\nArtic le IV\nAppointment a nd promotion\nRegulat ion 4.1\nAs stated in Article 101 of the Charter, the power of appointment of staff members\nrests with the Secretary-General. Upon appointment, each staff member, including a staff"
      },
      {
        "source": "n2317972.pdf",
        "page": 36,
        "content": "Secretary-General or by an official in the name of the Secretary-General.\nRegulat ion 4.2\nThe paramount consideration in the appointment, transfer or promotion of the\nstaff shall be the necessity of securing the highest standards of efficiency, competence"
      },
      {
        "source": "n2317972.pdf",
        "page": 36,
        "content": "Regulat ion 4.1\nAs stated in Article 101 of the Charter, the power of appointment of staff members\nrests with the Secretary-General. Upon appointment, each staff member, including a staff\nmember on secondment from government service, shall receive a letter of appointment in"
      },
      {
        "source": "n2317972.pdf",
        "page": 11,
        "content": "whose employment and contractual relationship are defined by a letter of appointment\nsubject to regulations promulgated by the General Assembly pursuant to Article 101,\nparagraph 1, of the Charter. The Secretary-General, as the chief administrative officer,"
      },
      {
        "source": "n2317972.pdf",
        "page": 12,
        "content": "(d) The Secretary-General shall seek to ensure that the paramount\nconsideration in the determination of the conditions of service shall be the necessity\nof securing staff of the highest standards of efficiency, competence and integrity;"
      }
    ]
  },
  {
    "question": "How are education grant claims supposed to be submitted by staff members?",
    "answer": "Education grant claims are supposed to be submitted in accordance with conditions established by the Secretary-General, as outlined in Rule 3.10. The specific process for submitting these claims would be detailed in the conditions set by the Secretary-General.",
    "context": "ST/SGB/2023/1/Rev.1\nAmount o f grant\n(e) The amount to which a staff member may be entitled under the grant is set\nout in appendix B to the present Rules.\n(f) The amount of the grant to be paid when the staff member’s period of\nservice or the child’s school attendance does not cover the full school year shall be\nprorated under conditions established by the Secretary-General. If a staff member in\nreceipt of the education grant dies while in service during the school year, the full\nentitlement for...",
    "source": "n2317972.pdf",
    "page": 32,
    "source_documents": [
      {
        "source": "n2317972.pdf",
        "page": 32,
        "content": "which a staff member is entitled under the grant is set out in appendix B to the present\nRules, under conditions established by the Secretary-General.\nClai ms\n(i) Education grant claims shall be made in accordance with conditions\nestablished by the Secretary-General.\nRule 3.10"
      },
      {
        "source": "n2317972.pdf",
        "page": 32,
        "content": "Rules, under conditions established by the Secretary-General.\nClai ms\n(i) Education grant claims shall be made in accordance with conditions\nestablished by the Secretary-General.\nRule 3.10\nSpecial po st allowance\n(a) Staff members shall be expected to assume temporarily, as a normal part"
      },
      {
        "source": "n2317972.pdf",
        "page": 61,
        "content": "family visit or education grant may be reimbursed up to a maximum amount\nestablished by the Secretary-General.\nUnaccoemdp asnhiipments for staff holding a temporary appointment or staff\nassigned for l ess than one year\n(h) (i) A staff member holding a temporary appointment may be reimbursed"
      },
      {
        "source": "n2317972.pdf",
        "page": 32,
        "content": "receipt of the education grant dies while in service during the school year, the full\nentitlement for that particular school year shall be granted.\nTra vel\n(g) When a staff member is entitled to boarding assistance in respect of a child"
      },
      {
        "source": "n2317972.pdf",
        "page": 32,
        "content": "prorated under conditions established by the Secretary-General. If a staff member in\nreceipt of the education grant dies while in service during the school year, the full\nentitlement for that particular school year shall be granted.\nTra vel"
      }
    ]
  },
  {
    "question": "What criteria are considered for the appointment of Under-Secretaries-General and Assistant Secretaries-General?",
    "answer": "The criteria considered for the appointment of Under-Secretaries-General and Assistant Secretaries-General include meeting the requirements of Article 101, paragraph 3, of the Charter as well as the requirements of the post. Additionally, the paramount consideration is securing staff of the highest standards of efficiency, competence, and integrity in the service of the United Nations.",
    "context": "ST/SGB/2023/1/Rev.1\nArtic le IV\nAppointment a nd promotion\nRegulat ion 4.1\nAs stated in Article 101 of the Charter, the power of appointment of staff members\nrests with the Secretary-General. Upon appointment, each staff member, including a staff\nmember on secondment from government service, shall receive a letter of appointment in\naccordance with the provisions of annex II to the present Regulations and signed by the\nSecretary-General or by an official in the name of the Secretary-General.\nRegu...",
    "source": "n2317972.pdf",
    "page": 36,
    "source_documents": [
      {
        "source": "n2317972.pdf",
        "page": 36,
        "content": "Charter as well as the requirements of the post.\nRegulat ion 4.5\n(a) Appointment of Under-Secretaries-General and of Assistant Secretaries-\nGeneral shall normally be for a period of up to five years, subject to prolongation or"
      },
      {
        "source": "n2317972.pdf",
        "page": 36,
        "content": "no internal candidate meets the requirements of Article 101, paragraph 3, of the\nCharter as well as the requirements of the post.\nRegulat ion 4.5\n(a) Appointment of Under-Secretaries-General and of Assistant Secretaries-"
      },
      {
        "source": "n2317972.pdf",
        "page": 36,
        "content": "Regulat ion 4.5\n(a) Appointment of Under-Secretaries-General and of Assistant Secretaries-\nGeneral shall normally be for a period of up to five years, subject to prolongation or\nrenewal. Other staff members shall be granted either a temporary, fixed-term or"
      },
      {
        "source": "n2317972.pdf",
        "page": 12,
        "content": "(d) The Secretary-General shall seek to ensure that the paramount\nconsideration in the determination of the conditions of service shall be the necessity\nof securing staff of the highest standards of efficiency, competence and integrity;"
      },
      {
        "source": "n2317972.pdf",
        "page": 36,
        "content": "in the service of the United Nations. This consideration shall also apply, on a\nreciprocal basis, to the specialized agencies brought into relationship with the United\nNations. The Secretary-General may limit eligibility to apply for vacant posts to"
      }
    ]
  },
  {
    "question": "How does the text emphasize the importance of efficiency, competence, and integrity in the selection process?",
    "answer": "The text emphasizes the importance of efficiency, competence, and integrity in the selection process by stating that these qualities are the paramount considerations in the appointment, transfer, or promotion of staff. It highlights that the highest standards of efficiency, competence, and integrity must be secured in the selection process. Additionally, it mentions that staff members should be retained based on their relative competence, integrity, and length of service, with a preference given to those holding continuing appointments or recruited through competitive examinations for a career.",
    "context": "ST/SGB/2023/1/Rev.1\nArtic le IV\nAppointment a nd promotion\nRegulat ion 4.1\nAs stated in Article 101 of the Charter, the power of appointment of staff members\nrests with the Secretary-General. Upon appointment, each staff member, including a staff\nmember on secondment from government service, shall receive a letter of appointment in\naccordance with the provisions of annex II to the present Regulations and signed by the\nSecretary-General or by an official in the name of the Secretary-General.\nRegu...",
    "source": "n2317972.pdf",
    "page": 36,
    "source_documents": [
      {
        "source": "n2317972.pdf",
        "page": 8,
        "content": "3. The paramount consideration in the employment of the staff and in the\ndetermination of the conditions of service shall be the necessity of securing the\nhighest standards of efficiency, competence, and integrity. Due regard shall be paid"
      },
      {
        "source": "n2317972.pdf",
        "page": 36,
        "content": "Regulat ion 4.2\nThe paramount consideration in the appointment, transfer or promotion of the\nstaff shall be the necessity of securing the highest standards of efficiency, competence\nand integrity. Due regard shall be paid to the importance of recruiting the staff on as"
      },
      {
        "source": "n2317972.pdf",
        "page": 70,
        "content": "services can be effectively utilized, provided that due regard shall be given in all cases\nto relative competence, integrity and length of service, staff members shall be retained\nin the following order of preference:\n(i) Staff members holding continuing appointments;"
      },
      {
        "source": "n2317972.pdf",
        "page": 70,
        "content": "to relative competence, integrity and length of service, staff members shall be retained\nin the following order of preference:\n(i) Staff members holding continuing appointments;\n(ii) Staff members recruited through competitive examinations for a career"
      },
      {
        "source": "n2317972.pdf",
        "page": 8,
        "content": "determination of the conditions of service shall be the necessity of securing the\nhighest standards of efficiency, competence, and integrity. Due regard shall be paid\nto the importance of recruiting the staff on as wide a geographical basis as possible.\nArtic le 105"
      }
    ]
  },
  {
    "question": "In what way does the text address the issue of diversity in the recruitment process?",
    "answer": "The text addresses the issue of diversity in the recruitment process by emphasizing the importance of recruiting staff on as wide a geographical basis as possible and by stating that selection of staff members should be made without distinction as to race, sex, or religion. The regulations aim to ensure that recruitment is inclusive and diverse, promoting equal opportunities for individuals from different backgrounds.",
    "context": "ST/SGB/2023/1/Rev.1\nArtic le IV\nAppointment a nd promotion\nRegulat ion 4.1\nAs stated in Article 101 of the Charter, the power of appointment of staff members\nrests with the Secretary-General. Upon appointment, each staff member, including a staff\nmember on secondment from government service, shall receive a letter of appointment in\naccordance with the provisions of annex II to the present Regulations and signed by the\nSecretary-General or by an official in the name of the Secretary-General.\nRegu...",
    "source": "n2317972.pdf",
    "page": 36,
    "source_documents": [
      {
        "source": "n2317972.pdf",
        "page": 6,
        "content": "on the recruitment of National Professional Officers, reflects the increased\nflexibility in the use of National Professional Officers in accordance with the\nguidelines approved by the General Assembly in its resolution 72/255."
      },
      {
        "source": "n2317972.pdf",
        "page": 36,
        "content": "Regulat ion 4.4\nSubject to the provisions of Article 101, paragraph 3, of the Charter, and without\nprejudice to the recruitment of fresh talent at all levels, the fullest regard shall be had,\nin filling vacancies, to the requisite qualifications and experience of persons already"
      },
      {
        "source": "n2317972.pdf",
        "page": 36,
        "content": "and integrity. Due regard shall be paid to the importance of recruiting the staff on as\nwide a geographical basis as possible.\nRegulat ion 4.3\nIn accordance with the principles of the Charter, selection of staff members shall"
      },
      {
        "source": "n2317972.pdf",
        "page": 36,
        "content": "wide a geographical basis as possible.\nRegulat ion 4.3\nIn accordance with the principles of the Charter, selection of staff members shall\nbe made without distinction as to race, sex or religion. So far as practicable, selection\nshall be made on a competitive basis.\nRegulat ion 4.4"
      },
      {
        "source": "n2317972.pdf",
        "page": 36,
        "content": "prejudice to the recruitment of fresh talent at all levels, the fullest regard shall be had,\nin filling vacancies, to the requisite qualifications and experience of persons already\nin the service of the United Nations. This consideration shall also apply, on a"
      }
    ]
  },
  {
    "question": "How is the effective date of appointment determined for staff members?",
    "answer": "The effective date of appointment for staff members is determined as the date on which they enter into official travel status to assume their duties or, if no travel is involved, the date on which they report for duty.",
    "context": "ST/SGB/2023/1/Rev.1\nChapt er IV\nAppointment a nd promotion\nRule 4.1\nLetter of appointment\nThe letter of appointment issued to every staff member contains expressly or by\nreference all the terms and conditions of employment. All contractual entitlements of\nstaff members are strictly limited to those contained expressly or by reference in their\nletters of appointment.\nRule 4.2\nEffective dat e of appointment\nThe effective date of appointment shall be the date on which staff members enter\ninto offic...",
    "source": "n2317972.pdf",
    "page": 37,
    "source_documents": [
      {
        "source": "n2317972.pdf",
        "page": 37,
        "content": "letters of appointment.\nRule 4.2\nEffective dat e of appointment\nThe effective date of appointment shall be the date on which staff members enter\ninto official travel status to assume their duties or, if no travel is involved, the date\non which they report for duty.\nRule 4.3\nNatio nality"
      },
      {
        "source": "n2317972.pdf",
        "page": 37,
        "content": "staff members are strictly limited to those contained expressly or by reference in their\nletters of appointment.\nRule 4.2\nEffective dat e of appointment\nThe effective date of appointment shall be the date on which staff members enter"
      },
      {
        "source": "n2317972.pdf",
        "page": 93,
        "content": "(iii) The date at which the staff member is required to enter upon his or her\nduties;\n(iv) The period of appointment, the notice required to terminate it and the\nperiod of probation, if any;\n(v) The category, level, commencing rate of salary and, if increments are"
      },
      {
        "source": "n2317972.pdf",
        "page": 93,
        "content": "time;\n(ii) The nature of the appointment;\n(iii) The date at which the staff member is required to enter upon his or her\nduties;\n(iv) The period of appointment, the notice required to terminate it and the\nperiod of probation, if any;"
      },
      {
        "source": "n2317972.pdf",
        "page": 76,
        "content": "temporary appointment the letter of appointment\nRetirement The effective date of retirement\nTermination The effective date of termination specified in the\nnotice of termination\nDismissal The date on which the staff member is notified in\nwriting of the dismissal decision"
      }
    ]
  },
  {
    "question": "What are the different types of appointments mentioned in the text and what are their implications?",
    "answer": "The different types of appointments mentioned in the text are temporary, fixed-term, and continuing appointments. \n\n1. Temporary Appointment: This type of appointment is granted for a period of less than one year. It implies a short-term commitment to a specific role or project.\n\n2. Fixed-Term Appointment: This type of appointment is for a specified period of time. It has a defined end date, and the staff member is required to enter upon their duties on a specific date. There may be a period of probation, notice required to terminate it, and a specified date of expiration.\n\n3. Continuing Appointment: This type of appointment does not have a specified end date. It implies a more permanent commitment to the organization or role. \n\nEach type of appointment has its own implications in terms of the duration of the commitment, the notice required for termination, and the nature of the appointment itself.",
    "context": "ST/SGB/2023/1/Rev.1\nArtic le IV\nAppointment a nd promotion\nRegulat ion 4.1\nAs stated in Article 101 of the Charter, the power of appointment of staff members\nrests with the Secretary-General. Upon appointment, each staff member, including a staff\nmember on secondment from government service, shall receive a letter of appointment in\naccordance with the provisions of annex II to the present Regulations and signed by the\nSecretary-General or by an official in the name of the Secretary-General.\nRegu...",
    "source": "n2317972.pdf",
    "page": 36,
    "source_documents": [
      {
        "source": "n2317972.pdf",
        "page": 93,
        "content": "time;\n(ii) The nature of the appointment;\n(iii) The date at which the staff member is required to enter upon his or her\nduties;\n(iv) The period of appointment, the notice required to terminate it and the\nperiod of probation, if any;"
      },
      {
        "source": "n2317972.pdf",
        "page": 76,
        "content": "Expiration of fixed-term or The date of expiration of the appointment specified in\ntemporary appointment the letter of appointment\nRetirement The effective date of retirement\nTermination The effective date of termination specified in the\nnotice of termination"
      },
      {
        "source": "n2317972.pdf",
        "page": 39,
        "content": "candidates may apply for vacancies shall be defined by the Secretary-General.\nRul4e. 11\nTypes of a ppointment\nA staff member may be granted a temporary, fixed-term or continuing\nappointment under staff rules 4.12, 4.13 and 4.14 below.\nRule 4.12\nTemporary a ppointment"
      },
      {
        "source": "n2317972.pdf",
        "page": 39,
        "content": "Rul4e. 11\nTypes of a ppointment\nA staff member may be granted a temporary, fixed-term or continuing\nappointment under staff rules 4.12, 4.13 and 4.14 below.\nRule 4.12\nTemporary a ppointment\n(a) A temporary appointment shall be granted for a period of less than one"
      },
      {
        "source": "n2317972.pdf",
        "page": 10,
        "content": "Page\nAnnex\nI. Salary scales and related provisions . . . . . . . . . . . . . . . . . . . . . . . . . . . . . . . . . . . . . . . . . . . . 87\nII. Letters of appointment . . . . . . . . . . . . . . . . . . . . . . . . . . . . . . . . . . . . . . . . . . . . . . . . . . . . . . 91"
      }
    ]
  },
  {
    "question": "What information is included in the letter of appointment issued to staff members?",
    "answer": "The letter of appointment issued to staff members includes information such as the position, nature of the appointment, start date, period of appointment, notice required to terminate it, period of probation (if any), and that the appointment is subject to the provisions of the Staff Regulations and Staff Rules. Additionally, a copy of the Staff Regulations and Staff Rules is transmitted to the staff member with the letter of appointment.",
    "context": "ST/SGB/2023/1/Rev.1\nChapt er IV\nAppointment a nd promotion\nRule 4.1\nLetter of appointment\nThe letter of appointment issued to every staff member contains expressly or by\nreference all the terms and conditions of employment. All contractual entitlements of\nstaff members are strictly limited to those contained expressly or by reference in their\nletters of appointment.\nRule 4.2\nEffective dat e of appointment\nThe effective date of appointment shall be the date on which staff members enter\ninto offic...",
    "source": "n2317972.pdf",
    "page": 37,
    "source_documents": [
      {
        "source": "n2317972.pdf",
        "page": 37,
        "content": "Rule 4.1\nLetter of appointment\nThe letter of appointment issued to every staff member contains expressly or by\nreference all the terms and conditions of employment. All contractual entitlements of\nstaff members are strictly limited to those contained expressly or by reference in their"
      },
      {
        "source": "n2317972.pdf",
        "page": 93,
        "content": "time;\n(ii) The nature of the appointment;\n(iii) The date at which the staff member is required to enter upon his or her\nduties;\n(iv) The period of appointment, the notice required to terminate it and the\nperiod of probation, if any;"
      },
      {
        "source": "n2317972.pdf",
        "page": 37,
        "content": "ST/SGB/2023/1/Rev.1\nChapt er IV\nAppointment a nd promotion\nRule 4.1\nLetter of appointment\nThe letter of appointment issued to every staff member contains expressly or by\nreference all the terms and conditions of employment. All contractual entitlements of"
      },
      {
        "source": "n2317972.pdf",
        "page": 93,
        "content": "ST/SGB/2023/1/Rev.1\nAnne x II\nLetters of appointment\n(a) The letter of appointment shall state:\n(i) That the appointment is subject to the provisions of the Staff Regulations\nand of the Staff Rules applicable to the category of appointment in question and"
      },
      {
        "source": "n2317972.pdf",
        "page": 93,
        "content": "(b) A copy of the Staff Regulations and the Staff Rules shall be transmitted to\nthe staff member with the letter of appointment. In accepting appointment the staff\nmember shall state that he or she has been acquainted with and accepts the conditions"
      }
    ]
  },
  {
    "question": "How does the United Nations determine the nationality of a staff member in cases of multiple nationalities?",
    "answer": "In cases where a staff member has been legally accorded nationality status by more than one State, the United Nations determines the nationality of the staff member for the purposes of Staff Regulations and Rules based on the nationality of the State with which the staff member has the closest connection.",
    "context": "ST/SGB/2023/1/Rev.1\nChapt er IV\nAppointment a nd promotion\nRule 4.1\nLetter of appointment\nThe letter of appointment issued to every staff member contains expressly or by\nreference all the terms and conditions of employment. All contractual entitlements of\nstaff members are strictly limited to those contained expressly or by reference in their\nletters of appointment.\nRule 4.2\nEffective dat e of appointment\nThe effective date of appointment shall be the date on which staff members enter\ninto offic...",
    "source": "n2317972.pdf",
    "page": 37,
    "source_documents": [
      {
        "source": "n2317972.pdf",
        "page": 37,
        "content": "on which they report for duty.\nRule 4.3\nNatio nality\n(a) In the application of the Staff Regulations and Rules, the United Nations\nshall not recognize more than one nationality for each staff member.\n(b) When a staff member has been legally accorded nationality status by more"
      },
      {
        "source": "n2317972.pdf",
        "page": 37,
        "content": "into official travel status to assume their duties or, if no travel is involved, the date\non which they report for duty.\nRule 4.3\nNatio nality\n(a) In the application of the Staff Regulations and Rules, the United Nations\nshall not recognize more than one nationality for each staff member."
      },
      {
        "source": "n2317972.pdf",
        "page": 37,
        "content": "(b) When a staff member has been legally accorded nationality status by more\nthan one State, the staff member’s nationality for the purposes of Staff Regulations\nand the Staff Rules shall be the nationality of the State with which the staff member"
      },
      {
        "source": "n2317972.pdf",
        "page": 37,
        "content": "shall not recognize more than one nationality for each staff member.\n(b) When a staff member has been legally accorded nationality status by more\nthan one State, the staff member’s nationality for the purposes of Staff Regulations"
      },
      {
        "source": "n2317972.pdf",
        "page": 70,
        "content": "distribution, due regard shall also be given to nationality in the case of staff members\nwith less than five years of service and in the case of staff members who have changed\ntheir nationality within the preceding five years."
      }
    ]
  },
  {
    "question": "What are the recruitment criteria for staff in posts subject to local recruitment?",
    "answer": "Staff in posts subject to local recruitment, as per staff rule 4.4, are recruited in the country or within commuting distance of the organization.",
    "context": "ST/SGB/2023/1/Rev.1\nChapt er IV\nAppointment a nd promotion\nRule 4.1\nLetter of appointment\nThe letter of appointment issued to every staff member contains expressly or by\nreference all the terms and conditions of employment. All contractual entitlements of\nstaff members are strictly limited to those contained expressly or by reference in their\nletters of appointment.\nRule 4.2\nEffective dat e of appointment\nThe effective date of appointment shall be the date on which staff members enter\ninto offic...",
    "source": "n2317972.pdf",
    "page": 37,
    "source_documents": [
      {
        "source": "n2317972.pdf",
        "page": 37,
        "content": "recruited staff members under staff rule 4.5 (a).\nRule 4.5\nStaff in posts subject to international recruitment\n(a) Staff members other than those regarded under staff rule 4.4 as having\nbeen locally recruited shall be considered as having been internationally recruited."
      },
      {
        "source": "n2317972.pdf",
        "page": 70,
        "content": "(ii) Staff members recruited through competitive examinations for a career\nappointment serving on a two-year fixed-term appointment;\n(iii) Staff members holding fixed-term appointments.\nWhen the suitable posts available are subject to the principle of geographical"
      },
      {
        "source": "n2317972.pdf",
        "page": 70,
        "content": "When the suitable posts available are subject to the principle of geographical\ndistribution, due regard shall also be given to nationality in the case of staff members\nwith less than five years of service and in the case of staff members who have changed"
      },
      {
        "source": "n2317972.pdf",
        "page": 37,
        "content": "than one State, the staff member’s nationality for the purposes of Staff Regulations\nand the Staff Rules shall be the nationality of the State with which the staff member\nis, in the opinion of the Secretary-General, most closely associated.\nRule 4.4\nStaff in posts subj ect to local recruitment"
      },
      {
        "source": "n2317972.pdf",
        "page": 37,
        "content": "is, in the opinion of the Secretary-General, most closely associated.\nRule 4.4\nStaff in posts subj ect to local recruitment\n(a) All staff in the General Service and related categories, except as stipulated\nin staff rule 4.5 (c), shall be recruited in the country or within commuting distance of"
      }
    ]
  },
  {
    "question": "What allowances and benefits are available to staff members in posts subject to international recruitment?",
    "answer": "Staff members in posts subject to international recruitment may receive allowances and benefits such as payment of travel expenses upon initial appointment and on separation for themselves and their spouses. Additionally, they may be eligible for other allowances and benefits outlined in staff rule 4.5 (a).",
    "context": "ST/SGB/2023/1/Rev.1\nChapt er IV\nAppointment a nd promotion\nRule 4.1\nLetter of appointment\nThe letter of appointment issued to every staff member contains expressly or by\nreference all the terms and conditions of employment. All contractual entitlements of\nstaff members are strictly limited to those contained expressly or by reference in their\nletters of appointment.\nRule 4.2\nEffective dat e of appointment\nThe effective date of appointment shall be the date on which staff members enter\ninto offic...",
    "source": "n2317972.pdf",
    "page": 37,
    "source_documents": [
      {
        "source": "n2317972.pdf",
        "page": 37,
        "content": "Depending on their type of appointment, the allowances and benefits available to\ninternationally recruited staff members, may include: payment of travel expenses\nupon initial appointment and on separation for themselves and their spouses and\n23-12028 35/115"
      },
      {
        "source": "n2317972.pdf",
        "page": 37,
        "content": "been locally recruited shall be considered as having been internationally recruited.\nDepending on their type of appointment, the allowances and benefits available to\ninternationally recruited staff members, may include: payment of travel expenses"
      },
      {
        "source": "n2317972.pdf",
        "page": 37,
        "content": "eligible to receive payment of the allowances or benefits available to internationally\nrecruited staff members under staff rule 4.5 (a).\nRule 4.5\nStaff in posts subject to international recruitment\n(a) Staff members other than those regarded under staff rule 4.4 as having"
      },
      {
        "source": "n2317972.pdf",
        "page": 37,
        "content": "General.\n(c) A staff member subject to local recruitment under this rule shall not be\neligible to receive payment of the allowances or benefits available to internationally\nrecruited staff members under staff rule 4.5 (a).\nRule 4.5\nStaff in posts subject to international recruitment"
      },
      {
        "source": "n2317972.pdf",
        "page": 37,
        "content": "in staff rule 4.5 (c), shall be recruited in the country or within commuting distance of\neach office, irrespective of their nationality and of the length of time they may have\nbeen in the country. The allowances and benefits available to staff members in the"
      }
    ]
  },
  {
    "question": "How does the geographical distribution of recruitment differ between posts in the Professional and higher categories versus the General Service and related categories?",
    "answer": "The geographical distribution of recruitment differs between posts in the Professional and higher categories compared to the General Service and related categories. Staff in the Professional and higher categories are considered internationally recruited, which means they can be appointed or reassigned to non-family duty stations. On the other hand, staff in the General Service category are typically not internationally recruited and may be required to serve in higher-level posts in the Professional category based on specific circumstances.",
    "context": "ST/SGB/2023/1/Rev.1\ndependent children; relocation shipment; home leave; education grant; and\nrepatriation grant.\n(b) Staff recruited locally at a duty station for posts in the Professional and\nhigher categories at that specific duty station are considered internationally recruited\nbut would generally not be entitled to some or all of the allowances and benefits\nmentioned in paragraph (a) above as determined by the Secretary-General.\n(c) Under special circumstances and conditions determined by t...",
    "source": "n2317972.pdf",
    "page": 38,
    "source_documents": [
      {
        "source": "n2317972.pdf",
        "page": 32,
        "content": "General Service category is required to serve in a higher-level post in the Professional\ncategory, or when a staff member in any category holding a fixed-term or continuing\nappointment is required to serve in a post which is classified more than one level"
      },
      {
        "source": "n2317972.pdf",
        "page": 30,
        "content": "Professional and higher categories and in the Field Service category to ensure equity\nin purchasing power across duty stations.\n(b) While the salaries of staff members in the Professional and higher\ncategories and in the Field Service category are normally subject to the post"
      },
      {
        "source": "n2317972.pdf",
        "page": 32,
        "content": "service at the higher level.\n(c) In the case of a staff member holding a fixed-term or continuing\nappointment who is assigned to serve in a mission, or when a staff member in the\nGeneral Service category is required to serve in a higher-level post in the Professional"
      },
      {
        "source": "n2317972.pdf",
        "page": 34,
        "content": "(b) Staff in the Professional and higher categories and in the Field Service\ncategory and staff in the General Service category considered internationally recruited\npursuant to staff rule 4.5 (c) who are appointed or reassigned to a non-family duty"
      },
      {
        "source": "n2317972.pdf",
        "page": 33,
        "content": "experienced by staff members serving in duty stations classified as B to E by the\nInternational Civil Service Commission.\n(b) Staff in the Professional and higher categories and in the Field Service\ncategory, and staff in the General Service category considered internationally"
      }
    ]
  },
  {
    "question": "How does the status of being internationally recruited impact the entitlements of staff members?",
    "answer": "The status of being internationally recruited can impact the entitlements of staff members in terms of allowances and benefits. Internationally recruited staff members may receive benefits such as payment of travel expenses upon initial appointment and separation for themselves and their spouses. However, the specific entitlements can vary depending on the type of appointment and the duty station. Additionally, staff members in higher categories at a duty station may be considered internationally recruited but may not be entitled to all the allowances and benefits available to lower categories. The conditions governing entitlement to benefits for internationally recruited staff in relation to residential status are set by the Secretary-General.",
    "context": "ST/SGB/2023/1/Rev.1\ndependent children; relocation shipment; home leave; education grant; and\nrepatriation grant.\n(b) Staff recruited locally at a duty station for posts in the Professional and\nhigher categories at that specific duty station are considered internationally recruited\nbut would generally not be entitled to some or all of the allowances and benefits\nmentioned in paragraph (a) above as determined by the Secretary-General.\n(c) Under special circumstances and conditions determined by t...",
    "source": "n2317972.pdf",
    "page": 38,
    "source_documents": [
      {
        "source": "n2317972.pdf",
        "page": 37,
        "content": "been locally recruited shall be considered as having been internationally recruited.\nDepending on their type of appointment, the allowances and benefits available to\ninternationally recruited staff members, may include: payment of travel expenses"
      },
      {
        "source": "n2317972.pdf",
        "page": 37,
        "content": "Depending on their type of appointment, the allowances and benefits available to\ninternationally recruited staff members, may include: payment of travel expenses\nupon initial appointment and on separation for themselves and their spouses and\n23-12028 35/115"
      },
      {
        "source": "n2317972.pdf",
        "page": 38,
        "content": "considers that the continuation of such entitlement would be contrary to the purposes\nfor which the allowance or benefit was created. Conditions governing entitlement to\nbenefits for internationally recruited staff in the light of residential status shall be set"
      },
      {
        "source": "n2317972.pdf",
        "page": 38,
        "content": "higher categories at that specific duty station are considered internationally recruited\nbut would generally not be entitled to some or all of the allowances and benefits\nmentioned in paragraph (a) above as determined by the Secretary-General."
      },
      {
        "source": "n2317972.pdf",
        "page": 38,
        "content": "General, staff who have been recruited to serve in posts in the General Service and\nrelated categories may be considered internationally recruited.\n(d) Staff members who have changed their residential status in such a way that"
      }
    ]
  },
  {
    "question": "What are the conditions under which staff members may lose entitlement to certain benefits?",
    "answer": "Staff members may lose entitlement to certain benefits under the following conditions:\n\n1. If a staff member's appointment is terminated for reasons of health, they will receive an indemnity equal to the provided amount reduced by any disability benefit they receive.\n2. Termination indemnity will not be paid to staff members who have reached the mandatory age of separation of 65 years and will receive a retirement service, or who are over that age and within 2 years of 25 years of contributory service.\n3. Staff members holding a temporary appointment may lose entitlement to benefits if they are granted special leave for compelling reasons under certain circumstances.\n\nThese are some of the conditions under which staff members may lose entitlement to certain benefits.",
    "context": "ST/SGB/2023/1/Rev.1\ndependent children; relocation shipment; home leave; education grant; and\nrepatriation grant.\n(b) Staff recruited locally at a duty station for posts in the Professional and\nhigher categories at that specific duty station are considered internationally recruited\nbut would generally not be entitled to some or all of the allowances and benefits\nmentioned in paragraph (a) above as determined by the Secretary-General.\n(c) Under special circumstances and conditions determined by t...",
    "source": "n2317972.pdf",
    "page": 38,
    "source_documents": [
      {
        "source": "n2317972.pdf",
        "page": 94,
        "content": "15 or more . . . . . . . . . 12 12\n(b) A staff member whose appointment is terminated for reasons of health\nshall receive an indemnity equal to the indemnity provided under paragraph (a) of the\npresent annex reduced by the amount of any disability benefit that the staff member"
      },
      {
        "source": "n2317972.pdf",
        "page": 38,
        "content": "considers that the continuation of such entitlement would be contrary to the purposes\nfor which the allowance or benefit was created. Conditions governing entitlement to\nbenefits for internationally recruited staff in the light of residential status shall be set"
      },
      {
        "source": "n2317972.pdf",
        "page": 72,
        "content": "accrue during periods of special leave with partial pay or without pay of one full\nmonth or more.\n(c) Termination indemnity shall not be paid to any staff member who has\nreached the mandatory age of separation of 65 years and will receive a retirement"
      },
      {
        "source": "n2317972.pdf",
        "page": 48,
        "content": "service, or who are over that age and within 2 years of 25 years of contributory service.\n(d) Staff members holding a temporary appointment may exceptionally be\ngranted special leave, with full or partial pay or without pay, for compelling reasons"
      },
      {
        "source": "n2317972.pdf",
        "page": 72,
        "content": "rule 6.4 (Compensation for death, injury or illness attributable to service).\nSpecial leave for pensi on purposes upon termination\n(d) Upon application of a staff member who is to be separated as a result of\nan agreed termination of appointment or because of abolition of post or reduction in"
      }
    ]
  },
  {
    "question": "What are the rules regarding family relationships within the organization according to the text?",
    "answer": "According to the text provided, the rules regarding family relationships within the organization are as follows:\n\n- Spouses of staff members may be appointed within the same organization, but they are not given any preference by virtue of the relationship.\n- Staff members who are the spouse, grandparent, grandchild, aunt, uncle, nephew, niece, or cousin of another staff member cannot be assigned to serve in a post that is superior or subordinate in the line of authority to that staff member.\n- An appointment within the same organization shall not be granted to a person who is the parent, child, or sibling of a staff member.\n\nThese rules aim to prevent conflicts of interest and ensure fair treatment within the organization.",
    "context": "ST/SGB/2023/1/Rev.1\ndependent children; relocation shipment; home leave; education grant; and\nrepatriation grant.\n(b) Staff recruited locally at a duty station for posts in the Professional and\nhigher categories at that specific duty station are considered internationally recruited\nbut would generally not be entitled to some or all of the allowances and benefits\nmentioned in paragraph (a) above as determined by the Secretary-General.\n(c) Under special circumstances and conditions determined by t...",
    "source": "n2317972.pdf",
    "page": 38,
    "source_documents": [
      {
        "source": "n2317972.pdf",
        "page": 38,
        "content": "and related categories.\nRule 4.7\nFamily re lationships\n(a) An appointment within the same organization shall not be granted to a\nperson who is the parent, child or sibling of a staff member.\n(b) Spouses of staff members may be appointed within the same organization"
      },
      {
        "source": "n2317972.pdf",
        "page": 38,
        "content": "considered and that the spouses are not given any preference by virtue of the\nrelationship to the staff members.\n(c) Staff members who are the spouse, grandparent, grandchild, aunt, uncle,\nnephew, niece or cousin of another staff member:"
      },
      {
        "source": "n2317972.pdf",
        "page": 38,
        "content": "relationship to the staff members.\n(c) Staff members who are the spouse, grandparent, grandchild, aunt, uncle,\nnephew, niece or cousin of another staff member:\n(i) Shall not be assigned to serve in a post which is superior or subordinate in\nthe line of authority to that staff member;"
      },
      {
        "source": "n2317972.pdf",
        "page": 38,
        "content": "Recruitment on as wide a geographical basis as possible, in accordance with the\nrequirements of staff regulation 4.2, shall not apply to posts in the General Service\nand related categories.\nRule 4.7\nFamily re lationships\n(a) An appointment within the same organization shall not be granted to a"
      },
      {
        "source": "n2317972.pdf",
        "page": 47,
        "content": "into account staff rule 4.7 (Family relationships), each staff member shall have the\nchoice of either exercising the home leave entitlement or of accompanying the spouse.\nStaff members who choose to accompany their spouse shall be granted travel time\nappropriate to the travel involved."
      }
    ]
  },
  {
    "question": "Under what conditions can a former staff member be reinstated according to the rules outlined in the document?",
    "answer": "A former staff member who held a fixed-term or continuing appointment and who is re-employed under a fixed-term or a continuing appointment within 12 months of separation from service may be reinstated under conditions established by the Secretary-General.",
    "context": "ST/SGB/2023/1/Rev.1\n(e) The rules of procedure of the central review bodies shall be established\nand published by the Secretary-General.\n(f) Executive heads of separately administered programmes, funds and\nsubsidiary organs of the United Nations to whom the Secretary-General has delegated\nthe authority to appoint, select and promote staff may establish advisory bodies to\nadvise them in the case of staff members recruited specifically for service with those\nprogrammes, funds or subsidiary organs....",
    "source": "n2317972.pdf",
    "page": 41,
    "source_documents": [
      {
        "source": "n2317972.pdf",
        "page": 41,
        "content": "of the Fund.\n(c) A former staff member who held a temporary appointment and who is\nre-employed under a temporary or fixed-term appointment shall not be reinstated\nregardless of the duration of separation from service.\n23-12028 39/115"
      },
      {
        "source": "n2317972.pdf",
        "page": 42,
        "content": "ST/SGB/2023/1/Rev.1\n(d) A former staff member who held a fixed-term or continuing appointment\nand who is re-employed under a temporary appointment shall not be reinstated\nregardless of the duration of separation from service.\nRule 4.18\nRe-employ ment"
      },
      {
        "source": "n2317972.pdf",
        "page": 41,
        "content": "by the Secretary-General.\nRule 4.17\nReinsta tement\n(a) A former staff member who held a fixed-term or continuing appointment\nand who is re-employed under a fixed-term or a continuing appointment within 12\nmonths of separation from service may be reinstated under conditions established by"
      },
      {
        "source": "n2317972.pdf",
        "page": 42,
        "content": "is reinstated under staff rule 4.17.\n(b) The terms of the new appointment shall be fully applicable without regard\nto any period of former service. When a staff member is re-employed under the\npresent rule, the service shall not be considered as continuous between the prior and\nnew appointments."
      },
      {
        "source": "n2317972.pdf",
        "page": 41,
        "content": "and who is re-employed under a fixed-term or a continuing appointment within 12\nmonths of separation from service may be reinstated under conditions established by\nthe Secretary-General.\n(b) On reinstatement, the staff member’s services shall be considered as"
      }
    ]
  },
  {
    "question": "How are staff members recruited for specific programs advised in terms of their appointment, selection, and promotion?",
    "answer": "Staff members recruited specifically for service with certain programs may be advised by advisory bodies established by the authority responsible for appointing, selecting, and promoting staff. These advisory bodies provide guidance on matters related to appointment, selection, and promotion. The composition and functions of these advisory bodies are determined by the authority.",
    "context": "ST/SGB/2023/1/Rev.1\n(e) The rules of procedure of the central review bodies shall be established\nand published by the Secretary-General.\n(f) Executive heads of separately administered programmes, funds and\nsubsidiary organs of the United Nations to whom the Secretary-General has delegated\nthe authority to appoint, select and promote staff may establish advisory bodies to\nadvise them in the case of staff members recruited specifically for service with those\nprogrammes, funds or subsidiary organs....",
    "source": "n2317972.pdf",
    "page": 41,
    "source_documents": [
      {
        "source": "n2317972.pdf",
        "page": 41,
        "content": "the authority to appoint, select and promote staff may establish advisory bodies to\nadvise them in the case of staff members recruited specifically for service with those\nprogrammes, funds or subsidiary organs. The composition and functions of such"
      },
      {
        "source": "n2317972.pdf",
        "page": 70,
        "content": "in the following order of preference:\n(i) Staff members holding continuing appointments;\n(ii) Staff members recruited through competitive examinations for a career\nappointment serving on a two-year fixed-term appointment;\n(iii) Staff members holding fixed-term appointments."
      },
      {
        "source": "n2317972.pdf",
        "page": 70,
        "content": "(ii) Staff members recruited through competitive examinations for a career\nappointment serving on a two-year fixed-term appointment;\n(iii) Staff members holding fixed-term appointments.\nWhen the suitable posts available are subject to the principle of geographical"
      },
      {
        "source": "n2317972.pdf",
        "page": 70,
        "content": "to relative competence, integrity and length of service, staff members shall be retained\nin the following order of preference:\n(i) Staff members holding continuing appointments;\n(ii) Staff members recruited through competitive examinations for a career"
      },
      {
        "source": "n2317972.pdf",
        "page": 37,
        "content": "ST/SGB/2023/1/Rev.1\nChapt er IV\nAppointment a nd promotion\nRule 4.1\nLetter of appointment\nThe letter of appointment issued to every staff member contains expressly or by\nreference all the terms and conditions of employment. All contractual entitlements of"
      }
    ]
  },
  {
    "question": "In the case of spouses who are both staff members, how does the Secretary-General decide on their entitlements and benefits when they maintain separate households?",
    "answer": "In the case of spouses who are both staff members and maintain separate households due to being assigned to different duty stations, the Secretary-General may decide to maintain separate entitlements and benefits for each spouse. This decision must not be inconsistent with any staff regulation or other decision of the General Assembly.",
    "context": "ST/SGB/2023/1/Rev.1\ndependent children; relocation shipment; home leave; education grant; and\nrepatriation grant.\n(b) Staff recruited locally at a duty station for posts in the Professional and\nhigher categories at that specific duty station are considered internationally recruited\nbut would generally not be entitled to some or all of the allowances and benefits\nmentioned in paragraph (a) above as determined by the Secretary-General.\n(c) Under special circumstances and conditions determined by t...",
    "source": "n2317972.pdf",
    "page": 38,
    "source_documents": [
      {
        "source": "n2317972.pdf",
        "page": 38,
        "content": "and allowances. Where both spouses are staff members and maintain separate\nhouseholds because they are assigned to different duty stations, the Secretary-General\nmay decide to maintain such separate entitlements and benefits, provided that this is"
      },
      {
        "source": "n2317972.pdf",
        "page": 38,
        "content": "households because they are assigned to different duty stations, the Secretary-General\nmay decide to maintain such separate entitlements and benefits, provided that this is\nnot inconsistent with any staff regulation or other decision of the General Assembly.\n36/115 23-12028"
      },
      {
        "source": "n2317972.pdf",
        "page": 38,
        "content": "of another organization participating in the United Nations common system of salaries\nand allowances. Where both spouses are staff members and maintain separate\nhouseholds because they are assigned to different duty stations, the Secretary-General"
      },
      {
        "source": "n2317972.pdf",
        "page": 63,
        "content": "conditions established by the Secretary-General.\nAdjustments t o entitlements\n(h) Where both spouses are staff members and each is entitled to relocation\nshipment or unaccompanied shipment under the present rule and taking into account"
      },
      {
        "source": "n2317972.pdf",
        "page": 38,
        "content": "separation from service for the staff members and their spouse and dependent children\nand relocation shipment, based upon place of home leave, if the Secretary-General\nconsiders that the continuation of such entitlement would be contrary to the purposes"
      }
    ]
  },
  {
    "question": "What are the responsibilities of the Boards of Examiners established by the Secretary-General?",
    "answer": "The responsibilities of the Boards of Examiners established by the Secretary-General include ensuring the regularity of competitive examinations administered according to conditions set by the Secretary-General and making recommendations to the Secretary-General regarding appointments to certain posts within the United Nations system.",
    "context": "ST/SGB/2023/1/Rev.1\n(e) The rules of procedure of the central review bodies shall be established\nand published by the Secretary-General.\n(f) Executive heads of separately administered programmes, funds and\nsubsidiary organs of the United Nations to whom the Secretary-General has delegated\nthe authority to appoint, select and promote staff may establish advisory bodies to\nadvise them in the case of staff members recruited specifically for service with those\nprogrammes, funds or subsidiary organs....",
    "source": "n2317972.pdf",
    "page": 41,
    "source_documents": [
      {
        "source": "n2317972.pdf",
        "page": 41,
        "content": "regularity of the competitive examinations administered in accordance with\nconditions established by the Secretary-General.\n(b) Boards of examiners shall make recommendations to the Secretary-\nGeneral in respect of the following:"
      },
      {
        "source": "n2317972.pdf",
        "page": 41,
        "content": "established by the Secretary-General.\nRule 4.16\nCompetitive examinations\n(a) Boards of examiners established by the Secretary-General shall ensure the\nregularity of the competitive examinations administered in accordance with\nconditions established by the Secretary-General."
      },
      {
        "source": "n2317972.pdf",
        "page": 41,
        "content": "conditions established by the Secretary-General.\n(b) Boards of examiners shall make recommendations to the Secretary-\nGeneral in respect of the following:\n(i) Appointment to P-1 and P-2 posts that are subject to the system of"
      },
      {
        "source": "n2317972.pdf",
        "page": 41,
        "content": "ST/SGB/2023/1/Rev.1\n(e) The rules of procedure of the central review bodies shall be established\nand published by the Secretary-General.\n(f) Executive heads of separately administered programmes, funds and\nsubsidiary organs of the United Nations to whom the Secretary-General has delegated"
      },
      {
        "source": "n2317972.pdf",
        "page": 41,
        "content": "(b) Boards of examiners shall make recommendations to the Secretary-\nGeneral in respect of the following:\n(i) Appointment to P-1 and P-2 posts that are subject to the system of\ndesirable ranges and to posts in the Professional category requiring special"
      }
    ]
  },
  {
    "question": "How are inter-organization movements regulated according to Rule 4.9?",
    "answer": "Inter-organization movements are defined in an inter-organization agreement among the organizations applying the United Nations common system of salaries and allowances. These movements are governed by this agreement as per Rule 4.9.",
    "context": "ST/SGB/2023/1/Rev.1\nRule 4.8\nChange of offi cial duty station\n(a) A change of official duty station shall take place when a staff member is\nassigned from one duty station to another for a period exceeding six months or when\na staff member is transferred for an indefinite period.\n(b) A change of official duty station shall take place when a staff member is\nassigned from any duty station to a United Nations field mission for a period\nexceeding three months.\n(c) Assignment of staff members from the...",
    "source": "n2317972.pdf",
    "page": 39,
    "source_documents": [
      {
        "source": "n2317972.pdf",
        "page": 39,
        "content": "station within the meaning of the Staff Rules.\nRule 4.9\nInt-oerragnization movements\n(a) Inter-organization movements are defined in and shall be governed by an\ninter-organization agreement among the organizations applying the United Nations\ncommon system of salaries and allowances."
      },
      {
        "source": "n2317972.pdf",
        "page": 39,
        "content": "conference or under staff rule 4.4 (b) shall not constitute a change of official duty\nstation within the meaning of the Staff Rules.\nRule 4.9\nInt-oerragnization movements\n(a) Inter-organization movements are defined in and shall be governed by an"
      },
      {
        "source": "n2317972.pdf",
        "page": 39,
        "content": "exceeding three months.\n(c) Assignment of staff members from their official duty station for a\nconference or under staff rule 4.4 (b) shall not constitute a change of official duty\nstation within the meaning of the Staff Rules.\nRule 4.9\nInt-oerragnization movements"
      },
      {
        "source": "n2317972.pdf",
        "page": 39,
        "content": "agency or other intergovernmental organization, provided that such movement in no\nway diminishes the rights or entitlements of the staff members under their letter of\nappointment with the United Nations.\nRule 4.10\nInternal acnadn diindtaetrens a l vacancies"
      },
      {
        "source": "n2317972.pdf",
        "page": 85,
        "content": "annually to the General Assembly. Should the Assembly find that a provisional rule\nand/or amendment is inconsistent with the intent and purpose of the Regulations, it\nmay direct that the rule and/or amendment be withdrawn or modified.\nRegulat ion 12.4"
      }
    ]
  },
  {
    "question": "What is the difference between a temporary, fixed-term, and continuing appointment according to Rule 4.11?",
    "answer": "According to Rule 4.11, a temporary appointment is granted for a period of less than one year to meet seasonal or peak workloads and specific short-term requirements with an expiration date specified in the letter of appointment. A fixed-term appointment is for a specific duration exceeding one year, and a continuing appointment has no specified end date.",
    "context": "ST/SGB/2023/1/Rev.1\nRule 4.8\nChange of offi cial duty station\n(a) A change of official duty station shall take place when a staff member is\nassigned from one duty station to another for a period exceeding six months or when\na staff member is transferred for an indefinite period.\n(b) A change of official duty station shall take place when a staff member is\nassigned from any duty station to a United Nations field mission for a period\nexceeding three months.\n(c) Assignment of staff members from the...",
    "source": "n2317972.pdf",
    "page": 39,
    "source_documents": [
      {
        "source": "n2317972.pdf",
        "page": 39,
        "content": "Rul4e. 11\nTypes of a ppointment\nA staff member may be granted a temporary, fixed-term or continuing\nappointment under staff rules 4.12, 4.13 and 4.14 below.\nRule 4.12\nTemporary a ppointment\n(a) A temporary appointment shall be granted for a period of less than one"
      },
      {
        "source": "n2317972.pdf",
        "page": 39,
        "content": "candidates may apply for vacancies shall be defined by the Secretary-General.\nRul4e. 11\nTypes of a ppointment\nA staff member may be granted a temporary, fixed-term or continuing\nappointment under staff rules 4.12, 4.13 and 4.14 below.\nRule 4.12\nTemporary a ppointment"
      },
      {
        "source": "n2317972.pdf",
        "page": 39,
        "content": "Rule 4.12\nTemporary a ppointment\n(a) A temporary appointment shall be granted for a period of less than one\nyear to meet seasonal or peak workloads and specific short-term requirements, having\nan expiration date specified in the letter of appointment."
      },
      {
        "source": "n2317972.pdf",
        "page": 94,
        "content": "Temporary appointments Fixed-term Continuing\nCompleted years of service exceeding six months appointments appointments\n. . . . . . . . . . . . . . . . .\nLess than 1 . . . . . . . . . One week for each month of One week for each Not applicable\nuncompleted service subject month of uncompleted"
      },
      {
        "source": "n2317972.pdf",
        "page": 39,
        "content": "appointment under staff rules 4.12, 4.13 and 4.14 below.\nRule 4.12\nTemporary a ppointment\n(a) A temporary appointment shall be granted for a period of less than one\nyear to meet seasonal or peak workloads and specific short-term requirements, having"
      }
    ]
  },
  {
    "question": "What are the conditions that define a change of official duty station according to Rule 4.8?",
    "answer": "A change of official duty station, according to Rule 4.8, occurs when a staff member is assigned from one duty station to another for a period exceeding six months or when a staff member is transferred for an indefinite period.",
    "context": "ST/SGB/2023/1/Rev.1\nRule 4.8\nChange of offi cial duty station\n(a) A change of official duty station shall take place when a staff member is\nassigned from one duty station to another for a period exceeding six months or when\na staff member is transferred for an indefinite period.\n(b) A change of official duty station shall take place when a staff member is\nassigned from any duty station to a United Nations field mission for a period\nexceeding three months.\n(c) Assignment of staff members from the...",
    "source": "n2317972.pdf",
    "page": 39,
    "source_documents": [
      {
        "source": "n2317972.pdf",
        "page": 39,
        "content": "ST/SGB/2023/1/Rev.1\nRule 4.8\nChange of offi cial duty station\n(a) A change of official duty station shall take place when a staff member is\nassigned from one duty station to another for a period exceeding six months or when\na staff member is transferred for an indefinite period."
      },
      {
        "source": "n2317972.pdf",
        "page": 54,
        "content": "commences;\n(ii) Staff members on official business travel;\n(iii) On change of official duty station, as defined in staff rule 4.8 (Change of\nofficial duty station):\na. Staff members internationally recruited pursuant to staff rule 4.5\n(Staff in posts subject to international recruitment); and"
      },
      {
        "source": "n2317972.pdf",
        "page": 74,
        "content": "country of the last duty station, provided that they meet the conditions contained in\nannex IV to the Staff Regulations and in this rule.\nDefin itions\n(b) The following definitions shall be used in ascertaining whether the"
      },
      {
        "source": "n2317972.pdf",
        "page": 39,
        "content": "exceeding three months.\n(c) Assignment of staff members from their official duty station for a\nconference or under staff rule 4.4 (b) shall not constitute a change of official duty\nstation within the meaning of the Staff Rules.\nRule 4.9\nInt-oerragnization movements"
      },
      {
        "source": "n2317972.pdf",
        "page": 39,
        "content": "conference or under staff rule 4.4 (b) shall not constitute a change of official duty\nstation within the meaning of the Staff Rules.\nRule 4.9\nInt-oerragnization movements\n(a) Inter-organization movements are defined in and shall be governed by an"
      }
    ]
  },
  {
    "question": "What are the conditions under which a former staff member can be re-employed?",
    "answer": "A former staff member can be re-employed under conditions established by the Secretary-General. If the former staff member is re-employed under a fixed-term or a continuing appointment within 12 months of separation from service, they may be reinstated under specific conditions. However, it is important to note that the service shall not be considered continuous between the prior and new appointments when re-employed under these conditions.",
    "context": "ST/SGB/2023/1/Rev.1\n(d) A former staff member who held a fixed-term or continuing appointment\nand who is re-employed under a temporary appointment shall not be reinstated\nregardless of the duration of separation from service.\nRule 4.18\nRe-employ ment\n(a) A former staff member who is re-employed under conditions established\nby the Secretary-General shall be given a new appointment unless the staff member\nis reinstated under staff rule 4.17.\n(b) The terms of the new appointment shall be fully appl...",
    "source": "n2317972.pdf",
    "page": 42,
    "source_documents": [
      {
        "source": "n2317972.pdf",
        "page": 41,
        "content": "of the Fund.\n(c) A former staff member who held a temporary appointment and who is\nre-employed under a temporary or fixed-term appointment shall not be reinstated\nregardless of the duration of separation from service.\n23-12028 39/115"
      },
      {
        "source": "n2317972.pdf",
        "page": 42,
        "content": "ST/SGB/2023/1/Rev.1\n(d) A former staff member who held a fixed-term or continuing appointment\nand who is re-employed under a temporary appointment shall not be reinstated\nregardless of the duration of separation from service.\nRule 4.18\nRe-employ ment"
      },
      {
        "source": "n2317972.pdf",
        "page": 41,
        "content": "and who is re-employed under a fixed-term or a continuing appointment within 12\nmonths of separation from service may be reinstated under conditions established by\nthe Secretary-General.\n(b) On reinstatement, the staff member’s services shall be considered as"
      },
      {
        "source": "n2317972.pdf",
        "page": 42,
        "content": "regardless of the duration of separation from service.\nRule 4.18\nRe-employ ment\n(a) A former staff member who is re-employed under conditions established\nby the Secretary-General shall be given a new appointment unless the staff member\nis reinstated under staff rule 4.17."
      },
      {
        "source": "n2317972.pdf",
        "page": 42,
        "content": "to any period of former service. When a staff member is re-employed under the\npresent rule, the service shall not be considered as continuous between the prior and\nnew appointments.\n(c) When a staff member receives a new appointment in the United Nations"
      }
    ]
  },
  {
    "question": "How are the normal number of working hours per week set by the Secretary-General for each duty station?",
    "answer": "The normal number of working hours per week for each duty station is set by the Secretary-General pursuant to staff regulation 1.3 (b). Exceptions may be made by the Secretary-General as the needs of service may require. Staff members may be required to work beyond the normal number of working hours whenever requested to do so.",
    "context": "ST/SGB/2023/1/Rev.1\nChapt er V\nAttendance and leave\nRule 5.1\nHours o f work\n(a) The Secretary-General shall set the normal number of working hours per\nweek for each duty station pursuant to staff regulation 1.3 (b). Exceptions may be\nmade by the Secretary-General as the needs of service may require. A staff member\nmay be required to work beyond the normal number of working hours whenever\nrequested to do so.\nOvertimceo mapnedn sato ry time off\n(b) A staff member in the General Service, Security S...",
    "source": "n2317972.pdf",
    "page": 44,
    "source_documents": [
      {
        "source": "n2317972.pdf",
        "page": 44,
        "content": "Rule 5.1\nHours o f work\n(a) The Secretary-General shall set the normal number of working hours per\nweek for each duty station pursuant to staff regulation 1.3 (b). Exceptions may be\nmade by the Secretary-General as the needs of service may require. A staff member"
      },
      {
        "source": "n2317972.pdf",
        "page": 44,
        "content": "ST/SGB/2023/1/Rev.1\nChapt er V\nAttendance and leave\nRule 5.1\nHours o f work\n(a) The Secretary-General shall set the normal number of working hours per\nweek for each duty station pursuant to staff regulation 1.3 (b). Exceptions may be"
      },
      {
        "source": "n2317972.pdf",
        "page": 44,
        "content": "week for each duty station pursuant to staff regulation 1.3 (b). Exceptions may be\nmade by the Secretary-General as the needs of service may require. A staff member\nmay be required to work beyond the normal number of working hours whenever\nrequested to do so.\nOvertimceo mapnedn sato ry time off"
      },
      {
        "source": "n2317972.pdf",
        "page": 15,
        "content": "establish a normal working week and shall establish official holidays for each duty\nstation. Exceptions may be made by the Secretary-General as the needs of the service\nmay require, and staff members shall be required to work beyond the normal tour of\nduty when requested to do so.\n23-12028 13/115"
      },
      {
        "source": "n2317972.pdf",
        "page": 15,
        "content": "General for the performance of official functions. The Secretary-General shall\nestablish a normal working week and shall establish official holidays for each duty\nstation. Exceptions may be made by the Secretary-General as the needs of the service"
      }
    ]
  },
  {
    "question": "How are termination indemnity, repatriation grant, and accrued annual leave handled when a staff member is re-employed less than 12 months after separation?",
    "answer": "When a staff member is re-employed in the United Nations common system of salaries and allowances less than 12 months after separation, the amount of any payment received on account of termination indemnity, repatriation grant, or accrued annual leave will be adjusted. This adjustment ensures that the number of months for which these payments were initially made is taken into account. The interval between separation and reinstatement is typically charged to annual leave, with any additional period charged to special leave. The staff member is required to return any monies received on account of separation, including termination indemnity, repatriation grant, and payment for accrued annual leave.",
    "context": "ST/SGB/2023/1/Rev.1\n(d) A former staff member who held a fixed-term or continuing appointment\nand who is re-employed under a temporary appointment shall not be reinstated\nregardless of the duration of separation from service.\nRule 4.18\nRe-employ ment\n(a) A former staff member who is re-employed under conditions established\nby the Secretary-General shall be given a new appointment unless the staff member\nis reinstated under staff rule 4.17.\n(b) The terms of the new appointment shall be fully appl...",
    "source": "n2317972.pdf",
    "page": 42,
    "source_documents": [
      {
        "source": "n2317972.pdf",
        "page": 41,
        "content": "repatriation grant under staff rule 9.12 and payment for accrued annual leave under\nstaff rule 9.10. The interval between separation and reinstatement shall be charged,\nto the extent possible, to annual leave, with any further period charged to special leave"
      },
      {
        "source": "n2317972.pdf",
        "page": 41,
        "content": "having been continuous, and the staff member shall return any monies received on\naccount of separation, including termination indemnity under staff rule 9.8,\nrepatriation grant under staff rule 9.12 and payment for accrued annual leave under"
      },
      {
        "source": "n2317972.pdf",
        "page": 41,
        "content": "account of separation, including termination indemnity under staff rule 9.8,\nrepatriation grant under staff rule 9.12 and payment for accrued annual leave under\nstaff rule 9.10. The interval between separation and reinstatement shall be charged,"
      },
      {
        "source": "n2317972.pdf",
        "page": 42,
        "content": "common system of salaries and allowances less than 12 months after separation, the\namount of any payment on account of termination indemnity, repatriation grant or\ncommutation of accrued annual leave shall be adjusted so that the number of months,"
      },
      {
        "source": "n2317972.pdf",
        "page": 42,
        "content": "new appointments.\n(c) When a staff member receives a new appointment in the United Nations\ncommon system of salaries and allowances less than 12 months after separation, the\namount of any payment on account of termination indemnity, repatriation grant or"
      }
    ]
  },
  {
    "question": "Why are staff members required to undergo medical examinations and receive inoculations before and after mission service?",
    "answer": "Staff members are required to undergo medical examinations and receive inoculations before and after mission service to ensure that they are in good health and do not pose a risk to the health or safety of others during their mission. This is a standard procedure to prevent the spread of diseases and to protect both the staff members and the communities they will be working in.",
    "context": "ST/SGB/2023/1/Rev.1\n(d) A former staff member who held a fixed-term or continuing appointment\nand who is re-employed under a temporary appointment shall not be reinstated\nregardless of the duration of separation from service.\nRule 4.18\nRe-employ ment\n(a) A former staff member who is re-employed under conditions established\nby the Secretary-General shall be given a new appointment unless the staff member\nis reinstated under staff rule 4.17.\n(b) The terms of the new appointment shall be fully appl...",
    "source": "n2317972.pdf",
    "page": 42,
    "source_documents": [
      {
        "source": "n2317972.pdf",
        "page": 42,
        "content": "to impair the health or safety of others.\n(b) Staff members may also be required to undergo such medical examinations\nand receive such inoculations as may be required by the United Nations Medical\nDirector or Medical Officer designated by the United Nations Medical Director before"
      },
      {
        "source": "n2317972.pdf",
        "page": 42,
        "content": "and receive such inoculations as may be required by the United Nations Medical\nDirector or Medical Officer designated by the United Nations Medical Director before\ngoing on or after returning from mission service.\n40/115 23-12028"
      },
      {
        "source": "n2317972.pdf",
        "page": 51,
        "content": "General.\n(h) Staff members may be required at any time to submit a medical report as\nto their condition or to undergo a medical examination by the United Nations medical\nservices or a medical practitioner designated by the United Nations Medical Director."
      },
      {
        "source": "n2317972.pdf",
        "page": 42,
        "content": "Rule 4.19\nMedilc aexam ination\n(a) Staff members may be required from time to time to satisfy the United\nNations Medical Director or Medical Officer designated by the United Nations\nMedical Director, by medical examination, that they are free from any ailment likely"
      },
      {
        "source": "n2317972.pdf",
        "page": 110,
        "content": "member’s home country.\n(iv) Special hazards: a death, injury or illness may be service-incurred if a staff\nmember is on official travel or assigned to an area involving special hazards, as\ndocumented and addressed by authorized United Nations security and safety"
      }
    ]
  },
  {
    "question": "Under what conditions can compensatory time off or payment for overtime be granted to staff members?",
    "answer": "Compensatory time off or payment for overtime can be granted to staff members under conditions established by the Secretary-General. This includes staff members in the Professional and higher categories, as well as in the Field Service category at the FS-6 and FS-7 levels who have been required to work substantial or recurrent periods of overtime. Additionally, staff members in the General Service, Security Service, Trades and Crafts categories, or in the Field Service category up to and including level FS-5, who are required to work in excess of the normal number of working hours per week may also be given compensatory time off or payment for overtime under conditions established by the Secretary-General.",
    "context": "ST/SGB/2023/1/Rev.1\nChapt er V\nAttendance and leave\nRule 5.1\nHours o f work\n(a) The Secretary-General shall set the normal number of working hours per\nweek for each duty station pursuant to staff regulation 1.3 (b). Exceptions may be\nmade by the Secretary-General as the needs of service may require. A staff member\nmay be required to work beyond the normal number of working hours whenever\nrequested to do so.\nOvertimceo mapnedn sato ry time off\n(b) A staff member in the General Service, Security S...",
    "source": "n2317972.pdf",
    "page": 44,
    "source_documents": [
      {
        "source": "n2317972.pdf",
        "page": 44,
        "content": "be given compensatory time off or may receive payment for overtime, under\nconditions established by the Secretary-General.\n(c) Should the exigencies of service permit, and under conditions established\nby the Secretary-General, occasional compensatory time off may be granted to staff"
      },
      {
        "source": "n2317972.pdf",
        "page": 44,
        "content": "by the Secretary-General, occasional compensatory time off may be granted to staff\nmembers serving in the Professional and higher categories and in the Field Service\ncategory at the FS-6 and FS-7 levels who have been required to work substantial or\nrecurrent periods of overtime.\nNight diia flferent"
      },
      {
        "source": "n2317972.pdf",
        "page": 44,
        "content": "(c) Should the exigencies of service permit, and under conditions established\nby the Secretary-General, occasional compensatory time off may be granted to staff\nmembers serving in the Professional and higher categories and in the Field Service"
      },
      {
        "source": "n2317972.pdf",
        "page": 44,
        "content": "Overtimceo mapnedn sato ry time off\n(b) A staff member in the General Service, Security Service or Trades and\nCrafts category, or in the Field Service category up to and including level FS-5, who\nis required to work in excess of the normal number of working hours per week shall"
      },
      {
        "source": "n2317972.pdf",
        "page": 44,
        "content": "Crafts category, or in the Field Service category up to and including level FS-5, who\nis required to work in excess of the normal number of working hours per week shall\nbe given compensatory time off or may receive payment for overtime, under\nconditions established by the Secretary-General."
      }
    ]
  },
  {
    "question": "What is the rate and conditions established by the Secretary-General for receiving night differential for staff members working night-time hours?",
    "answer": "The rate and conditions for receiving night differential for staff members working night-time hours are established by the Secretary-General.",
    "context": "ST/SGB/2023/1/Rev.1\nChapt er V\nAttendance and leave\nRule 5.1\nHours o f work\n(a) The Secretary-General shall set the normal number of working hours per\nweek for each duty station pursuant to staff regulation 1.3 (b). Exceptions may be\nmade by the Secretary-General as the needs of service may require. A staff member\nmay be required to work beyond the normal number of working hours whenever\nrequested to do so.\nOvertimceo mapnedn sato ry time off\n(b) A staff member in the General Service, Security S...",
    "source": "n2317972.pdf",
    "page": 44,
    "source_documents": [
      {
        "source": "n2317972.pdf",
        "page": 44,
        "content": "Night diia flferent\n(d) A staff member who is assigned to regularly scheduled night-time hours\nof work shall receive a night differential at a rate and under conditions established by\nthe Secretary-General.\n(e) Unless otherwise specifically prescribed by the Secretary-General, night"
      },
      {
        "source": "n2317972.pdf",
        "page": 44,
        "content": "of work shall receive a night differential at a rate and under conditions established by\nthe Secretary-General.\n(e) Unless otherwise specifically prescribed by the Secretary-General, night\ndifferential shall not be paid for the same work for which overtime payment or"
      },
      {
        "source": "n2317972.pdf",
        "page": 44,
        "content": "the Secretary-General.\n(e) Unless otherwise specifically prescribed by the Secretary-General, night\ndifferential shall not be paid for the same work for which overtime payment or\ncompensatory time off is allowed, or for any hours when the staff member is on leave\nor in travel status.\nRule 5.2"
      },
      {
        "source": "n2317972.pdf",
        "page": 44,
        "content": "category at the FS-6 and FS-7 levels who have been required to work substantial or\nrecurrent periods of overtime.\nNight diia flferent\n(d) A staff member who is assigned to regularly scheduled night-time hours\nof work shall receive a night differential at a rate and under conditions established by"
      },
      {
        "source": "n2317972.pdf",
        "page": 29,
        "content": "conditions and/or the practices of comparator employers call for the\nestablishment of such an allowance, under conditions established by the\nSecretary-General.\n(c) Staff members shall be responsible for reporting to the Secretary-General"
      }
    ]
  },
  {
    "question": "How many official holidays are mandated by the General Assembly to be observed at all duty stations?",
    "answer": "There are 10 official holidays mandated by the General Assembly to be observed at all duty stations in each calendar year.",
    "context": "ST/SGB/2023/1/Rev.1\nChapt er V\nAttendance and leave\nRule 5.1\nHours o f work\n(a) The Secretary-General shall set the normal number of working hours per\nweek for each duty station pursuant to staff regulation 1.3 (b). Exceptions may be\nmade by the Secretary-General as the needs of service may require. A staff member\nmay be required to work beyond the normal number of working hours whenever\nrequested to do so.\nOvertimceo mapnedn sato ry time off\n(b) A staff member in the General Service, Security S...",
    "source": "n2317972.pdf",
    "page": 44,
    "source_documents": [
      {
        "source": "n2317972.pdf",
        "page": 44,
        "content": "or in travel status.\nRule 5.2\nOfficial holidays\n(a) Pursuant to staff regulation 1.3 (b), the number of official holidays at each\nduty station shall be 10 days in each calendar year, including those official holidays\nmandated by the General Assembly, which shall be observed at all duty stations."
      },
      {
        "source": "n2317972.pdf",
        "page": 44,
        "content": "duty station shall be 10 days in each calendar year, including those official holidays\nmandated by the General Assembly, which shall be observed at all duty stations.\nWhen an official holiday falls on a non-working day, the preceding or following"
      },
      {
        "source": "n2317972.pdf",
        "page": 44,
        "content": "mandated by the General Assembly, which shall be observed at all duty stations.\nWhen an official holiday falls on a non-working day, the preceding or following\nworking day which is closest to the holiday shall be observed as an official holiday."
      },
      {
        "source": "n2317972.pdf",
        "page": 44,
        "content": "(b) Pursuant to staff regulation 1.3 (b), the official holidays not mandated by\nthe General Assembly shall be determined by the Secretary-General at Headquarters\nand under conditions established by the Secretary-General at other duty stations, after\nstaff consultation.\nRule 5.3\nAnnual leave"
      },
      {
        "source": "n2317972.pdf",
        "page": 44,
        "content": "working day which is closest to the holiday shall be observed as an official holiday.\n(b) Pursuant to staff regulation 1.3 (b), the official holidays not mandated by\nthe General Assembly shall be determined by the Secretary-General at Headquarters"
      }
    ]
  },
  {
    "question": "How does a staff member holding a temporary appointment accrue annual leave while in full pay status?",
    "answer": "A staff member holding a temporary appointment accrues 1 1/2 days per month of annual leave while in in full pay status.",
    "context": "ST/SGB/2023/1/Rev.1\nChapt er V\nAttendance and leave\nRule 5.1\nHours o f work\n(a) The Secretary-General shall set the normal number of working hours per\nweek for each duty station pursuant to staff regulation 1.3 (b). Exceptions may be\nmade by the Secretary-General as the needs of service may require. A staff member\nmay be required to work beyond the normal number of working hours whenever\nrequested to do so.\nOvertimceo mapnedn sato ry time off\n(b) A staff member in the General Service, Security S...",
    "source": "n2317972.pdf",
    "page": 44,
    "source_documents": [
      {
        "source": "n2317972.pdf",
        "page": 45,
        "content": "General.\n(b) A staff member who holds a fixed-term or a continuing appointment:\n(i) Shall accrue 2 1/2 days per month of annual leave while in full pay status;\n(ii) May accumulate and carry forward up to 60 working days of annual leave"
      },
      {
        "source": "n2317972.pdf",
        "page": 45,
        "content": "by the first day of the next annual leave cycle as established by the Secretary-\nGeneral.\n(b) A staff member who holds a fixed-term or a continuing appointment:\n(i) Shall accrue 2 1/2 days per month of annual leave while in full pay status;"
      },
      {
        "source": "n2317972.pdf",
        "page": 73,
        "content": "appointment, in accordance with staff rules 4.17 (Reinstatement), 4.18\n(Re-employment) and 5.3 (Annual leave). The payment shall be calculated as shown\nin the table below.\nStaff category Calculation of the accrued annual leave"
      },
      {
        "source": "n2317972.pdf",
        "page": 44,
        "content": "and under conditions established by the Secretary-General at other duty stations, after\nstaff consultation.\nRule 5.3\nAnnual leave\n(a) A staff member who holds a temporary appointment:\n(i) Shall accrue 1 1/2 days per month of annual leave while in full pay status;\n42/115 23-12028"
      },
      {
        "source": "n2317972.pdf",
        "page": 45,
        "content": "(f) A staff member may, in exceptional circumstances, be granted advance\nannual leave up to a maximum of 10 working days, provided that the staff member’s\nservice is expected to continue for a sufficient period to accrue the advance leave."
      }
    ]
  },
  {
    "question": "What are the regulations regarding annual leave for staff members?",
    "answer": "The regulations regarding annual leave for staff members are as follows:\n- Regulation 5.1: Staff members shall be allowed appropriate annual leave.\n- Regulation 5.2: Special leave may be authorized by the Secretary-General in exceptional cases.\n- Regulation 5.3: Eligible staff members shall be granted home leave once in every 24 months.",
    "context": "ST/SGB/2023/1/Rev.1\nArti cle V\nAnnual and special leave\nRegulat ion 5.1\nStaff members shall be allowed appropriate annual leave.\nRegulat ion 5.2\nSpecial leave may be authorized by the Secretary-General in exceptional cases.\nRegulat ion 5.3\nEligible staff members shall be granted home leave once in every 24 months.\nHowever, the Secretary-General may grant home leave once in every 12 months to\neligible staff members in duty stations having the most difficult conditions of life and\nwork under speci...",
    "source": "n2317972.pdf",
    "page": 43,
    "source_documents": [
      {
        "source": "n2317972.pdf",
        "page": 43,
        "content": "Regulat ion 5.1\nStaff members shall be allowed appropriate annual leave.\nRegulat ion 5.2\nSpecial leave may be authorized by the Secretary-General in exceptional cases.\nRegulat ion 5.3\nEligible staff members shall be granted home leave once in every 24 months."
      },
      {
        "source": "n2317972.pdf",
        "page": 43,
        "content": "ST/SGB/2023/1/Rev.1\nArti cle V\nAnnual and special leave\nRegulat ion 5.1\nStaff members shall be allowed appropriate annual leave.\nRegulat ion 5.2\nSpecial leave may be authorized by the Secretary-General in exceptional cases.\nRegulat ion 5.3"
      },
      {
        "source": "n2317972.pdf",
        "page": 73,
        "content": "appointment, in accordance with staff rules 4.17 (Reinstatement), 4.18\n(Re-employment) and 5.3 (Annual leave). The payment shall be calculated as shown\nin the table below.\nStaff category Calculation of the accrued annual leave"
      },
      {
        "source": "n2317972.pdf",
        "page": 45,
        "content": "General.\n(c) (i) Annual leave may be taken in units of days and half-days;\n(ii) Leave may be taken only when authorized.\n(d) All arrangements related to leave shall be subject to the exigencies of\nservice, which may require that leave be taken by a staff member during a period"
      },
      {
        "source": "n2317972.pdf",
        "page": 45,
        "content": "General.\n(b) A staff member who holds a fixed-term or a continuing appointment:\n(i) Shall accrue 2 1/2 days per month of annual leave while in full pay status;\n(ii) May accumulate and carry forward up to 60 working days of annual leave"
      }
    ]
  },
  {
    "question": "How often are eligible staff members granted home leave according to the regulations?",
    "answer": "Eligible staff members are granted home leave once every 24 months according to the regulations. However, in duty stations with the most difficult conditions of life and Service Commission that do not fall under the rest and recuperation framework, home leave can be granted once every 12 months.",
    "context": "ST/SGB/2023/1/Rev.1\nArti cle V\nAnnual and special leave\nRegulat ion 5.1\nStaff members shall be allowed appropriate annual leave.\nRegulat ion 5.2\nSpecial leave may be authorized by the Secretary-General in exceptional cases.\nRegulat ion 5.3\nEligible staff members shall be granted home leave once in every 24 months.\nHowever, the Secretary-General may grant home leave once in every 12 months to\neligible staff members in duty stations having the most difficult conditions of life and\nwork under speci...",
    "source": "n2317972.pdf",
    "page": 43,
    "source_documents": [
      {
        "source": "n2317972.pdf",
        "page": 43,
        "content": "Regulat ion 5.3\nEligible staff members shall be granted home leave once in every 24 months.\nHowever, the Secretary-General may grant home leave once in every 12 months to\neligible staff members in duty stations having the most difficult conditions of life and"
      },
      {
        "source": "n2317972.pdf",
        "page": 47,
        "content": "Service Commission that do not fall under the rest and recuperation framework shall\nbe granted home leave once in every 12 months. Staff members shall be eligible for\nhome leave provided that the following conditions are fulfilled:"
      },
      {
        "source": "n2317972.pdf",
        "page": 43,
        "content": "Regulat ion 5.1\nStaff members shall be allowed appropriate annual leave.\nRegulat ion 5.2\nSpecial leave may be authorized by the Secretary-General in exceptional cases.\nRegulat ion 5.3\nEligible staff members shall be granted home leave once in every 24 months."
      },
      {
        "source": "n2317972.pdf",
        "page": 43,
        "content": "Regulat ion 5.2\nSpecial leave may be authorized by the Secretary-General in exceptional cases.\nRegulat ion 5.3\nEligible staff members shall be granted home leave once in every 24 months.\nHowever, the Secretary-General may grant home leave once in every 12 months to"
      },
      {
        "source": "n2317972.pdf",
        "page": 47,
        "content": "regard to staff members and to their dependent children, if any.\n(s) A staff member travelling on home leave shall be required to spend no less\nthan seven calendar days, exclusive of travel time, in the staff member’s home"
      }
    ]
  },
  {
    "question": "Are staff members whose home country is the same as their official duty station eligible for home leave?",
    "answer": "No, staff members whose home country is the same as their official duty station are not eligible for home leave.",
    "context": "ST/SGB/2023/1/Rev.1\nArti cle V\nAnnual and special leave\nRegulat ion 5.1\nStaff members shall be allowed appropriate annual leave.\nRegulat ion 5.2\nSpecial leave may be authorized by the Secretary-General in exceptional cases.\nRegulat ion 5.3\nEligible staff members shall be granted home leave once in every 24 months.\nHowever, the Secretary-General may grant home leave once in every 12 months to\neligible staff members in duty stations having the most difficult conditions of life and\nwork under speci...",
    "source": "n2317972.pdf",
    "page": 43,
    "source_documents": [
      {
        "source": "n2317972.pdf",
        "page": 46,
        "content": "ST/SGB/2023/1/Rev.1\n(d) Staff members shall be eligible for home leave provided that the following\nconditions are fulfilled:\n(i) While performing their official duties:\na. They continue to reside in a country other than that of their\nrecognized nationality; or"
      },
      {
        "source": "n2317972.pdf",
        "page": 45,
        "content": "qualifying service towards home leave entitlement for themselves only.\n(b) Staff members who reside in their home country while in service with the\nUnited Nations or whose duty station is in their home country shall not be eligible for\nhome leave."
      },
      {
        "source": "n2317972.pdf",
        "page": 31,
        "content": "under staff rule 5.4 (Home leave). If both parents are eligible staff members,\n“home country” means the country of home leave of either parent;\n(iv) “Duty station” means the country, or area within commuting distance\nnotwithstanding national boundaries, where the staff member is serving."
      },
      {
        "source": "n2317972.pdf",
        "page": 45,
        "content": "(b) Staff members who reside in their home country while in service with the\nUnited Nations or whose duty station is in their home country shall not be eligible for\nhome leave.\n(c) Leave taken for this purpose will be charged against the staff member’s\naccrued annual leave.\n23-12028 43/115"
      },
      {
        "source": "n2317972.pdf",
        "page": 43,
        "content": "work under specific conditions, as approved by the General Assembly. A staff member\nwhose home country is either the country of his or her official duty station or the\ncountry of his or her normal residence while in United Nations service shall not be\neligible for home leave.\n23-12028 41/115"
      }
    ]
  },
  {
    "question": "What conditions must be fulfilled for staff members to be eligible for home leave according to the document?",
    "answer": "Staff members shall be eligible for home leave if they continue to reside in a country other than that of their recognized nationality while performing their official duties, and if they have compelling reasons for paying such expenses. Additionally, staff members must spend no less than seven calendar days, exclusive of travel time, in their home country during their home leave.",
    "context": "ST/SGB/2023/1/Rev.1\n(d) Staff members shall be eligible for home leave provided that the following\nconditions are fulfilled:\n(i) While performing their official duties:\na. They continue to reside in a country other than that of their\nrecognized nationality; or\nb. In the case of staff members who are native of a non-metropolitan\nterritory of the country of the duty station and who maintained their normal\nresidence in such non-metropolitan territory prior to appointment, they continue\nto reside, w...",
    "source": "n2317972.pdf",
    "page": 46,
    "source_documents": [
      {
        "source": "n2317972.pdf",
        "page": 46,
        "content": "ST/SGB/2023/1/Rev.1\n(d) Staff members shall be eligible for home leave provided that the following\nconditions are fulfilled:\n(i) While performing their official duties:\na. They continue to reside in a country other than that of their\nrecognized nationality; or"
      },
      {
        "source": "n2317972.pdf",
        "page": 54,
        "content": "compelling reasons for paying such expenses:\na. Staff members; and\nb. Their eligible family members;\n(v) On home leave, in accordance with the provisions of staff rule 5.4 (Home\nleave):\na. Staff members internationally recruited pursuant to staff rule 4.5"
      },
      {
        "source": "n2317972.pdf",
        "page": 47,
        "content": "regard to staff members and to their dependent children, if any.\n(s) A staff member travelling on home leave shall be required to spend no less\nthan seven calendar days, exclusive of travel time, in the staff member’s home"
      },
      {
        "source": "n2317972.pdf",
        "page": 47,
        "content": "Service Commission that do not fall under the rest and recuperation framework shall\nbe granted home leave once in every 12 months. Staff members shall be eligible for\nhome leave provided that the following conditions are fulfilled:"
      },
      {
        "source": "n2317972.pdf",
        "page": 47,
        "content": "advance the eligibility for, or the due date of, the next home leave. The granting of\nadvance home leave shall be subject to the conditions for the entitlement being\nsubsequently met. If these conditions are not met, the staff member will be required"
      }
    ]
  },
  {
    "question": "What conditions need to be met for staff members in duty stations with difficult living conditions to be eligible for more frequent home leave?",
    "answer": "Staff members in duty stations with difficult living conditions may be eligible for more frequent home leave if the Secretary-General approves it under specific conditions, as approved by the General Assembly. This could include granting home leave once every 12 months to eligible staff members in such duty stations. Additionally, the presence of eligible family members of the staff member at the duty station may also be exceptionally approved.",
    "context": "ST/SGB/2023/1/Rev.1\nArti cle V\nAnnual and special leave\nRegulat ion 5.1\nStaff members shall be allowed appropriate annual leave.\nRegulat ion 5.2\nSpecial leave may be authorized by the Secretary-General in exceptional cases.\nRegulat ion 5.3\nEligible staff members shall be granted home leave once in every 24 months.\nHowever, the Secretary-General may grant home leave once in every 12 months to\neligible staff members in duty stations having the most difficult conditions of life and\nwork under speci...",
    "source": "n2317972.pdf",
    "page": 43,
    "source_documents": [
      {
        "source": "n2317972.pdf",
        "page": 46,
